number,value,datetime_start,datetime_complete,duration,params_model.dropout_0,params_model.dropout_1,params_model.dropout_2,params_model.embedding_dim,params_model.entity_initializer,params_model.relation_dim,params_negative_sampler.num_negs_per_pos,params_optimizer.lr,user_attrs_both.optimistic.adjusted_arithmetic_mean_rank,user_attrs_both.optimistic.adjusted_arithmetic_mean_rank_index,user_attrs_both.optimistic.adjusted_geometric_mean_rank_index,user_attrs_both.optimistic.adjusted_hits_at_k,user_attrs_both.optimistic.adjusted_inverse_harmonic_mean_rank,user_attrs_both.optimistic.arithmetic_mean_rank,user_attrs_both.optimistic.count,user_attrs_both.optimistic.geometric_mean_rank,user_attrs_both.optimistic.harmonic_mean_rank,user_attrs_both.optimistic.hits_at_1,user_attrs_both.optimistic.hits_at_10,user_attrs_both.optimistic.hits_at_3,user_attrs_both.optimistic.hits_at_5,user_attrs_both.optimistic.inverse_arithmetic_mean_rank,user_attrs_both.optimistic.inverse_geometric_mean_rank,user_attrs_both.optimistic.inverse_harmonic_mean_rank,user_attrs_both.optimistic.inverse_median_rank,user_attrs_both.optimistic.median_absolute_deviation,user_attrs_both.optimistic.median_rank,user_attrs_both.optimistic.standard_deviation,user_attrs_both.optimistic.variance,user_attrs_both.optimistic.z_arithmetic_mean_rank,user_attrs_both.optimistic.z_geometric_mean_rank,user_attrs_both.optimistic.z_hits_at_k,user_attrs_both.optimistic.z_inverse_harmonic_mean_rank,user_attrs_both.pessimistic.adjusted_arithmetic_mean_rank,user_attrs_both.pessimistic.adjusted_arithmetic_mean_rank_index,user_attrs_both.pessimistic.adjusted_geometric_mean_rank_index,user_attrs_both.pessimistic.adjusted_hits_at_k,user_attrs_both.pessimistic.adjusted_inverse_harmonic_mean_rank,user_attrs_both.pessimistic.arithmetic_mean_rank,user_attrs_both.pessimistic.count,user_attrs_both.pessimistic.geometric_mean_rank,user_attrs_both.pessimistic.harmonic_mean_rank,user_attrs_both.pessimistic.hits_at_1,user_attrs_both.pessimistic.hits_at_10,user_attrs_both.pessimistic.hits_at_3,user_attrs_both.pessimistic.hits_at_5,user_attrs_both.pessimistic.inverse_arithmetic_mean_rank,user_attrs_both.pessimistic.inverse_geometric_mean_rank,user_attrs_both.pessimistic.inverse_harmonic_mean_rank,user_attrs_both.pessimistic.inverse_median_rank,user_attrs_both.pessimistic.median_absolute_deviation,user_attrs_both.pessimistic.median_rank,user_attrs_both.pessimistic.standard_deviation,user_attrs_both.pessimistic.variance,user_attrs_both.pessimistic.z_arithmetic_mean_rank,user_attrs_both.pessimistic.z_geometric_mean_rank,user_attrs_both.pessimistic.z_hits_at_k,user_attrs_both.pessimistic.z_inverse_harmonic_mean_rank,user_attrs_both.realistic.adjusted_arithmetic_mean_rank,user_attrs_both.realistic.adjusted_arithmetic_mean_rank_index,user_attrs_both.realistic.adjusted_geometric_mean_rank_index,user_attrs_both.realistic.adjusted_hits_at_k,user_attrs_both.realistic.adjusted_inverse_harmonic_mean_rank,user_attrs_both.realistic.arithmetic_mean_rank,user_attrs_both.realistic.count,user_attrs_both.realistic.geometric_mean_rank,user_attrs_both.realistic.harmonic_mean_rank,user_attrs_both.realistic.hits_at_1,user_attrs_both.realistic.hits_at_10,user_attrs_both.realistic.hits_at_3,user_attrs_both.realistic.hits_at_5,user_attrs_both.realistic.inverse_arithmetic_mean_rank,user_attrs_both.realistic.inverse_geometric_mean_rank,user_attrs_both.realistic.inverse_harmonic_mean_rank,user_attrs_both.realistic.inverse_median_rank,user_attrs_both.realistic.median_absolute_deviation,user_attrs_both.realistic.median_rank,user_attrs_both.realistic.standard_deviation,user_attrs_both.realistic.variance,user_attrs_both.realistic.z_arithmetic_mean_rank,user_attrs_both.realistic.z_geometric_mean_rank,user_attrs_both.realistic.z_hits_at_k,user_attrs_both.realistic.z_inverse_harmonic_mean_rank,user_attrs_head.optimistic.adjusted_arithmetic_mean_rank,user_attrs_head.optimistic.adjusted_arithmetic_mean_rank_index,user_attrs_head.optimistic.adjusted_geometric_mean_rank_index,user_attrs_head.optimistic.adjusted_hits_at_k,user_attrs_head.optimistic.adjusted_inverse_harmonic_mean_rank,user_attrs_head.optimistic.arithmetic_mean_rank,user_attrs_head.optimistic.count,user_attrs_head.optimistic.geometric_mean_rank,user_attrs_head.optimistic.harmonic_mean_rank,user_attrs_head.optimistic.hits_at_1,user_attrs_head.optimistic.hits_at_10,user_attrs_head.optimistic.hits_at_3,user_attrs_head.optimistic.hits_at_5,user_attrs_head.optimistic.inverse_arithmetic_mean_rank,user_attrs_head.optimistic.inverse_geometric_mean_rank,user_attrs_head.optimistic.inverse_harmonic_mean_rank,user_attrs_head.optimistic.inverse_median_rank,user_attrs_head.optimistic.median_absolute_deviation,user_attrs_head.optimistic.median_rank,user_attrs_head.optimistic.standard_deviation,user_attrs_head.optimistic.variance,user_attrs_head.optimistic.z_arithmetic_mean_rank,user_attrs_head.optimistic.z_geometric_mean_rank,user_attrs_head.optimistic.z_hits_at_k,user_attrs_head.optimistic.z_inverse_harmonic_mean_rank,user_attrs_head.pessimistic.adjusted_arithmetic_mean_rank,user_attrs_head.pessimistic.adjusted_arithmetic_mean_rank_index,user_attrs_head.pessimistic.adjusted_geometric_mean_rank_index,user_attrs_head.pessimistic.adjusted_hits_at_k,user_attrs_head.pessimistic.adjusted_inverse_harmonic_mean_rank,user_attrs_head.pessimistic.arithmetic_mean_rank,user_attrs_head.pessimistic.count,user_attrs_head.pessimistic.geometric_mean_rank,user_attrs_head.pessimistic.harmonic_mean_rank,user_attrs_head.pessimistic.hits_at_1,user_attrs_head.pessimistic.hits_at_10,user_attrs_head.pessimistic.hits_at_3,user_attrs_head.pessimistic.hits_at_5,user_attrs_head.pessimistic.inverse_arithmetic_mean_rank,user_attrs_head.pessimistic.inverse_geometric_mean_rank,user_attrs_head.pessimistic.inverse_harmonic_mean_rank,user_attrs_head.pessimistic.inverse_median_rank,user_attrs_head.pessimistic.median_absolute_deviation,user_attrs_head.pessimistic.median_rank,user_attrs_head.pessimistic.standard_deviation,user_attrs_head.pessimistic.variance,user_attrs_head.pessimistic.z_arithmetic_mean_rank,user_attrs_head.pessimistic.z_geometric_mean_rank,user_attrs_head.pessimistic.z_hits_at_k,user_attrs_head.pessimistic.z_inverse_harmonic_mean_rank,user_attrs_head.realistic.adjusted_arithmetic_mean_rank,user_attrs_head.realistic.adjusted_arithmetic_mean_rank_index,user_attrs_head.realistic.adjusted_geometric_mean_rank_index,user_attrs_head.realistic.adjusted_hits_at_k,user_attrs_head.realistic.adjusted_inverse_harmonic_mean_rank,user_attrs_head.realistic.arithmetic_mean_rank,user_attrs_head.realistic.count,user_attrs_head.realistic.geometric_mean_rank,user_attrs_head.realistic.harmonic_mean_rank,user_attrs_head.realistic.hits_at_1,user_attrs_head.realistic.hits_at_10,user_attrs_head.realistic.hits_at_3,user_attrs_head.realistic.hits_at_5,user_attrs_head.realistic.inverse_arithmetic_mean_rank,user_attrs_head.realistic.inverse_geometric_mean_rank,user_attrs_head.realistic.inverse_harmonic_mean_rank,user_attrs_head.realistic.inverse_median_rank,user_attrs_head.realistic.median_absolute_deviation,user_attrs_head.realistic.median_rank,user_attrs_head.realistic.standard_deviation,user_attrs_head.realistic.variance,user_attrs_head.realistic.z_arithmetic_mean_rank,user_attrs_head.realistic.z_geometric_mean_rank,user_attrs_head.realistic.z_hits_at_k,user_attrs_head.realistic.z_inverse_harmonic_mean_rank,user_attrs_random_seed,user_attrs_tail.optimistic.adjusted_arithmetic_mean_rank,user_attrs_tail.optimistic.adjusted_arithmetic_mean_rank_index,user_attrs_tail.optimistic.adjusted_geometric_mean_rank_index,user_attrs_tail.optimistic.adjusted_hits_at_k,user_attrs_tail.optimistic.adjusted_inverse_harmonic_mean_rank,user_attrs_tail.optimistic.arithmetic_mean_rank,user_attrs_tail.optimistic.count,user_attrs_tail.optimistic.geometric_mean_rank,user_attrs_tail.optimistic.harmonic_mean_rank,user_attrs_tail.optimistic.hits_at_1,user_attrs_tail.optimistic.hits_at_10,user_attrs_tail.optimistic.hits_at_3,user_attrs_tail.optimistic.hits_at_5,user_attrs_tail.optimistic.inverse_arithmetic_mean_rank,user_attrs_tail.optimistic.inverse_geometric_mean_rank,user_attrs_tail.optimistic.inverse_harmonic_mean_rank,user_attrs_tail.optimistic.inverse_median_rank,user_attrs_tail.optimistic.median_absolute_deviation,user_attrs_tail.optimistic.median_rank,user_attrs_tail.optimistic.standard_deviation,user_attrs_tail.optimistic.variance,user_attrs_tail.optimistic.z_arithmetic_mean_rank,user_attrs_tail.optimistic.z_geometric_mean_rank,user_attrs_tail.optimistic.z_hits_at_k,user_attrs_tail.optimistic.z_inverse_harmonic_mean_rank,user_attrs_tail.pessimistic.adjusted_arithmetic_mean_rank,user_attrs_tail.pessimistic.adjusted_arithmetic_mean_rank_index,user_attrs_tail.pessimistic.adjusted_geometric_mean_rank_index,user_attrs_tail.pessimistic.adjusted_hits_at_k,user_attrs_tail.pessimistic.adjusted_inverse_harmonic_mean_rank,user_attrs_tail.pessimistic.arithmetic_mean_rank,user_attrs_tail.pessimistic.count,user_attrs_tail.pessimistic.geometric_mean_rank,user_attrs_tail.pessimistic.harmonic_mean_rank,user_attrs_tail.pessimistic.hits_at_1,user_attrs_tail.pessimistic.hits_at_10,user_attrs_tail.pessimistic.hits_at_3,user_attrs_tail.pessimistic.hits_at_5,user_attrs_tail.pessimistic.inverse_arithmetic_mean_rank,user_attrs_tail.pessimistic.inverse_geometric_mean_rank,user_attrs_tail.pessimistic.inverse_harmonic_mean_rank,user_attrs_tail.pessimistic.inverse_median_rank,user_attrs_tail.pessimistic.median_absolute_deviation,user_attrs_tail.pessimistic.median_rank,user_attrs_tail.pessimistic.standard_deviation,user_attrs_tail.pessimistic.variance,user_attrs_tail.pessimistic.z_arithmetic_mean_rank,user_attrs_tail.pessimistic.z_geometric_mean_rank,user_attrs_tail.pessimistic.z_hits_at_k,user_attrs_tail.pessimistic.z_inverse_harmonic_mean_rank,user_attrs_tail.realistic.adjusted_arithmetic_mean_rank,user_attrs_tail.realistic.adjusted_arithmetic_mean_rank_index,user_attrs_tail.realistic.adjusted_geometric_mean_rank_index,user_attrs_tail.realistic.adjusted_hits_at_k,user_attrs_tail.realistic.adjusted_inverse_harmonic_mean_rank,user_attrs_tail.realistic.arithmetic_mean_rank,user_attrs_tail.realistic.count,user_attrs_tail.realistic.geometric_mean_rank,user_attrs_tail.realistic.harmonic_mean_rank,user_attrs_tail.realistic.hits_at_1,user_attrs_tail.realistic.hits_at_10,user_attrs_tail.realistic.hits_at_3,user_attrs_tail.realistic.hits_at_5,user_attrs_tail.realistic.inverse_arithmetic_mean_rank,user_attrs_tail.realistic.inverse_geometric_mean_rank,user_attrs_tail.realistic.inverse_harmonic_mean_rank,user_attrs_tail.realistic.inverse_median_rank,user_attrs_tail.realistic.median_absolute_deviation,user_attrs_tail.realistic.median_rank,user_attrs_tail.realistic.standard_deviation,user_attrs_tail.realistic.variance,user_attrs_tail.realistic.z_arithmetic_mean_rank,user_attrs_tail.realistic.z_geometric_mean_rank,user_attrs_tail.realistic.z_hits_at_k,user_attrs_tail.realistic.z_inverse_harmonic_mean_rank,state
6,0.49718263745307917,2025-07-07 17:42:11.056489,2025-07-07 18:54:47.563432,0 days 01:12:36.506943,0.1,0.2,0.1,300,xavier_uniform,112,14,0.001,0.005742245481822845,0.9943028106568002,0.9996686882491834,0.5858880712705863,0.4970541966017727,126.72037588116204,163988.0,6.379716726138649,2.0113332499854724,0.43794667902529455,0.5859819011147157,0.518263531477913,0.5407407859111643,0.00789139073370329,0.15674677151461147,0.49718265235620346,0.3333333333333333,2.965204437011204,3.0,1534.0192112673599,2353214.9405373326,697.3831791721885,404.9761768681146,15760.132243459691,32991.06687315833,0.005742246310803674,0.9943028098277817,0.9996686882127789,0.5858880712705863,0.49705419522231625,126.72039417518354,163988.0,6.3797173172624095,2.011333255564585,0.43794667902529455,0.5859819011147157,0.518263531477913,0.5407407859111643,0.007891389594460686,0.15674675699096782,0.4971826509770993,0.3333333333333333,2.965204437011204,3.0,1534.0193342052128,2353215.3177154046,697.3831785907324,404.9761768533667,15760.132243459691,32991.06678159942,0.005742245790380061,0.994302810348229,0.9996686882988609,0.5858880712705863,0.4970541816948411,126.72038269042969,163988.0,6.379715919494629,2.011333310275489,0.43794667902529455,0.5859819011147157,0.518263531477913,0.5407407859111643,0.007891390472650528,0.1567467898130417,0.49718263745307917,0.3333333432674408,2.965204437011204,3.0,1534.019287109375,2353215.0,697.3831789557631,404.9761768882394,15760.132243459691,32991.065883737894,0.009892358178271445,0.9901526333225518,0.9979454405839604,0.18316929161645396,0.07947604071486104,217.7065516989048,81994.0,34.26969710877439,12.545203696604322,0.02135522111374003,0.18335487962533845,0.06139473620020977,0.09744615459667781,0.004593339025382352,0.02918029875857761,0.0797117387795525,0.02702702702702703,40.030259899651256,37.0,1942.0000553792631,3771364.2150930613,491.06518433645664,285.97610937963714,3479.2483764033573,3724.921573420158,0.009892359286619736,0.9901526322141532,0.9979454401929362,0.18316929161645396,0.0794760379559707,217.70657609093348,81994.0,34.26970344067054,12.545204130693214,0.02135522111374003,0.18335487962533845,0.06139473620020977,0.09744615459667781,0.004593338510740768,0.029180293367033393,0.07971173602136856,0.02702702702702703,40.030259899651256,37.0,1942.0001091973888,3771364.42412267,491.06518378674747,285.97610926758335,3479.2483764033573,3724.9214441151494,0.009892358474925762,0.990152633025884,0.9979454402256226,0.18316929161645396,0.07947603718296989,217.70655822753906,81994.0,34.26970291137695,12.545204252318593,0.02135522111374003,0.18335487962533845,0.06139473620020977,0.09744615459667781,0.004593338817358017,0.029180293902754784,0.07971173524856567,0.027027027681469917,40.030259899651256,37.0,1942.0001220703125,3771364.5,491.06518418932455,285.97610927695007,3479.2483764033573,3724.9214078857726,203852730.0,0.0016148403910753119,0.9984302790054511,0.9999884745850065,0.9886063481313223,0.9146318170410187,35.73420006341927,81994.0,1.187661080767249,1.0933101200781967,0.854538136936849,0.9886089226040929,0.9751323267556162,0.9840354172256507,0.027984395851180382,0.8419910496300705,0.9146535659328545,1.0,0.0,1.0,958.3885942569065,918508.6976017293,495.17600740523153,286.5610448642375,18830.1023924078,42985.52870331888,0.0016148409422172582,0.9984302784542842,0.9999884745849665,0.9886063481313223,0.9146318170409942,35.73421225943362,81994.0,1.1876610814167448,1.093310120078226,0.854538136936849,0.9886089226040929,0.9751323267556162,0.9840354172256507,0.027984386300162697,0.8419910491696112,0.91465356593283,1.0,0.0,1.0,958.3888776008031,918509.240708927,495.17600713187784,286.56104486422606,18830.1023924078,42985.52870331773,0.0016148407114702989,0.9984302786850416,0.9999884745867886,0.9886063481313223,0.9146317907590612,35.73420715332031,81994.0,1.187661051750183,1.093310151485728,0.854538136936849,0.9886089226040929,0.9751323267556162,0.9840354172256507,0.027984390035271645,0.8419910669326782,0.9146535396575928,1.0,0.0,1.0,958.388671875,918508.875,495.17600724632297,286.56104486474817,18830.1023924078,42985.52746812914,COMPLETE
7,0.48590222001075745,2025-07-07 18:54:47.594171,2025-07-07 19:32:42.577873,0 days 00:37:54.983702,0.1,0.1,0.4,300,xavier_uniform,192,4,0.0005,0.0054949256830250145,0.9945501416632301,0.9996165916644013,0.5638997732903592,0.48577285858170516,121.26250091470108,163988.0,7.225641652847974,2.058018862399954,0.4294521550357343,0.5639985852623363,0.50946410712979,0.5286240456618777,0.00824657245609196,0.1383960135368534,0.48590419566604576,0.3333333333333333,2.965204437011204,3.0,1383.359874940503,1913684.543595404,697.5566519630962,404.9550720000908,15168.6566682266,32242.288611988275,0.005494926788332787,0.9945501405578723,0.999616589682038,0.5638997732903592,0.48576980418693344,121.26252530672976,163988.0,7.225673841723016,2.0580317958879046,0.4294460570285631,0.5639985852623363,0.50946410712979,0.5286240456618777,0.008246570797289033,0.13839539701137998,0.48590114205138707,0.3333333333333333,2.965204437011204,3.0,1383.3599732323908,1913684.815541521,697.5566511878213,404.9550711970149,15168.6566682266,32242.08588209914,0.005494925849008389,0.9945501414972392,0.9996165905145259,0.5638997732903592,0.48577088242169225,121.26250457763672,163988.0,7.22566032409668,2.058027230206647,0.4294460570285631,0.5639985852623363,0.50946410712979,0.5286240456618777,0.008246571756899357,0.13839565217494965,0.48590222001075745,0.3333333432674408,2.965204437011204,3.0,1383.3599853515625,1913684.75,697.5566518466736,404.95507153426433,15168.6566682266,32242.15744796716,0.010088982490084275,0.9899560000759298,0.997372340715855,0.13952203542475253,0.06473073511200168,222.03377076371441,81994.0,43.549963659399964,15.391669818183535,0.016708539649242626,0.1397175403078274,0.0477717881796229,0.07515184037856429,0.0045038193809904155,0.02296213167526161,0.0649702086786329,0.020833333333333332,51.891077647696065,48.0,1852.902507273312,3433247.701459726,490.9676642791952,285.81187908817867,2650.1812118186735,3033.8314479844853,0.010088984706780858,0.9899559978591325,0.9973723167541345,0.13952203542475253,0.0647246263185418,222.0338195477718,81994.0,43.550351674064416,15.39311677819772,0.016696343634900114,0.1397175403078274,0.0477717881796229,0.07515184037856429,0.004503818391435835,0.02296192709266986,0.06496410144931568,0.020833333333333332,51.891077647696065,48.0,1852.9026513877884,3433248.2355198963,490.9676631797769,285.8118722215913,2650.1812118186735,3033.5451380935842,0.010088984430911453,0.9899559981350143,0.9973723267399981,0.13952203542475253,0.06472666756946556,222.0338134765625,81994.0,43.55018997192383,15.392633246815683,0.016696343634900114,0.1397175403078274,0.0477717881796229,0.07515184037856429,0.004503818694502115,0.022962013259530067,0.06496614217758179,0.02083333395421505,51.891077647696065,48.0,1852.902587890625,3433248.0,490.96766331660024,285.81187508318897,2650.1812118186735,3033.6408084306354,894459133.0,0.000926005550117343,0.9991191449764915,0.9999877873720812,0.9882769813214142,0.9068144421620035,20.49123106568773,81994.0,1.198850536448208,1.1027325702959978,0.842195770422226,0.9882796302168452,0.9711564260799571,0.9820962509451912,0.048801362728981446,0.8341323372658818,0.9068381826534586,1.0,0.0,1.0,611.4014132115799,373811.6880771171,495.51765359560636,286.56084793351386,18823.8289037063,42618.13060280928,0.000926005550117343,0.9991191449764915,0.9999877873720812,0.9882769813214142,0.9068144421620035,20.49123106568773,81994.0,1.198850536448208,1.1027325702959978,0.842195770422226,0.9882796302168452,0.9711564260799571,0.9820962509451912,0.048801362728981446,0.8341323372658818,0.9068381826534586,1.0,0.0,1.0,611.4014132115799,373811.6880771171,495.51765359560636,286.56084793351386,18823.8289037063,42618.13060280928,0.000926005588648755,0.9991191449379583,0.9999877873735517,0.9882769813214142,0.9068144977619981,20.49123191833496,81994.0,1.1988505125045776,1.1027325027025703,0.842195770422226,0.9882796302168452,0.9711564260799571,0.9820962509451912,0.04880136251449585,0.8341323733329773,0.9068382382392882,1.0,0.0,1.0,611.4014282226562,373811.6875,495.51765357649566,286.56084793393524,18823.8289037063,42618.133215877315,COMPLETE
