number,value,datetime_start,datetime_complete,duration,params_loss.margin,params_model.embedding_dim,params_model.entity_initializer,params_model.scoring_fct_norm,params_negative_sampler.num_negs_per_pos,params_optimizer.lr,params_regularizer.p,params_regularizer.weight,user_attrs_both.optimistic.adjusted_arithmetic_mean_rank,user_attrs_both.optimistic.adjusted_arithmetic_mean_rank_index,user_attrs_both.optimistic.adjusted_geometric_mean_rank_index,user_attrs_both.optimistic.adjusted_hits_at_k,user_attrs_both.optimistic.adjusted_inverse_harmonic_mean_rank,user_attrs_both.optimistic.arithmetic_mean_rank,user_attrs_both.optimistic.count,user_attrs_both.optimistic.geometric_mean_rank,user_attrs_both.optimistic.harmonic_mean_rank,user_attrs_both.optimistic.hits_at_1,user_attrs_both.optimistic.hits_at_10,user_attrs_both.optimistic.hits_at_3,user_attrs_both.optimistic.hits_at_5,user_attrs_both.optimistic.inverse_arithmetic_mean_rank,user_attrs_both.optimistic.inverse_geometric_mean_rank,user_attrs_both.optimistic.inverse_harmonic_mean_rank,user_attrs_both.optimistic.inverse_median_rank,user_attrs_both.optimistic.median_absolute_deviation,user_attrs_both.optimistic.median_rank,user_attrs_both.optimistic.standard_deviation,user_attrs_both.optimistic.variance,user_attrs_both.optimistic.z_arithmetic_mean_rank,user_attrs_both.optimistic.z_geometric_mean_rank,user_attrs_both.optimistic.z_hits_at_k,user_attrs_both.optimistic.z_inverse_harmonic_mean_rank,user_attrs_both.pessimistic.adjusted_arithmetic_mean_rank,user_attrs_both.pessimistic.adjusted_arithmetic_mean_rank_index,user_attrs_both.pessimistic.adjusted_geometric_mean_rank_index,user_attrs_both.pessimistic.adjusted_hits_at_k,user_attrs_both.pessimistic.adjusted_inverse_harmonic_mean_rank,user_attrs_both.pessimistic.arithmetic_mean_rank,user_attrs_both.pessimistic.count,user_attrs_both.pessimistic.geometric_mean_rank,user_attrs_both.pessimistic.harmonic_mean_rank,user_attrs_both.pessimistic.hits_at_1,user_attrs_both.pessimistic.hits_at_10,user_attrs_both.pessimistic.hits_at_3,user_attrs_both.pessimistic.hits_at_5,user_attrs_both.pessimistic.inverse_arithmetic_mean_rank,user_attrs_both.pessimistic.inverse_geometric_mean_rank,user_attrs_both.pessimistic.inverse_harmonic_mean_rank,user_attrs_both.pessimistic.inverse_median_rank,user_attrs_both.pessimistic.median_absolute_deviation,user_attrs_both.pessimistic.median_rank,user_attrs_both.pessimistic.standard_deviation,user_attrs_both.pessimistic.variance,user_attrs_both.pessimistic.z_arithmetic_mean_rank,user_attrs_both.pessimistic.z_geometric_mean_rank,user_attrs_both.pessimistic.z_hits_at_k,user_attrs_both.pessimistic.z_inverse_harmonic_mean_rank,user_attrs_both.realistic.adjusted_arithmetic_mean_rank,user_attrs_both.realistic.adjusted_arithmetic_mean_rank_index,user_attrs_both.realistic.adjusted_geometric_mean_rank_index,user_attrs_both.realistic.adjusted_hits_at_k,user_attrs_both.realistic.adjusted_inverse_harmonic_mean_rank,user_attrs_both.realistic.arithmetic_mean_rank,user_attrs_both.realistic.count,user_attrs_both.realistic.geometric_mean_rank,user_attrs_both.realistic.harmonic_mean_rank,user_attrs_both.realistic.hits_at_1,user_attrs_both.realistic.hits_at_10,user_attrs_both.realistic.hits_at_3,user_attrs_both.realistic.hits_at_5,user_attrs_both.realistic.inverse_arithmetic_mean_rank,user_attrs_both.realistic.inverse_geometric_mean_rank,user_attrs_both.realistic.inverse_harmonic_mean_rank,user_attrs_both.realistic.inverse_median_rank,user_attrs_both.realistic.median_absolute_deviation,user_attrs_both.realistic.median_rank,user_attrs_both.realistic.standard_deviation,user_attrs_both.realistic.variance,user_attrs_both.realistic.z_arithmetic_mean_rank,user_attrs_both.realistic.z_geometric_mean_rank,user_attrs_both.realistic.z_hits_at_k,user_attrs_both.realistic.z_inverse_harmonic_mean_rank,user_attrs_head.optimistic.adjusted_arithmetic_mean_rank,user_attrs_head.optimistic.adjusted_arithmetic_mean_rank_index,user_attrs_head.optimistic.adjusted_geometric_mean_rank_index,user_attrs_head.optimistic.adjusted_hits_at_k,user_attrs_head.optimistic.adjusted_inverse_harmonic_mean_rank,user_attrs_head.optimistic.arithmetic_mean_rank,user_attrs_head.optimistic.count,user_attrs_head.optimistic.geometric_mean_rank,user_attrs_head.optimistic.harmonic_mean_rank,user_attrs_head.optimistic.hits_at_1,user_attrs_head.optimistic.hits_at_10,user_attrs_head.optimistic.hits_at_3,user_attrs_head.optimistic.hits_at_5,user_attrs_head.optimistic.inverse_arithmetic_mean_rank,user_attrs_head.optimistic.inverse_geometric_mean_rank,user_attrs_head.optimistic.inverse_harmonic_mean_rank,user_attrs_head.optimistic.inverse_median_rank,user_attrs_head.optimistic.median_absolute_deviation,user_attrs_head.optimistic.median_rank,user_attrs_head.optimistic.standard_deviation,user_attrs_head.optimistic.variance,user_attrs_head.optimistic.z_arithmetic_mean_rank,user_attrs_head.optimistic.z_geometric_mean_rank,user_attrs_head.optimistic.z_hits_at_k,user_attrs_head.optimistic.z_inverse_harmonic_mean_rank,user_attrs_head.pessimistic.adjusted_arithmetic_mean_rank,user_attrs_head.pessimistic.adjusted_arithmetic_mean_rank_index,user_attrs_head.pessimistic.adjusted_geometric_mean_rank_index,user_attrs_head.pessimistic.adjusted_hits_at_k,user_attrs_head.pessimistic.adjusted_inverse_harmonic_mean_rank,user_attrs_head.pessimistic.arithmetic_mean_rank,user_attrs_head.pessimistic.count,user_attrs_head.pessimistic.geometric_mean_rank,user_attrs_head.pessimistic.harmonic_mean_rank,user_attrs_head.pessimistic.hits_at_1,user_attrs_head.pessimistic.hits_at_10,user_attrs_head.pessimistic.hits_at_3,user_attrs_head.pessimistic.hits_at_5,user_attrs_head.pessimistic.inverse_arithmetic_mean_rank,user_attrs_head.pessimistic.inverse_geometric_mean_rank,user_attrs_head.pessimistic.inverse_harmonic_mean_rank,user_attrs_head.pessimistic.inverse_median_rank,user_attrs_head.pessimistic.median_absolute_deviation,user_attrs_head.pessimistic.median_rank,user_attrs_head.pessimistic.standard_deviation,user_attrs_head.pessimistic.variance,user_attrs_head.pessimistic.z_arithmetic_mean_rank,user_attrs_head.pessimistic.z_geometric_mean_rank,user_attrs_head.pessimistic.z_hits_at_k,user_attrs_head.pessimistic.z_inverse_harmonic_mean_rank,user_attrs_head.realistic.adjusted_arithmetic_mean_rank,user_attrs_head.realistic.adjusted_arithmetic_mean_rank_index,user_attrs_head.realistic.adjusted_geometric_mean_rank_index,user_attrs_head.realistic.adjusted_hits_at_k,user_attrs_head.realistic.adjusted_inverse_harmonic_mean_rank,user_attrs_head.realistic.arithmetic_mean_rank,user_attrs_head.realistic.count,user_attrs_head.realistic.geometric_mean_rank,user_attrs_head.realistic.harmonic_mean_rank,user_attrs_head.realistic.hits_at_1,user_attrs_head.realistic.hits_at_10,user_attrs_head.realistic.hits_at_3,user_attrs_head.realistic.hits_at_5,user_attrs_head.realistic.inverse_arithmetic_mean_rank,user_attrs_head.realistic.inverse_geometric_mean_rank,user_attrs_head.realistic.inverse_harmonic_mean_rank,user_attrs_head.realistic.inverse_median_rank,user_attrs_head.realistic.median_absolute_deviation,user_attrs_head.realistic.median_rank,user_attrs_head.realistic.standard_deviation,user_attrs_head.realistic.variance,user_attrs_head.realistic.z_arithmetic_mean_rank,user_attrs_head.realistic.z_geometric_mean_rank,user_attrs_head.realistic.z_hits_at_k,user_attrs_head.realistic.z_inverse_harmonic_mean_rank,user_attrs_random_seed,user_attrs_tail.optimistic.adjusted_arithmetic_mean_rank,user_attrs_tail.optimistic.adjusted_arithmetic_mean_rank_index,user_attrs_tail.optimistic.adjusted_geometric_mean_rank_index,user_attrs_tail.optimistic.adjusted_hits_at_k,user_attrs_tail.optimistic.adjusted_inverse_harmonic_mean_rank,user_attrs_tail.optimistic.arithmetic_mean_rank,user_attrs_tail.optimistic.count,user_attrs_tail.optimistic.geometric_mean_rank,user_attrs_tail.optimistic.harmonic_mean_rank,user_attrs_tail.optimistic.hits_at_1,user_attrs_tail.optimistic.hits_at_10,user_attrs_tail.optimistic.hits_at_3,user_attrs_tail.optimistic.hits_at_5,user_attrs_tail.optimistic.inverse_arithmetic_mean_rank,user_attrs_tail.optimistic.inverse_geometric_mean_rank,user_attrs_tail.optimistic.inverse_harmonic_mean_rank,user_attrs_tail.optimistic.inverse_median_rank,user_attrs_tail.optimistic.median_absolute_deviation,user_attrs_tail.optimistic.median_rank,user_attrs_tail.optimistic.standard_deviation,user_attrs_tail.optimistic.variance,user_attrs_tail.optimistic.z_arithmetic_mean_rank,user_attrs_tail.optimistic.z_geometric_mean_rank,user_attrs_tail.optimistic.z_hits_at_k,user_attrs_tail.optimistic.z_inverse_harmonic_mean_rank,user_attrs_tail.pessimistic.adjusted_arithmetic_mean_rank,user_attrs_tail.pessimistic.adjusted_arithmetic_mean_rank_index,user_attrs_tail.pessimistic.adjusted_geometric_mean_rank_index,user_attrs_tail.pessimistic.adjusted_hits_at_k,user_attrs_tail.pessimistic.adjusted_inverse_harmonic_mean_rank,user_attrs_tail.pessimistic.arithmetic_mean_rank,user_attrs_tail.pessimistic.count,user_attrs_tail.pessimistic.geometric_mean_rank,user_attrs_tail.pessimistic.harmonic_mean_rank,user_attrs_tail.pessimistic.hits_at_1,user_attrs_tail.pessimistic.hits_at_10,user_attrs_tail.pessimistic.hits_at_3,user_attrs_tail.pessimistic.hits_at_5,user_attrs_tail.pessimistic.inverse_arithmetic_mean_rank,user_attrs_tail.pessimistic.inverse_geometric_mean_rank,user_attrs_tail.pessimistic.inverse_harmonic_mean_rank,user_attrs_tail.pessimistic.inverse_median_rank,user_attrs_tail.pessimistic.median_absolute_deviation,user_attrs_tail.pessimistic.median_rank,user_attrs_tail.pessimistic.standard_deviation,user_attrs_tail.pessimistic.variance,user_attrs_tail.pessimistic.z_arithmetic_mean_rank,user_attrs_tail.pessimistic.z_geometric_mean_rank,user_attrs_tail.pessimistic.z_hits_at_k,user_attrs_tail.pessimistic.z_inverse_harmonic_mean_rank,user_attrs_tail.realistic.adjusted_arithmetic_mean_rank,user_attrs_tail.realistic.adjusted_arithmetic_mean_rank_index,user_attrs_tail.realistic.adjusted_geometric_mean_rank_index,user_attrs_tail.realistic.adjusted_hits_at_k,user_attrs_tail.realistic.adjusted_inverse_harmonic_mean_rank,user_attrs_tail.realistic.arithmetic_mean_rank,user_attrs_tail.realistic.count,user_attrs_tail.realistic.geometric_mean_rank,user_attrs_tail.realistic.harmonic_mean_rank,user_attrs_tail.realistic.hits_at_1,user_attrs_tail.realistic.hits_at_10,user_attrs_tail.realistic.hits_at_3,user_attrs_tail.realistic.hits_at_5,user_attrs_tail.realistic.inverse_arithmetic_mean_rank,user_attrs_tail.realistic.inverse_geometric_mean_rank,user_attrs_tail.realistic.inverse_harmonic_mean_rank,user_attrs_tail.realistic.inverse_median_rank,user_attrs_tail.realistic.median_absolute_deviation,user_attrs_tail.realistic.median_rank,user_attrs_tail.realistic.standard_deviation,user_attrs_tail.realistic.variance,user_attrs_tail.realistic.z_arithmetic_mean_rank,user_attrs_tail.realistic.z_geometric_mean_rank,user_attrs_tail.realistic.z_hits_at_k,user_attrs_tail.realistic.z_inverse_harmonic_mean_rank,state
10,0.33569368720054626,2025-07-14 11:56:08.125942,2025-07-14 12:02:35.062558,0 days 00:06:26.936616,4.0,400,xavier_uniform_norm,1.0,2,0.0001,1,1e-05,0.04071120849619291,0.9593322629764439,0.9991471868335052,0.5241317558614881,0.33552424607964326,898.4185123301705,163988.0,14.847662344476635,2.9789037816716504,0.2070029514354709,0.5242395785057443,0.42337244188599166,0.46338756494377636,0.0011130670019325003,0.0673506695397072,0.3356939576742009,0.125,10.378215529539213,8.0,4063.8307298509667,16514720.20088104,672.8555690142632,404.7649112237714,14098.914435072717,22269.81064772699,0.04071132261922051,0.9593321488482447,0.9991471841237194,0.5241317558614881,0.33552372848168477,898.4210308071322,163988.0,14.84770634496895,2.9789083736014477,0.2070029514354709,0.5242395785057443,0.4233663438788204,0.46338756494377636,0.0011130638817544267,0.06735046994910723,0.3356934402084404,0.125,10.378215529539213,8.0,4063.8385357440166,16514783.644598074,672.8554889671332,404.76491012600894,14098.914435072717,22269.77629310534,0.040711266837203004,0.95933220463279,0.9991471853881323,0.5241317558614881,0.3355239755368902,898.4197998046875,163988.0,14.847685813903809,2.9789061818210225,0.2070029514354709,0.5242395785057443,0.4233663438788204,0.46338756494377636,0.0011130654020234942,0.06735056638717651,0.33569368720054626,0.125,10.378215529539213,8.0,4063.834716796875,16514752.0,672.8555280932455,404.76491063823573,14098.914435072717,22269.79269094457,0.08133297165268573,0.9187087735138156,0.9943835295076654,0.1671644844270989,0.06979795995326075,1789.9393126326318,81994.0,91.94809847871383,14.278343382934109,0.02012342366514623,0.16735370880796155,0.05784569602653853,0.09195794814254701,0.0005586781590540107,0.0108757007109995,0.07003613606850422,0.016129032258064516,81.5431220178081,62.0,5607.091586092875,31439476.05483352,455.6326752404008,284.95539078107424,3175.2416352252953,3271.3245963446934,0.0813331999724336,0.9187085451836927,0.9943834963496326,0.1671644844270989,0.06979692538356264,1789.9443373905408,81994.0,91.94863541023264,14.278554250894738,0.02012342366514623,0.16735370880796155,0.05783350001219601,0.09195794814254701,0.0005586765907245159,0.010875637202645354,0.07003510176370531,0.016129032258064516,81.5431220178081,62.0,5607.102103708671,31439594.001414202,455.63256200031014,284.95538127914676,3175.2416352252953,3271.2761076309494,0.08133307787796569,0.9187086672837087,0.9943835121522613,0.1671644844270989,0.06979737075194403,1789.941650390625,81994.0,91.94837951660156,14.278463474301947,0.02012342366514623,0.16735370880796155,0.05783350001219601,0.09195794814254701,0.0005586774204857647,0.010875667445361614,0.07003554701805115,0.016129031777381897,81.5431220178081,62.0,5607.09716796875,31439536.0,455.63262255568804,284.9553858076251,3175.2416352252953,3271.2969813719797,2075156243.0,0.0003117099016791372,0.999733468386409,0.9999141659588239,0.8810985816231255,0.6012501914733567,6.897712027709344,81994.0,2.397581687310531,1.6629201649614687,0.39388247920579555,0.8811254482035271,0.7888991877454448,0.8348171817450057,0.1449756087210978,0.4170869360959052,0.6013517792798976,0.5,1.482602218505602,2.0,18.59226141924425,345.67218468151816,495.82233006603707,286.5397506612517,16782.389209951576,28257.33468038196,0.00031171045282108345,0.9997334678352421,0.9999141659459503,0.8810985816231255,0.6012501908464747,6.897724223723687,81994.0,2.3975818969239153,1.662920166694546,0.39388247920579555,0.8811254482035271,0.7888991877454448,0.8348171817450057,0.14497535238661038,0.41708689963124707,0.6013517786531754,0.5,1.482602218505602,2.0,18.592348402506374,345.6754191201813,495.8223297926834,286.53975065756254,16782.389209951576,28257.33465091999,0.00031171016943271404,0.9997334681186433,0.9999141659509375,0.8810985816231255,0.6012502097788417,6.8977179527282715,81994.0,2.3975818157196045,1.6629201143541452,0.39388247920579555,0.8811254482035271,0.7888991877454448,0.8348171817450057,0.144975483417511,0.4170868992805481,0.601351797580719,0.5,1.482602218505602,2.0,18.592304229736328,345.67376708984375,495.8223299332375,286.5397506589917,16782.389209951576,28257.33554069639,COMPLETE
11,0.455237478017807,2025-07-14 12:02:35.091923,2025-07-14 12:08:09.028063,0 days 00:05:33.936140,10.0,200,xavier_uniform_norm,1.0,6,0.001,1,1e-05,0.015349921911953912,0.9846946988417811,0.9993637859690377,0.5507982853398661,0.4550983171035219,338.7434202502622,163988.0,11.330606310633142,2.196655646518039,0.3991999414591312,0.5509000658584774,0.47591896968070835,0.5050674439593141,0.002952086860495192,0.08825653037309714,0.455237488672892,0.2,5.930408874022408,5.0,1670.2255268154868,2789653.3104260704,690.6442506570678,404.85265778505914,14816.232386506577,30206.32179764712,0.01534993324135859,0.9846946875118631,0.9993637855732116,0.5507982853398661,0.45509830327022727,338.74367026855623,163988.0,11.330612737911073,2.1966557132507343,0.3991999414591312,0.5509000658584774,0.47591896968070835,0.5050674439593141,0.0029520846816331633,0.08825648030967488,0.4552374748431305,0.2,5.930408874022408,5.0,1670.2264696406908,2789656.459888405,690.6442427105004,404.85265762470584,14816.232386506577,30206.320879487386,0.01534992689757739,0.9846946938559317,0.9993637857836067,0.5507982853398661,0.4550983064457148,338.7435302734375,163988.0,11.330609321594238,2.1966556979319796,0.3991999414591312,0.5509000658584774,0.47591896968070835,0.5050674439593141,0.0029520858079195023,0.08825650811195374,0.455237478017807,0.20000000298023224,5.930408874022408,5.0,1670.2259521484375,2789654.75,690.6442471600973,404.8526577099391,14816.232386506577,30206.32109025459,0.030658905976468125,0.9693851418712482,0.9943247992602695,0.1405833298039247,0.060506590262725424,674.7273580993731,81994.0,92.89912356308541,16.46167886930774,0.017391516452423348,0.14077859355562602,0.04839378491109105,0.07763982730443691,0.0014820801142803538,0.010764364201142605,0.060747145412031286,0.012195121951219513,109.71256416941455,82.0,2313.751284207577,5353445.005172213,480.76556822220243,284.9385607551328,2670.340195418133,2835.852181065888,0.030658928697608084,0.9693851191490758,0.9943247927517003,0.1405833298039247,0.06050656259611839,674.7278581359611,81994.0,92.8992289570318,16.461686364678766,0.017391516452423348,0.14077859355562602,0.04839378491109105,0.07763982730443691,0.0014820790159200672,0.010764351988997937,0.060747117752508226,0.012195121951219513,109.71256416941455,82.0,2313.752572789111,5353450.968088231,480.7655569531643,284.9385588900055,2670.340195418133,2835.8508843739482,0.030658916972617193,0.9693851308745994,0.9943247968685482,0.1405833298039247,0.06050657655246777,674.7276000976562,81994.0,92.89916229248047,16.461682583657108,0.017391516452423348,0.14077859355562602,0.04839378491109105,0.07763982730443691,0.0014820796204730868,0.01076435949653387,0.06074713170528411,0.012195121496915817,109.71256416941455,82.0,2313.751708984375,5353447.5,480.76556276842575,284.9385600697495,2670.340195418133,2835.851538486891,1230487403.0,0.00012470192789910245,0.9999204848115235,0.999976541654069,0.9610127287234542,0.8496895379714458,2.759482401151304,81994.0,1.3819574872455946,1.1768474120993166,0.7810083664658389,0.9610215381613288,0.9034441544503257,0.9324950606141913,0.3623868010837042,0.7236112610042142,0.8497278319337528,1.0,0.0,1.0,9.55001019575598,91.20269473904318,495.9150817069425,286.557625311668,18304.523450082146,39933.39543068107,0.00012470192789910245,0.9999204848115235,0.999976541654069,0.9610127287234542,0.8496895379714458,2.759482401151304,81994.0,1.3819574872455946,1.1768474120993166,0.7810083664658389,0.9610215381613288,0.9034441544503257,0.9324950606141913,0.3623868010837042,0.7236112610042142,0.8497278319337528,1.0,0.0,1.0,9.55001019575598,91.20269473904318,495.9150817069425,286.557625311668,18304.523450082146,39933.39543068107,0.0001247019271117388,0.9999204848123109,0.9999765416513834,0.9610127287234542,0.8496895750809607,2.7594823837280273,81994.0,1.3819575309753418,1.1768473607168541,0.7810083664658389,0.9610215381613288,0.9034441544503257,0.9324950606141913,0.3623867928981781,0.7236112356185913,0.8497278690338134,1.0,0.0,1.0,9.550010681152344,91.20269775390625,495.915081707333,286.55762531089835,18304.523450082146,39933.397174740356,COMPLETE
