number,value,datetime_start,datetime_complete,duration,params_loss.margin,params_model.embedding_dim,params_model.entity_initializer,params_negative_sampler.num_negs_per_pos,params_optimizer.lr,params_regularizer.p,params_regularizer.weight,user_attrs_both.optimistic.adjusted_arithmetic_mean_rank,user_attrs_both.optimistic.adjusted_arithmetic_mean_rank_index,user_attrs_both.optimistic.adjusted_geometric_mean_rank_index,user_attrs_both.optimistic.adjusted_hits_at_k,user_attrs_both.optimistic.adjusted_inverse_harmonic_mean_rank,user_attrs_both.optimistic.arithmetic_mean_rank,user_attrs_both.optimistic.count,user_attrs_both.optimistic.geometric_mean_rank,user_attrs_both.optimistic.harmonic_mean_rank,user_attrs_both.optimistic.hits_at_1,user_attrs_both.optimistic.hits_at_10,user_attrs_both.optimistic.hits_at_3,user_attrs_both.optimistic.hits_at_5,user_attrs_both.optimistic.inverse_arithmetic_mean_rank,user_attrs_both.optimistic.inverse_geometric_mean_rank,user_attrs_both.optimistic.inverse_harmonic_mean_rank,user_attrs_both.optimistic.inverse_median_rank,user_attrs_both.optimistic.median_absolute_deviation,user_attrs_both.optimistic.median_rank,user_attrs_both.optimistic.standard_deviation,user_attrs_both.optimistic.variance,user_attrs_both.optimistic.z_arithmetic_mean_rank,user_attrs_both.optimistic.z_geometric_mean_rank,user_attrs_both.optimistic.z_hits_at_k,user_attrs_both.optimistic.z_inverse_harmonic_mean_rank,user_attrs_both.pessimistic.adjusted_arithmetic_mean_rank,user_attrs_both.pessimistic.adjusted_arithmetic_mean_rank_index,user_attrs_both.pessimistic.adjusted_geometric_mean_rank_index,user_attrs_both.pessimistic.adjusted_hits_at_k,user_attrs_both.pessimistic.adjusted_inverse_harmonic_mean_rank,user_attrs_both.pessimistic.arithmetic_mean_rank,user_attrs_both.pessimistic.count,user_attrs_both.pessimistic.geometric_mean_rank,user_attrs_both.pessimistic.harmonic_mean_rank,user_attrs_both.pessimistic.hits_at_1,user_attrs_both.pessimistic.hits_at_10,user_attrs_both.pessimistic.hits_at_3,user_attrs_both.pessimistic.hits_at_5,user_attrs_both.pessimistic.inverse_arithmetic_mean_rank,user_attrs_both.pessimistic.inverse_geometric_mean_rank,user_attrs_both.pessimistic.inverse_harmonic_mean_rank,user_attrs_both.pessimistic.inverse_median_rank,user_attrs_both.pessimistic.median_absolute_deviation,user_attrs_both.pessimistic.median_rank,user_attrs_both.pessimistic.standard_deviation,user_attrs_both.pessimistic.variance,user_attrs_both.pessimistic.z_arithmetic_mean_rank,user_attrs_both.pessimistic.z_geometric_mean_rank,user_attrs_both.pessimistic.z_hits_at_k,user_attrs_both.pessimistic.z_inverse_harmonic_mean_rank,user_attrs_both.realistic.adjusted_arithmetic_mean_rank,user_attrs_both.realistic.adjusted_arithmetic_mean_rank_index,user_attrs_both.realistic.adjusted_geometric_mean_rank_index,user_attrs_both.realistic.adjusted_hits_at_k,user_attrs_both.realistic.adjusted_inverse_harmonic_mean_rank,user_attrs_both.realistic.arithmetic_mean_rank,user_attrs_both.realistic.count,user_attrs_both.realistic.geometric_mean_rank,user_attrs_both.realistic.harmonic_mean_rank,user_attrs_both.realistic.hits_at_1,user_attrs_both.realistic.hits_at_10,user_attrs_both.realistic.hits_at_3,user_attrs_both.realistic.hits_at_5,user_attrs_both.realistic.inverse_arithmetic_mean_rank,user_attrs_both.realistic.inverse_geometric_mean_rank,user_attrs_both.realistic.inverse_harmonic_mean_rank,user_attrs_both.realistic.inverse_median_rank,user_attrs_both.realistic.median_absolute_deviation,user_attrs_both.realistic.median_rank,user_attrs_both.realistic.standard_deviation,user_attrs_both.realistic.variance,user_attrs_both.realistic.z_arithmetic_mean_rank,user_attrs_both.realistic.z_geometric_mean_rank,user_attrs_both.realistic.z_hits_at_k,user_attrs_both.realistic.z_inverse_harmonic_mean_rank,user_attrs_head.optimistic.adjusted_arithmetic_mean_rank,user_attrs_head.optimistic.adjusted_arithmetic_mean_rank_index,user_attrs_head.optimistic.adjusted_geometric_mean_rank_index,user_attrs_head.optimistic.adjusted_hits_at_k,user_attrs_head.optimistic.adjusted_inverse_harmonic_mean_rank,user_attrs_head.optimistic.arithmetic_mean_rank,user_attrs_head.optimistic.count,user_attrs_head.optimistic.geometric_mean_rank,user_attrs_head.optimistic.harmonic_mean_rank,user_attrs_head.optimistic.hits_at_1,user_attrs_head.optimistic.hits_at_10,user_attrs_head.optimistic.hits_at_3,user_attrs_head.optimistic.hits_at_5,user_attrs_head.optimistic.inverse_arithmetic_mean_rank,user_attrs_head.optimistic.inverse_geometric_mean_rank,user_attrs_head.optimistic.inverse_harmonic_mean_rank,user_attrs_head.optimistic.inverse_median_rank,user_attrs_head.optimistic.median_absolute_deviation,user_attrs_head.optimistic.median_rank,user_attrs_head.optimistic.standard_deviation,user_attrs_head.optimistic.variance,user_attrs_head.optimistic.z_arithmetic_mean_rank,user_attrs_head.optimistic.z_geometric_mean_rank,user_attrs_head.optimistic.z_hits_at_k,user_attrs_head.optimistic.z_inverse_harmonic_mean_rank,user_attrs_head.pessimistic.adjusted_arithmetic_mean_rank,user_attrs_head.pessimistic.adjusted_arithmetic_mean_rank_index,user_attrs_head.pessimistic.adjusted_geometric_mean_rank_index,user_attrs_head.pessimistic.adjusted_hits_at_k,user_attrs_head.pessimistic.adjusted_inverse_harmonic_mean_rank,user_attrs_head.pessimistic.arithmetic_mean_rank,user_attrs_head.pessimistic.count,user_attrs_head.pessimistic.geometric_mean_rank,user_attrs_head.pessimistic.harmonic_mean_rank,user_attrs_head.pessimistic.hits_at_1,user_attrs_head.pessimistic.hits_at_10,user_attrs_head.pessimistic.hits_at_3,user_attrs_head.pessimistic.hits_at_5,user_attrs_head.pessimistic.inverse_arithmetic_mean_rank,user_attrs_head.pessimistic.inverse_geometric_mean_rank,user_attrs_head.pessimistic.inverse_harmonic_mean_rank,user_attrs_head.pessimistic.inverse_median_rank,user_attrs_head.pessimistic.median_absolute_deviation,user_attrs_head.pessimistic.median_rank,user_attrs_head.pessimistic.standard_deviation,user_attrs_head.pessimistic.variance,user_attrs_head.pessimistic.z_arithmetic_mean_rank,user_attrs_head.pessimistic.z_geometric_mean_rank,user_attrs_head.pessimistic.z_hits_at_k,user_attrs_head.pessimistic.z_inverse_harmonic_mean_rank,user_attrs_head.realistic.adjusted_arithmetic_mean_rank,user_attrs_head.realistic.adjusted_arithmetic_mean_rank_index,user_attrs_head.realistic.adjusted_geometric_mean_rank_index,user_attrs_head.realistic.adjusted_hits_at_k,user_attrs_head.realistic.adjusted_inverse_harmonic_mean_rank,user_attrs_head.realistic.arithmetic_mean_rank,user_attrs_head.realistic.count,user_attrs_head.realistic.geometric_mean_rank,user_attrs_head.realistic.harmonic_mean_rank,user_attrs_head.realistic.hits_at_1,user_attrs_head.realistic.hits_at_10,user_attrs_head.realistic.hits_at_3,user_attrs_head.realistic.hits_at_5,user_attrs_head.realistic.inverse_arithmetic_mean_rank,user_attrs_head.realistic.inverse_geometric_mean_rank,user_attrs_head.realistic.inverse_harmonic_mean_rank,user_attrs_head.realistic.inverse_median_rank,user_attrs_head.realistic.median_absolute_deviation,user_attrs_head.realistic.median_rank,user_attrs_head.realistic.standard_deviation,user_attrs_head.realistic.variance,user_attrs_head.realistic.z_arithmetic_mean_rank,user_attrs_head.realistic.z_geometric_mean_rank,user_attrs_head.realistic.z_hits_at_k,user_attrs_head.realistic.z_inverse_harmonic_mean_rank,user_attrs_random_seed,user_attrs_tail.optimistic.adjusted_arithmetic_mean_rank,user_attrs_tail.optimistic.adjusted_arithmetic_mean_rank_index,user_attrs_tail.optimistic.adjusted_geometric_mean_rank_index,user_attrs_tail.optimistic.adjusted_hits_at_k,user_attrs_tail.optimistic.adjusted_inverse_harmonic_mean_rank,user_attrs_tail.optimistic.arithmetic_mean_rank,user_attrs_tail.optimistic.count,user_attrs_tail.optimistic.geometric_mean_rank,user_attrs_tail.optimistic.harmonic_mean_rank,user_attrs_tail.optimistic.hits_at_1,user_attrs_tail.optimistic.hits_at_10,user_attrs_tail.optimistic.hits_at_3,user_attrs_tail.optimistic.hits_at_5,user_attrs_tail.optimistic.inverse_arithmetic_mean_rank,user_attrs_tail.optimistic.inverse_geometric_mean_rank,user_attrs_tail.optimistic.inverse_harmonic_mean_rank,user_attrs_tail.optimistic.inverse_median_rank,user_attrs_tail.optimistic.median_absolute_deviation,user_attrs_tail.optimistic.median_rank,user_attrs_tail.optimistic.standard_deviation,user_attrs_tail.optimistic.variance,user_attrs_tail.optimistic.z_arithmetic_mean_rank,user_attrs_tail.optimistic.z_geometric_mean_rank,user_attrs_tail.optimistic.z_hits_at_k,user_attrs_tail.optimistic.z_inverse_harmonic_mean_rank,user_attrs_tail.pessimistic.adjusted_arithmetic_mean_rank,user_attrs_tail.pessimistic.adjusted_arithmetic_mean_rank_index,user_attrs_tail.pessimistic.adjusted_geometric_mean_rank_index,user_attrs_tail.pessimistic.adjusted_hits_at_k,user_attrs_tail.pessimistic.adjusted_inverse_harmonic_mean_rank,user_attrs_tail.pessimistic.arithmetic_mean_rank,user_attrs_tail.pessimistic.count,user_attrs_tail.pessimistic.geometric_mean_rank,user_attrs_tail.pessimistic.harmonic_mean_rank,user_attrs_tail.pessimistic.hits_at_1,user_attrs_tail.pessimistic.hits_at_10,user_attrs_tail.pessimistic.hits_at_3,user_attrs_tail.pessimistic.hits_at_5,user_attrs_tail.pessimistic.inverse_arithmetic_mean_rank,user_attrs_tail.pessimistic.inverse_geometric_mean_rank,user_attrs_tail.pessimistic.inverse_harmonic_mean_rank,user_attrs_tail.pessimistic.inverse_median_rank,user_attrs_tail.pessimistic.median_absolute_deviation,user_attrs_tail.pessimistic.median_rank,user_attrs_tail.pessimistic.standard_deviation,user_attrs_tail.pessimistic.variance,user_attrs_tail.pessimistic.z_arithmetic_mean_rank,user_attrs_tail.pessimistic.z_geometric_mean_rank,user_attrs_tail.pessimistic.z_hits_at_k,user_attrs_tail.pessimistic.z_inverse_harmonic_mean_rank,user_attrs_tail.realistic.adjusted_arithmetic_mean_rank,user_attrs_tail.realistic.adjusted_arithmetic_mean_rank_index,user_attrs_tail.realistic.adjusted_geometric_mean_rank_index,user_attrs_tail.realistic.adjusted_hits_at_k,user_attrs_tail.realistic.adjusted_inverse_harmonic_mean_rank,user_attrs_tail.realistic.arithmetic_mean_rank,user_attrs_tail.realistic.count,user_attrs_tail.realistic.geometric_mean_rank,user_attrs_tail.realistic.harmonic_mean_rank,user_attrs_tail.realistic.hits_at_1,user_attrs_tail.realistic.hits_at_10,user_attrs_tail.realistic.hits_at_3,user_attrs_tail.realistic.hits_at_5,user_attrs_tail.realistic.inverse_arithmetic_mean_rank,user_attrs_tail.realistic.inverse_geometric_mean_rank,user_attrs_tail.realistic.inverse_harmonic_mean_rank,user_attrs_tail.realistic.inverse_median_rank,user_attrs_tail.realistic.median_absolute_deviation,user_attrs_tail.realistic.median_rank,user_attrs_tail.realistic.standard_deviation,user_attrs_tail.realistic.variance,user_attrs_tail.realistic.z_arithmetic_mean_rank,user_attrs_tail.realistic.z_geometric_mean_rank,user_attrs_tail.realistic.z_hits_at_k,user_attrs_tail.realistic.z_inverse_harmonic_mean_rank,state
6,0.008619519881904125,2025-07-14 14:37:48.951678,2025-07-14 14:44:02.614618,0 days 00:06:13.662940,2.0,100,xavier_uniform_norm,8,1e-05,1,0.01,0.32239485630415476,0.677635850291944,0.9460408343805047,0.008702873526096284,0.00836698973385706,7114.637906432178,163988.0,877.1688201411856,116.00578844498078,0.0007134668390370027,0.008927482498719419,0.002280654682049906,0.004006390711515477,0.00014055529081753035,0.0011400314022094902,0.008620259500880682,0.004016064257028112,338.03330581927725,249.0,10703.07589169557,114555833.54339492,475.27960147822705,383.25097582033914,234.10348220938025,555.3437024048718,0.3223956294669423,0.6776350770941195,0.9460334557263592,0.008702873526096284,0.008365519916700988,7114.654968656243,163988.0,877.2886319770915,116.02556659808293,0.0007134668390370027,0.008927482498719419,0.002280654682049906,0.004006390711515477,0.00014055495374062696,0.0011398757074354896,0.008618790059125837,0.004016064257028112,338.03330581927725,249.0,10703.071619323917,114555742.08837709,475.2790591734572,383.2479866508459,234.10348220938025,555.2461459685338,0.3223952450076531,0.6776354615708311,0.9460371467364778,0.008702873526096284,0.008366249925928562,7114.646484375,163988.0,877.2286987304688,116.01574260527043,0.0007134668390370027,0.008927482498719419,0.002280654682049906,0.004006390711515477,0.00014055511564947665,0.0011399536160752177,0.008619519881904125,0.00401606410741806,338.03330581927725,249.0,10703.0732421875,114555784.0,475.279328837375,383.24948191741186,234.10348220938025,555.2945990012405,0.6415785264603241,0.3584377605769036,0.48926000312896967,-0.0002272566188840388,7.313371181642131e-05,14119.5704929629,81994.0,8271.466584991529,3038.01120003122,0.0,0.0,0.0,0.0,7.082368408432774e-05,0.00012089754455570036,0.00032916271012750826,8.618460742911317e-05,12714.796625904042,11603.0,11444.243442079121,130970707.96157098,177.76684022967686,140.20473112038852,-4.316674565378852,3.4276662304636165,0.6415788578564631,0.35843742916570565,0.4892596999550598,-0.0002272566188840388,7.313358089315803e-05,14119.577786179476,81994.0,8271.471494318597,3038.0124080801393,0.0,0.0,0.0,0.0,7.082364750161439e-05,0.00012089747279995673,0.0003291625792377676,8.618460742911317e-05,12714.796625904042,11603.0,11444.247428049128,130970799.19440909,177.76667586663268,140.20464424139524,-4.316674565378852,3.4276600942886954,0.6415786513822167,0.3584376356493344,0.48926011065877884,-0.0002272566188840388,7.313363611302106e-05,14119.5732421875,81994.0,8271.46484375,3038.011898557924,0.0,0.0,0.0,0.0,7.082366937538609e-05,0.0001208975663757883,0.0003291626344434917,8.618460560683161e-05,12714.796625904042,11603.0,11444.2451171875,130970752.0,177.76677827197688,140.20476193465473,-4.316674565378852,3.4276626823599834,1332656995.0,0.004957619909730765,0.9950873484186501,0.9943483899825329,0.0176329925218313,0.016660835120940423,109.7053199014562,81994.0,93.02161002789902,59.13186280007037,0.0014269336780740054,0.017854964997438837,0.004561309364099812,0.008012781423030954,0.009115328234749774,0.010750190194515879,0.016911356291633855,0.009615384615384616,41.51286211815685,104.0,52.896517266134744,2798.0415388864913,493.5180658786045,284.9447976995107,335.8577003862601,783.0197823528474,0.004958832422012501,0.995086135851572,0.9943468325917283,0.0176329925218313,0.016657895619436074,109.73215113300974,81994.0,93.04696804249102,59.14214016140979,0.0014269336780740054,0.017854964997438837,0.004561309364099812,0.008012781423030954,0.009113099394067917,0.010747260453917617,0.016908417539013905,0.009615384615384616,41.51286211815685,104.0,52.89256497658225,2797.6234298019754,493.5174645004842,284.94435140683066,335.8577003862601,782.8816327456127,0.004958226130802939,0.9950867421701813,0.9943476091000535,0.0176329925218313,0.016659355290622894,109.71873474121094,81994.0,93.0343246459961,59.1370362753611,0.0014269336780740054,0.017854964997438837,0.004561309364099812,0.008012781423030954,0.009114213287830353,0.010748720727860928,0.016909876838326454,0.009615384973585606,41.51286211815685,104.0,52.89447784423828,2797.82568359375,493.5177652069376,284.9445739264323,335.8577003862601,782.9502338335362,COMPLETE
7,0.018716296181082726,2025-07-14 14:44:02.644875,2025-07-14 14:52:05.242028,0 days 00:08:02.597153,1.0,300,xavier_uniform_norm,4,0.0001,2,1e-05,0.3484754155664114,0.6515541091537722,0.9547018694746428,0.03525961399930256,0.018466312205038016,7690.185970924702,163988.0,736.5341603478062,53.42735825505577,0.0023965168183037785,0.03547820572236993,0.008823816376808059,0.016220699075542112,0.00013003586698433973,0.001357710278539939,0.01871700253690479,0.00404040404040404,359.5310379876085,247.5,11241.728882381902,126376468.26497942,456.9864141731753,386.7596511658555,948.468157539443,1225.6678346589306,0.34847608593557594,0.651553438754229,0.9547011089367275,0.03525961399930256,0.018465016949123548,7690.200764690099,163988.0,736.546509679011,53.43105485197453,0.0023965168183037785,0.03547820572236993,0.008817718369636803,0.016214601068370856,0.00013003561683220868,0.0013576875144460366,0.01871570761180743,0.00404040404040404,359.5310379876085,247.5,11241.738120112368,126376675.96118754,456.9859439689682,386.75934306404054,948.468157539443,1225.581864407026,0.3484757503688853,0.6515537743361264,0.9547014472899804,0.03525961399930256,0.018465605668761816,7690.193359375,163988.0,736.541015625,53.42937461156114,0.0023965168183037785,0.03547820572236993,0.008817718369636803,0.016214601068370856,0.00013003573985770345,0.0013576976489275694,0.018716296181082726,0.004040404222905636,359.5310379876085,247.5,11241.7333984375,126376568.0,456.9861793390867,386.7594801344603,948.468157539443,1225.6209396006132,0.6950386671851121,0.3049751905688096,0.41261084759671585,-0.0002272566188840388,1.3565856401756961e-05,15296.097129058224,81994.0,9512.654436894578,3709.0597655972374,0.0,0.0,0.0,0.0,6.537615390139521e-05,0.00010512312905234175,0.00026961010692664824,7.74233508826262e-05,13169.955506985261,12916.0,11706.800628320532,137049180.951246,151.2521333929855,118.23977552770404,-4.316674565378852,0.6358111289680242,0.6950399600733932,0.3049738976217783,0.4126088638169062,-0.0002272566188840388,1.3564721626873851e-05,15296.125582359686,81994.0,9512.686560450062,3709.075372904859,0.0,0.0,0.0,0.0,6.537603229103021e-05,0.00010512277406023228,0.00026960897244232167,7.74233508826262e-05,13169.955506985261,12916.0,11706.800621355867,137049180.78817812,151.25149215722962,118.23920704609299,-4.316674565378852,0.6357579437891321,0.6950392680018872,0.3049745897247328,0.4126101325559526,-0.0002272566188840388,1.3565281879843627e-05,15296.1103515625,81994.0,9512.666015625,3709.0676673597295,0.0,0.0,0.0,0.0,6.537609442602843e-05,0.00010512299922993407,0.00026960953255183995,7.742334855720401e-05,13169.955506985261,12916.0,11706.80078125,137049184.0,151.25183540498102,118.23957062213785,-4.316674565378852,0.6357842019966995,1897856987.0,0.0038084068316621375,0.9962366134323871,0.996559010615177,0.0707464403122193,0.036919034892283424,84.27481279117984,81994.0,57.027465147398146,26.90747423417216,0.004793033636607557,0.07095641144473985,0.017647632753616117,0.032441398151084225,0.011865941517756294,0.017535410304759524,0.03716439496688293,0.014705882352941176,62.269293177235284,68.0,63.13864009315022,3986.4878728123563,494.08804905411444,285.5782827589778,1347.515841361457,1735.1071813740639,0.0038084580878631384,0.9962365621738697,0.99655890499356,0.0707464403122193,0.03691644551688879,84.2759470205137,81994.0,57.029184917732245,26.909348626412573,0.004793033636607557,0.07095641144473985,0.017635436739273605,0.03242920213674171,0.011865781819771054,0.01753488150746947,0.03716180625117254,0.014705882352941176,62.269293177235284,68.0,63.1384994494189,3986.470112724271,494.08802363222117,285.57825249158805,1347.515841361457,1734.9854868645618,0.0038084325993898616,0.9962365876634949,0.9965589576256888,0.0707464403122193,0.03691762149270952,84.27538299560547,81994.0,57.02832794189453,26.908497330857223,0.004793033636607557,0.07095641144473985,0.017635436739273605,0.03242920213674171,0.011865860782563686,0.017535144463181496,0.03716298192739487,0.014705882407724857,62.269293177235284,68.0,63.13856506347656,3986.478515625,494.0880362739159,285.5782675740797,1347.515841361457,1735.040754942333,COMPLETE
