number,value,datetime_start,datetime_complete,duration,params_model.dropout_0,params_model.dropout_1,params_model.dropout_2,params_model.embedding_dim,params_model.entity_initializer,params_model.relation_dim,params_negative_sampler.num_negs_per_pos,params_optimizer.lr,user_attrs_both.optimistic.adjusted_arithmetic_mean_rank,user_attrs_both.optimistic.adjusted_arithmetic_mean_rank_index,user_attrs_both.optimistic.adjusted_geometric_mean_rank_index,user_attrs_both.optimistic.adjusted_hits_at_k,user_attrs_both.optimistic.adjusted_inverse_harmonic_mean_rank,user_attrs_both.optimistic.arithmetic_mean_rank,user_attrs_both.optimistic.count,user_attrs_both.optimistic.geometric_mean_rank,user_attrs_both.optimistic.harmonic_mean_rank,user_attrs_both.optimistic.hits_at_1,user_attrs_both.optimistic.hits_at_10,user_attrs_both.optimistic.hits_at_3,user_attrs_both.optimistic.hits_at_5,user_attrs_both.optimistic.inverse_arithmetic_mean_rank,user_attrs_both.optimistic.inverse_geometric_mean_rank,user_attrs_both.optimistic.inverse_harmonic_mean_rank,user_attrs_both.optimistic.inverse_median_rank,user_attrs_both.optimistic.median_absolute_deviation,user_attrs_both.optimistic.median_rank,user_attrs_both.optimistic.standard_deviation,user_attrs_both.optimistic.variance,user_attrs_both.optimistic.z_arithmetic_mean_rank,user_attrs_both.optimistic.z_geometric_mean_rank,user_attrs_both.optimistic.z_hits_at_k,user_attrs_both.optimistic.z_inverse_harmonic_mean_rank,user_attrs_both.pessimistic.adjusted_arithmetic_mean_rank,user_attrs_both.pessimistic.adjusted_arithmetic_mean_rank_index,user_attrs_both.pessimistic.adjusted_geometric_mean_rank_index,user_attrs_both.pessimistic.adjusted_hits_at_k,user_attrs_both.pessimistic.adjusted_inverse_harmonic_mean_rank,user_attrs_both.pessimistic.arithmetic_mean_rank,user_attrs_both.pessimistic.count,user_attrs_both.pessimistic.geometric_mean_rank,user_attrs_both.pessimistic.harmonic_mean_rank,user_attrs_both.pessimistic.hits_at_1,user_attrs_both.pessimistic.hits_at_10,user_attrs_both.pessimistic.hits_at_3,user_attrs_both.pessimistic.hits_at_5,user_attrs_both.pessimistic.inverse_arithmetic_mean_rank,user_attrs_both.pessimistic.inverse_geometric_mean_rank,user_attrs_both.pessimistic.inverse_harmonic_mean_rank,user_attrs_both.pessimistic.inverse_median_rank,user_attrs_both.pessimistic.median_absolute_deviation,user_attrs_both.pessimistic.median_rank,user_attrs_both.pessimistic.standard_deviation,user_attrs_both.pessimistic.variance,user_attrs_both.pessimistic.z_arithmetic_mean_rank,user_attrs_both.pessimistic.z_geometric_mean_rank,user_attrs_both.pessimistic.z_hits_at_k,user_attrs_both.pessimistic.z_inverse_harmonic_mean_rank,user_attrs_both.realistic.adjusted_arithmetic_mean_rank,user_attrs_both.realistic.adjusted_arithmetic_mean_rank_index,user_attrs_both.realistic.adjusted_geometric_mean_rank_index,user_attrs_both.realistic.adjusted_hits_at_k,user_attrs_both.realistic.adjusted_inverse_harmonic_mean_rank,user_attrs_both.realistic.arithmetic_mean_rank,user_attrs_both.realistic.count,user_attrs_both.realistic.geometric_mean_rank,user_attrs_both.realistic.harmonic_mean_rank,user_attrs_both.realistic.hits_at_1,user_attrs_both.realistic.hits_at_10,user_attrs_both.realistic.hits_at_3,user_attrs_both.realistic.hits_at_5,user_attrs_both.realistic.inverse_arithmetic_mean_rank,user_attrs_both.realistic.inverse_geometric_mean_rank,user_attrs_both.realistic.inverse_harmonic_mean_rank,user_attrs_both.realistic.inverse_median_rank,user_attrs_both.realistic.median_absolute_deviation,user_attrs_both.realistic.median_rank,user_attrs_both.realistic.standard_deviation,user_attrs_both.realistic.variance,user_attrs_both.realistic.z_arithmetic_mean_rank,user_attrs_both.realistic.z_geometric_mean_rank,user_attrs_both.realistic.z_hits_at_k,user_attrs_both.realistic.z_inverse_harmonic_mean_rank,user_attrs_head.optimistic.adjusted_arithmetic_mean_rank,user_attrs_head.optimistic.adjusted_arithmetic_mean_rank_index,user_attrs_head.optimistic.adjusted_geometric_mean_rank_index,user_attrs_head.optimistic.adjusted_hits_at_k,user_attrs_head.optimistic.adjusted_inverse_harmonic_mean_rank,user_attrs_head.optimistic.arithmetic_mean_rank,user_attrs_head.optimistic.count,user_attrs_head.optimistic.geometric_mean_rank,user_attrs_head.optimistic.harmonic_mean_rank,user_attrs_head.optimistic.hits_at_1,user_attrs_head.optimistic.hits_at_10,user_attrs_head.optimistic.hits_at_3,user_attrs_head.optimistic.hits_at_5,user_attrs_head.optimistic.inverse_arithmetic_mean_rank,user_attrs_head.optimistic.inverse_geometric_mean_rank,user_attrs_head.optimistic.inverse_harmonic_mean_rank,user_attrs_head.optimistic.inverse_median_rank,user_attrs_head.optimistic.median_absolute_deviation,user_attrs_head.optimistic.median_rank,user_attrs_head.optimistic.standard_deviation,user_attrs_head.optimistic.variance,user_attrs_head.optimistic.z_arithmetic_mean_rank,user_attrs_head.optimistic.z_geometric_mean_rank,user_attrs_head.optimistic.z_hits_at_k,user_attrs_head.optimistic.z_inverse_harmonic_mean_rank,user_attrs_head.pessimistic.adjusted_arithmetic_mean_rank,user_attrs_head.pessimistic.adjusted_arithmetic_mean_rank_index,user_attrs_head.pessimistic.adjusted_geometric_mean_rank_index,user_attrs_head.pessimistic.adjusted_hits_at_k,user_attrs_head.pessimistic.adjusted_inverse_harmonic_mean_rank,user_attrs_head.pessimistic.arithmetic_mean_rank,user_attrs_head.pessimistic.count,user_attrs_head.pessimistic.geometric_mean_rank,user_attrs_head.pessimistic.harmonic_mean_rank,user_attrs_head.pessimistic.hits_at_1,user_attrs_head.pessimistic.hits_at_10,user_attrs_head.pessimistic.hits_at_3,user_attrs_head.pessimistic.hits_at_5,user_attrs_head.pessimistic.inverse_arithmetic_mean_rank,user_attrs_head.pessimistic.inverse_geometric_mean_rank,user_attrs_head.pessimistic.inverse_harmonic_mean_rank,user_attrs_head.pessimistic.inverse_median_rank,user_attrs_head.pessimistic.median_absolute_deviation,user_attrs_head.pessimistic.median_rank,user_attrs_head.pessimistic.standard_deviation,user_attrs_head.pessimistic.variance,user_attrs_head.pessimistic.z_arithmetic_mean_rank,user_attrs_head.pessimistic.z_geometric_mean_rank,user_attrs_head.pessimistic.z_hits_at_k,user_attrs_head.pessimistic.z_inverse_harmonic_mean_rank,user_attrs_head.realistic.adjusted_arithmetic_mean_rank,user_attrs_head.realistic.adjusted_arithmetic_mean_rank_index,user_attrs_head.realistic.adjusted_geometric_mean_rank_index,user_attrs_head.realistic.adjusted_hits_at_k,user_attrs_head.realistic.adjusted_inverse_harmonic_mean_rank,user_attrs_head.realistic.arithmetic_mean_rank,user_attrs_head.realistic.count,user_attrs_head.realistic.geometric_mean_rank,user_attrs_head.realistic.harmonic_mean_rank,user_attrs_head.realistic.hits_at_1,user_attrs_head.realistic.hits_at_10,user_attrs_head.realistic.hits_at_3,user_attrs_head.realistic.hits_at_5,user_attrs_head.realistic.inverse_arithmetic_mean_rank,user_attrs_head.realistic.inverse_geometric_mean_rank,user_attrs_head.realistic.inverse_harmonic_mean_rank,user_attrs_head.realistic.inverse_median_rank,user_attrs_head.realistic.median_absolute_deviation,user_attrs_head.realistic.median_rank,user_attrs_head.realistic.standard_deviation,user_attrs_head.realistic.variance,user_attrs_head.realistic.z_arithmetic_mean_rank,user_attrs_head.realistic.z_geometric_mean_rank,user_attrs_head.realistic.z_hits_at_k,user_attrs_head.realistic.z_inverse_harmonic_mean_rank,user_attrs_random_seed,user_attrs_tail.optimistic.adjusted_arithmetic_mean_rank,user_attrs_tail.optimistic.adjusted_arithmetic_mean_rank_index,user_attrs_tail.optimistic.adjusted_geometric_mean_rank_index,user_attrs_tail.optimistic.adjusted_hits_at_k,user_attrs_tail.optimistic.adjusted_inverse_harmonic_mean_rank,user_attrs_tail.optimistic.arithmetic_mean_rank,user_attrs_tail.optimistic.count,user_attrs_tail.optimistic.geometric_mean_rank,user_attrs_tail.optimistic.harmonic_mean_rank,user_attrs_tail.optimistic.hits_at_1,user_attrs_tail.optimistic.hits_at_10,user_attrs_tail.optimistic.hits_at_3,user_attrs_tail.optimistic.hits_at_5,user_attrs_tail.optimistic.inverse_arithmetic_mean_rank,user_attrs_tail.optimistic.inverse_geometric_mean_rank,user_attrs_tail.optimistic.inverse_harmonic_mean_rank,user_attrs_tail.optimistic.inverse_median_rank,user_attrs_tail.optimistic.median_absolute_deviation,user_attrs_tail.optimistic.median_rank,user_attrs_tail.optimistic.standard_deviation,user_attrs_tail.optimistic.variance,user_attrs_tail.optimistic.z_arithmetic_mean_rank,user_attrs_tail.optimistic.z_geometric_mean_rank,user_attrs_tail.optimistic.z_hits_at_k,user_attrs_tail.optimistic.z_inverse_harmonic_mean_rank,user_attrs_tail.pessimistic.adjusted_arithmetic_mean_rank,user_attrs_tail.pessimistic.adjusted_arithmetic_mean_rank_index,user_attrs_tail.pessimistic.adjusted_geometric_mean_rank_index,user_attrs_tail.pessimistic.adjusted_hits_at_k,user_attrs_tail.pessimistic.adjusted_inverse_harmonic_mean_rank,user_attrs_tail.pessimistic.arithmetic_mean_rank,user_attrs_tail.pessimistic.count,user_attrs_tail.pessimistic.geometric_mean_rank,user_attrs_tail.pessimistic.harmonic_mean_rank,user_attrs_tail.pessimistic.hits_at_1,user_attrs_tail.pessimistic.hits_at_10,user_attrs_tail.pessimistic.hits_at_3,user_attrs_tail.pessimistic.hits_at_5,user_attrs_tail.pessimistic.inverse_arithmetic_mean_rank,user_attrs_tail.pessimistic.inverse_geometric_mean_rank,user_attrs_tail.pessimistic.inverse_harmonic_mean_rank,user_attrs_tail.pessimistic.inverse_median_rank,user_attrs_tail.pessimistic.median_absolute_deviation,user_attrs_tail.pessimistic.median_rank,user_attrs_tail.pessimistic.standard_deviation,user_attrs_tail.pessimistic.variance,user_attrs_tail.pessimistic.z_arithmetic_mean_rank,user_attrs_tail.pessimistic.z_geometric_mean_rank,user_attrs_tail.pessimistic.z_hits_at_k,user_attrs_tail.pessimistic.z_inverse_harmonic_mean_rank,user_attrs_tail.realistic.adjusted_arithmetic_mean_rank,user_attrs_tail.realistic.adjusted_arithmetic_mean_rank_index,user_attrs_tail.realistic.adjusted_geometric_mean_rank_index,user_attrs_tail.realistic.adjusted_hits_at_k,user_attrs_tail.realistic.adjusted_inverse_harmonic_mean_rank,user_attrs_tail.realistic.arithmetic_mean_rank,user_attrs_tail.realistic.count,user_attrs_tail.realistic.geometric_mean_rank,user_attrs_tail.realistic.harmonic_mean_rank,user_attrs_tail.realistic.hits_at_1,user_attrs_tail.realistic.hits_at_10,user_attrs_tail.realistic.hits_at_3,user_attrs_tail.realistic.hits_at_5,user_attrs_tail.realistic.inverse_arithmetic_mean_rank,user_attrs_tail.realistic.inverse_geometric_mean_rank,user_attrs_tail.realistic.inverse_harmonic_mean_rank,user_attrs_tail.realistic.inverse_median_rank,user_attrs_tail.realistic.median_absolute_deviation,user_attrs_tail.realistic.median_rank,user_attrs_tail.realistic.standard_deviation,user_attrs_tail.realistic.variance,user_attrs_tail.realistic.z_arithmetic_mean_rank,user_attrs_tail.realistic.z_geometric_mean_rank,user_attrs_tail.realistic.z_hits_at_k,user_attrs_tail.realistic.z_inverse_harmonic_mean_rank,state
4,0.477712869644165,2025-07-07 15:59:46.169052,2025-07-07 16:36:11.513309,0 days 00:36:25.344257,0.3,0.2,0.4,300,xavier_uniform,64,8,0.01,0.005007453453685938,0.9950376359830344,0.9996055213864571,0.5627408893468798,0.47757947507990495,110.50492109178721,163988.0,7.405396700088606,2.0933074864249606,0.41718906261433764,0.5628399638997975,0.5044027611776472,0.5258921384491548,0.009049370744035766,0.13503665509074414,0.47771290480971934,0.3333333333333333,2.965204437011204,3.0,1267.1082029648303,1605563.1980207618,697.8985702750327,404.9505873154234,15137.483198242055,31698.467706997733,0.0050074551116475975,0.9950376343249976,0.9996055212128248,0.5627408893468798,0.4775794599943218,110.50495767983023,163988.0,7.405399519465831,2.0933075525121425,0.41718906261433764,0.5628399638997975,0.5044027611776472,0.5258921384491548,0.009049367747801271,0.135036603679707,0.47771288972798914,0.3333333333333333,2.965204437011204,3.0,1267.1082742239453,1605563.3786067846,697.8985691121204,404.9505872450831,15137.483198242055,31698.46670571963,0.00500745379341089,0.9950376356432941,0.9996055211955882,0.5627408893468798,0.4775794399053668,110.50492858886719,163988.0,7.405399799346924,2.0933076405181885,0.41718906261433764,0.5628399638997975,0.5044027611776472,0.5258921384491548,0.00904936995357275,0.13503660261631012,0.477712869644165,0.3333333432674408,2.965204437011204,3.0,1267.1082763671875,1605563.25,697.8985700367459,404.9505872381004,15137.483198242055,31698.465372351835,0.00948139316139329,0.9905636170140993,0.9973006762633401,0.13875351190880025,0.06397790385004518,208.66221918676976,81994.0,44.71043369011496,15.572062244606853,0.017123204136888066,0.13894919140424908,0.04566187769836817,0.07413957118813572,0.004792434413366025,0.022366144039910985,0.0642175701774076,0.02,53.37367986620167,50.0,1727.5510484871188,2984432.6251289435,491.26901127733123,285.79134257337773,2635.583327143202,2998.5473877370987,0.009481395932264016,0.9905636142431027,0.9973006741721412,0.13875351190880025,0.06397787368020734,208.66228016684147,81994.0,44.71046755311915,15.572069558594585,0.017123204136888066,0.13894919140424908,0.04566187769836817,0.07413957118813572,0.004792433012811052,0.022366127100145627,0.06421754001529469,0.02,53.37367986620167,50.0,1727.5511290962509,2984432.903641731,491.2690099030583,285.7913419741136,2635.583327143202,2998.545973722525,0.009481394411752088,0.9905636157636838,0.9973006755399496,0.13875351190880025,0.06397788621080755,208.66224670410156,81994.0,44.710445404052734,15.572066520836083,0.017123204136888066,0.13894919140424908,0.04566187769836817,0.07413957118813572,0.004792433697730303,0.02236613817512989,0.06421755254268646,0.019999999552965164,53.37367986620167,50.0,1727.551025390625,2984432.75,491.2690106571889,285.79134236607945,2635.583327143202,2998.5465610127653,1178843712.0,0.0005579931917777088,0.9994871739661836,0.9999860857419695,0.9867277374377716,0.8911805159611514,12.347622996804644,81994.0,1.2265571089239464,1.1220722113454444,0.8172549210917872,0.986730736395346,0.9631436446569261,0.9776447057101739,0.08098724752600425,0.8152902076262033,0.891208239442031,1.0,0.0,1.0,455.4383169804287,207424.06057396543,495.70017923566076,286.56036030699096,18794.320271665914,41883.37310702652,0.0005579937429196551,0.9994871734150168,0.999986085741664,0.9867277374377716,0.8911805159598037,12.347635192818986,81994.0,1.2265571138962277,1.1220722113471409,0.8172549210917872,0.986730736395346,0.9631436446569261,0.9776447057101739,0.08098716753322693,0.8152902043211373,0.8912082394406836,1.0,0.0,1.0,455.43839721327845,207424.13365620002,495.70017896230706,286.5603603069035,18794.320271665914,41883.37310696318,0.0005579934877886005,0.9994871736701594,0.9999860857403322,0.9867277374377716,0.8911805675860447,12.34762954711914,81994.0,1.2265571355819702,1.1220721463638896,0.8172549210917872,0.986730736395346,0.9631436446569261,0.9776447057101739,0.08098720759153366,0.8152902126312256,0.891208291053772,1.0,0.0,1.0,455.4383239746094,207424.078125,495.7001790888462,286.5603603065218,18794.320271665914,41883.37553327421,COMPLETE
5,0.4884277880191803,2025-07-07 16:36:11.544110,2025-07-07 17:42:11.023722,0 days 01:05:59.479612,0.2,0.3,0.30000000000000004,300,xavier_uniform_norm,224,8,0.0005,0.005176415221158309,0.9948686665588304,0.999633835310333,0.57145691647968,0.488297091744169,114.23358416469497,163988.0,6.945645757109665,2.0473855757345185,0.4301412298460863,0.571554016147523,0.5118240359050662,0.5334170792984853,0.00875399303376721,0.14397509388905783,0.4884277841223145,0.3333333333333333,2.965204437011204,3.0,1329.4168333148823,1767349.1167009696,697.780058657675,404.9620575803003,15371.94050670477,32409.829990042486,0.005176416602793025,0.994868665177133,0.9996338353033679,0.57145691647968,0.48829709170590574,114.23361465473083,163988.0,6.945645870205767,2.047385575894869,0.4301412298460863,0.571554016147523,0.5118240359050662,0.5334170792984853,0.008753990697243391,0.14397509154470825,0.488427784084061,0.3333333333333333,2.965204437011204,3.0,1329.4173126143473,1767350.3910787534,697.7800576885813,404.96205757747873,15371.94050670477,32409.82998750283,0.005176416139518694,0.9948686656404284,0.9996338352777604,0.57145691647968,0.48829709564203033,114.23360443115234,163988.0,6.945646286010742,2.0473855593996846,0.4301412298460863,0.571554016147523,0.5118240359050662,0.5334170792984853,0.008753991685807705,0.14397507905960083,0.4884277880191803,0.3333333432674408,2.965204437011204,3.0,1329.4171142578125,1767349.75,697.780058013527,404.96205756710486,15371.94050670477,32409.83024875593,0.009200123736446512,0.9908448992202156,0.9975697358997482,0.15384341015059308,0.06885218450984254,202.4721686952704,81994.0,40.35352264747872,14.473748377297936,0.017464692538478425,0.1540356611459375,0.05113788813815645,0.08329877795936289,0.0049389504070806115,0.0247809840230263,0.06909060278873573,0.022222222222222223,48.92587321068486,45.0,1713.1479505056884,2934875.9003218403,491.40851289935244,285.8684456141673,2922.2116341837987,3226.997534740821,0.009200125953143094,0.9908448970034183,0.9975697358193302,0.15384341015059308,0.06885218443332336,202.47221747932775,81994.0,40.35352394969699,14.473748393323786,0.017464692538478425,0.1540356611459375,0.05113788813815645,0.08329877795936289,0.004938949217080112,0.024780983223337768,0.06909060271223615,0.022222222222222223,48.92587321068486,45.0,1713.1483991571172,2934877.437534593,491.4085117999341,285.86844559112234,2922.2116341837987,3226.997531154483,0.00920012509012104,0.9908448978664796,0.9975697356266929,0.15384341015059308,0.06885218650372184,202.47219848632812,81994.0,40.3535270690918,14.473747959708337,0.017464692538478425,0.1540356611459375,0.05113788813815645,0.08329877795936289,0.004938949830830097,0.024780981242656708,0.06909060478210449,0.02222222276031971,48.92587321068486,45.0,1713.1480712890625,2934876.5,491.40851222796846,285.86844553591925,2922.2116341837987,3226.997628190921,1737316744.0,0.001174722683050528,0.9988704166034403,0.9999879941251129,0.9890699014193414,0.9077414611371517,25.99499963411957,81994.0,1.1954841069189694,1.1016067352828327,0.8428177671536942,0.9890723711491085,0.972510183671976,0.9835353806376076,0.03846893687536185,0.8364812164481418,0.9077649654558932,1.0,0.0,1.0,764.3626348011653,584250.2374801796,495.3942956353304,286.5609071815615,18838.93174687658,42661.698298599345,0.0011747232341924741,0.9988704160522734,0.9999879941250911,0.9890699014193414,0.9077414611371444,25.99501183013391,81994.0,1.195484107272586,1.1016067352828416,0.8428177671536942,0.9890723711491085,0.972510183671976,0.9835353806376076,0.038468918826987455,0.8364812162007161,0.9077649654558859,1.0,0.0,1.0,764.3632922675181,584251.2425660393,495.39429536197673,286.56090718155525,18838.93174687658,42661.698298598996,0.001174722996091181,0.9988704162903855,0.9999879941217682,0.9890699014193414,0.9077414669389926,25.995006561279297,81994.0,1.1954841613769531,1.1016067282438755,0.8428177671536942,0.9890723711491085,0.972510183671976,0.9835353806376076,0.03846892714500427,0.8364811539649963,0.9077649712562561,1.0,0.0,1.0,764.3629760742188,584250.75,495.3942954800695,286.56090718060307,18838.93174687658,42661.69857127212,COMPLETE
