number,value,datetime_start,datetime_complete,duration,params_model.dropout_0,params_model.dropout_1,params_model.dropout_2,params_model.embedding_dim,params_model.entity_initializer,params_model.relation_dim,params_negative_sampler.num_negs_per_pos,params_optimizer.lr,user_attrs_both.optimistic.adjusted_arithmetic_mean_rank,user_attrs_both.optimistic.adjusted_arithmetic_mean_rank_index,user_attrs_both.optimistic.adjusted_geometric_mean_rank_index,user_attrs_both.optimistic.adjusted_hits_at_k,user_attrs_both.optimistic.adjusted_inverse_harmonic_mean_rank,user_attrs_both.optimistic.arithmetic_mean_rank,user_attrs_both.optimistic.count,user_attrs_both.optimistic.geometric_mean_rank,user_attrs_both.optimistic.harmonic_mean_rank,user_attrs_both.optimistic.hits_at_1,user_attrs_both.optimistic.hits_at_10,user_attrs_both.optimistic.hits_at_3,user_attrs_both.optimistic.hits_at_5,user_attrs_both.optimistic.inverse_arithmetic_mean_rank,user_attrs_both.optimistic.inverse_geometric_mean_rank,user_attrs_both.optimistic.inverse_harmonic_mean_rank,user_attrs_both.optimistic.inverse_median_rank,user_attrs_both.optimistic.median_absolute_deviation,user_attrs_both.optimistic.median_rank,user_attrs_both.optimistic.standard_deviation,user_attrs_both.optimistic.variance,user_attrs_both.optimistic.z_arithmetic_mean_rank,user_attrs_both.optimistic.z_geometric_mean_rank,user_attrs_both.optimistic.z_hits_at_k,user_attrs_both.optimistic.z_inverse_harmonic_mean_rank,user_attrs_both.pessimistic.adjusted_arithmetic_mean_rank,user_attrs_both.pessimistic.adjusted_arithmetic_mean_rank_index,user_attrs_both.pessimistic.adjusted_geometric_mean_rank_index,user_attrs_both.pessimistic.adjusted_hits_at_k,user_attrs_both.pessimistic.adjusted_inverse_harmonic_mean_rank,user_attrs_both.pessimistic.arithmetic_mean_rank,user_attrs_both.pessimistic.count,user_attrs_both.pessimistic.geometric_mean_rank,user_attrs_both.pessimistic.harmonic_mean_rank,user_attrs_both.pessimistic.hits_at_1,user_attrs_both.pessimistic.hits_at_10,user_attrs_both.pessimistic.hits_at_3,user_attrs_both.pessimistic.hits_at_5,user_attrs_both.pessimistic.inverse_arithmetic_mean_rank,user_attrs_both.pessimistic.inverse_geometric_mean_rank,user_attrs_both.pessimistic.inverse_harmonic_mean_rank,user_attrs_both.pessimistic.inverse_median_rank,user_attrs_both.pessimistic.median_absolute_deviation,user_attrs_both.pessimistic.median_rank,user_attrs_both.pessimistic.standard_deviation,user_attrs_both.pessimistic.variance,user_attrs_both.pessimistic.z_arithmetic_mean_rank,user_attrs_both.pessimistic.z_geometric_mean_rank,user_attrs_both.pessimistic.z_hits_at_k,user_attrs_both.pessimistic.z_inverse_harmonic_mean_rank,user_attrs_both.realistic.adjusted_arithmetic_mean_rank,user_attrs_both.realistic.adjusted_arithmetic_mean_rank_index,user_attrs_both.realistic.adjusted_geometric_mean_rank_index,user_attrs_both.realistic.adjusted_hits_at_k,user_attrs_both.realistic.adjusted_inverse_harmonic_mean_rank,user_attrs_both.realistic.arithmetic_mean_rank,user_attrs_both.realistic.count,user_attrs_both.realistic.geometric_mean_rank,user_attrs_both.realistic.harmonic_mean_rank,user_attrs_both.realistic.hits_at_1,user_attrs_both.realistic.hits_at_10,user_attrs_both.realistic.hits_at_3,user_attrs_both.realistic.hits_at_5,user_attrs_both.realistic.inverse_arithmetic_mean_rank,user_attrs_both.realistic.inverse_geometric_mean_rank,user_attrs_both.realistic.inverse_harmonic_mean_rank,user_attrs_both.realistic.inverse_median_rank,user_attrs_both.realistic.median_absolute_deviation,user_attrs_both.realistic.median_rank,user_attrs_both.realistic.standard_deviation,user_attrs_both.realistic.variance,user_attrs_both.realistic.z_arithmetic_mean_rank,user_attrs_both.realistic.z_geometric_mean_rank,user_attrs_both.realistic.z_hits_at_k,user_attrs_both.realistic.z_inverse_harmonic_mean_rank,user_attrs_head.optimistic.adjusted_arithmetic_mean_rank,user_attrs_head.optimistic.adjusted_arithmetic_mean_rank_index,user_attrs_head.optimistic.adjusted_geometric_mean_rank_index,user_attrs_head.optimistic.adjusted_hits_at_k,user_attrs_head.optimistic.adjusted_inverse_harmonic_mean_rank,user_attrs_head.optimistic.arithmetic_mean_rank,user_attrs_head.optimistic.count,user_attrs_head.optimistic.geometric_mean_rank,user_attrs_head.optimistic.harmonic_mean_rank,user_attrs_head.optimistic.hits_at_1,user_attrs_head.optimistic.hits_at_10,user_attrs_head.optimistic.hits_at_3,user_attrs_head.optimistic.hits_at_5,user_attrs_head.optimistic.inverse_arithmetic_mean_rank,user_attrs_head.optimistic.inverse_geometric_mean_rank,user_attrs_head.optimistic.inverse_harmonic_mean_rank,user_attrs_head.optimistic.inverse_median_rank,user_attrs_head.optimistic.median_absolute_deviation,user_attrs_head.optimistic.median_rank,user_attrs_head.optimistic.standard_deviation,user_attrs_head.optimistic.variance,user_attrs_head.optimistic.z_arithmetic_mean_rank,user_attrs_head.optimistic.z_geometric_mean_rank,user_attrs_head.optimistic.z_hits_at_k,user_attrs_head.optimistic.z_inverse_harmonic_mean_rank,user_attrs_head.pessimistic.adjusted_arithmetic_mean_rank,user_attrs_head.pessimistic.adjusted_arithmetic_mean_rank_index,user_attrs_head.pessimistic.adjusted_geometric_mean_rank_index,user_attrs_head.pessimistic.adjusted_hits_at_k,user_attrs_head.pessimistic.adjusted_inverse_harmonic_mean_rank,user_attrs_head.pessimistic.arithmetic_mean_rank,user_attrs_head.pessimistic.count,user_attrs_head.pessimistic.geometric_mean_rank,user_attrs_head.pessimistic.harmonic_mean_rank,user_attrs_head.pessimistic.hits_at_1,user_attrs_head.pessimistic.hits_at_10,user_attrs_head.pessimistic.hits_at_3,user_attrs_head.pessimistic.hits_at_5,user_attrs_head.pessimistic.inverse_arithmetic_mean_rank,user_attrs_head.pessimistic.inverse_geometric_mean_rank,user_attrs_head.pessimistic.inverse_harmonic_mean_rank,user_attrs_head.pessimistic.inverse_median_rank,user_attrs_head.pessimistic.median_absolute_deviation,user_attrs_head.pessimistic.median_rank,user_attrs_head.pessimistic.standard_deviation,user_attrs_head.pessimistic.variance,user_attrs_head.pessimistic.z_arithmetic_mean_rank,user_attrs_head.pessimistic.z_geometric_mean_rank,user_attrs_head.pessimistic.z_hits_at_k,user_attrs_head.pessimistic.z_inverse_harmonic_mean_rank,user_attrs_head.realistic.adjusted_arithmetic_mean_rank,user_attrs_head.realistic.adjusted_arithmetic_mean_rank_index,user_attrs_head.realistic.adjusted_geometric_mean_rank_index,user_attrs_head.realistic.adjusted_hits_at_k,user_attrs_head.realistic.adjusted_inverse_harmonic_mean_rank,user_attrs_head.realistic.arithmetic_mean_rank,user_attrs_head.realistic.count,user_attrs_head.realistic.geometric_mean_rank,user_attrs_head.realistic.harmonic_mean_rank,user_attrs_head.realistic.hits_at_1,user_attrs_head.realistic.hits_at_10,user_attrs_head.realistic.hits_at_3,user_attrs_head.realistic.hits_at_5,user_attrs_head.realistic.inverse_arithmetic_mean_rank,user_attrs_head.realistic.inverse_geometric_mean_rank,user_attrs_head.realistic.inverse_harmonic_mean_rank,user_attrs_head.realistic.inverse_median_rank,user_attrs_head.realistic.median_absolute_deviation,user_attrs_head.realistic.median_rank,user_attrs_head.realistic.standard_deviation,user_attrs_head.realistic.variance,user_attrs_head.realistic.z_arithmetic_mean_rank,user_attrs_head.realistic.z_geometric_mean_rank,user_attrs_head.realistic.z_hits_at_k,user_attrs_head.realistic.z_inverse_harmonic_mean_rank,user_attrs_random_seed,user_attrs_tail.optimistic.adjusted_arithmetic_mean_rank,user_attrs_tail.optimistic.adjusted_arithmetic_mean_rank_index,user_attrs_tail.optimistic.adjusted_geometric_mean_rank_index,user_attrs_tail.optimistic.adjusted_hits_at_k,user_attrs_tail.optimistic.adjusted_inverse_harmonic_mean_rank,user_attrs_tail.optimistic.arithmetic_mean_rank,user_attrs_tail.optimistic.count,user_attrs_tail.optimistic.geometric_mean_rank,user_attrs_tail.optimistic.harmonic_mean_rank,user_attrs_tail.optimistic.hits_at_1,user_attrs_tail.optimistic.hits_at_10,user_attrs_tail.optimistic.hits_at_3,user_attrs_tail.optimistic.hits_at_5,user_attrs_tail.optimistic.inverse_arithmetic_mean_rank,user_attrs_tail.optimistic.inverse_geometric_mean_rank,user_attrs_tail.optimistic.inverse_harmonic_mean_rank,user_attrs_tail.optimistic.inverse_median_rank,user_attrs_tail.optimistic.median_absolute_deviation,user_attrs_tail.optimistic.median_rank,user_attrs_tail.optimistic.standard_deviation,user_attrs_tail.optimistic.variance,user_attrs_tail.optimistic.z_arithmetic_mean_rank,user_attrs_tail.optimistic.z_geometric_mean_rank,user_attrs_tail.optimistic.z_hits_at_k,user_attrs_tail.optimistic.z_inverse_harmonic_mean_rank,user_attrs_tail.pessimistic.adjusted_arithmetic_mean_rank,user_attrs_tail.pessimistic.adjusted_arithmetic_mean_rank_index,user_attrs_tail.pessimistic.adjusted_geometric_mean_rank_index,user_attrs_tail.pessimistic.adjusted_hits_at_k,user_attrs_tail.pessimistic.adjusted_inverse_harmonic_mean_rank,user_attrs_tail.pessimistic.arithmetic_mean_rank,user_attrs_tail.pessimistic.count,user_attrs_tail.pessimistic.geometric_mean_rank,user_attrs_tail.pessimistic.harmonic_mean_rank,user_attrs_tail.pessimistic.hits_at_1,user_attrs_tail.pessimistic.hits_at_10,user_attrs_tail.pessimistic.hits_at_3,user_attrs_tail.pessimistic.hits_at_5,user_attrs_tail.pessimistic.inverse_arithmetic_mean_rank,user_attrs_tail.pessimistic.inverse_geometric_mean_rank,user_attrs_tail.pessimistic.inverse_harmonic_mean_rank,user_attrs_tail.pessimistic.inverse_median_rank,user_attrs_tail.pessimistic.median_absolute_deviation,user_attrs_tail.pessimistic.median_rank,user_attrs_tail.pessimistic.standard_deviation,user_attrs_tail.pessimistic.variance,user_attrs_tail.pessimistic.z_arithmetic_mean_rank,user_attrs_tail.pessimistic.z_geometric_mean_rank,user_attrs_tail.pessimistic.z_hits_at_k,user_attrs_tail.pessimistic.z_inverse_harmonic_mean_rank,user_attrs_tail.realistic.adjusted_arithmetic_mean_rank,user_attrs_tail.realistic.adjusted_arithmetic_mean_rank_index,user_attrs_tail.realistic.adjusted_geometric_mean_rank_index,user_attrs_tail.realistic.adjusted_hits_at_k,user_attrs_tail.realistic.adjusted_inverse_harmonic_mean_rank,user_attrs_tail.realistic.arithmetic_mean_rank,user_attrs_tail.realistic.count,user_attrs_tail.realistic.geometric_mean_rank,user_attrs_tail.realistic.harmonic_mean_rank,user_attrs_tail.realistic.hits_at_1,user_attrs_tail.realistic.hits_at_10,user_attrs_tail.realistic.hits_at_3,user_attrs_tail.realistic.hits_at_5,user_attrs_tail.realistic.inverse_arithmetic_mean_rank,user_attrs_tail.realistic.inverse_geometric_mean_rank,user_attrs_tail.realistic.inverse_harmonic_mean_rank,user_attrs_tail.realistic.inverse_median_rank,user_attrs_tail.realistic.median_absolute_deviation,user_attrs_tail.realistic.median_rank,user_attrs_tail.realistic.standard_deviation,user_attrs_tail.realistic.variance,user_attrs_tail.realistic.z_arithmetic_mean_rank,user_attrs_tail.realistic.z_geometric_mean_rank,user_attrs_tail.realistic.z_hits_at_k,user_attrs_tail.realistic.z_inverse_harmonic_mean_rank,state
8,0.4568855166435242,2025-07-07 19:32:42.835326,2025-07-07 19:43:09.916715,0 days 00:10:27.081389,0.2,0.1,0.4,100,xavier_uniform_norm,208,6,0.001,0.005177954914886649,0.9948671267953287,0.9995419397126769,0.54508315768176,0.4567467672684515,114.26756226065322,163988.0,8.43781222132648,2.1887321024921342,0.39993780032685317,0.5451862331390102,0.4780227821547918,0.5032685318437935,0.008751389985190391,0.11851413302046598,0.456885517812518,0.2,5.930408874022408,5.0,1190.504632924839,1417301.2810155053,697.7789786997844,404.9248297184625,14662.497958214371,30315.73467455284,0.005177956020194422,0.9948671256899708,0.9995419394746579,0.54508315768176,0.4567467435806956,114.2675866526819,163988.0,8.437816086190836,2.188732215940494,0.39993780032685317,0.5451862331390102,0.4780227821547918,0.5032685318437935,0.008751388117082717,0.11851407873615312,0.45688549413081214,0.2,5.930408874022408,5.0,1190.5048679465253,1417301.840604374,697.7789779245096,404.9248296220385,14662.497958214371,30315.733102321195,0.005177955633768463,0.9948671260764144,0.9995419395592556,0.54508315768176,0.4567467660991591,114.267578125,163988.0,8.437814712524414,2.1887321080922555,0.39993780032685317,0.5451862331390102,0.4780227821547918,0.5032685318437935,0.008751388639211655,0.11851409822702408,0.4568855166435242,0.20000000298023224,5.930408874022408,5.0,1190.5047607421875,1417301.625,697.7789781955529,404.9248296563099,14662.497958214371,30315.734596943188,0.0102230344449722,0.9898219420295843,0.9968191148572794,0.12487129347778958,0.05693272731771797,224.98392565309658,81994.0,52.508408279624135,17.490407262589915,0.013940044393492206,0.12507012708246945,0.040429787545430154,0.06555357709100666,0.0044447619850935625,0.01904456891312871,0.057174197546496906,0.01694915254237288,65.23449761424648,59.0,1671.9755110437882,2795502.1095301365,490.9011783284186,285.65334398975574,2371.89455316406,2668.3506414249496,0.01022303666166878,0.989821939812787,0.9968191118867544,0.12487129347778958,0.05693267994217587,224.98397443715393,81994.0,52.508456381647896,17.490421751749043,0.013940044393492206,0.12507012708246945,0.040429787545430154,0.06555357709100666,0.004444761021320368,0.019044551466752078,0.05717415018308521,0.01694915254237288,65.23449761424648,59.0,1671.9758425005687,2795503.217905486,490.90117722900027,285.65334313850764,2371.89455316406,2668.348421005094,0.010223035449209893,0.989821941025301,0.9968191127795171,0.12487129347778958,0.056932705743403915,224.98394775390625,81994.0,52.50844192504883,17.490413860794696,0.013940044393492206,0.12507012708246945,0.040429787545430154,0.06555357709100666,0.0044447616674005985,0.019044557586312294,0.0571741759777069,0.016949152573943138,65.23449761424648,59.0,1671.9755859375,2795502.5,490.9011778303454,285.6533433943421,2371.89455316406,2668.349630269548,532473200.0,0.00016047985848147473,0.9998847052640515,0.9999781413905291,0.9652944972522614,0.8565602945499005,3.551198868209869,81994.0,1.3559099849917626,1.167410333013992,0.7859355562602142,0.9653023391955509,0.9156157767641535,0.9409834865965803,0.2815950435645672,0.7375120849235985,0.8565968380785391,1.0,0.0,1.0,120.76516987599963,14584.22625517905,495.8973366787352,286.55808373910304,18386.078803201646,40256.30471353563,0.00016047985848147473,0.9998847052640515,0.9999781413905291,0.9652944972522614,0.8565602945499005,3.551198868209869,81994.0,1.3559099849917626,1.167410333013992,0.7859355562602142,0.9653023391955509,0.9156157767641535,0.9409834865965803,0.2815950435645672,0.7375120849235985,0.8565968380785391,1.0,0.0,1.0,120.76516987599963,14584.22625517905,495.8973366787352,286.55808373910304,18386.078803201646,40256.30471353563,0.00016047986260015403,0.9998847052599326,0.9999781413930724,0.9652944972522614,0.8565602243558527,3.551198959350586,81994.0,1.3559099435806274,1.1674104286533675,0.7859355562602142,0.9653023391955509,0.9156157767641535,0.9409834865965803,0.28159502148628235,0.7375121116638184,0.8565967679023744,1.0,0.0,1.0,120.76517486572266,14584.2275390625,495.8973366766924,286.5580837398319,18386.078803201646,40256.30141458167,COMPLETE
9,0.4726826548576355,2025-07-07 19:43:09.949826,2025-07-07 19:51:57.555069,0 days 00:08:47.605243,0.3,0.2,0.1,100,xavier_uniform_norm,224,4,0.001,0.005187158260061829,0.9948579230330915,0.9995865546727467,0.5554643180596646,0.4725478608440844,114.47066248749908,163988.0,7.713371128211109,2.1155846469628177,0.4161097153450252,0.5555650413444886,0.49412761909408004,0.5164219333121935,0.008735862781515799,0.1296450000107697,0.4726825756821516,0.25,4.447806655516806,4.0,1273.3043890981985,1621304.0672967366,697.7725233735995,404.94290370254595,14941.746620918038,31364.503477606293,0.005187159089042659,0.9948579222040731,0.9995865545952168,0.5554643180596646,0.4725478576544182,114.4706807815206,163988.0,7.713372387111816,2.115584661235155,0.4161097153450252,0.5555650413444886,0.49412761909408004,0.5164219333121935,0.008735861385402308,0.1296449788513891,0.4726825724933001,0.25,4.447806655516806,4.0,1273.30446443626,1621304.2591533111,697.7725227921434,404.9429036711378,14941.746620918038,31364.503265898013,0.00518715837291838,0.9948579229202298,0.9995865546342262,0.5554643180596646,0.4725479400397954,114.47066497802734,163988.0,7.713371753692627,2.1155842925972905,0.4161097153450252,0.5555650413444886,0.49412761909408004,0.5164219333121935,0.00873586256057024,0.1296449899673462,0.4726826548576355,0.25,4.447806655516806,4.0,1273.304443359375,1621304.25,697.7725232944407,404.9429036869409,14941.746620918038,31364.50873407735,0.009920766807484202,0.9901242234024219,0.9971660456490867,0.13405697931131422,0.060787014237531134,218.33175598214504,81994.0,46.89052141248043,16.3860561152545,0.01454984511061785,0.13425372588238163,0.04394223967607386,0.0709929994877674,0.0045801857613501674,0.021326271704324426,0.06102749758491648,0.019230769230769232,56.33888430321287,52.0,1761.7635919078098,3103810.9537719074,491.051094465667,285.7527621683758,2546.374031904213,2848.9952277509337,0.009920768470006638,0.990124221739824,0.9971660447038683,0.13405697931131422,0.06078700785819486,218.33179257018807,81994.0,46.89053671850275,16.386057827685978,0.01454984511061785,0.13425372588238163,0.04394223967607386,0.0709929994877674,0.0045801849938026115,0.021326264742996755,0.061027491207213624,0.019230769230769232,56.33888430321287,52.0,1761.7636986511295,3103811.3298849077,491.05109364110325,285.7527618975094,2546.374031904213,2848.9949287611116,0.009920768221872999,0.9901242219879689,0.9971660451414578,0.13405697931131422,0.060787013705624816,218.331787109375,81994.0,46.89052963256836,16.386056258036287,0.01454984511061785,0.13425372588238163,0.04394223967607386,0.0709929994877674,0.004580185282975435,0.02132626809179783,0.06102749705314636,0.01923076994717121,56.33888430321287,52.0,1761.7635498046875,3103811.0,491.05109376417045,285.75276202290723,2546.374031904213,2848.995202821291,1782142984.0,0.00047944995301848353,0.9995657207544983,0.9999834895131413,0.9768711306819992,0.884308179462329,10.609568992853136,81994.0,1.2688298694346605,1.1307898015269486,0.8176695855794326,0.9768763568065956,0.9443129985120863,0.9618508671366197,0.09425453575669514,0.7881277262534494,0.8843376537793866,1.0,0.0,1.0,342.37833946930476,117222.92733775849,495.7391348701703,286.5596163203705,18606.580313487695,41560.3895716574,0.00047944995301848353,0.9995657207544983,0.9999834895131413,0.9768711306819992,0.884308179462329,10.609568992853136,81994.0,1.2688298694346605,1.1307898015269486,0.8176695855794326,0.9768763568065956,0.9443129985120863,0.9618508671366197,0.09425453575669514,0.7881277262534494,0.8843376537793866,1.0,0.0,1.0,342.37833946930476,117222.92733775849,495.7391348701703,286.5596163203705,18606.580313487695,41560.3895716574,0.00047944993507941696,0.9995657207724382,0.9999834895160213,0.9768711306819992,0.8843081893359708,10.60956859588623,81994.0,1.2688298225402832,1.1307897889048821,0.8176695855794326,0.9768763568065956,0.9443129985120863,0.9618508671366197,0.09425453841686249,0.7881277799606323,0.8843376636505128,1.0,0.0,1.0,342.37835693359375,117222.9375,495.73913487906765,286.55961632119585,18606.580313487695,41560.39003569516,COMPLETE
