number,value,datetime_start,datetime_complete,duration,params_loss.margin,params_model.embedding_dim,params_model.entity_initializer,params_model.scoring_fct_norm,params_negative_sampler.num_negs_per_pos,params_optimizer.lr,params_regularizer.p,params_regularizer.weight,user_attrs_both.optimistic.adjusted_arithmetic_mean_rank,user_attrs_both.optimistic.adjusted_arithmetic_mean_rank_index,user_attrs_both.optimistic.adjusted_geometric_mean_rank_index,user_attrs_both.optimistic.adjusted_hits_at_k,user_attrs_both.optimistic.adjusted_inverse_harmonic_mean_rank,user_attrs_both.optimistic.arithmetic_mean_rank,user_attrs_both.optimistic.count,user_attrs_both.optimistic.geometric_mean_rank,user_attrs_both.optimistic.harmonic_mean_rank,user_attrs_both.optimistic.hits_at_1,user_attrs_both.optimistic.hits_at_10,user_attrs_both.optimistic.hits_at_3,user_attrs_both.optimistic.hits_at_5,user_attrs_both.optimistic.inverse_arithmetic_mean_rank,user_attrs_both.optimistic.inverse_geometric_mean_rank,user_attrs_both.optimistic.inverse_harmonic_mean_rank,user_attrs_both.optimistic.inverse_median_rank,user_attrs_both.optimistic.median_absolute_deviation,user_attrs_both.optimistic.median_rank,user_attrs_both.optimistic.standard_deviation,user_attrs_both.optimistic.variance,user_attrs_both.optimistic.z_arithmetic_mean_rank,user_attrs_both.optimistic.z_geometric_mean_rank,user_attrs_both.optimistic.z_hits_at_k,user_attrs_both.optimistic.z_inverse_harmonic_mean_rank,user_attrs_both.pessimistic.adjusted_arithmetic_mean_rank,user_attrs_both.pessimistic.adjusted_arithmetic_mean_rank_index,user_attrs_both.pessimistic.adjusted_geometric_mean_rank_index,user_attrs_both.pessimistic.adjusted_hits_at_k,user_attrs_both.pessimistic.adjusted_inverse_harmonic_mean_rank,user_attrs_both.pessimistic.arithmetic_mean_rank,user_attrs_both.pessimistic.count,user_attrs_both.pessimistic.geometric_mean_rank,user_attrs_both.pessimistic.harmonic_mean_rank,user_attrs_both.pessimistic.hits_at_1,user_attrs_both.pessimistic.hits_at_10,user_attrs_both.pessimistic.hits_at_3,user_attrs_both.pessimistic.hits_at_5,user_attrs_both.pessimistic.inverse_arithmetic_mean_rank,user_attrs_both.pessimistic.inverse_geometric_mean_rank,user_attrs_both.pessimistic.inverse_harmonic_mean_rank,user_attrs_both.pessimistic.inverse_median_rank,user_attrs_both.pessimistic.median_absolute_deviation,user_attrs_both.pessimistic.median_rank,user_attrs_both.pessimistic.standard_deviation,user_attrs_both.pessimistic.variance,user_attrs_both.pessimistic.z_arithmetic_mean_rank,user_attrs_both.pessimistic.z_geometric_mean_rank,user_attrs_both.pessimistic.z_hits_at_k,user_attrs_both.pessimistic.z_inverse_harmonic_mean_rank,user_attrs_both.realistic.adjusted_arithmetic_mean_rank,user_attrs_both.realistic.adjusted_arithmetic_mean_rank_index,user_attrs_both.realistic.adjusted_geometric_mean_rank_index,user_attrs_both.realistic.adjusted_hits_at_k,user_attrs_both.realistic.adjusted_inverse_harmonic_mean_rank,user_attrs_both.realistic.arithmetic_mean_rank,user_attrs_both.realistic.count,user_attrs_both.realistic.geometric_mean_rank,user_attrs_both.realistic.harmonic_mean_rank,user_attrs_both.realistic.hits_at_1,user_attrs_both.realistic.hits_at_10,user_attrs_both.realistic.hits_at_3,user_attrs_both.realistic.hits_at_5,user_attrs_both.realistic.inverse_arithmetic_mean_rank,user_attrs_both.realistic.inverse_geometric_mean_rank,user_attrs_both.realistic.inverse_harmonic_mean_rank,user_attrs_both.realistic.inverse_median_rank,user_attrs_both.realistic.median_absolute_deviation,user_attrs_both.realistic.median_rank,user_attrs_both.realistic.standard_deviation,user_attrs_both.realistic.variance,user_attrs_both.realistic.z_arithmetic_mean_rank,user_attrs_both.realistic.z_geometric_mean_rank,user_attrs_both.realistic.z_hits_at_k,user_attrs_both.realistic.z_inverse_harmonic_mean_rank,user_attrs_head.optimistic.adjusted_arithmetic_mean_rank,user_attrs_head.optimistic.adjusted_arithmetic_mean_rank_index,user_attrs_head.optimistic.adjusted_geometric_mean_rank_index,user_attrs_head.optimistic.adjusted_hits_at_k,user_attrs_head.optimistic.adjusted_inverse_harmonic_mean_rank,user_attrs_head.optimistic.arithmetic_mean_rank,user_attrs_head.optimistic.count,user_attrs_head.optimistic.geometric_mean_rank,user_attrs_head.optimistic.harmonic_mean_rank,user_attrs_head.optimistic.hits_at_1,user_attrs_head.optimistic.hits_at_10,user_attrs_head.optimistic.hits_at_3,user_attrs_head.optimistic.hits_at_5,user_attrs_head.optimistic.inverse_arithmetic_mean_rank,user_attrs_head.optimistic.inverse_geometric_mean_rank,user_attrs_head.optimistic.inverse_harmonic_mean_rank,user_attrs_head.optimistic.inverse_median_rank,user_attrs_head.optimistic.median_absolute_deviation,user_attrs_head.optimistic.median_rank,user_attrs_head.optimistic.standard_deviation,user_attrs_head.optimistic.variance,user_attrs_head.optimistic.z_arithmetic_mean_rank,user_attrs_head.optimistic.z_geometric_mean_rank,user_attrs_head.optimistic.z_hits_at_k,user_attrs_head.optimistic.z_inverse_harmonic_mean_rank,user_attrs_head.pessimistic.adjusted_arithmetic_mean_rank,user_attrs_head.pessimistic.adjusted_arithmetic_mean_rank_index,user_attrs_head.pessimistic.adjusted_geometric_mean_rank_index,user_attrs_head.pessimistic.adjusted_hits_at_k,user_attrs_head.pessimistic.adjusted_inverse_harmonic_mean_rank,user_attrs_head.pessimistic.arithmetic_mean_rank,user_attrs_head.pessimistic.count,user_attrs_head.pessimistic.geometric_mean_rank,user_attrs_head.pessimistic.harmonic_mean_rank,user_attrs_head.pessimistic.hits_at_1,user_attrs_head.pessimistic.hits_at_10,user_attrs_head.pessimistic.hits_at_3,user_attrs_head.pessimistic.hits_at_5,user_attrs_head.pessimistic.inverse_arithmetic_mean_rank,user_attrs_head.pessimistic.inverse_geometric_mean_rank,user_attrs_head.pessimistic.inverse_harmonic_mean_rank,user_attrs_head.pessimistic.inverse_median_rank,user_attrs_head.pessimistic.median_absolute_deviation,user_attrs_head.pessimistic.median_rank,user_attrs_head.pessimistic.standard_deviation,user_attrs_head.pessimistic.variance,user_attrs_head.pessimistic.z_arithmetic_mean_rank,user_attrs_head.pessimistic.z_geometric_mean_rank,user_attrs_head.pessimistic.z_hits_at_k,user_attrs_head.pessimistic.z_inverse_harmonic_mean_rank,user_attrs_head.realistic.adjusted_arithmetic_mean_rank,user_attrs_head.realistic.adjusted_arithmetic_mean_rank_index,user_attrs_head.realistic.adjusted_geometric_mean_rank_index,user_attrs_head.realistic.adjusted_hits_at_k,user_attrs_head.realistic.adjusted_inverse_harmonic_mean_rank,user_attrs_head.realistic.arithmetic_mean_rank,user_attrs_head.realistic.count,user_attrs_head.realistic.geometric_mean_rank,user_attrs_head.realistic.harmonic_mean_rank,user_attrs_head.realistic.hits_at_1,user_attrs_head.realistic.hits_at_10,user_attrs_head.realistic.hits_at_3,user_attrs_head.realistic.hits_at_5,user_attrs_head.realistic.inverse_arithmetic_mean_rank,user_attrs_head.realistic.inverse_geometric_mean_rank,user_attrs_head.realistic.inverse_harmonic_mean_rank,user_attrs_head.realistic.inverse_median_rank,user_attrs_head.realistic.median_absolute_deviation,user_attrs_head.realistic.median_rank,user_attrs_head.realistic.standard_deviation,user_attrs_head.realistic.variance,user_attrs_head.realistic.z_arithmetic_mean_rank,user_attrs_head.realistic.z_geometric_mean_rank,user_attrs_head.realistic.z_hits_at_k,user_attrs_head.realistic.z_inverse_harmonic_mean_rank,user_attrs_random_seed,user_attrs_tail.optimistic.adjusted_arithmetic_mean_rank,user_attrs_tail.optimistic.adjusted_arithmetic_mean_rank_index,user_attrs_tail.optimistic.adjusted_geometric_mean_rank_index,user_attrs_tail.optimistic.adjusted_hits_at_k,user_attrs_tail.optimistic.adjusted_inverse_harmonic_mean_rank,user_attrs_tail.optimistic.arithmetic_mean_rank,user_attrs_tail.optimistic.count,user_attrs_tail.optimistic.geometric_mean_rank,user_attrs_tail.optimistic.harmonic_mean_rank,user_attrs_tail.optimistic.hits_at_1,user_attrs_tail.optimistic.hits_at_10,user_attrs_tail.optimistic.hits_at_3,user_attrs_tail.optimistic.hits_at_5,user_attrs_tail.optimistic.inverse_arithmetic_mean_rank,user_attrs_tail.optimistic.inverse_geometric_mean_rank,user_attrs_tail.optimistic.inverse_harmonic_mean_rank,user_attrs_tail.optimistic.inverse_median_rank,user_attrs_tail.optimistic.median_absolute_deviation,user_attrs_tail.optimistic.median_rank,user_attrs_tail.optimistic.standard_deviation,user_attrs_tail.optimistic.variance,user_attrs_tail.optimistic.z_arithmetic_mean_rank,user_attrs_tail.optimistic.z_geometric_mean_rank,user_attrs_tail.optimistic.z_hits_at_k,user_attrs_tail.optimistic.z_inverse_harmonic_mean_rank,user_attrs_tail.pessimistic.adjusted_arithmetic_mean_rank,user_attrs_tail.pessimistic.adjusted_arithmetic_mean_rank_index,user_attrs_tail.pessimistic.adjusted_geometric_mean_rank_index,user_attrs_tail.pessimistic.adjusted_hits_at_k,user_attrs_tail.pessimistic.adjusted_inverse_harmonic_mean_rank,user_attrs_tail.pessimistic.arithmetic_mean_rank,user_attrs_tail.pessimistic.count,user_attrs_tail.pessimistic.geometric_mean_rank,user_attrs_tail.pessimistic.harmonic_mean_rank,user_attrs_tail.pessimistic.hits_at_1,user_attrs_tail.pessimistic.hits_at_10,user_attrs_tail.pessimistic.hits_at_3,user_attrs_tail.pessimistic.hits_at_5,user_attrs_tail.pessimistic.inverse_arithmetic_mean_rank,user_attrs_tail.pessimistic.inverse_geometric_mean_rank,user_attrs_tail.pessimistic.inverse_harmonic_mean_rank,user_attrs_tail.pessimistic.inverse_median_rank,user_attrs_tail.pessimistic.median_absolute_deviation,user_attrs_tail.pessimistic.median_rank,user_attrs_tail.pessimistic.standard_deviation,user_attrs_tail.pessimistic.variance,user_attrs_tail.pessimistic.z_arithmetic_mean_rank,user_attrs_tail.pessimistic.z_geometric_mean_rank,user_attrs_tail.pessimistic.z_hits_at_k,user_attrs_tail.pessimistic.z_inverse_harmonic_mean_rank,user_attrs_tail.realistic.adjusted_arithmetic_mean_rank,user_attrs_tail.realistic.adjusted_arithmetic_mean_rank_index,user_attrs_tail.realistic.adjusted_geometric_mean_rank_index,user_attrs_tail.realistic.adjusted_hits_at_k,user_attrs_tail.realistic.adjusted_inverse_harmonic_mean_rank,user_attrs_tail.realistic.arithmetic_mean_rank,user_attrs_tail.realistic.count,user_attrs_tail.realistic.geometric_mean_rank,user_attrs_tail.realistic.harmonic_mean_rank,user_attrs_tail.realistic.hits_at_1,user_attrs_tail.realistic.hits_at_10,user_attrs_tail.realistic.hits_at_3,user_attrs_tail.realistic.hits_at_5,user_attrs_tail.realistic.inverse_arithmetic_mean_rank,user_attrs_tail.realistic.inverse_geometric_mean_rank,user_attrs_tail.realistic.inverse_harmonic_mean_rank,user_attrs_tail.realistic.inverse_median_rank,user_attrs_tail.realistic.median_absolute_deviation,user_attrs_tail.realistic.median_rank,user_attrs_tail.realistic.standard_deviation,user_attrs_tail.realistic.variance,user_attrs_tail.realistic.z_arithmetic_mean_rank,user_attrs_tail.realistic.z_geometric_mean_rank,user_attrs_tail.realistic.z_hits_at_k,user_attrs_tail.realistic.z_inverse_harmonic_mean_rank,state
8,0.02830959297716618,2025-07-14 11:40:30.338882,2025-07-14 11:48:05.733702,0 days 00:07:35.394820,7.0,300,xavier_uniform,1.5,10,0.001,2,0.001,0.5723315190600611,0.4276878613171846,0.9334750413348331,0.04815982210698085,0.028345829984624763,12630.262055760177,163988.0,1081.207484204342,34.97237546985042,0.01159231163255848,0.04837549088957729,0.021824767665926774,0.029983901261067883,7.917492096246242e-05,0.0009248918589718212,0.028593997020937196,0.0040650406504065045,363.2375435338725,246.0,15191.437184006918,230779763.71562806,299.9713137909276,378.1604424398603,1295.4780997358334,1881.4028309012708,0.5724705311317786,0.42754884294594653,0.9330094627676221,0.04706193205526355,0.02785090217121617,12633.329786325829,163988.0,1088.767375452344,35.588207352481035,0.011378881381564504,0.04727784959875113,0.021349123106568772,0.02920335634314706,7.915569504742831e-05,0.0009184698426369873,0.02809919561543425,0.0040650406504065045,363.2375435338725,246.0,15192.227325798523,230803771.11873934,299.8738092152004,377.9718317227325,1265.9453386978428,1848.5528988391732,0.5724010240715672,0.4276183531559645,0.9332372529410843,0.04720831739549252,0.028061353283583314,12631.7958984375,163988.0,1085.068603515625,35.32371520871301,0.011378881381564504,0.047424201770861284,0.021361319120911285,0.029264336414859624,7.91653073974885e-05,0.0009216007310897112,0.02830959297716618,0.004065040498971939,363.2375435338725,246.0,15191.83203125,230791760.0,299.922562221556,378.06411188981303,1269.8830401695748,1862.5212080680308,1.1436866558932333,-0.1436931851613894,-0.2786328113490184,-3.2076043404099484e-05,-9.293462461263129e-05,25169.739468741616,81994.0,20706.035841174107,6129.821211053973,1.2196014342512866e-05,0.00019513622948020586,8.537210039759007e-05,0.0001463521721101544,3.973024835008337e-05,4.8295096544336725e-05,0.00016313689511803203,3.8207312879685175e-05,15227.807386271037,26173.0,12127.564386006514,147077817.93673354,-71.26448800362249,-79.84637645969462,-0.6092752827195613,-4.355705002709879,1.1439372772712457,-0.1439438179278929,-0.2794495990064747,-3.2076043404099484e-05,-9.479850949927027e-05,25175.255030855915,81994.0,20719.26216977459,6200.647209019922,1.2196014342512866e-05,0.00019513622948020586,8.537210039759007e-05,0.0001463521721101544,3.972154398334219e-05,4.82642669321887e-05,0.0001612734874748761,3.819782654366966e-05,15222.618278506268,26179.5,12124.481411265975,147003049.49213418,-71.38878906746032,-80.08043911178908,-0.6092752827195613,-4.443062462419308,1.1438120028005505,-0.14381853776459796,-0.27904309993634624,-3.2076043404099484e-05,-9.391925658479874e-05,25172.498046875,81994.0,20712.6796875,6167.033538794993,1.2196014342512866e-05,0.00019513622948020586,8.537210039759007e-05,0.0001463521721101544,3.972589547629468e-05,4.82796058349777e-05,0.00016215251525864005,3.820293568423949e-05,15224.4715312794,26176.0,12126.0224609375,147040416.0,-71.32665649879192,-79.9639507570011,-0.6092752827195613,-4.401853210924786,422305798.0,0.0041025882148829325,0.9959424187544109,0.996594019798192,0.09635166008990062,0.056784558127706296,90.78464277873991,81994.0,56.457432647484325,17.536212277155716,0.023172427250774445,0.09655584554967436,0.04356416323145596,0.05982145035002561,0.011015078865675524,0.01771245969054101,0.057024857146756376,0.013157894736842105,74.13011092528009,76.0,68.71617843916884,4721.913179283692,493.94214187451126,285.5883151426698,1835.2215000447227,2668.73971342977,0.00413060165772662,0.9959144040455732,0.9965476061472571,0.09415588135717902,0.05579656701801648,91.40454179574115,81994.0,57.21315692306252,17.84531468194388,0.022745566748786496,0.09436056296802205,0.04261287411273996,0.05826036051418396,0.01094037539441605,0.017478497146115386,0.056037117743393615,0.013157894736842105,74.13011092528009,76.0,68.66634242694347,4715.066582294257,493.92824785310324,285.57501464506817,1793.3982420347238,2622.3064717548955,0.004116594798300636,0.9959284115380024,0.9965703309374024,0.09444865185487523,0.05621659152600604,91.09458923339844,81994.0,56.843143463134766,17.71258436945524,0.022745566748786496,0.09465326731224236,0.04263726614142498,0.058382320657609094,0.010977600701153278,0.01759227178990841,0.0564570352435112,0.01315789483487606,74.13011092528009,76.0,68.68989562988281,4718.3017578125,493.93519493225415,285.5815267597314,1798.974676436057,2642.0466286222713,COMPLETE
9,0.044531989842653275,2025-07-14 11:48:05.762644,2025-07-14 11:56:08.096317,0 days 00:08:02.333673,6.0,300,xavier_uniform,1.5,14,0.0001,2,0.01,0.524101622165798,0.47591994381463787,0.9411296170791958,0.067531482130615,0.04445203870697816,11565.920469790473,163988.0,956.9153362138895,22.373320637636052,0.0286240456618777,0.06774276166548772,0.04366173134619606,0.05300997633973217,8.646090923865015e-05,0.001045024530546849,0.044696092108822486,0.0041841004184100415,349.8941235673221,239.0,14879.002732794424,221384722.32250392,333.800286886106,381.26139064093735,1816.567261161713,2950.4230960252366,0.5241410603761336,0.47588050381710634,0.940974604800502,0.06713502183416153,0.04417950485437118,11566.790795667976,163988.0,959.4323678205001,22.51054333246717,0.02841671341805498,0.06734639119935605,0.043344634973290726,0.05275386003853941,8.645440361682019e-05,0.0010422829513993318,0.0444236278632018,0.0041841004184100415,349.8941235673221,239.0,14878.547723335558,221371182.3555737,333.77262449737464,381.198593555532,1805.9026530091053,2932.334158001925,0.5241213338403616,0.475900231246813,0.9410497405632714,0.0671899163367474,0.04428789451727448,11566.35546875,163988.0,958.2123413085938,22.455767270524884,0.02841671341805498,0.06740127326389736,0.043350732980461985,0.05277215406005317,8.645765774417669e-05,0.0010436100419610739,0.044531989842653275,0.0041841003112494946,349.8941235673221,239.0,14878.775390625,221377952.0,333.78646090364674,381.2290318340438,1807.3792910610048,2939.528324436188,1.0449259397959196,-0.04492798127643338,0.3449914225835591,0.046115931271634054,0.023104375160757366,22996.258226211674,81994.0,10607.62291105712,42.81828759392747,0.012330170500280508,0.04633265848720638,0.028404517403712467,0.03730760787374686,4.348533531686371e-05,9.427182775866071e-05,0.023354507062113828,3.9605528931838884e-05,14018.003975970467,25249.0,13470.635174163433,181458011.99540913,-22.28198629674256,98.86242352293402,875.9589426110364,1082.8670465035561,1.0449996504989918,-0.04500169532899512,0.3431073161548379,0.045749967692609174,0.022836302489148957,22997.88041807937,81994.0,10638.132444981953,43.31535177522326,0.012098446227772763,0.045966778056930994,0.028136205088177185,0.03707588360123912,4.348226800996269e-05,9.400146173886975e-05,0.02308650302990286,3.9605528931838884e-05,14018.003975970467,25249.0,13468.354069907642,181396561.35239774,-22.3185447056091,98.32250480169859,869.0075689560502,1070.3028866795776,1.0449628401481281,-0.04496488330543147,0.344020526937043,0.045847557980349146,0.022940838667608644,22997.0703125,81994.0,10623.3447265625,43.12015279609464,0.012098446227772763,0.0460643461716711,0.028148401102519698,0.037112471644266655,4.348380025476217e-05,9.41323087317869e-05,0.023191012442111972,3.9605529309483245e-05,14018.003975970467,25249.0,13469.494140625,181427280.0,-22.300287820227425,98.58419893438156,870.86126859738,1075.2023389276383,1794456631.0,0.006127027930993662,0.9939178875490613,0.994759762912447,0.08894700625233389,0.06579967487974453,135.58271336927092,81994.0,86.32348343820284,15.142870601653843,0.044917920823474886,0.08915286484376905,0.05891894528867966,0.06871234480571749,0.007375571524936338,0.011584333256382997,0.06603767715553113,0.00684931506849315,99.33434863987533,146.0,78.67781048365082,6190.197862501275,492.93806647714763,285.06268251480714,1694.1841799776707,3092.4288446062897,0.00613238117271753,0.9939125340654118,0.9947471206417572,0.08852004927652692,0.06552267985185943,135.70117325657975,81994.0,86.52932957756701,15.20663859513901,0.044734980608337194,0.0887260043417811,0.05855306485840427,0.0684318364758397,0.00736913304433433,0.011556775082876095,0.06576075269650075,0.006802721088435374,99.33434863987533,147.0,78.634900309829,6183.447546736746,492.9354113927466,285.0590596907542,1686.0518798090598,3079.410734477176,0.006129704967684524,0.9939152103913889,0.9947532538597706,0.08853224804726426,0.06563491554178591,135.64195251464844,81994.0,86.4294662475586,15.180735815549694,0.044734980608337194,0.08873820035612362,0.05855306485840427,0.0684318364758397,0.0073723504319787025,0.011570127680897713,0.06587295979261398,0.006825938355177641,99.33434863987533,146.5,78.65613555908203,6186.7880859375,492.9367387287055,285.06081725237317,1686.2842312424489,3084.6855460253673,COMPLETE
