number,value,datetime_start,datetime_complete,duration,params_loss.margin,params_model.embedding_dim,params_model.entity_initializer,params_negative_sampler.num_negs_per_pos,params_optimizer.lr,params_regularizer.p,params_regularizer.weight,user_attrs_both.optimistic.adjusted_arithmetic_mean_rank,user_attrs_both.optimistic.adjusted_arithmetic_mean_rank_index,user_attrs_both.optimistic.adjusted_geometric_mean_rank_index,user_attrs_both.optimistic.adjusted_hits_at_k,user_attrs_both.optimistic.adjusted_inverse_harmonic_mean_rank,user_attrs_both.optimistic.arithmetic_mean_rank,user_attrs_both.optimistic.count,user_attrs_both.optimistic.geometric_mean_rank,user_attrs_both.optimistic.harmonic_mean_rank,user_attrs_both.optimistic.hits_at_1,user_attrs_both.optimistic.hits_at_10,user_attrs_both.optimistic.hits_at_3,user_attrs_both.optimistic.hits_at_5,user_attrs_both.optimistic.inverse_arithmetic_mean_rank,user_attrs_both.optimistic.inverse_geometric_mean_rank,user_attrs_both.optimistic.inverse_harmonic_mean_rank,user_attrs_both.optimistic.inverse_median_rank,user_attrs_both.optimistic.median_absolute_deviation,user_attrs_both.optimistic.median_rank,user_attrs_both.optimistic.standard_deviation,user_attrs_both.optimistic.variance,user_attrs_both.optimistic.z_arithmetic_mean_rank,user_attrs_both.optimistic.z_geometric_mean_rank,user_attrs_both.optimistic.z_hits_at_k,user_attrs_both.optimistic.z_inverse_harmonic_mean_rank,user_attrs_both.pessimistic.adjusted_arithmetic_mean_rank,user_attrs_both.pessimistic.adjusted_arithmetic_mean_rank_index,user_attrs_both.pessimistic.adjusted_geometric_mean_rank_index,user_attrs_both.pessimistic.adjusted_hits_at_k,user_attrs_both.pessimistic.adjusted_inverse_harmonic_mean_rank,user_attrs_both.pessimistic.arithmetic_mean_rank,user_attrs_both.pessimistic.count,user_attrs_both.pessimistic.geometric_mean_rank,user_attrs_both.pessimistic.harmonic_mean_rank,user_attrs_both.pessimistic.hits_at_1,user_attrs_both.pessimistic.hits_at_10,user_attrs_both.pessimistic.hits_at_3,user_attrs_both.pessimistic.hits_at_5,user_attrs_both.pessimistic.inverse_arithmetic_mean_rank,user_attrs_both.pessimistic.inverse_geometric_mean_rank,user_attrs_both.pessimistic.inverse_harmonic_mean_rank,user_attrs_both.pessimistic.inverse_median_rank,user_attrs_both.pessimistic.median_absolute_deviation,user_attrs_both.pessimistic.median_rank,user_attrs_both.pessimistic.standard_deviation,user_attrs_both.pessimistic.variance,user_attrs_both.pessimistic.z_arithmetic_mean_rank,user_attrs_both.pessimistic.z_geometric_mean_rank,user_attrs_both.pessimistic.z_hits_at_k,user_attrs_both.pessimistic.z_inverse_harmonic_mean_rank,user_attrs_both.realistic.adjusted_arithmetic_mean_rank,user_attrs_both.realistic.adjusted_arithmetic_mean_rank_index,user_attrs_both.realistic.adjusted_geometric_mean_rank_index,user_attrs_both.realistic.adjusted_hits_at_k,user_attrs_both.realistic.adjusted_inverse_harmonic_mean_rank,user_attrs_both.realistic.arithmetic_mean_rank,user_attrs_both.realistic.count,user_attrs_both.realistic.geometric_mean_rank,user_attrs_both.realistic.harmonic_mean_rank,user_attrs_both.realistic.hits_at_1,user_attrs_both.realistic.hits_at_10,user_attrs_both.realistic.hits_at_3,user_attrs_both.realistic.hits_at_5,user_attrs_both.realistic.inverse_arithmetic_mean_rank,user_attrs_both.realistic.inverse_geometric_mean_rank,user_attrs_both.realistic.inverse_harmonic_mean_rank,user_attrs_both.realistic.inverse_median_rank,user_attrs_both.realistic.median_absolute_deviation,user_attrs_both.realistic.median_rank,user_attrs_both.realistic.standard_deviation,user_attrs_both.realistic.variance,user_attrs_both.realistic.z_arithmetic_mean_rank,user_attrs_both.realistic.z_geometric_mean_rank,user_attrs_both.realistic.z_hits_at_k,user_attrs_both.realistic.z_inverse_harmonic_mean_rank,user_attrs_head.optimistic.adjusted_arithmetic_mean_rank,user_attrs_head.optimistic.adjusted_arithmetic_mean_rank_index,user_attrs_head.optimistic.adjusted_geometric_mean_rank_index,user_attrs_head.optimistic.adjusted_hits_at_k,user_attrs_head.optimistic.adjusted_inverse_harmonic_mean_rank,user_attrs_head.optimistic.arithmetic_mean_rank,user_attrs_head.optimistic.count,user_attrs_head.optimistic.geometric_mean_rank,user_attrs_head.optimistic.harmonic_mean_rank,user_attrs_head.optimistic.hits_at_1,user_attrs_head.optimistic.hits_at_10,user_attrs_head.optimistic.hits_at_3,user_attrs_head.optimistic.hits_at_5,user_attrs_head.optimistic.inverse_arithmetic_mean_rank,user_attrs_head.optimistic.inverse_geometric_mean_rank,user_attrs_head.optimistic.inverse_harmonic_mean_rank,user_attrs_head.optimistic.inverse_median_rank,user_attrs_head.optimistic.median_absolute_deviation,user_attrs_head.optimistic.median_rank,user_attrs_head.optimistic.standard_deviation,user_attrs_head.optimistic.variance,user_attrs_head.optimistic.z_arithmetic_mean_rank,user_attrs_head.optimistic.z_geometric_mean_rank,user_attrs_head.optimistic.z_hits_at_k,user_attrs_head.optimistic.z_inverse_harmonic_mean_rank,user_attrs_head.pessimistic.adjusted_arithmetic_mean_rank,user_attrs_head.pessimistic.adjusted_arithmetic_mean_rank_index,user_attrs_head.pessimistic.adjusted_geometric_mean_rank_index,user_attrs_head.pessimistic.adjusted_hits_at_k,user_attrs_head.pessimistic.adjusted_inverse_harmonic_mean_rank,user_attrs_head.pessimistic.arithmetic_mean_rank,user_attrs_head.pessimistic.count,user_attrs_head.pessimistic.geometric_mean_rank,user_attrs_head.pessimistic.harmonic_mean_rank,user_attrs_head.pessimistic.hits_at_1,user_attrs_head.pessimistic.hits_at_10,user_attrs_head.pessimistic.hits_at_3,user_attrs_head.pessimistic.hits_at_5,user_attrs_head.pessimistic.inverse_arithmetic_mean_rank,user_attrs_head.pessimistic.inverse_geometric_mean_rank,user_attrs_head.pessimistic.inverse_harmonic_mean_rank,user_attrs_head.pessimistic.inverse_median_rank,user_attrs_head.pessimistic.median_absolute_deviation,user_attrs_head.pessimistic.median_rank,user_attrs_head.pessimistic.standard_deviation,user_attrs_head.pessimistic.variance,user_attrs_head.pessimistic.z_arithmetic_mean_rank,user_attrs_head.pessimistic.z_geometric_mean_rank,user_attrs_head.pessimistic.z_hits_at_k,user_attrs_head.pessimistic.z_inverse_harmonic_mean_rank,user_attrs_head.realistic.adjusted_arithmetic_mean_rank,user_attrs_head.realistic.adjusted_arithmetic_mean_rank_index,user_attrs_head.realistic.adjusted_geometric_mean_rank_index,user_attrs_head.realistic.adjusted_hits_at_k,user_attrs_head.realistic.adjusted_inverse_harmonic_mean_rank,user_attrs_head.realistic.arithmetic_mean_rank,user_attrs_head.realistic.count,user_attrs_head.realistic.geometric_mean_rank,user_attrs_head.realistic.harmonic_mean_rank,user_attrs_head.realistic.hits_at_1,user_attrs_head.realistic.hits_at_10,user_attrs_head.realistic.hits_at_3,user_attrs_head.realistic.hits_at_5,user_attrs_head.realistic.inverse_arithmetic_mean_rank,user_attrs_head.realistic.inverse_geometric_mean_rank,user_attrs_head.realistic.inverse_harmonic_mean_rank,user_attrs_head.realistic.inverse_median_rank,user_attrs_head.realistic.median_absolute_deviation,user_attrs_head.realistic.median_rank,user_attrs_head.realistic.standard_deviation,user_attrs_head.realistic.variance,user_attrs_head.realistic.z_arithmetic_mean_rank,user_attrs_head.realistic.z_geometric_mean_rank,user_attrs_head.realistic.z_hits_at_k,user_attrs_head.realistic.z_inverse_harmonic_mean_rank,user_attrs_random_seed,user_attrs_tail.optimistic.adjusted_arithmetic_mean_rank,user_attrs_tail.optimistic.adjusted_arithmetic_mean_rank_index,user_attrs_tail.optimistic.adjusted_geometric_mean_rank_index,user_attrs_tail.optimistic.adjusted_hits_at_k,user_attrs_tail.optimistic.adjusted_inverse_harmonic_mean_rank,user_attrs_tail.optimistic.arithmetic_mean_rank,user_attrs_tail.optimistic.count,user_attrs_tail.optimistic.geometric_mean_rank,user_attrs_tail.optimistic.harmonic_mean_rank,user_attrs_tail.optimistic.hits_at_1,user_attrs_tail.optimistic.hits_at_10,user_attrs_tail.optimistic.hits_at_3,user_attrs_tail.optimistic.hits_at_5,user_attrs_tail.optimistic.inverse_arithmetic_mean_rank,user_attrs_tail.optimistic.inverse_geometric_mean_rank,user_attrs_tail.optimistic.inverse_harmonic_mean_rank,user_attrs_tail.optimistic.inverse_median_rank,user_attrs_tail.optimistic.median_absolute_deviation,user_attrs_tail.optimistic.median_rank,user_attrs_tail.optimistic.standard_deviation,user_attrs_tail.optimistic.variance,user_attrs_tail.optimistic.z_arithmetic_mean_rank,user_attrs_tail.optimistic.z_geometric_mean_rank,user_attrs_tail.optimistic.z_hits_at_k,user_attrs_tail.optimistic.z_inverse_harmonic_mean_rank,user_attrs_tail.pessimistic.adjusted_arithmetic_mean_rank,user_attrs_tail.pessimistic.adjusted_arithmetic_mean_rank_index,user_attrs_tail.pessimistic.adjusted_geometric_mean_rank_index,user_attrs_tail.pessimistic.adjusted_hits_at_k,user_attrs_tail.pessimistic.adjusted_inverse_harmonic_mean_rank,user_attrs_tail.pessimistic.arithmetic_mean_rank,user_attrs_tail.pessimistic.count,user_attrs_tail.pessimistic.geometric_mean_rank,user_attrs_tail.pessimistic.harmonic_mean_rank,user_attrs_tail.pessimistic.hits_at_1,user_attrs_tail.pessimistic.hits_at_10,user_attrs_tail.pessimistic.hits_at_3,user_attrs_tail.pessimistic.hits_at_5,user_attrs_tail.pessimistic.inverse_arithmetic_mean_rank,user_attrs_tail.pessimistic.inverse_geometric_mean_rank,user_attrs_tail.pessimistic.inverse_harmonic_mean_rank,user_attrs_tail.pessimistic.inverse_median_rank,user_attrs_tail.pessimistic.median_absolute_deviation,user_attrs_tail.pessimistic.median_rank,user_attrs_tail.pessimistic.standard_deviation,user_attrs_tail.pessimistic.variance,user_attrs_tail.pessimistic.z_arithmetic_mean_rank,user_attrs_tail.pessimistic.z_geometric_mean_rank,user_attrs_tail.pessimistic.z_hits_at_k,user_attrs_tail.pessimistic.z_inverse_harmonic_mean_rank,user_attrs_tail.realistic.adjusted_arithmetic_mean_rank,user_attrs_tail.realistic.adjusted_arithmetic_mean_rank_index,user_attrs_tail.realistic.adjusted_geometric_mean_rank_index,user_attrs_tail.realistic.adjusted_hits_at_k,user_attrs_tail.realistic.adjusted_inverse_harmonic_mean_rank,user_attrs_tail.realistic.arithmetic_mean_rank,user_attrs_tail.realistic.count,user_attrs_tail.realistic.geometric_mean_rank,user_attrs_tail.realistic.harmonic_mean_rank,user_attrs_tail.realistic.hits_at_1,user_attrs_tail.realistic.hits_at_10,user_attrs_tail.realistic.hits_at_3,user_attrs_tail.realistic.hits_at_5,user_attrs_tail.realistic.inverse_arithmetic_mean_rank,user_attrs_tail.realistic.inverse_geometric_mean_rank,user_attrs_tail.realistic.inverse_harmonic_mean_rank,user_attrs_tail.realistic.inverse_median_rank,user_attrs_tail.realistic.median_absolute_deviation,user_attrs_tail.realistic.median_rank,user_attrs_tail.realistic.standard_deviation,user_attrs_tail.realistic.variance,user_attrs_tail.realistic.z_arithmetic_mean_rank,user_attrs_tail.realistic.z_geometric_mean_rank,user_attrs_tail.realistic.z_hits_at_k,user_attrs_tail.realistic.z_inverse_harmonic_mean_rank,state
12,0.33664897084236145,2025-07-14 15:22:52.012802,2025-07-14 15:31:12.290293,0 days 00:08:20.277491,3.0,200,xavier_uniform_norm,12,0.01,2,0.01,0.09674059667570334,0.9033003357492174,0.9974788319531535,0.45126845276251654,0.3364795087253381,2134.8799546308264,163988.0,41.93778707699116,2.9704531137261827,0.27436153864916946,0.45139278483791495,0.3676671463765641,0.40246237529575335,0.0004684104124125915,0.023844844225189038,0.3366489763393654,0.047619047619047616,29.65204437011204,21.0,5851.323344826873,34237984.88571595,633.5559480878616,404.08904331968864,12138.923527518069,22333.21446574323,0.09674063342718682,0.9033002989960686,0.9974788297755051,0.45126845276251654,0.33647946797421574,2134.8807656657805,163988.0,41.93782243683522,2.9704534732056542,0.27436153864916946,0.45139278483791495,0.3676671463765641,0.40246237529575335,0.00046841023446484684,0.02384482412042621,0.33664893559865117,0.047619047619047616,29.65204437011204,21.0,5851.324604906388,34237999.6319829,633.5559223099722,404.0890424375006,12138.923527518069,22333.211760961716,0.09674061554743037,0.9033003168766353,0.9974788308385332,0.45126845276251654,0.3364795032269298,2134.88037109375,163988.0,41.93780517578125,2.970453162229502,0.27436153864916946,0.45139278483791495,0.3676671463765641,0.40246237529575335,0.0004684103187173605,0.02384483441710472,0.33664897084236145,0.0476190485060215,29.65204437011204,21.0,5851.32373046875,34237992.0,633.5559348510275,404.08904286814436,12138.923527518069,22333.214100796395,0.19364577596280128,0.8063908655953508,0.957180837008847,0.06870808288343704,0.03152869950149641,4261.6687928385,81994.0,694.3752180858883,31.469624172665704,0.012098446227772763,0.0689196770495402,0.030148547454691806,0.04233236578286216,0.0002346498633775682,0.001440143562088226,0.03177667437377892,0.0010449320794148381,1375.8548587731987,957.0,7709.030378886436,59429149.38259394,399.9287238494048,274.2944058949331,1305.0904095788492,1477.7023603422306,0.19364584966796264,0.8063907918868402,0.9571807646987274,0.06870808288343704,0.03152861799919943,4261.670414908408,81994.0,694.3763890112749,31.469704866966087,0.012098446227772763,0.0689196770495402,0.030148547454691806,0.04233236578286216,0.00023464977406552733,0.001440141133577286,0.03177659289235042,0.0010449320794148381,1375.8548587731987,957.0,7709.031844241284,59429171.97552617,399.9286872937444,274.29438517339275,1305.0904095788492,1477.6985404530972,0.19364580507805018,0.8063908364787788,0.9571807713233366,0.06870808288343704,0.03152865823077288,4261.66943359375,81994.0,694.3762817382812,31.46966503418826,0.012098446227772763,0.0689196770495402,0.030148547454691806,0.04233236578286216,0.00023464982223231345,0.001440141350030899,0.031776633113622665,0.0010449320543557405,1375.8548587731987,957.0,7709.03125,59429160.0,399.92870940907073,274.29438707177303,1305.0904095788492,1477.7004260459692,1100287959.0,0.0003656402434030002,0.9996795356074449,0.9999058556761069,0.8338283450159243,0.6414299269201073,8.091116423152913,81994.0,2.5328927921179076,1.5587947490100906,0.5366246310705661,0.8338658926262897,0.7051857452984365,0.7625923848086446,0.12359233852308407,0.3948054979318088,0.6415212783049519,1.0,0.0,1.0,18.94371105320921,358.86418846748086,495.7955818606618,286.53736923050616,15882.027405569652,30145.687063448688,0.0003656402434030002,0.9996795356074449,0.9999058556761069,0.8338283450159243,0.6414299269201073,8.091116423152913,81994.0,2.5328927921179076,1.5587947490100906,0.5366246310705661,0.8338658926262897,0.7051857452984365,0.7625923848086446,0.12359233852308407,0.3948054979318088,0.6415212783049519,1.0,0.0,1.0,18.94371105320921,358.86418846748086,495.7955818606618,286.53736923050616,15882.027405569652,30145.687063448688,0.00036564022209056927,0.9996795356287583,0.9999058556815181,0.8338283450159243,0.6414299236578118,8.091115951538086,81994.0,2.5328927040100098,1.5587947569349307,0.5366246310705661,0.8338658926262897,0.7051857452984365,0.7625923848086446,0.12359234690666199,0.39480552077293396,0.6415212750434875,1.0,0.0,1.0,18.943710327148438,358.86419677734375,495.7955818712323,286.53736923205685,15882.027405569652,30145.68691012853,COMPLETE
13,,2025-07-14 15:31:12.321488,2025-07-14 15:32:14.015442,0 days 00:01:01.693954,4.0,300,xavier_uniform_norm,12,0.01,2,0.0001,,,,,,,,,,,,,,,,,,,,,,,,,,,,,,,,,,,,,,,,,,,,,,,,,,,,,,,,,,,,,,,,,,,,,,,,,,,,,,,,,,,,,,,,,,,,,,,,,,,,,,,,,,,,,,,,,,,,,,,,,,,,,,,,,,,,,,,,,,,,,,,,,,,,,,,,,,,,,,,,,,,,,,,,,,,,,,,,,,,,,,,,,,,,,,,,,,,,,,,,,,,,,,,,,,,,,,,,,,,,,,,,,,,FAIL
14,0.4802127182483673,2025-07-14 15:35:11.926640,2025-07-14 15:45:03.453205,0 days 00:09:51.526565,4.0,300,xavier_uniform_norm,12,0.01,2,1e-05,0.007500645630304143,0.9925443308240313,0.9995726272585707,0.5591178521762128,0.4800799170218963,165.52490426128742,163988.0,7.9395192886974035,2.0824105299313356,0.4228297192477498,0.5592177476400713,0.5071285703831988,0.5260019025782374,0.006041386971119836,0.12595220990565348,0.480212708121954,0.3333333333333333,2.965204437011204,3.0,1590.0660928805255,2528310.17972834,696.1498182250576,404.93726156229195,15040.025086816686,31864.429986130803,0.00750065447276633,0.9925443219811684,0.9995726270820857,0.5591178521762128,0.48007990895173996,165.5250993975169,163988.0,7.939522154394582,2.0824105649180953,0.4228297192477498,0.5592177476400713,0.5071285703831988,0.5260019025782374,0.006041379848976556,0.12595216444436683,0.4802127000538588,0.3333333333333333,2.965204437011204,3.0,1590.0674272571605,2528314.423224205,696.1498120228588,404.937261490796,15040.025086816686,31864.429450488875,0.0075006503835019864,0.992544326070618,0.9995726271632871,0.5591178521762128,0.48007992715089665,165.52500915527344,163988.0,7.939520835876465,2.0824104860188175,0.4228297192477498,0.5592177476400713,0.5071285703831988,0.5260019025782374,0.006041383370757103,0.12595218420028687,0.4802127182483673,0.3333333432674408,2.965204437011204,3.0,1590.0667724609375,2528312.25,696.1498148911131,404.9372615236916,15040.025086816686,31864.43065842475,0.013530362923782136,0.9865144632623959,0.9969082035315526,0.13044613866493537,0.060560906327828644,297.77011732565796,81994.0,51.06578599002049,16.446976839734,0.01595238676000683,0.13064370563699784,0.04460082445056955,0.06977339805351611,0.0033582953487113834,0.019582583144718946,0.06080144756962966,0.01818181818181818,60.78669095872968,55.0,2174.443245675729,4728203.428664798,489.2608376215034,285.6788736744683,2477.7871451750166,2838.3978927151657,0.013530376223961625,0.9865144499616121,0.9969082013368613,0.13044613866493537,0.060560890198899826,297.7704100300022,81994.0,51.065821528888705,16.44698120154243,0.01595238676000683,0.13064370563699784,0.04460082445056955,0.06977339805351611,0.0033582920475518164,0.019582569516369868,0.06080143144483061,0.01818181818181818,60.78669095872968,55.0,2174.4448961006397,4728210.606178121,489.2608310249933,285.6788730455469,2477.7871451750166,2838.397136776717,0.013530369573601288,0.9865144566122745,0.99690820197736,0.13044613866493537,0.06056090146950041,297.770263671875,81994.0,51.06581115722656,16.446978153590198,0.01595238676000683,0.13064370563699784,0.04460082445056955,0.06977339805351611,0.003358293790370226,0.01958257332444191,0.06080144271254539,0.0181818176060915,60.78669095872968,55.0,2174.444091796875,4728207.5,489.26083432338254,285.6788732290913,2477.7871451750166,2838.3976650126847,1729401443.0,0.0015039203186839858,0.9985412040905839,0.99998560362871,0.9877890304919205,0.8995983897795996,33.27969119691685,81994.0,1.2344070557910722,1.1115755413605084,0.8297070517354929,0.9877917896431446,0.9696563163158279,0.9822304071029587,0.03004835573993077,0.8101055444463156,0.8996239686742783,1.0,0.0,1.0,541.7004135451623,293439.3380349999,495.23102120232096,286.5602221505193,18814.534846370745,42278.993235150265,0.0015039247278195557,0.9985411996812491,0.9999856036267435,0.9877890304919205,0.899598389768205,33.27978876503159,81994.0,1.2344070878104247,1.1115755413745838,0.8297070517354929,0.9877917896431446,0.9696563163158279,0.9822304071029587,0.030048267645578934,0.8101055234329438,0.8996239686628867,1.0,0.0,1.0,541.7015745793285,293440.59590172383,495.2310190154914,286.56022214995573,18814.534846370745,42278.993234614754,0.00150392249608825,0.9985412019130813,0.9999856036280033,0.9877890304919205,0.8995983515498359,33.27973937988281,81994.0,1.2344070672988892,1.1115755885851792,0.8297070517354929,0.9877917896431446,0.9696563163158279,0.9822304071029587,0.0300483126193285,0.810105562210083,0.8996239304542543,1.0,0.0,1.0,541.7009887695312,293439.96875,495.23102012237865,286.56022215031675,18814.534846370745,42278.99143844193,COMPLETE
