number,value,datetime_start,datetime_complete,duration,params_loss.margin,params_model.embedding_dim,params_model.entity_initializer,params_model.scoring_fct_norm,params_negative_sampler.num_negs_per_pos,params_optimizer.lr,params_regularizer.p,params_regularizer.weight,user_attrs_both.optimistic.adjusted_arithmetic_mean_rank,user_attrs_both.optimistic.adjusted_arithmetic_mean_rank_index,user_attrs_both.optimistic.adjusted_geometric_mean_rank_index,user_attrs_both.optimistic.adjusted_hits_at_k,user_attrs_both.optimistic.adjusted_inverse_harmonic_mean_rank,user_attrs_both.optimistic.arithmetic_mean_rank,user_attrs_both.optimistic.count,user_attrs_both.optimistic.geometric_mean_rank,user_attrs_both.optimistic.harmonic_mean_rank,user_attrs_both.optimistic.hits_at_1,user_attrs_both.optimistic.hits_at_10,user_attrs_both.optimistic.hits_at_3,user_attrs_both.optimistic.hits_at_5,user_attrs_both.optimistic.inverse_arithmetic_mean_rank,user_attrs_both.optimistic.inverse_geometric_mean_rank,user_attrs_both.optimistic.inverse_harmonic_mean_rank,user_attrs_both.optimistic.inverse_median_rank,user_attrs_both.optimistic.median_absolute_deviation,user_attrs_both.optimistic.median_rank,user_attrs_both.optimistic.standard_deviation,user_attrs_both.optimistic.variance,user_attrs_both.optimistic.z_arithmetic_mean_rank,user_attrs_both.optimistic.z_geometric_mean_rank,user_attrs_both.optimistic.z_hits_at_k,user_attrs_both.optimistic.z_inverse_harmonic_mean_rank,user_attrs_both.pessimistic.adjusted_arithmetic_mean_rank,user_attrs_both.pessimistic.adjusted_arithmetic_mean_rank_index,user_attrs_both.pessimistic.adjusted_geometric_mean_rank_index,user_attrs_both.pessimistic.adjusted_hits_at_k,user_attrs_both.pessimistic.adjusted_inverse_harmonic_mean_rank,user_attrs_both.pessimistic.arithmetic_mean_rank,user_attrs_both.pessimistic.count,user_attrs_both.pessimistic.geometric_mean_rank,user_attrs_both.pessimistic.harmonic_mean_rank,user_attrs_both.pessimistic.hits_at_1,user_attrs_both.pessimistic.hits_at_10,user_attrs_both.pessimistic.hits_at_3,user_attrs_both.pessimistic.hits_at_5,user_attrs_both.pessimistic.inverse_arithmetic_mean_rank,user_attrs_both.pessimistic.inverse_geometric_mean_rank,user_attrs_both.pessimistic.inverse_harmonic_mean_rank,user_attrs_both.pessimistic.inverse_median_rank,user_attrs_both.pessimistic.median_absolute_deviation,user_attrs_both.pessimistic.median_rank,user_attrs_both.pessimistic.standard_deviation,user_attrs_both.pessimistic.variance,user_attrs_both.pessimistic.z_arithmetic_mean_rank,user_attrs_both.pessimistic.z_geometric_mean_rank,user_attrs_both.pessimistic.z_hits_at_k,user_attrs_both.pessimistic.z_inverse_harmonic_mean_rank,user_attrs_both.realistic.adjusted_arithmetic_mean_rank,user_attrs_both.realistic.adjusted_arithmetic_mean_rank_index,user_attrs_both.realistic.adjusted_geometric_mean_rank_index,user_attrs_both.realistic.adjusted_hits_at_k,user_attrs_both.realistic.adjusted_inverse_harmonic_mean_rank,user_attrs_both.realistic.arithmetic_mean_rank,user_attrs_both.realistic.count,user_attrs_both.realistic.geometric_mean_rank,user_attrs_both.realistic.harmonic_mean_rank,user_attrs_both.realistic.hits_at_1,user_attrs_both.realistic.hits_at_10,user_attrs_both.realistic.hits_at_3,user_attrs_both.realistic.hits_at_5,user_attrs_both.realistic.inverse_arithmetic_mean_rank,user_attrs_both.realistic.inverse_geometric_mean_rank,user_attrs_both.realistic.inverse_harmonic_mean_rank,user_attrs_both.realistic.inverse_median_rank,user_attrs_both.realistic.median_absolute_deviation,user_attrs_both.realistic.median_rank,user_attrs_both.realistic.standard_deviation,user_attrs_both.realistic.variance,user_attrs_both.realistic.z_arithmetic_mean_rank,user_attrs_both.realistic.z_geometric_mean_rank,user_attrs_both.realistic.z_hits_at_k,user_attrs_both.realistic.z_inverse_harmonic_mean_rank,user_attrs_head.optimistic.adjusted_arithmetic_mean_rank,user_attrs_head.optimistic.adjusted_arithmetic_mean_rank_index,user_attrs_head.optimistic.adjusted_geometric_mean_rank_index,user_attrs_head.optimistic.adjusted_hits_at_k,user_attrs_head.optimistic.adjusted_inverse_harmonic_mean_rank,user_attrs_head.optimistic.arithmetic_mean_rank,user_attrs_head.optimistic.count,user_attrs_head.optimistic.geometric_mean_rank,user_attrs_head.optimistic.harmonic_mean_rank,user_attrs_head.optimistic.hits_at_1,user_attrs_head.optimistic.hits_at_10,user_attrs_head.optimistic.hits_at_3,user_attrs_head.optimistic.hits_at_5,user_attrs_head.optimistic.inverse_arithmetic_mean_rank,user_attrs_head.optimistic.inverse_geometric_mean_rank,user_attrs_head.optimistic.inverse_harmonic_mean_rank,user_attrs_head.optimistic.inverse_median_rank,user_attrs_head.optimistic.median_absolute_deviation,user_attrs_head.optimistic.median_rank,user_attrs_head.optimistic.standard_deviation,user_attrs_head.optimistic.variance,user_attrs_head.optimistic.z_arithmetic_mean_rank,user_attrs_head.optimistic.z_geometric_mean_rank,user_attrs_head.optimistic.z_hits_at_k,user_attrs_head.optimistic.z_inverse_harmonic_mean_rank,user_attrs_head.pessimistic.adjusted_arithmetic_mean_rank,user_attrs_head.pessimistic.adjusted_arithmetic_mean_rank_index,user_attrs_head.pessimistic.adjusted_geometric_mean_rank_index,user_attrs_head.pessimistic.adjusted_hits_at_k,user_attrs_head.pessimistic.adjusted_inverse_harmonic_mean_rank,user_attrs_head.pessimistic.arithmetic_mean_rank,user_attrs_head.pessimistic.count,user_attrs_head.pessimistic.geometric_mean_rank,user_attrs_head.pessimistic.harmonic_mean_rank,user_attrs_head.pessimistic.hits_at_1,user_attrs_head.pessimistic.hits_at_10,user_attrs_head.pessimistic.hits_at_3,user_attrs_head.pessimistic.hits_at_5,user_attrs_head.pessimistic.inverse_arithmetic_mean_rank,user_attrs_head.pessimistic.inverse_geometric_mean_rank,user_attrs_head.pessimistic.inverse_harmonic_mean_rank,user_attrs_head.pessimistic.inverse_median_rank,user_attrs_head.pessimistic.median_absolute_deviation,user_attrs_head.pessimistic.median_rank,user_attrs_head.pessimistic.standard_deviation,user_attrs_head.pessimistic.variance,user_attrs_head.pessimistic.z_arithmetic_mean_rank,user_attrs_head.pessimistic.z_geometric_mean_rank,user_attrs_head.pessimistic.z_hits_at_k,user_attrs_head.pessimistic.z_inverse_harmonic_mean_rank,user_attrs_head.realistic.adjusted_arithmetic_mean_rank,user_attrs_head.realistic.adjusted_arithmetic_mean_rank_index,user_attrs_head.realistic.adjusted_geometric_mean_rank_index,user_attrs_head.realistic.adjusted_hits_at_k,user_attrs_head.realistic.adjusted_inverse_harmonic_mean_rank,user_attrs_head.realistic.arithmetic_mean_rank,user_attrs_head.realistic.count,user_attrs_head.realistic.geometric_mean_rank,user_attrs_head.realistic.harmonic_mean_rank,user_attrs_head.realistic.hits_at_1,user_attrs_head.realistic.hits_at_10,user_attrs_head.realistic.hits_at_3,user_attrs_head.realistic.hits_at_5,user_attrs_head.realistic.inverse_arithmetic_mean_rank,user_attrs_head.realistic.inverse_geometric_mean_rank,user_attrs_head.realistic.inverse_harmonic_mean_rank,user_attrs_head.realistic.inverse_median_rank,user_attrs_head.realistic.median_absolute_deviation,user_attrs_head.realistic.median_rank,user_attrs_head.realistic.standard_deviation,user_attrs_head.realistic.variance,user_attrs_head.realistic.z_arithmetic_mean_rank,user_attrs_head.realistic.z_geometric_mean_rank,user_attrs_head.realistic.z_hits_at_k,user_attrs_head.realistic.z_inverse_harmonic_mean_rank,user_attrs_random_seed,user_attrs_tail.optimistic.adjusted_arithmetic_mean_rank,user_attrs_tail.optimistic.adjusted_arithmetic_mean_rank_index,user_attrs_tail.optimistic.adjusted_geometric_mean_rank_index,user_attrs_tail.optimistic.adjusted_hits_at_k,user_attrs_tail.optimistic.adjusted_inverse_harmonic_mean_rank,user_attrs_tail.optimistic.arithmetic_mean_rank,user_attrs_tail.optimistic.count,user_attrs_tail.optimistic.geometric_mean_rank,user_attrs_tail.optimistic.harmonic_mean_rank,user_attrs_tail.optimistic.hits_at_1,user_attrs_tail.optimistic.hits_at_10,user_attrs_tail.optimistic.hits_at_3,user_attrs_tail.optimistic.hits_at_5,user_attrs_tail.optimistic.inverse_arithmetic_mean_rank,user_attrs_tail.optimistic.inverse_geometric_mean_rank,user_attrs_tail.optimistic.inverse_harmonic_mean_rank,user_attrs_tail.optimistic.inverse_median_rank,user_attrs_tail.optimistic.median_absolute_deviation,user_attrs_tail.optimistic.median_rank,user_attrs_tail.optimistic.standard_deviation,user_attrs_tail.optimistic.variance,user_attrs_tail.optimistic.z_arithmetic_mean_rank,user_attrs_tail.optimistic.z_geometric_mean_rank,user_attrs_tail.optimistic.z_hits_at_k,user_attrs_tail.optimistic.z_inverse_harmonic_mean_rank,user_attrs_tail.pessimistic.adjusted_arithmetic_mean_rank,user_attrs_tail.pessimistic.adjusted_arithmetic_mean_rank_index,user_attrs_tail.pessimistic.adjusted_geometric_mean_rank_index,user_attrs_tail.pessimistic.adjusted_hits_at_k,user_attrs_tail.pessimistic.adjusted_inverse_harmonic_mean_rank,user_attrs_tail.pessimistic.arithmetic_mean_rank,user_attrs_tail.pessimistic.count,user_attrs_tail.pessimistic.geometric_mean_rank,user_attrs_tail.pessimistic.harmonic_mean_rank,user_attrs_tail.pessimistic.hits_at_1,user_attrs_tail.pessimistic.hits_at_10,user_attrs_tail.pessimistic.hits_at_3,user_attrs_tail.pessimistic.hits_at_5,user_attrs_tail.pessimistic.inverse_arithmetic_mean_rank,user_attrs_tail.pessimistic.inverse_geometric_mean_rank,user_attrs_tail.pessimistic.inverse_harmonic_mean_rank,user_attrs_tail.pessimistic.inverse_median_rank,user_attrs_tail.pessimistic.median_absolute_deviation,user_attrs_tail.pessimistic.median_rank,user_attrs_tail.pessimistic.standard_deviation,user_attrs_tail.pessimistic.variance,user_attrs_tail.pessimistic.z_arithmetic_mean_rank,user_attrs_tail.pessimistic.z_geometric_mean_rank,user_attrs_tail.pessimistic.z_hits_at_k,user_attrs_tail.pessimistic.z_inverse_harmonic_mean_rank,user_attrs_tail.realistic.adjusted_arithmetic_mean_rank,user_attrs_tail.realistic.adjusted_arithmetic_mean_rank_index,user_attrs_tail.realistic.adjusted_geometric_mean_rank_index,user_attrs_tail.realistic.adjusted_hits_at_k,user_attrs_tail.realistic.adjusted_inverse_harmonic_mean_rank,user_attrs_tail.realistic.arithmetic_mean_rank,user_attrs_tail.realistic.count,user_attrs_tail.realistic.geometric_mean_rank,user_attrs_tail.realistic.harmonic_mean_rank,user_attrs_tail.realistic.hits_at_1,user_attrs_tail.realistic.hits_at_10,user_attrs_tail.realistic.hits_at_3,user_attrs_tail.realistic.hits_at_5,user_attrs_tail.realistic.inverse_arithmetic_mean_rank,user_attrs_tail.realistic.inverse_geometric_mean_rank,user_attrs_tail.realistic.inverse_harmonic_mean_rank,user_attrs_tail.realistic.inverse_median_rank,user_attrs_tail.realistic.median_absolute_deviation,user_attrs_tail.realistic.median_rank,user_attrs_tail.realistic.standard_deviation,user_attrs_tail.realistic.variance,user_attrs_tail.realistic.z_arithmetic_mean_rank,user_attrs_tail.realistic.z_geometric_mean_rank,user_attrs_tail.realistic.z_hits_at_k,user_attrs_tail.realistic.z_inverse_harmonic_mean_rank,state
6,0.06455885618925095,2025-07-14 11:25:19.346429,2025-07-14 11:33:46.496547,0 days 00:08:27.150118,10.0,400,xavier_uniform_norm,1.5,10,0.0001,2,0.001,0.2605402333719255,0.7394932762503027,0.9765837693711729,0.11052607643369976,0.06548133819145718,5749.624673756616,163988.0,381.22402545825594,15.216063405855662,0.03896016781715735,0.11072761421567431,0.06216918311095934,0.07901187891796961,0.00017392439624178683,0.00262312953334443,0.06572002056820858,0.005813953488372093,246.11196827192992,172.0,10117.306150515658,102359883.74326196,518.6651052783751,395.62423626977414,2973.102997588358,4346.20454265883,0.26243691249674356,0.7375965111748977,0.9759822587654077,0.10764716474252994,0.06359206517417158,5791.480754689367,163988.0,390.99113048489994,15.66631253516318,0.037636900260994706,0.10784935483084128,0.05983974437153938,0.07627997170524672,0.00017266741311197471,0.0025576027741596556,0.0638312300840093,0.005747126436781609,249.07717270894113,174.0,10127.802210362785,102572377.61222932,517.3347539565731,395.380558070855,2895.6615353109605,4220.807487607188,0.26148857384750873,0.7385448927993845,0.976272418025302,0.10834859449779378,0.06431987716751103,5770.552734375,163988.0,386.2796325683594,15.489741594376328,0.037636900260994706,0.10855062565553578,0.06011415469424592,0.07684708637217358,0.00017329362162854522,0.0025887980591505766,0.06455885618925095,0.005780346691608429,248.33587159968832,173.0,10122.5,102465008.0,517.9999289769638,395.49810460315723,2914.5296881963436,4269.114682893953,0.5185382966858914,0.48148358142483727,0.8028846326864983,0.05372797371535169,0.021418317270211477,11411.756677317853,81994.0,3192.9099125622356,46.14912996228156,0.007354196648535259,0.05394297143693441,0.019855111349610946,0.03084372027221504,8.762892762931164e-05,0.00031319392885642783,0.0216688808828534,0.000132013201320132,10262.572556495777,7575.0,11857.305569635786,140595695.37171584,238.79128905002113,230.07853355392564,1020.547514634749,1003.844068584183,0.5223240110081019,0.47769769507590765,0.7958385557302347,0.05187375824829227,0.020357079507424217,11495.070968607459,81994.0,3307.0077791461463,48.52504522637003,0.006683415859697051,0.052089177256872454,0.01868429397272971,0.029136278264263238,8.699380827930134e-05,0.00030238816077360277,0.02060791484757996,0.0001295672454003628,10329.289656328529,7718.0,11835.46751127537,140078291.21045482,236.91368259294842,228.05937539918455,985.3272214494856,954.1054630676247,0.5204311647313232,0.47959062736555125,0.79927246653814,0.05231291454312213,0.020770297581359225,11453.4140625,81994.0,3251.402099609375,47.5714147737936,0.006683415859697051,0.05252823377320292,0.018842842159182378,0.029465570651511085,8.731021080166101e-05,0.00030755961779505014,0.021021027117967606,0.00013077878975309432,10296.672407521406,7646.5,11846.3330078125,140335616.0,237.85248042316886,229.0434136169721,993.668869835469,973.4723679144563,479260632.0,0.003953822878468872,0.9960911908138839,0.9972659372126182,0.16732410823975763,0.10954430261204219,87.49267019538014,81994.0,45.51702414615634,9.109860893244358,0.07056613898577944,0.16751225699441422,0.10448325487230772,0.12718003756372417,0.011429528871011676,0.021969801821599192,0.10977116025356377,0.012658227848101266,85.99092867332492,79.0,67.78247047245233,4594.463303348873,494.01592604950304,285.780862718201,3187.042139501245,5148.322720117893,0.00397180278218119,0.996073210097617,0.9972223143925553,0.1634205016038081,0.10682699540202246,87.89054077127595,81994.0,46.227307078585596,9.341032620397128,0.06859038466229236,0.1636095324048101,0.10099519477034904,0.12342366514623021,0.011377788681518912,0.021632235645914176,0.10705454532043863,0.012658227848101266,84.50832645481931,79.0,67.68572522595616,4581.357399363638,494.0070084320404,285.7683619732275,3112.6896808168026,5020.6157183541445,0.003962812791051457,0.9960822004950257,0.9972429337619765,0.16438420449205815,0.10786941209009106,87.69160461425781,81994.0,45.89157485961914,9.250976514238936,0.06859038466229236,0.16457301753786863,0.10138546722930947,0.12422860209283607,0.011403599753975868,0.02179049141705036,0.10809669643640518,0.012658228166401386,85.24962756407211,79.0,67.73319244384766,4587.78515625,494.0114672602505,285.7742707493744,3131.0454440545245,5069.606833282504,COMPLETE
7,0.07750193774700165,2025-07-14 11:33:46.527144,2025-07-14 11:40:30.309618,0 days 00:06:43.782474,1.0,100,xavier_uniform,1.5,14,1e-05,2,1e-05,0.38498137038426966,0.6150465000190597,0.9719988019265897,0.156125109915025,0.07726629297405001,8495.80257701783,163988.0,455.67301795444024,12.902898589980653,0.03656365099885357,0.1563163158279874,0.07826792204307632,0.10712978998463302,0.00011770518334608205,0.0021945560974601826,0.07750196539376966,0.005,295.0378414826148,200.0,12311.858757959877,151581866.07595333,431.3807412841249,393.76681829860206,4199.697006032903,5128.409449060944,0.38498186694378694,0.6150460034370402,0.9719987314662089,0.156125109915025,0.07726622719778795,8495.813535136718,163988.0,455.674162063844,12.902909537940358,0.03656365099885357,0.1563163158279874,0.07826792204307632,0.10712978998463302,0.0001177050315269081,0.0021945505873556446,0.0775018996343073,0.005,295.0378414826148,200.0,12311.868338907743,151582101.9945989,431.3803929918906,393.7667897543693,4199.697006032903,5128.405083281366,0.384981643028293,0.6150462273626811,0.9719987576702577,0.156125109915025,0.07726626532021902,8495.80859375,163988.0,455.6737365722656,12.902903192748719,0.03656365099885357,0.1563163158279874,0.07826792204307632,0.10712978998463302,0.00011770510172937065,0.002194552682340145,0.07750193774700165,0.004999999888241291,295.0378414826148,200.0,12311.86328125,151581984.0,431.38055004864805,393.7668003699019,4199.697006032903,5128.407613588286,0.7699501232074873,0.23006033049348806,0.3787216346394757,0.0011756037673780252,0.000744797521329182,16944.7146254604,81994.0,10061.42603315022,999.3458864940051,0.00017074420079518014,0.0014025416493889796,0.0005854086884406176,0.0009634851330585165,5.901545243479302e-05,9.938948979053432e-05,0.0010006545416505288,6.791863347709444e-05,15148.488167580988,14723.5,12664.627391338065,160392786.96143037,114.0981852698747,108.52831748869701,22.330257778734797,34.907531000222164,0.7699511140708593,0.23005933958509028,0.3787203558717749,0.0011756037673780252,0.0007447968132035688,16944.736431934045,81994.0,10061.44674037034,999.3465935129556,0.00017074420079518014,0.0014025416493889796,0.0005854086884406176,0.0009634851330585165,5.9015376486789156e-05,9.93892852394299e-05,0.0010006538337062295,6.791863347709444e-05,15148.488167580988,14723.5,12664.631544808415,160392892.1657564,114.0976938298698,108.527951038792,22.330257778734797,34.90749781144792,0.7699505768661323,0.23005987681422835,0.3787205646640518,0.0011756037673780252,0.0007447971647781561,16944.724609375,81994.0,10061.443359375,999.346242487686,0.00017074420079518014,0.0014025416493889796,0.0005854086884406176,0.0009634851330585165,5.901541589992121e-05,9.938931907527149e-05,0.0010006541851907969,6.791863415855914e-05,15148.488167580988,14723.5,12664.6298828125,160392848.0,114.09796026811057,108.52801087132451,22.330257778734797,34.90751428921597,167063304.0,0.002118998588685858,0.9979260980237342,0.9987939701723871,0.3110744226085983,0.1537876903056035,46.890528575261605,81994.0,20.63702487178121,6.493368351484636,0.07295655779691197,0.31123009000658586,0.15595043539771203,0.21329609483620754,0.021326268446621385,0.048456597121583476,0.1540032762458888,0.038461538461538464,34.099851025628844,26.0,52.11128323346304,2715.5858402382064,494.925956569649,286.2187424864854,5925.071430555844,7227.6571322820755,0.002119003548963374,0.9979260930632325,0.9987939664162545,0.3110744226085983,0.1537875594612884,46.890638339390684,81994.0,20.637086030526813,6.493373866981596,0.07295655779691197,0.31123009000658586,0.15595043539771203,0.21329609483620754,0.02132621852494479,0.048456453518717656,0.15400314543490837,0.038461538461538464,34.099851025628844,26.0,52.111336473484606,2715.591389052727,494.92595410946575,286.21874141011165,5925.071430555844,7227.650982909227,0.0021190010498900445,0.9979260955624187,0.9987939681219318,0.3110744226085983,0.1537876318611779,46.89058303833008,81994.0,20.63705825805664,6.493370815098741,0.07295655779691197,0.31123009000658586,0.15595043539771203,0.21329609483620754,0.02132624387741089,0.04845651984214783,0.15400321781635284,0.03846153989434242,34.099851025628844,26.0,52.11131286621094,2715.5888671875,494.9259553489485,286.218741898898,5925.071430555844,7227.6543855325235,COMPLETE
