number,value,datetime_start,datetime_complete,duration,params_loss.margin,params_model.embedding_dim,params_model.entity_initializer,params_model.scoring_fct_norm,params_negative_sampler.num_negs_per_pos,params_optimizer.lr,params_regularizer.p,params_regularizer.weight,user_attrs_both.optimistic.adjusted_arithmetic_mean_rank,user_attrs_both.optimistic.adjusted_arithmetic_mean_rank_index,user_attrs_both.optimistic.adjusted_geometric_mean_rank_index,user_attrs_both.optimistic.adjusted_hits_at_k,user_attrs_both.optimistic.adjusted_inverse_harmonic_mean_rank,user_attrs_both.optimistic.arithmetic_mean_rank,user_attrs_both.optimistic.count,user_attrs_both.optimistic.geometric_mean_rank,user_attrs_both.optimistic.harmonic_mean_rank,user_attrs_both.optimistic.hits_at_1,user_attrs_both.optimistic.hits_at_10,user_attrs_both.optimistic.hits_at_3,user_attrs_both.optimistic.hits_at_5,user_attrs_both.optimistic.inverse_arithmetic_mean_rank,user_attrs_both.optimistic.inverse_geometric_mean_rank,user_attrs_both.optimistic.inverse_harmonic_mean_rank,user_attrs_both.optimistic.inverse_median_rank,user_attrs_both.optimistic.median_absolute_deviation,user_attrs_both.optimistic.median_rank,user_attrs_both.optimistic.standard_deviation,user_attrs_both.optimistic.variance,user_attrs_both.optimistic.z_arithmetic_mean_rank,user_attrs_both.optimistic.z_geometric_mean_rank,user_attrs_both.optimistic.z_hits_at_k,user_attrs_both.optimistic.z_inverse_harmonic_mean_rank,user_attrs_both.pessimistic.adjusted_arithmetic_mean_rank,user_attrs_both.pessimistic.adjusted_arithmetic_mean_rank_index,user_attrs_both.pessimistic.adjusted_geometric_mean_rank_index,user_attrs_both.pessimistic.adjusted_hits_at_k,user_attrs_both.pessimistic.adjusted_inverse_harmonic_mean_rank,user_attrs_both.pessimistic.arithmetic_mean_rank,user_attrs_both.pessimistic.count,user_attrs_both.pessimistic.geometric_mean_rank,user_attrs_both.pessimistic.harmonic_mean_rank,user_attrs_both.pessimistic.hits_at_1,user_attrs_both.pessimistic.hits_at_10,user_attrs_both.pessimistic.hits_at_3,user_attrs_both.pessimistic.hits_at_5,user_attrs_both.pessimistic.inverse_arithmetic_mean_rank,user_attrs_both.pessimistic.inverse_geometric_mean_rank,user_attrs_both.pessimistic.inverse_harmonic_mean_rank,user_attrs_both.pessimistic.inverse_median_rank,user_attrs_both.pessimistic.median_absolute_deviation,user_attrs_both.pessimistic.median_rank,user_attrs_both.pessimistic.standard_deviation,user_attrs_both.pessimistic.variance,user_attrs_both.pessimistic.z_arithmetic_mean_rank,user_attrs_both.pessimistic.z_geometric_mean_rank,user_attrs_both.pessimistic.z_hits_at_k,user_attrs_both.pessimistic.z_inverse_harmonic_mean_rank,user_attrs_both.realistic.adjusted_arithmetic_mean_rank,user_attrs_both.realistic.adjusted_arithmetic_mean_rank_index,user_attrs_both.realistic.adjusted_geometric_mean_rank_index,user_attrs_both.realistic.adjusted_hits_at_k,user_attrs_both.realistic.adjusted_inverse_harmonic_mean_rank,user_attrs_both.realistic.arithmetic_mean_rank,user_attrs_both.realistic.count,user_attrs_both.realistic.geometric_mean_rank,user_attrs_both.realistic.harmonic_mean_rank,user_attrs_both.realistic.hits_at_1,user_attrs_both.realistic.hits_at_10,user_attrs_both.realistic.hits_at_3,user_attrs_both.realistic.hits_at_5,user_attrs_both.realistic.inverse_arithmetic_mean_rank,user_attrs_both.realistic.inverse_geometric_mean_rank,user_attrs_both.realistic.inverse_harmonic_mean_rank,user_attrs_both.realistic.inverse_median_rank,user_attrs_both.realistic.median_absolute_deviation,user_attrs_both.realistic.median_rank,user_attrs_both.realistic.standard_deviation,user_attrs_both.realistic.variance,user_attrs_both.realistic.z_arithmetic_mean_rank,user_attrs_both.realistic.z_geometric_mean_rank,user_attrs_both.realistic.z_hits_at_k,user_attrs_both.realistic.z_inverse_harmonic_mean_rank,user_attrs_head.optimistic.adjusted_arithmetic_mean_rank,user_attrs_head.optimistic.adjusted_arithmetic_mean_rank_index,user_attrs_head.optimistic.adjusted_geometric_mean_rank_index,user_attrs_head.optimistic.adjusted_hits_at_k,user_attrs_head.optimistic.adjusted_inverse_harmonic_mean_rank,user_attrs_head.optimistic.arithmetic_mean_rank,user_attrs_head.optimistic.count,user_attrs_head.optimistic.geometric_mean_rank,user_attrs_head.optimistic.harmonic_mean_rank,user_attrs_head.optimistic.hits_at_1,user_attrs_head.optimistic.hits_at_10,user_attrs_head.optimistic.hits_at_3,user_attrs_head.optimistic.hits_at_5,user_attrs_head.optimistic.inverse_arithmetic_mean_rank,user_attrs_head.optimistic.inverse_geometric_mean_rank,user_attrs_head.optimistic.inverse_harmonic_mean_rank,user_attrs_head.optimistic.inverse_median_rank,user_attrs_head.optimistic.median_absolute_deviation,user_attrs_head.optimistic.median_rank,user_attrs_head.optimistic.standard_deviation,user_attrs_head.optimistic.variance,user_attrs_head.optimistic.z_arithmetic_mean_rank,user_attrs_head.optimistic.z_geometric_mean_rank,user_attrs_head.optimistic.z_hits_at_k,user_attrs_head.optimistic.z_inverse_harmonic_mean_rank,user_attrs_head.pessimistic.adjusted_arithmetic_mean_rank,user_attrs_head.pessimistic.adjusted_arithmetic_mean_rank_index,user_attrs_head.pessimistic.adjusted_geometric_mean_rank_index,user_attrs_head.pessimistic.adjusted_hits_at_k,user_attrs_head.pessimistic.adjusted_inverse_harmonic_mean_rank,user_attrs_head.pessimistic.arithmetic_mean_rank,user_attrs_head.pessimistic.count,user_attrs_head.pessimistic.geometric_mean_rank,user_attrs_head.pessimistic.harmonic_mean_rank,user_attrs_head.pessimistic.hits_at_1,user_attrs_head.pessimistic.hits_at_10,user_attrs_head.pessimistic.hits_at_3,user_attrs_head.pessimistic.hits_at_5,user_attrs_head.pessimistic.inverse_arithmetic_mean_rank,user_attrs_head.pessimistic.inverse_geometric_mean_rank,user_attrs_head.pessimistic.inverse_harmonic_mean_rank,user_attrs_head.pessimistic.inverse_median_rank,user_attrs_head.pessimistic.median_absolute_deviation,user_attrs_head.pessimistic.median_rank,user_attrs_head.pessimistic.standard_deviation,user_attrs_head.pessimistic.variance,user_attrs_head.pessimistic.z_arithmetic_mean_rank,user_attrs_head.pessimistic.z_geometric_mean_rank,user_attrs_head.pessimistic.z_hits_at_k,user_attrs_head.pessimistic.z_inverse_harmonic_mean_rank,user_attrs_head.realistic.adjusted_arithmetic_mean_rank,user_attrs_head.realistic.adjusted_arithmetic_mean_rank_index,user_attrs_head.realistic.adjusted_geometric_mean_rank_index,user_attrs_head.realistic.adjusted_hits_at_k,user_attrs_head.realistic.adjusted_inverse_harmonic_mean_rank,user_attrs_head.realistic.arithmetic_mean_rank,user_attrs_head.realistic.count,user_attrs_head.realistic.geometric_mean_rank,user_attrs_head.realistic.harmonic_mean_rank,user_attrs_head.realistic.hits_at_1,user_attrs_head.realistic.hits_at_10,user_attrs_head.realistic.hits_at_3,user_attrs_head.realistic.hits_at_5,user_attrs_head.realistic.inverse_arithmetic_mean_rank,user_attrs_head.realistic.inverse_geometric_mean_rank,user_attrs_head.realistic.inverse_harmonic_mean_rank,user_attrs_head.realistic.inverse_median_rank,user_attrs_head.realistic.median_absolute_deviation,user_attrs_head.realistic.median_rank,user_attrs_head.realistic.standard_deviation,user_attrs_head.realistic.variance,user_attrs_head.realistic.z_arithmetic_mean_rank,user_attrs_head.realistic.z_geometric_mean_rank,user_attrs_head.realistic.z_hits_at_k,user_attrs_head.realistic.z_inverse_harmonic_mean_rank,user_attrs_random_seed,user_attrs_tail.optimistic.adjusted_arithmetic_mean_rank,user_attrs_tail.optimistic.adjusted_arithmetic_mean_rank_index,user_attrs_tail.optimistic.adjusted_geometric_mean_rank_index,user_attrs_tail.optimistic.adjusted_hits_at_k,user_attrs_tail.optimistic.adjusted_inverse_harmonic_mean_rank,user_attrs_tail.optimistic.arithmetic_mean_rank,user_attrs_tail.optimistic.count,user_attrs_tail.optimistic.geometric_mean_rank,user_attrs_tail.optimistic.harmonic_mean_rank,user_attrs_tail.optimistic.hits_at_1,user_attrs_tail.optimistic.hits_at_10,user_attrs_tail.optimistic.hits_at_3,user_attrs_tail.optimistic.hits_at_5,user_attrs_tail.optimistic.inverse_arithmetic_mean_rank,user_attrs_tail.optimistic.inverse_geometric_mean_rank,user_attrs_tail.optimistic.inverse_harmonic_mean_rank,user_attrs_tail.optimistic.inverse_median_rank,user_attrs_tail.optimistic.median_absolute_deviation,user_attrs_tail.optimistic.median_rank,user_attrs_tail.optimistic.standard_deviation,user_attrs_tail.optimistic.variance,user_attrs_tail.optimistic.z_arithmetic_mean_rank,user_attrs_tail.optimistic.z_geometric_mean_rank,user_attrs_tail.optimistic.z_hits_at_k,user_attrs_tail.optimistic.z_inverse_harmonic_mean_rank,user_attrs_tail.pessimistic.adjusted_arithmetic_mean_rank,user_attrs_tail.pessimistic.adjusted_arithmetic_mean_rank_index,user_attrs_tail.pessimistic.adjusted_geometric_mean_rank_index,user_attrs_tail.pessimistic.adjusted_hits_at_k,user_attrs_tail.pessimistic.adjusted_inverse_harmonic_mean_rank,user_attrs_tail.pessimistic.arithmetic_mean_rank,user_attrs_tail.pessimistic.count,user_attrs_tail.pessimistic.geometric_mean_rank,user_attrs_tail.pessimistic.harmonic_mean_rank,user_attrs_tail.pessimistic.hits_at_1,user_attrs_tail.pessimistic.hits_at_10,user_attrs_tail.pessimistic.hits_at_3,user_attrs_tail.pessimistic.hits_at_5,user_attrs_tail.pessimistic.inverse_arithmetic_mean_rank,user_attrs_tail.pessimistic.inverse_geometric_mean_rank,user_attrs_tail.pessimistic.inverse_harmonic_mean_rank,user_attrs_tail.pessimistic.inverse_median_rank,user_attrs_tail.pessimistic.median_absolute_deviation,user_attrs_tail.pessimistic.median_rank,user_attrs_tail.pessimistic.standard_deviation,user_attrs_tail.pessimistic.variance,user_attrs_tail.pessimistic.z_arithmetic_mean_rank,user_attrs_tail.pessimistic.z_geometric_mean_rank,user_attrs_tail.pessimistic.z_hits_at_k,user_attrs_tail.pessimistic.z_inverse_harmonic_mean_rank,user_attrs_tail.realistic.adjusted_arithmetic_mean_rank,user_attrs_tail.realistic.adjusted_arithmetic_mean_rank_index,user_attrs_tail.realistic.adjusted_geometric_mean_rank_index,user_attrs_tail.realistic.adjusted_hits_at_k,user_attrs_tail.realistic.adjusted_inverse_harmonic_mean_rank,user_attrs_tail.realistic.arithmetic_mean_rank,user_attrs_tail.realistic.count,user_attrs_tail.realistic.geometric_mean_rank,user_attrs_tail.realistic.harmonic_mean_rank,user_attrs_tail.realistic.hits_at_1,user_attrs_tail.realistic.hits_at_10,user_attrs_tail.realistic.hits_at_3,user_attrs_tail.realistic.hits_at_5,user_attrs_tail.realistic.inverse_arithmetic_mean_rank,user_attrs_tail.realistic.inverse_geometric_mean_rank,user_attrs_tail.realistic.inverse_harmonic_mean_rank,user_attrs_tail.realistic.inverse_median_rank,user_attrs_tail.realistic.median_absolute_deviation,user_attrs_tail.realistic.median_rank,user_attrs_tail.realistic.standard_deviation,user_attrs_tail.realistic.variance,user_attrs_tail.realistic.z_arithmetic_mean_rank,user_attrs_tail.realistic.z_geometric_mean_rank,user_attrs_tail.realistic.z_hits_at_k,user_attrs_tail.realistic.z_inverse_harmonic_mean_rank,state
12,0.4548705518245697,2025-07-14 12:08:09.058417,2025-07-14 12:13:30.089222,0 days 00:05:21.030805,9.0,200,xavier_uniform_norm,1.0,4,0.001,1,1e-05,0.0208985970540375,0.979145772253958,0.9993418813557177,0.5475839072440049,0.4547312746341606,461.19206893187305,163988.0,11.68628525762915,2.19842771113046,0.39994389833402444,0.5476864160792253,0.4746383881747445,0.5028233773202917,0.002168294008862757,0.08557039109987245,0.4548705399486559,0.2,5.930408874022408,5.0,2245.1780331795585,5040824.40067203,686.752349695576,404.84378399851124,14729.767025023128,30181.960022342184,0.02089861252834633,0.9791457567789479,0.9993418810919608,0.5475839072440049,0.45473126873487785,461.19241042027465,163988.0,11.686289540416379,2.1984277396349095,0.39994389833402444,0.5476864160792253,0.4746383881747445,0.5028233773202917,0.002168292403356598,0.085570359740066,0.4548705340508799,0.2,5.930408874022408,5.0,2245.1797592024213,5040832.151132242,686.7523388417278,404.84378389166056,14729.767025023128,30181.95963078804,0.020898607128670945,0.979145762178868,0.9993418811354892,0.5475839072440049,0.45473128651310835,461.1922912597656,163988.0,11.686288833618164,2.1984276537331677,0.39994389833402444,0.5476864160792253,0.4746383881747445,0.5028233773202917,0.0021682928781956434,0.08557036519050598,0.4548705518245697,0.20000000298023224,5.930408874022408,5.0,2245.178955078125,5040828.5,686.7523426291187,404.84378390929436,14729.767025023128,30181.960810785702,0.04177931572334373,0.9582642268016146,0.9939781514130265,0.13715547094705827,0.0584735916703845,919.4603141693294,81994.0,98.51242867908621,17.031519463348342,0.015696270458814058,0.13735151352537991,0.04561309364099812,0.07444447154669855,0.0010875945210353454,0.010151003415595376,0.05871466736435289,0.0125,106.74735973240334,80.0,3108.2982922293104,9661518.273475649,475.2501617839703,284.83922365848616,2605.2289955164297,2740.5686182810664,0.04177934620292172,0.9582641963206516,0.99397814904415,0.13715547094705827,0.05847358955366692,919.4609849501182,81994.0,98.51246703855293,17.03152007719304,0.015696270458814058,0.13735151352537991,0.04561309364099812,0.07444447154669855,0.0010875937275949246,0.01015099946292736,0.05871466524817729,0.0125,106.74735973240334,80.0,3108.300688476628,9661533.16998428,475.2501466669679,284.8392229796493,2605.2289955164297,2740.5685190737213,0.04177933017996939,0.958264212344332,0.9939781481393883,0.13715547094705827,0.058473586051810154,919.4606323242188,81994.0,98.51248168945312,17.03152109272597,0.015696270458814058,0.13735151352537991,0.04561309364099812,0.07444447154669855,0.0010875941952690482,0.010150997899472713,0.05871466174721717,0.012500000186264515,106.74735973240334,80.0,3108.29931640625,9661525.0,475.2501546138958,284.8392227203764,2605.2289955164297,2740.5683549470023,287942080.0,0.00013212856562473967,0.9999130578381704,0.9999762740290883,0.9580118311220681,0.8509884494888595,2.9238236944166647,81994.0,1.3863150564236728,1.1750516614679942,0.7841915262092348,0.9580213186330707,0.9036636827084908,0.9312022830938849,0.3420178863416425,0.7213367519644028,0.8510264125329589,1.0,0.0,1.0,10.533692722720854,110.95868237670228,495.91139826595577,286.55754861989,18247.36499746848,39994.44119497068,0.0001321291167666859,0.9999130572870036,0.9999762739998358,0.9580118311220681,0.8509884398070167,2.923835890431007,81994.0,1.386315532723373,1.1750516748327584,0.7841915262092348,0.9580213186330707,0.9036636827084908,0.9312022830938849,0.3420164597037587,0.7213365041330322,0.8510264028535826,1.0,0.0,1.0,10.533730439667632,110.95947697558044,495.9113979926021,286.55754861150723,18247.36499746848,39994.44073994699,0.00013212884126377928,0.999913057562519,0.9999762740113181,0.9580118311220681,0.8509883931617959,2.9238297939300537,81994.0,1.3863153457641602,1.1750517392215762,0.7841915262092348,0.9580213186330707,0.9036636827084908,0.9312022830938849,0.34201717376708984,0.7213366031646729,0.8510263562202454,1.0,0.0,1.0,10.533711433410645,110.95906829833984,495.9113981292452,286.55754861479767,18247.36499746848,39994.43854773212,COMPLETE
13,0.473206490278244,2025-07-14 12:13:30.119671,2025-07-14 12:19:07.519947,0 days 00:05:37.400276,4.0,200,xavier_uniform_norm,1.0,6,0.001,1,1e-05,0.006260882140159758,0.9937841504957396,0.9995585193351485,0.5509934657935048,0.47307189232512026,138.16569505085738,163988.0,8.168598491044117,2.11324243512518,0.4157804229577774,0.5510952020879577,0.500664682781667,0.5193489767543966,0.007237686602538425,0.122420021145167,0.4732064733220086,0.3333333333333333,2.965204437011204,3.0,1380.7559591776646,1906487.0188046328,697.0194017915419,404.931546295866,14821.482655135556,31399.28511259236,0.006260889600987227,0.9937841430345741,0.9995585191804021,0.5509934657935048,0.47307188819726465,138.165859697051,163988.0,8.16860100375866,2.1132424535546233,0.4157804229577774,0.5510952020879577,0.500664682781667,0.5193489767543966,0.00723767797770482,0.12241998348797609,0.47320646919520726,0.3333333333333333,2.965204437011204,3.0,1380.7572470071295,1906490.5751627076,697.0193965584365,404.93154623317656,14821.482655135556,31399.28483861346,0.006260885603691318,0.9937841470320512,0.9995585192958768,0.5509934657935048,0.47307190928568754,138.165771484375,163988.0,8.168599128723145,2.1132423594021352,0.4157804229577774,0.5510952020879577,0.500664682781667,0.5193489767543966,0.007237682584673166,0.12242001295089722,0.473206490278244,0.3333333432674408,2.965204437011204,3.0,1380.756591796875,1906488.875,697.0193993621832,404.9315462799566,14821.482655135556,31399.286238319117,0.012454033706864329,0.9875908413888108,0.9966959400259494,0.11633214330054224,0.055129453819445784,274.0827499573139,81994.0,54.50299130203841,18.059869480461202,0.013513183891504256,0.11653291704271045,0.03878332560919091,0.062004536917335415,0.0036485331534207885,0.018347616820851446,0.055371385772299754,0.01694915254237288,63.75189539574088,59.0,1943.1563337266552,3775856.5373020163,489.7946662508229,285.61804640974316,2209.6958345477165,2583.8339456248914,0.012454048669566255,0.987590826425429,0.9966959379552557,0.11633214330054224,0.055129445563729215,274.0830792497012,81994.0,54.50302483299977,18.059872172447466,0.013513183891504256,0.11653291704271045,0.03878332560919091,0.062004536917335415,0.003648528769953573,0.01834760553316177,0.05537137751869704,0.01694915254237288,63.75189539574088,59.0,1943.1581408895183,3775863.5605052095,489.79465882974904,285.61804581635505,2209.6958345477165,2583.8335586919684,0.012454042650160783,0.987590832445108,0.9966959386482765,0.11633214330054224,0.05512944938842251,274.08294677734375,81994.0,54.503013610839844,18.059870925308886,0.013513183891504256,0.11653291704271045,0.03878332560919091,0.062004536917335415,0.0036485304590314627,0.018347609788179398,0.05537138134241104,0.016949152573943138,63.75189539574088,59.0,1943.1573486328125,3775860.5,489.79466181520263,285.6180460149505,2209.6958345477165,2583.833737949547,1747204221.0,0.00010161679633872834,0.9999435709863558,0.9999862266308465,0.9856542456128856,0.8910137949160204,2.24864014440081,81994.0,1.2242631039847645,1.122282106596338,0.8180476620240505,0.9856574871332049,0.962546039954143,0.9766934165914579,0.44471322033898303,0.8168178855878063,0.8910415608717173,1.0,0.0,1.0,13.061725703715442,170.60867835910065,495.9265313996452,286.5604006807201,18773.873345527692,41875.53761285564,0.00010161679633872834,0.9999435709863558,0.9999862266308465,0.9856542456128856,0.8910137949160204,2.24864014440081,81994.0,1.2242631039847645,1.122282106596338,0.8180476620240505,0.9856574871332049,0.962546039954143,0.9766934165914579,0.44471322033898303,0.8168178855878063,0.8910415608717173,1.0,0.0,1.0,13.061725703715442,170.60867835910065,495.9265313996452,286.5604006807201,18773.873345527692,41875.53761285564,0.00010161679254382473,0.9999435709901509,0.99998622663281,0.9856542456128856,0.8910138109107133,2.2486400604248047,81994.0,1.224263072013855,1.1222820864558811,0.8180476620240505,0.9856574871332049,0.962546039954143,0.9766934165914579,0.4447132349014282,0.8168178796768188,0.8910415768623353,1.0,0.0,1.0,13.061725616455078,170.60867309570312,495.9265314015274,286.5604006812828,18773.873345527692,41875.53836456832,COMPLETE
