number,value,datetime_start,datetime_complete,duration,params_loss.margin,params_model.embedding_dim,params_model.entity_initializer,params_negative_sampler.num_negs_per_pos,params_optimizer.lr,params_regularizer.p,params_regularizer.weight,user_attrs_both.optimistic.adjusted_arithmetic_mean_rank,user_attrs_both.optimistic.adjusted_arithmetic_mean_rank_index,user_attrs_both.optimistic.adjusted_geometric_mean_rank_index,user_attrs_both.optimistic.adjusted_hits_at_k,user_attrs_both.optimistic.adjusted_inverse_harmonic_mean_rank,user_attrs_both.optimistic.arithmetic_mean_rank,user_attrs_both.optimistic.count,user_attrs_both.optimistic.geometric_mean_rank,user_attrs_both.optimistic.harmonic_mean_rank,user_attrs_both.optimistic.hits_at_1,user_attrs_both.optimistic.hits_at_10,user_attrs_both.optimistic.hits_at_3,user_attrs_both.optimistic.hits_at_5,user_attrs_both.optimistic.inverse_arithmetic_mean_rank,user_attrs_both.optimistic.inverse_geometric_mean_rank,user_attrs_both.optimistic.inverse_harmonic_mean_rank,user_attrs_both.optimistic.inverse_median_rank,user_attrs_both.optimistic.median_absolute_deviation,user_attrs_both.optimistic.median_rank,user_attrs_both.optimistic.standard_deviation,user_attrs_both.optimistic.variance,user_attrs_both.optimistic.z_arithmetic_mean_rank,user_attrs_both.optimistic.z_geometric_mean_rank,user_attrs_both.optimistic.z_hits_at_k,user_attrs_both.optimistic.z_inverse_harmonic_mean_rank,user_attrs_both.pessimistic.adjusted_arithmetic_mean_rank,user_attrs_both.pessimistic.adjusted_arithmetic_mean_rank_index,user_attrs_both.pessimistic.adjusted_geometric_mean_rank_index,user_attrs_both.pessimistic.adjusted_hits_at_k,user_attrs_both.pessimistic.adjusted_inverse_harmonic_mean_rank,user_attrs_both.pessimistic.arithmetic_mean_rank,user_attrs_both.pessimistic.count,user_attrs_both.pessimistic.geometric_mean_rank,user_attrs_both.pessimistic.harmonic_mean_rank,user_attrs_both.pessimistic.hits_at_1,user_attrs_both.pessimistic.hits_at_10,user_attrs_both.pessimistic.hits_at_3,user_attrs_both.pessimistic.hits_at_5,user_attrs_both.pessimistic.inverse_arithmetic_mean_rank,user_attrs_both.pessimistic.inverse_geometric_mean_rank,user_attrs_both.pessimistic.inverse_harmonic_mean_rank,user_attrs_both.pessimistic.inverse_median_rank,user_attrs_both.pessimistic.median_absolute_deviation,user_attrs_both.pessimistic.median_rank,user_attrs_both.pessimistic.standard_deviation,user_attrs_both.pessimistic.variance,user_attrs_both.pessimistic.z_arithmetic_mean_rank,user_attrs_both.pessimistic.z_geometric_mean_rank,user_attrs_both.pessimistic.z_hits_at_k,user_attrs_both.pessimistic.z_inverse_harmonic_mean_rank,user_attrs_both.realistic.adjusted_arithmetic_mean_rank,user_attrs_both.realistic.adjusted_arithmetic_mean_rank_index,user_attrs_both.realistic.adjusted_geometric_mean_rank_index,user_attrs_both.realistic.adjusted_hits_at_k,user_attrs_both.realistic.adjusted_inverse_harmonic_mean_rank,user_attrs_both.realistic.arithmetic_mean_rank,user_attrs_both.realistic.count,user_attrs_both.realistic.geometric_mean_rank,user_attrs_both.realistic.harmonic_mean_rank,user_attrs_both.realistic.hits_at_1,user_attrs_both.realistic.hits_at_10,user_attrs_both.realistic.hits_at_3,user_attrs_both.realistic.hits_at_5,user_attrs_both.realistic.inverse_arithmetic_mean_rank,user_attrs_both.realistic.inverse_geometric_mean_rank,user_attrs_both.realistic.inverse_harmonic_mean_rank,user_attrs_both.realistic.inverse_median_rank,user_attrs_both.realistic.median_absolute_deviation,user_attrs_both.realistic.median_rank,user_attrs_both.realistic.standard_deviation,user_attrs_both.realistic.variance,user_attrs_both.realistic.z_arithmetic_mean_rank,user_attrs_both.realistic.z_geometric_mean_rank,user_attrs_both.realistic.z_hits_at_k,user_attrs_both.realistic.z_inverse_harmonic_mean_rank,user_attrs_head.optimistic.adjusted_arithmetic_mean_rank,user_attrs_head.optimistic.adjusted_arithmetic_mean_rank_index,user_attrs_head.optimistic.adjusted_geometric_mean_rank_index,user_attrs_head.optimistic.adjusted_hits_at_k,user_attrs_head.optimistic.adjusted_inverse_harmonic_mean_rank,user_attrs_head.optimistic.arithmetic_mean_rank,user_attrs_head.optimistic.count,user_attrs_head.optimistic.geometric_mean_rank,user_attrs_head.optimistic.harmonic_mean_rank,user_attrs_head.optimistic.hits_at_1,user_attrs_head.optimistic.hits_at_10,user_attrs_head.optimistic.hits_at_3,user_attrs_head.optimistic.hits_at_5,user_attrs_head.optimistic.inverse_arithmetic_mean_rank,user_attrs_head.optimistic.inverse_geometric_mean_rank,user_attrs_head.optimistic.inverse_harmonic_mean_rank,user_attrs_head.optimistic.inverse_median_rank,user_attrs_head.optimistic.median_absolute_deviation,user_attrs_head.optimistic.median_rank,user_attrs_head.optimistic.standard_deviation,user_attrs_head.optimistic.variance,user_attrs_head.optimistic.z_arithmetic_mean_rank,user_attrs_head.optimistic.z_geometric_mean_rank,user_attrs_head.optimistic.z_hits_at_k,user_attrs_head.optimistic.z_inverse_harmonic_mean_rank,user_attrs_head.pessimistic.adjusted_arithmetic_mean_rank,user_attrs_head.pessimistic.adjusted_arithmetic_mean_rank_index,user_attrs_head.pessimistic.adjusted_geometric_mean_rank_index,user_attrs_head.pessimistic.adjusted_hits_at_k,user_attrs_head.pessimistic.adjusted_inverse_harmonic_mean_rank,user_attrs_head.pessimistic.arithmetic_mean_rank,user_attrs_head.pessimistic.count,user_attrs_head.pessimistic.geometric_mean_rank,user_attrs_head.pessimistic.harmonic_mean_rank,user_attrs_head.pessimistic.hits_at_1,user_attrs_head.pessimistic.hits_at_10,user_attrs_head.pessimistic.hits_at_3,user_attrs_head.pessimistic.hits_at_5,user_attrs_head.pessimistic.inverse_arithmetic_mean_rank,user_attrs_head.pessimistic.inverse_geometric_mean_rank,user_attrs_head.pessimistic.inverse_harmonic_mean_rank,user_attrs_head.pessimistic.inverse_median_rank,user_attrs_head.pessimistic.median_absolute_deviation,user_attrs_head.pessimistic.median_rank,user_attrs_head.pessimistic.standard_deviation,user_attrs_head.pessimistic.variance,user_attrs_head.pessimistic.z_arithmetic_mean_rank,user_attrs_head.pessimistic.z_geometric_mean_rank,user_attrs_head.pessimistic.z_hits_at_k,user_attrs_head.pessimistic.z_inverse_harmonic_mean_rank,user_attrs_head.realistic.adjusted_arithmetic_mean_rank,user_attrs_head.realistic.adjusted_arithmetic_mean_rank_index,user_attrs_head.realistic.adjusted_geometric_mean_rank_index,user_attrs_head.realistic.adjusted_hits_at_k,user_attrs_head.realistic.adjusted_inverse_harmonic_mean_rank,user_attrs_head.realistic.arithmetic_mean_rank,user_attrs_head.realistic.count,user_attrs_head.realistic.geometric_mean_rank,user_attrs_head.realistic.harmonic_mean_rank,user_attrs_head.realistic.hits_at_1,user_attrs_head.realistic.hits_at_10,user_attrs_head.realistic.hits_at_3,user_attrs_head.realistic.hits_at_5,user_attrs_head.realistic.inverse_arithmetic_mean_rank,user_attrs_head.realistic.inverse_geometric_mean_rank,user_attrs_head.realistic.inverse_harmonic_mean_rank,user_attrs_head.realistic.inverse_median_rank,user_attrs_head.realistic.median_absolute_deviation,user_attrs_head.realistic.median_rank,user_attrs_head.realistic.standard_deviation,user_attrs_head.realistic.variance,user_attrs_head.realistic.z_arithmetic_mean_rank,user_attrs_head.realistic.z_geometric_mean_rank,user_attrs_head.realistic.z_hits_at_k,user_attrs_head.realistic.z_inverse_harmonic_mean_rank,user_attrs_random_seed,user_attrs_tail.optimistic.adjusted_arithmetic_mean_rank,user_attrs_tail.optimistic.adjusted_arithmetic_mean_rank_index,user_attrs_tail.optimistic.adjusted_geometric_mean_rank_index,user_attrs_tail.optimistic.adjusted_hits_at_k,user_attrs_tail.optimistic.adjusted_inverse_harmonic_mean_rank,user_attrs_tail.optimistic.arithmetic_mean_rank,user_attrs_tail.optimistic.count,user_attrs_tail.optimistic.geometric_mean_rank,user_attrs_tail.optimistic.harmonic_mean_rank,user_attrs_tail.optimistic.hits_at_1,user_attrs_tail.optimistic.hits_at_10,user_attrs_tail.optimistic.hits_at_3,user_attrs_tail.optimistic.hits_at_5,user_attrs_tail.optimistic.inverse_arithmetic_mean_rank,user_attrs_tail.optimistic.inverse_geometric_mean_rank,user_attrs_tail.optimistic.inverse_harmonic_mean_rank,user_attrs_tail.optimistic.inverse_median_rank,user_attrs_tail.optimistic.median_absolute_deviation,user_attrs_tail.optimistic.median_rank,user_attrs_tail.optimistic.standard_deviation,user_attrs_tail.optimistic.variance,user_attrs_tail.optimistic.z_arithmetic_mean_rank,user_attrs_tail.optimistic.z_geometric_mean_rank,user_attrs_tail.optimistic.z_hits_at_k,user_attrs_tail.optimistic.z_inverse_harmonic_mean_rank,user_attrs_tail.pessimistic.adjusted_arithmetic_mean_rank,user_attrs_tail.pessimistic.adjusted_arithmetic_mean_rank_index,user_attrs_tail.pessimistic.adjusted_geometric_mean_rank_index,user_attrs_tail.pessimistic.adjusted_hits_at_k,user_attrs_tail.pessimistic.adjusted_inverse_harmonic_mean_rank,user_attrs_tail.pessimistic.arithmetic_mean_rank,user_attrs_tail.pessimistic.count,user_attrs_tail.pessimistic.geometric_mean_rank,user_attrs_tail.pessimistic.harmonic_mean_rank,user_attrs_tail.pessimistic.hits_at_1,user_attrs_tail.pessimistic.hits_at_10,user_attrs_tail.pessimistic.hits_at_3,user_attrs_tail.pessimistic.hits_at_5,user_attrs_tail.pessimistic.inverse_arithmetic_mean_rank,user_attrs_tail.pessimistic.inverse_geometric_mean_rank,user_attrs_tail.pessimistic.inverse_harmonic_mean_rank,user_attrs_tail.pessimistic.inverse_median_rank,user_attrs_tail.pessimistic.median_absolute_deviation,user_attrs_tail.pessimistic.median_rank,user_attrs_tail.pessimistic.standard_deviation,user_attrs_tail.pessimistic.variance,user_attrs_tail.pessimistic.z_arithmetic_mean_rank,user_attrs_tail.pessimistic.z_geometric_mean_rank,user_attrs_tail.pessimistic.z_hits_at_k,user_attrs_tail.pessimistic.z_inverse_harmonic_mean_rank,user_attrs_tail.realistic.adjusted_arithmetic_mean_rank,user_attrs_tail.realistic.adjusted_arithmetic_mean_rank_index,user_attrs_tail.realistic.adjusted_geometric_mean_rank_index,user_attrs_tail.realistic.adjusted_hits_at_k,user_attrs_tail.realistic.adjusted_inverse_harmonic_mean_rank,user_attrs_tail.realistic.arithmetic_mean_rank,user_attrs_tail.realistic.count,user_attrs_tail.realistic.geometric_mean_rank,user_attrs_tail.realistic.harmonic_mean_rank,user_attrs_tail.realistic.hits_at_1,user_attrs_tail.realistic.hits_at_10,user_attrs_tail.realistic.hits_at_3,user_attrs_tail.realistic.hits_at_5,user_attrs_tail.realistic.inverse_arithmetic_mean_rank,user_attrs_tail.realistic.inverse_geometric_mean_rank,user_attrs_tail.realistic.inverse_harmonic_mean_rank,user_attrs_tail.realistic.inverse_median_rank,user_attrs_tail.realistic.median_absolute_deviation,user_attrs_tail.realistic.median_rank,user_attrs_tail.realistic.standard_deviation,user_attrs_tail.realistic.variance,user_attrs_tail.realistic.z_arithmetic_mean_rank,user_attrs_tail.realistic.z_geometric_mean_rank,user_attrs_tail.realistic.z_hits_at_k,user_attrs_tail.realistic.z_inverse_harmonic_mean_rank,state
21,0.479152262210846,2025-07-14 16:42:23.495136,2025-07-14 16:50:57.252582,0 days 00:08:33.757446,5.0,200,xavier_uniform,14,0.01,1,1e-05,0.006082163544644679,0.9939628771901303,0.9995743283871009,0.5535003147449259,0.4790191708521108,134.2217174427397,163988.0,7.911896997652409,2.0870193883937644,0.42336024587164917,0.5536014830353441,0.5050003658804303,0.5226236066053613,0.00745035914494694,0.12639193865854378,0.4791522328739032,0.3333333333333333,2.965204437011204,3.0,1407.6281517792047,1981417.0136813396,697.1447569539745,404.93795070714225,14888.915792838967,31794.02489135021,0.006082172110779923,0.9939628686236068,0.9995743281232362,0.5535003147449259,0.4790191618052461,134.22190648096202,163988.0,7.911901282188905,2.0870194277886767,0.42336024587164917,0.5536014830353441,0.5050003658804303,0.5226236066053613,0.007450348651856168,0.12639187021344384,0.4791522238293491,0.3333333333333333,2.965204437011204,3.0,1407.6300110205093,1981422.2479255993,697.1447509455943,404.9379506002479,14888.915792838967,31794.024290881043,0.0060821680567648044,0.9939628726778057,0.9995743283169868,0.5535003147449259,0.4790192001965484,134.22181701660156,163988.0,7.911898136138916,2.0870192606123195,0.42336024587164917,0.5536014830353441,0.5050003658804303,0.5226236066053613,0.007450353819876909,0.1263919174671173,0.479152262210846,0.3333333432674408,2.965204437011204,3.0,1407.6290283203125,1981419.5,697.1447537891245,404.93795067873833,14888.915792838967,31794.026839033802,0.01134504423669069,0.9886998812525968,0.9968957031401139,0.12116286254367073,0.05736304957830203,249.67661048369393,81994.0,51.268206145729515,17.35978211609992,0.014598629167987901,0.12136253872234554,0.04046637558845769,0.06490718833085347,0.004005180934099987,0.019505266034811265,0.05760440962404554,0.017857142857142856,60.78669095872968,56.0,1937.5147096357553,3753963.250054925,490.34469343533794,285.6752915013715,2301.4539667935337,2688.519193576702,0.011345059199392615,0.9886998662892149,0.9968956998640616,0.12116286254367073,0.05736303159832011,249.67693977608118,81994.0,51.26825919519064,17.359787533198165,0.014598629167987901,0.12136253872234554,0.04046637558845769,0.06490718833085347,0.004005175651771582,0.019505245851878034,0.057604391648667354,0.017857142857142856,60.78669095872968,56.0,1937.5172318780544,3753973.023824399,490.344686014264,285.67529056256996,2301.4539667935337,2688.5183508822,0.01134505093115766,0.9886998745578256,0.9968957006976367,0.12116286254367073,0.05736303480358854,249.6767578125,81994.0,51.268245697021484,17.359786567498727,0.014598629167987901,0.12136253872234554,0.04046637558845769,0.06490718833085347,0.004005178343504667,0.019505251199007034,0.05760439485311508,0.01785714365541935,60.78669095872968,56.0,1937.5159912109375,3753968.25,490.34469011507304,285.6752908014433,2301.4539667935337,2688.5185011082735,1561900109.0,0.0008480790391959647,0.9991970750090969,0.9999864274759933,0.9858372271739456,0.9006747514492038,18.766824401785495,81994.0,1.2209928688264713,1.1102475160305696,0.8321218625753104,0.9858404273483425,0.9695343561724029,0.9803400248798693,0.05328552015997224,0.8190056023514098,0.9007000561237608,1.0,0.0,1.0,426.8619362903617,182211.1126535568,495.55630334733564,286.5604582357786,18777.358617028523,42329.57968379756,0.0008480812437637496,0.9991970728044296,0.99998642747237,0.9858372271739456,0.9006747513354446,18.766873185842865,81994.0,1.2209929278225742,1.110247516170759,0.8321218625753104,0.9858404273483425,0.9695343561724029,0.9803400248798693,0.053285381645482015,0.8190055627785854,0.9007000560100306,1.0,0.0,1.0,426.8626741710333,182211.74260044575,495.5563022539209,286.5604582347403,18777.358617028523,42329.57967845115,0.0008480801741980234,0.9991970738740437,0.9999864274726795,0.9858372271739456,0.9006747280305057,18.766849517822266,81994.0,1.220992922782898,1.1102475448902636,0.8321218625753104,0.9858404273483425,0.9695343561724029,0.9803400248798693,0.053285449743270874,0.81900554895401,0.9007000327110289,1.0,0.0,1.0,426.8623046875,182211.4375,495.5563027844008,286.56045823482896,18777.358617028523,42329.578583174225,COMPLETE
22,0.48099061846733093,2025-07-14 16:50:57.283253,2025-07-14 17:00:53.077769,0 days 00:09:55.794516,4.0,300,xavier_uniform,14,0.01,2,1e-05,0.007709425281332267,0.9923355417118701,0.999574222989129,0.559563107586076,0.48085800775808213,170.13227187355173,163988.0,7.913608410637443,2.079042708387272,0.42417128082542627,0.559662902163573,0.5072871185696515,0.5268251335463571,0.0058777796181034665,0.12636460488186446,0.4809906001285116,0.3333333333333333,2.965204437011204,3.0,1650.8111308305952,2725177.3896741886,696.0033779120515,404.9379080093283,15052.002262126538,31916.07434138701,0.007709434952775284,0.9923355320399888,0.9995742224820807,0.559563107586076,0.48085795935469466,170.13248530380272,163988.0,7.913616643897723,2.0790429175535583,0.42417128082542627,0.559662902163573,0.5072871185696515,0.5268251335463571,0.00587777224446182,0.12636447341319104,0.48099055173748667,0.3333333333333333,2.965204437011204,3.0,1650.812736757569,2725182.6918410147,696.0033711283965,404.93790780391777,15052.002262126538,31916.07112870034,0.007709429727642594,0.9923355372653583,0.9995742227161875,0.559563107586076,0.4808580261015865,170.1323699951172,163988.0,7.9136128425598145,2.0790426291192214,0.42417128082542627,0.559662902163573,0.5072871185696515,0.5268251335463571,0.005877776071429253,0.12636452913284302,0.48099061846733093,0.3333333432674408,2.965204437011204,3.0,1650.8118896484375,2725180.0,696.0033747933612,404.9379078987568,15052.002262126538,31916.075558903703,0.013763838707912035,0.9862809768688883,0.9969244604209818,0.1312756561107251,0.06058839511536107,302.908346952216,81994.0,50.80253646653848,16.43954630140501,0.015842622630924213,0.1314730346122887,0.0440763958338415,0.07094421543039735,0.0033013286364068097,0.019684056536402636,0.0608289293187206,0.01818181818181818,60.78669095872968,55.0,2241.7840064724837,5025595.531675821,489.1450402837908,285.6835323279382,2493.5435921263183,2839.686250524459,0.013763854778962251,0.9862809607971078,0.9969244539884335,0.1312756561107251,0.060588298360187004,302.908700636632,81994.0,50.80264062947078,16.439572443677086,0.015842622630924213,0.1314730346122887,0.0440763958338415,0.07094421543039735,0.0033013247816859373,0.0196840161772988,0.060828832588320475,0.01818181818181818,60.78669095872968,55.0,2241.786009118179,5025604.510678013,489.14503231300773,285.68353048459585,2493.5435921263183,2839.6817157560936,0.013763847426109066,0.9862809681502951,0.9969244564443476,0.1312756561107251,0.06058834525946855,302.9085388183594,81994.0,50.8026008605957,16.439559771953896,0.015842622630924213,0.1314730346122887,0.0440763958338415,0.07094421543039735,0.0033013266511261463,0.01968403160572052,0.06082887947559357,0.0181818176060915,60.78669095872968,55.0,2241.78515625,5025600.5,489.14503595981347,285.68353118837456,2493.5435921263183,2839.6839138543387,571407145.0,0.00168813896307408,0.9983569771209158,0.9999857073676717,0.9878500243456071,0.9011270815019649,37.35619679488743,81994.0,1.2327179395493426,1.1096903733691696,0.8324999390199282,0.9878527697148571,0.9704978413054614,0.9827060516623167,0.026769320375163566,0.8112155813726377,0.9011522709383025,1.0,0.0,1.0,624.0995717399303,389500.2754459644,495.1396530044459,286.56025187840714,18815.69660353769,42350.83812473966,0.0016881422699257574,0.9983569738139146,0.9999857073653673,0.9878500243456071,0.9011270814503021,37.356269970973486,81994.0,1.232717977069994,1.1096903734327717,0.8324999390199282,0.9878527697148571,0.9704978413054614,0.9827060516623167,0.026769267937538158,0.8112155566813963,0.9011522708866528,1.0,0.0,1.0,624.1008142021582,389501.8262877968,495.13965136432375,286.5602518777468,18815.69660353769,42350.83812231163,0.0016881405399711143,0.9983569755439474,0.9999857073645194,0.9878500243456071,0.9011270637100696,37.356231689453125,81994.0,1.2327179908752441,1.1096903952727546,0.8324999390199282,0.9878527697148571,0.9704978413054614,0.9827060516623167,0.02676929533481598,0.8112155199050903,0.9011522531509399,1.0,0.0,1.0,624.1002197265625,389501.0625,495.13965222234134,286.56025187750384,18815.69660353769,42350.837288562725,COMPLETE
