number,value,datetime_start,datetime_complete,duration,params_loss.margin,params_model.embedding_dim,params_model.entity_initializer,params_model.scoring_fct_norm,params_negative_sampler.num_negs_per_pos,params_optimizer.lr,params_regularizer.p,params_regularizer.weight,user_attrs_both.optimistic.adjusted_arithmetic_mean_rank,user_attrs_both.optimistic.adjusted_arithmetic_mean_rank_index,user_attrs_both.optimistic.adjusted_geometric_mean_rank_index,user_attrs_both.optimistic.adjusted_hits_at_k,user_attrs_both.optimistic.adjusted_inverse_harmonic_mean_rank,user_attrs_both.optimistic.arithmetic_mean_rank,user_attrs_both.optimistic.count,user_attrs_both.optimistic.geometric_mean_rank,user_attrs_both.optimistic.harmonic_mean_rank,user_attrs_both.optimistic.hits_at_1,user_attrs_both.optimistic.hits_at_10,user_attrs_both.optimistic.hits_at_3,user_attrs_both.optimistic.hits_at_5,user_attrs_both.optimistic.inverse_arithmetic_mean_rank,user_attrs_both.optimistic.inverse_geometric_mean_rank,user_attrs_both.optimistic.inverse_harmonic_mean_rank,user_attrs_both.optimistic.inverse_median_rank,user_attrs_both.optimistic.median_absolute_deviation,user_attrs_both.optimistic.median_rank,user_attrs_both.optimistic.standard_deviation,user_attrs_both.optimistic.variance,user_attrs_both.optimistic.z_arithmetic_mean_rank,user_attrs_both.optimistic.z_geometric_mean_rank,user_attrs_both.optimistic.z_hits_at_k,user_attrs_both.optimistic.z_inverse_harmonic_mean_rank,user_attrs_both.pessimistic.adjusted_arithmetic_mean_rank,user_attrs_both.pessimistic.adjusted_arithmetic_mean_rank_index,user_attrs_both.pessimistic.adjusted_geometric_mean_rank_index,user_attrs_both.pessimistic.adjusted_hits_at_k,user_attrs_both.pessimistic.adjusted_inverse_harmonic_mean_rank,user_attrs_both.pessimistic.arithmetic_mean_rank,user_attrs_both.pessimistic.count,user_attrs_both.pessimistic.geometric_mean_rank,user_attrs_both.pessimistic.harmonic_mean_rank,user_attrs_both.pessimistic.hits_at_1,user_attrs_both.pessimistic.hits_at_10,user_attrs_both.pessimistic.hits_at_3,user_attrs_both.pessimistic.hits_at_5,user_attrs_both.pessimistic.inverse_arithmetic_mean_rank,user_attrs_both.pessimistic.inverse_geometric_mean_rank,user_attrs_both.pessimistic.inverse_harmonic_mean_rank,user_attrs_both.pessimistic.inverse_median_rank,user_attrs_both.pessimistic.median_absolute_deviation,user_attrs_both.pessimistic.median_rank,user_attrs_both.pessimistic.standard_deviation,user_attrs_both.pessimistic.variance,user_attrs_both.pessimistic.z_arithmetic_mean_rank,user_attrs_both.pessimistic.z_geometric_mean_rank,user_attrs_both.pessimistic.z_hits_at_k,user_attrs_both.pessimistic.z_inverse_harmonic_mean_rank,user_attrs_both.realistic.adjusted_arithmetic_mean_rank,user_attrs_both.realistic.adjusted_arithmetic_mean_rank_index,user_attrs_both.realistic.adjusted_geometric_mean_rank_index,user_attrs_both.realistic.adjusted_hits_at_k,user_attrs_both.realistic.adjusted_inverse_harmonic_mean_rank,user_attrs_both.realistic.arithmetic_mean_rank,user_attrs_both.realistic.count,user_attrs_both.realistic.geometric_mean_rank,user_attrs_both.realistic.harmonic_mean_rank,user_attrs_both.realistic.hits_at_1,user_attrs_both.realistic.hits_at_10,user_attrs_both.realistic.hits_at_3,user_attrs_both.realistic.hits_at_5,user_attrs_both.realistic.inverse_arithmetic_mean_rank,user_attrs_both.realistic.inverse_geometric_mean_rank,user_attrs_both.realistic.inverse_harmonic_mean_rank,user_attrs_both.realistic.inverse_median_rank,user_attrs_both.realistic.median_absolute_deviation,user_attrs_both.realistic.median_rank,user_attrs_both.realistic.standard_deviation,user_attrs_both.realistic.variance,user_attrs_both.realistic.z_arithmetic_mean_rank,user_attrs_both.realistic.z_geometric_mean_rank,user_attrs_both.realistic.z_hits_at_k,user_attrs_both.realistic.z_inverse_harmonic_mean_rank,user_attrs_head.optimistic.adjusted_arithmetic_mean_rank,user_attrs_head.optimistic.adjusted_arithmetic_mean_rank_index,user_attrs_head.optimistic.adjusted_geometric_mean_rank_index,user_attrs_head.optimistic.adjusted_hits_at_k,user_attrs_head.optimistic.adjusted_inverse_harmonic_mean_rank,user_attrs_head.optimistic.arithmetic_mean_rank,user_attrs_head.optimistic.count,user_attrs_head.optimistic.geometric_mean_rank,user_attrs_head.optimistic.harmonic_mean_rank,user_attrs_head.optimistic.hits_at_1,user_attrs_head.optimistic.hits_at_10,user_attrs_head.optimistic.hits_at_3,user_attrs_head.optimistic.hits_at_5,user_attrs_head.optimistic.inverse_arithmetic_mean_rank,user_attrs_head.optimistic.inverse_geometric_mean_rank,user_attrs_head.optimistic.inverse_harmonic_mean_rank,user_attrs_head.optimistic.inverse_median_rank,user_attrs_head.optimistic.median_absolute_deviation,user_attrs_head.optimistic.median_rank,user_attrs_head.optimistic.standard_deviation,user_attrs_head.optimistic.variance,user_attrs_head.optimistic.z_arithmetic_mean_rank,user_attrs_head.optimistic.z_geometric_mean_rank,user_attrs_head.optimistic.z_hits_at_k,user_attrs_head.optimistic.z_inverse_harmonic_mean_rank,user_attrs_head.pessimistic.adjusted_arithmetic_mean_rank,user_attrs_head.pessimistic.adjusted_arithmetic_mean_rank_index,user_attrs_head.pessimistic.adjusted_geometric_mean_rank_index,user_attrs_head.pessimistic.adjusted_hits_at_k,user_attrs_head.pessimistic.adjusted_inverse_harmonic_mean_rank,user_attrs_head.pessimistic.arithmetic_mean_rank,user_attrs_head.pessimistic.count,user_attrs_head.pessimistic.geometric_mean_rank,user_attrs_head.pessimistic.harmonic_mean_rank,user_attrs_head.pessimistic.hits_at_1,user_attrs_head.pessimistic.hits_at_10,user_attrs_head.pessimistic.hits_at_3,user_attrs_head.pessimistic.hits_at_5,user_attrs_head.pessimistic.inverse_arithmetic_mean_rank,user_attrs_head.pessimistic.inverse_geometric_mean_rank,user_attrs_head.pessimistic.inverse_harmonic_mean_rank,user_attrs_head.pessimistic.inverse_median_rank,user_attrs_head.pessimistic.median_absolute_deviation,user_attrs_head.pessimistic.median_rank,user_attrs_head.pessimistic.standard_deviation,user_attrs_head.pessimistic.variance,user_attrs_head.pessimistic.z_arithmetic_mean_rank,user_attrs_head.pessimistic.z_geometric_mean_rank,user_attrs_head.pessimistic.z_hits_at_k,user_attrs_head.pessimistic.z_inverse_harmonic_mean_rank,user_attrs_head.realistic.adjusted_arithmetic_mean_rank,user_attrs_head.realistic.adjusted_arithmetic_mean_rank_index,user_attrs_head.realistic.adjusted_geometric_mean_rank_index,user_attrs_head.realistic.adjusted_hits_at_k,user_attrs_head.realistic.adjusted_inverse_harmonic_mean_rank,user_attrs_head.realistic.arithmetic_mean_rank,user_attrs_head.realistic.count,user_attrs_head.realistic.geometric_mean_rank,user_attrs_head.realistic.harmonic_mean_rank,user_attrs_head.realistic.hits_at_1,user_attrs_head.realistic.hits_at_10,user_attrs_head.realistic.hits_at_3,user_attrs_head.realistic.hits_at_5,user_attrs_head.realistic.inverse_arithmetic_mean_rank,user_attrs_head.realistic.inverse_geometric_mean_rank,user_attrs_head.realistic.inverse_harmonic_mean_rank,user_attrs_head.realistic.inverse_median_rank,user_attrs_head.realistic.median_absolute_deviation,user_attrs_head.realistic.median_rank,user_attrs_head.realistic.standard_deviation,user_attrs_head.realistic.variance,user_attrs_head.realistic.z_arithmetic_mean_rank,user_attrs_head.realistic.z_geometric_mean_rank,user_attrs_head.realistic.z_hits_at_k,user_attrs_head.realistic.z_inverse_harmonic_mean_rank,user_attrs_random_seed,user_attrs_tail.optimistic.adjusted_arithmetic_mean_rank,user_attrs_tail.optimistic.adjusted_arithmetic_mean_rank_index,user_attrs_tail.optimistic.adjusted_geometric_mean_rank_index,user_attrs_tail.optimistic.adjusted_hits_at_k,user_attrs_tail.optimistic.adjusted_inverse_harmonic_mean_rank,user_attrs_tail.optimistic.arithmetic_mean_rank,user_attrs_tail.optimistic.count,user_attrs_tail.optimistic.geometric_mean_rank,user_attrs_tail.optimistic.harmonic_mean_rank,user_attrs_tail.optimistic.hits_at_1,user_attrs_tail.optimistic.hits_at_10,user_attrs_tail.optimistic.hits_at_3,user_attrs_tail.optimistic.hits_at_5,user_attrs_tail.optimistic.inverse_arithmetic_mean_rank,user_attrs_tail.optimistic.inverse_geometric_mean_rank,user_attrs_tail.optimistic.inverse_harmonic_mean_rank,user_attrs_tail.optimistic.inverse_median_rank,user_attrs_tail.optimistic.median_absolute_deviation,user_attrs_tail.optimistic.median_rank,user_attrs_tail.optimistic.standard_deviation,user_attrs_tail.optimistic.variance,user_attrs_tail.optimistic.z_arithmetic_mean_rank,user_attrs_tail.optimistic.z_geometric_mean_rank,user_attrs_tail.optimistic.z_hits_at_k,user_attrs_tail.optimistic.z_inverse_harmonic_mean_rank,user_attrs_tail.pessimistic.adjusted_arithmetic_mean_rank,user_attrs_tail.pessimistic.adjusted_arithmetic_mean_rank_index,user_attrs_tail.pessimistic.adjusted_geometric_mean_rank_index,user_attrs_tail.pessimistic.adjusted_hits_at_k,user_attrs_tail.pessimistic.adjusted_inverse_harmonic_mean_rank,user_attrs_tail.pessimistic.arithmetic_mean_rank,user_attrs_tail.pessimistic.count,user_attrs_tail.pessimistic.geometric_mean_rank,user_attrs_tail.pessimistic.harmonic_mean_rank,user_attrs_tail.pessimistic.hits_at_1,user_attrs_tail.pessimistic.hits_at_10,user_attrs_tail.pessimistic.hits_at_3,user_attrs_tail.pessimistic.hits_at_5,user_attrs_tail.pessimistic.inverse_arithmetic_mean_rank,user_attrs_tail.pessimistic.inverse_geometric_mean_rank,user_attrs_tail.pessimistic.inverse_harmonic_mean_rank,user_attrs_tail.pessimistic.inverse_median_rank,user_attrs_tail.pessimistic.median_absolute_deviation,user_attrs_tail.pessimistic.median_rank,user_attrs_tail.pessimistic.standard_deviation,user_attrs_tail.pessimistic.variance,user_attrs_tail.pessimistic.z_arithmetic_mean_rank,user_attrs_tail.pessimistic.z_geometric_mean_rank,user_attrs_tail.pessimistic.z_hits_at_k,user_attrs_tail.pessimistic.z_inverse_harmonic_mean_rank,user_attrs_tail.realistic.adjusted_arithmetic_mean_rank,user_attrs_tail.realistic.adjusted_arithmetic_mean_rank_index,user_attrs_tail.realistic.adjusted_geometric_mean_rank_index,user_attrs_tail.realistic.adjusted_hits_at_k,user_attrs_tail.realistic.adjusted_inverse_harmonic_mean_rank,user_attrs_tail.realistic.arithmetic_mean_rank,user_attrs_tail.realistic.count,user_attrs_tail.realistic.geometric_mean_rank,user_attrs_tail.realistic.harmonic_mean_rank,user_attrs_tail.realistic.hits_at_1,user_attrs_tail.realistic.hits_at_10,user_attrs_tail.realistic.hits_at_3,user_attrs_tail.realistic.hits_at_5,user_attrs_tail.realistic.inverse_arithmetic_mean_rank,user_attrs_tail.realistic.inverse_geometric_mean_rank,user_attrs_tail.realistic.inverse_harmonic_mean_rank,user_attrs_tail.realistic.inverse_median_rank,user_attrs_tail.realistic.median_absolute_deviation,user_attrs_tail.realistic.median_rank,user_attrs_tail.realistic.standard_deviation,user_attrs_tail.realistic.variance,user_attrs_tail.realistic.z_arithmetic_mean_rank,user_attrs_tail.realistic.z_geometric_mean_rank,user_attrs_tail.realistic.z_hits_at_k,user_attrs_tail.realistic.z_inverse_harmonic_mean_rank,state
14,0.0765048936009407,2025-07-14 12:19:07.550121,2025-07-14 12:24:51.370308,0 days 00:05:43.820187,4.0,200,xavier_uniform_norm,1.0,6,1e-05,1,1e-05,0.33806058896373886,0.6619694077184375,0.9750575356720794,0.156802142113584,0.07626907617249186,7460.350665902383,163988.0,406.0064394196628,13.071040546642644,0.03456350464668147,0.15699319462399688,0.07763372929726566,0.10586140449301168,0.0001340419565759169,0.0024630151221970253,0.07650500328811653,0.00546448087431694,269.83360376801954,183.0,11353.124746193089,128893441.50262187,464.2914865788903,395.0059431335265,4217.9088753396645,5062.2210003723185,0.3380613507971217,0.6619686458505312,0.9750574302572084,0.156802142113584,0.07626886677136312,7460.3674781081545,163988.0,406.0081511070499,13.071076314225717,0.03456350464668147,0.15699319462399688,0.07763372929726566,0.10586140449301168,0.00013404165450755866,0.0024630047383859925,0.07650479394047026,0.00546448087431694,269.83360376801954,183.0,11353.141006981317,128893810.72440077,464.2909522206878,395.0059004288665,4217.9088753396645,5062.207101753841,0.3380609393581765,0.6619690573081214,0.9750574849402874,0.156802142113584,0.07626896645729403,7460.3583984375,163988.0,406.00726318359375,13.071059286953952,0.03456350464668147,0.15699319462399688,0.07763372929726566,0.10586140449301168,0.00013404182391241193,0.0024630101397633553,0.0765048936009407,0.005464480724185705,269.83360376801954,183.0,11353.1328125,128893616.0,464.2912408084291,395.0059225815502,4217.9088753396645,5062.2137182259185,0.6758818711441303,0.324132857114137,0.5051359640435784,0.0029078313747624867,0.001422769365692469,14874.503012415542,81994.0,8014.385477082806,595.7867890299196,0.0003414884015903603,0.003134375686025807,0.0009512891187160036,0.001548893821499134,6.722913694429412e-05,0.00012477563037858701,0.0016784527928661091,8.366100560528738e-05,13363.435096500243,11953.0,12159.150797128965,147844948.10732195,160.7533584939775,144.7542238585549,55.23342641233601,66.68304380288805,0.6758833929063336,0.3241313352827834,0.5051341249580987,0.0029078313747624867,0.0014227642170762562,14874.536502670928,81994.0,8014.415257587757,595.7886161301625,0.0003414884015903603,0.003134375686025807,0.0009512891187160036,0.001548893821499134,6.72289855768236e-05,0.00012477516672888098,0.0016784476455681877,8.365750616974108e-05,13364.176397609495,11953.5,12159.160823385851,147845191.92896128,160.75260374327644,144.75369684125627,55.23342641233601,66.68280249504946,0.6758826217427039,0.3241321064814555,0.5051353747527519,0.0029078313747624867,0.0014227668380784708,14874.51953125,81994.0,8014.39501953125,595.7876860082046,0.0003414884015903603,0.003134375686025807,0.0009512891187160036,0.001548893821499134,6.722906255163252e-05,0.00012477548443712294,0.0016784502658993006,8.365925896214321e-05,13363.80574705487,11953.25,12159.15625,147845072.0,160.75298621846798,144.75405498850353,55.23342641233601,66.68292533745083,256915326.0,0.00208771742524289,0.9979573806008473,0.9987981990792447,0.3106962607157407,0.15111528700616692,46.1983193892236,81994.0,20.5681682421687,6.608007219905458,0.06878552089177258,0.31085201356196795,0.1543161694758153,0.21017391516452424,0.021645809051514198,0.04861881662120051,0.15133155378336696,0.038461538461538464,32.61724880712324,26.0,51.2334198413239,2624.8633086373616,494.9414713050911,286.21995434042026,5917.868536120788,7102.060507941571,0.002087723487804299,0.9979573745380118,0.9987981931219854,0.3106962607157407,0.15111487335278753,46.19845354538137,81994.0,20.56826524047388,6.608025277842048,0.06878552089177258,0.31085201356196795,0.1543161694758153,0.21017391516452424,0.021645746194029772,0.048618587338723006,0.1513311402353723,0.038461538461538464,32.61724880712324,26.0,51.233487760605136,2624.8702681160767,494.9414682982005,286.2199526332821,5917.868536120788,7102.041067212655,0.0020877204871939843,0.9979573775387578,0.9987981958919705,0.3106962607157407,0.15111506847329287,46.198387145996094,81994.0,20.568220138549805,6.608016759892056,0.06878552089177258,0.31085201356196795,0.1543161694758153,0.21017391516452424,0.02164577692747116,0.04861869290471077,0.1513313353061676,0.03846153989434242,32.61724880712324,26.0,51.23345184326172,2624.86669921875,494.941469786434,286.21995342706106,5917.868536120788,7102.050237414179,COMPLETE
15,0.43872892856597895,2025-07-14 12:24:51.400827,2025-07-14 12:33:00.306163,0 days 00:08:08.905336,4.0,400,xavier_uniform_norm,1.5,8,0.0001,1,1e-05,0.14796896476048002,0.8520696461814617,0.9972211825460678,0.5195145182550992,0.438585555995321,3265.392065273069,163988.0,46.12140212041441,2.279311660003078,0.39427275166475595,0.5196233870771032,0.4622106495597239,0.48638924799375566,0.00030624193971524665,0.02168190805191017,0.4387289450353839,0.14285714285714285,8.895613311033612,7.0,5311.42264757772,28211210.541201524,597.6238147588361,403.9846668666894,13974.7127678185,29110.317358482105,0.14796904019773555,0.8520695707407877,0.9972211808788154,0.5195145182550992,0.43858554926291576,3265.3937300290263,163988.0,46.12142919263917,2.279311694970752,0.39427275166475595,0.5196233870771032,0.4622106495597239,0.48638924799375566,0.0003062417835876444,0.021681895325125718,0.43872893830469817,0.14285714285714285,8.895613311033612,7.0,5311.425715047399,28211243.126466773,597.6237618463264,403.98466619126805,13974.7127678185,29110.31691163097,0.1479689990630699,0.8520696118773174,0.9972211818030926,0.5195145182550992,0.4385855395217086,3265.392822265625,163988.0,46.12141418457031,2.279311745565949,0.39427275166475595,0.5196233870771032,0.4622106495597239,0.48638924799375566,0.00030624185455963016,0.021681902930140495,0.43872892856597895,0.1428571492433548,8.895613311033612,7.0,5311.42431640625,28211226.0,597.6237906986273,403.98466656570236,13974.7127678185,29110.316265076086,0.2965297377832041,0.7035022286228156,0.9167518488941623,0.1209920795401258,0.051469717289388484,6525.892565309657,81994.0,1349.046082549148,19.337652037280325,0.021086908798204747,0.12119179452155036,0.056577310534917186,0.08266458521355222,0.00015323574361548648,0.0007412645223433785,0.05171258630945153,0.0001524274064476793,7797.746368230213,6560.5,5929.624256320182,35160443.82114067,348.90120972614966,262.70887801233897,2298.209992421207,2412.3076412037503,0.2965298885185716,0.7035020778805985,0.9167517690757085,0.1209920795401258,0.05146970764635422,6525.8958826255575,81994.0,1349.0473750577803,19.337655642320087,0.021086908798204747,0.12119179452155036,0.056577310534917186,0.08266458521355222,0.00015323566572099078,0.0007412638121453441,0.05171257666888634,0.0001524274064476793,7797.746368230213,6560.5,5929.627934172327,35160487.437716775,348.9011349657015,262.70885513917386,2298.209992421207,2412.3071892493494,0.29652980492648895,0.7035021614764796,0.9167517848797899,0.1209920795401258,0.05146971472976794,6525.89404296875,81994.0,1349.047119140625,19.33765299419205,0.021086908798204747,0.12119179452155036,0.056577310534917186,0.08266458521355222,0.00015323571278713644,0.0007412639679387212,0.051712583750486374,0.00015242741210386157,7797.746368230213,6560.5,5929.62646484375,35160468.0,348.9011764249931,262.70885966806844,2298.209992421207,2412.307521238215,164973965.0,0.00022105146065757737,0.9998241309245008,0.9999645748250912,0.9180364594157976,0.825700898314483,4.8915652364807185,81994.0,1.5768058341887439,1.2110271719923127,0.7674585945313072,0.918054979632656,0.8678439885845306,0.8901139107739591,0.20443354052443533,0.6341934931478063,0.8257453037613163,1.0,0.0,1.0,15.818969141441388,250.23978469787485,495.86729456138295,286.55419604512866,17485.94935025311,38805.98619418203,0.0002210520117995236,0.999824130373334,0.9999645748041867,0.9180364594157976,0.8257008944927029,4.891577432495061,81994.0,1.576806174564862,1.211027177595857,0.7674585945313072,0.918054979632656,0.8678439885845306,0.8901139107739591,0.20443303081679465,0.634193356248089,0.8257452999405098,1.0,0.0,1.0,15.819008930149424,250.24104353214722,495.86729428802926,286.55419603913816,17485.94935025311,38805.98601456742,0.00022105174469139578,0.9998241306404542,0.999964574818027,0.9180364594157976,0.8257008194857816,4.891571521759033,81994.0,1.5768059492111206,1.2110272875720043,0.7674585945313072,0.918054979632656,0.8678439885845306,0.8901139107739591,0.20443327724933624,0.6341934204101562,0.8257452249526976,1.0,0.0,1.0,15.818988800048828,250.2404022216797,495.86729442050876,286.5541960431043,17485.94935025311,38805.982489419795,COMPLETE
