number,value,datetime_start,datetime_complete,duration,params_loss.margin,params_model.embedding_dim,params_model.entity_initializer,params_negative_sampler.num_negs_per_pos,params_optimizer.lr,params_regularizer.p,params_regularizer.weight,user_attrs_both.optimistic.adjusted_arithmetic_mean_rank,user_attrs_both.optimistic.adjusted_arithmetic_mean_rank_index,user_attrs_both.optimistic.adjusted_geometric_mean_rank_index,user_attrs_both.optimistic.adjusted_hits_at_k,user_attrs_both.optimistic.adjusted_inverse_harmonic_mean_rank,user_attrs_both.optimistic.arithmetic_mean_rank,user_attrs_both.optimistic.count,user_attrs_both.optimistic.geometric_mean_rank,user_attrs_both.optimistic.harmonic_mean_rank,user_attrs_both.optimistic.hits_at_1,user_attrs_both.optimistic.hits_at_10,user_attrs_both.optimistic.hits_at_3,user_attrs_both.optimistic.hits_at_5,user_attrs_both.optimistic.inverse_arithmetic_mean_rank,user_attrs_both.optimistic.inverse_geometric_mean_rank,user_attrs_both.optimistic.inverse_harmonic_mean_rank,user_attrs_both.optimistic.inverse_median_rank,user_attrs_both.optimistic.median_absolute_deviation,user_attrs_both.optimistic.median_rank,user_attrs_both.optimistic.standard_deviation,user_attrs_both.optimistic.variance,user_attrs_both.optimistic.z_arithmetic_mean_rank,user_attrs_both.optimistic.z_geometric_mean_rank,user_attrs_both.optimistic.z_hits_at_k,user_attrs_both.optimistic.z_inverse_harmonic_mean_rank,user_attrs_both.pessimistic.adjusted_arithmetic_mean_rank,user_attrs_both.pessimistic.adjusted_arithmetic_mean_rank_index,user_attrs_both.pessimistic.adjusted_geometric_mean_rank_index,user_attrs_both.pessimistic.adjusted_hits_at_k,user_attrs_both.pessimistic.adjusted_inverse_harmonic_mean_rank,user_attrs_both.pessimistic.arithmetic_mean_rank,user_attrs_both.pessimistic.count,user_attrs_both.pessimistic.geometric_mean_rank,user_attrs_both.pessimistic.harmonic_mean_rank,user_attrs_both.pessimistic.hits_at_1,user_attrs_both.pessimistic.hits_at_10,user_attrs_both.pessimistic.hits_at_3,user_attrs_both.pessimistic.hits_at_5,user_attrs_both.pessimistic.inverse_arithmetic_mean_rank,user_attrs_both.pessimistic.inverse_geometric_mean_rank,user_attrs_both.pessimistic.inverse_harmonic_mean_rank,user_attrs_both.pessimistic.inverse_median_rank,user_attrs_both.pessimistic.median_absolute_deviation,user_attrs_both.pessimistic.median_rank,user_attrs_both.pessimistic.standard_deviation,user_attrs_both.pessimistic.variance,user_attrs_both.pessimistic.z_arithmetic_mean_rank,user_attrs_both.pessimistic.z_geometric_mean_rank,user_attrs_both.pessimistic.z_hits_at_k,user_attrs_both.pessimistic.z_inverse_harmonic_mean_rank,user_attrs_both.realistic.adjusted_arithmetic_mean_rank,user_attrs_both.realistic.adjusted_arithmetic_mean_rank_index,user_attrs_both.realistic.adjusted_geometric_mean_rank_index,user_attrs_both.realistic.adjusted_hits_at_k,user_attrs_both.realistic.adjusted_inverse_harmonic_mean_rank,user_attrs_both.realistic.arithmetic_mean_rank,user_attrs_both.realistic.count,user_attrs_both.realistic.geometric_mean_rank,user_attrs_both.realistic.harmonic_mean_rank,user_attrs_both.realistic.hits_at_1,user_attrs_both.realistic.hits_at_10,user_attrs_both.realistic.hits_at_3,user_attrs_both.realistic.hits_at_5,user_attrs_both.realistic.inverse_arithmetic_mean_rank,user_attrs_both.realistic.inverse_geometric_mean_rank,user_attrs_both.realistic.inverse_harmonic_mean_rank,user_attrs_both.realistic.inverse_median_rank,user_attrs_both.realistic.median_absolute_deviation,user_attrs_both.realistic.median_rank,user_attrs_both.realistic.standard_deviation,user_attrs_both.realistic.variance,user_attrs_both.realistic.z_arithmetic_mean_rank,user_attrs_both.realistic.z_geometric_mean_rank,user_attrs_both.realistic.z_hits_at_k,user_attrs_both.realistic.z_inverse_harmonic_mean_rank,user_attrs_head.optimistic.adjusted_arithmetic_mean_rank,user_attrs_head.optimistic.adjusted_arithmetic_mean_rank_index,user_attrs_head.optimistic.adjusted_geometric_mean_rank_index,user_attrs_head.optimistic.adjusted_hits_at_k,user_attrs_head.optimistic.adjusted_inverse_harmonic_mean_rank,user_attrs_head.optimistic.arithmetic_mean_rank,user_attrs_head.optimistic.count,user_attrs_head.optimistic.geometric_mean_rank,user_attrs_head.optimistic.harmonic_mean_rank,user_attrs_head.optimistic.hits_at_1,user_attrs_head.optimistic.hits_at_10,user_attrs_head.optimistic.hits_at_3,user_attrs_head.optimistic.hits_at_5,user_attrs_head.optimistic.inverse_arithmetic_mean_rank,user_attrs_head.optimistic.inverse_geometric_mean_rank,user_attrs_head.optimistic.inverse_harmonic_mean_rank,user_attrs_head.optimistic.inverse_median_rank,user_attrs_head.optimistic.median_absolute_deviation,user_attrs_head.optimistic.median_rank,user_attrs_head.optimistic.standard_deviation,user_attrs_head.optimistic.variance,user_attrs_head.optimistic.z_arithmetic_mean_rank,user_attrs_head.optimistic.z_geometric_mean_rank,user_attrs_head.optimistic.z_hits_at_k,user_attrs_head.optimistic.z_inverse_harmonic_mean_rank,user_attrs_head.pessimistic.adjusted_arithmetic_mean_rank,user_attrs_head.pessimistic.adjusted_arithmetic_mean_rank_index,user_attrs_head.pessimistic.adjusted_geometric_mean_rank_index,user_attrs_head.pessimistic.adjusted_hits_at_k,user_attrs_head.pessimistic.adjusted_inverse_harmonic_mean_rank,user_attrs_head.pessimistic.arithmetic_mean_rank,user_attrs_head.pessimistic.count,user_attrs_head.pessimistic.geometric_mean_rank,user_attrs_head.pessimistic.harmonic_mean_rank,user_attrs_head.pessimistic.hits_at_1,user_attrs_head.pessimistic.hits_at_10,user_attrs_head.pessimistic.hits_at_3,user_attrs_head.pessimistic.hits_at_5,user_attrs_head.pessimistic.inverse_arithmetic_mean_rank,user_attrs_head.pessimistic.inverse_geometric_mean_rank,user_attrs_head.pessimistic.inverse_harmonic_mean_rank,user_attrs_head.pessimistic.inverse_median_rank,user_attrs_head.pessimistic.median_absolute_deviation,user_attrs_head.pessimistic.median_rank,user_attrs_head.pessimistic.standard_deviation,user_attrs_head.pessimistic.variance,user_attrs_head.pessimistic.z_arithmetic_mean_rank,user_attrs_head.pessimistic.z_geometric_mean_rank,user_attrs_head.pessimistic.z_hits_at_k,user_attrs_head.pessimistic.z_inverse_harmonic_mean_rank,user_attrs_head.realistic.adjusted_arithmetic_mean_rank,user_attrs_head.realistic.adjusted_arithmetic_mean_rank_index,user_attrs_head.realistic.adjusted_geometric_mean_rank_index,user_attrs_head.realistic.adjusted_hits_at_k,user_attrs_head.realistic.adjusted_inverse_harmonic_mean_rank,user_attrs_head.realistic.arithmetic_mean_rank,user_attrs_head.realistic.count,user_attrs_head.realistic.geometric_mean_rank,user_attrs_head.realistic.harmonic_mean_rank,user_attrs_head.realistic.hits_at_1,user_attrs_head.realistic.hits_at_10,user_attrs_head.realistic.hits_at_3,user_attrs_head.realistic.hits_at_5,user_attrs_head.realistic.inverse_arithmetic_mean_rank,user_attrs_head.realistic.inverse_geometric_mean_rank,user_attrs_head.realistic.inverse_harmonic_mean_rank,user_attrs_head.realistic.inverse_median_rank,user_attrs_head.realistic.median_absolute_deviation,user_attrs_head.realistic.median_rank,user_attrs_head.realistic.standard_deviation,user_attrs_head.realistic.variance,user_attrs_head.realistic.z_arithmetic_mean_rank,user_attrs_head.realistic.z_geometric_mean_rank,user_attrs_head.realistic.z_hits_at_k,user_attrs_head.realistic.z_inverse_harmonic_mean_rank,user_attrs_random_seed,user_attrs_tail.optimistic.adjusted_arithmetic_mean_rank,user_attrs_tail.optimistic.adjusted_arithmetic_mean_rank_index,user_attrs_tail.optimistic.adjusted_geometric_mean_rank_index,user_attrs_tail.optimistic.adjusted_hits_at_k,user_attrs_tail.optimistic.adjusted_inverse_harmonic_mean_rank,user_attrs_tail.optimistic.arithmetic_mean_rank,user_attrs_tail.optimistic.count,user_attrs_tail.optimistic.geometric_mean_rank,user_attrs_tail.optimistic.harmonic_mean_rank,user_attrs_tail.optimistic.hits_at_1,user_attrs_tail.optimistic.hits_at_10,user_attrs_tail.optimistic.hits_at_3,user_attrs_tail.optimistic.hits_at_5,user_attrs_tail.optimistic.inverse_arithmetic_mean_rank,user_attrs_tail.optimistic.inverse_geometric_mean_rank,user_attrs_tail.optimistic.inverse_harmonic_mean_rank,user_attrs_tail.optimistic.inverse_median_rank,user_attrs_tail.optimistic.median_absolute_deviation,user_attrs_tail.optimistic.median_rank,user_attrs_tail.optimistic.standard_deviation,user_attrs_tail.optimistic.variance,user_attrs_tail.optimistic.z_arithmetic_mean_rank,user_attrs_tail.optimistic.z_geometric_mean_rank,user_attrs_tail.optimistic.z_hits_at_k,user_attrs_tail.optimistic.z_inverse_harmonic_mean_rank,user_attrs_tail.pessimistic.adjusted_arithmetic_mean_rank,user_attrs_tail.pessimistic.adjusted_arithmetic_mean_rank_index,user_attrs_tail.pessimistic.adjusted_geometric_mean_rank_index,user_attrs_tail.pessimistic.adjusted_hits_at_k,user_attrs_tail.pessimistic.adjusted_inverse_harmonic_mean_rank,user_attrs_tail.pessimistic.arithmetic_mean_rank,user_attrs_tail.pessimistic.count,user_attrs_tail.pessimistic.geometric_mean_rank,user_attrs_tail.pessimistic.harmonic_mean_rank,user_attrs_tail.pessimistic.hits_at_1,user_attrs_tail.pessimistic.hits_at_10,user_attrs_tail.pessimistic.hits_at_3,user_attrs_tail.pessimistic.hits_at_5,user_attrs_tail.pessimistic.inverse_arithmetic_mean_rank,user_attrs_tail.pessimistic.inverse_geometric_mean_rank,user_attrs_tail.pessimistic.inverse_harmonic_mean_rank,user_attrs_tail.pessimistic.inverse_median_rank,user_attrs_tail.pessimistic.median_absolute_deviation,user_attrs_tail.pessimistic.median_rank,user_attrs_tail.pessimistic.standard_deviation,user_attrs_tail.pessimistic.variance,user_attrs_tail.pessimistic.z_arithmetic_mean_rank,user_attrs_tail.pessimistic.z_geometric_mean_rank,user_attrs_tail.pessimistic.z_hits_at_k,user_attrs_tail.pessimistic.z_inverse_harmonic_mean_rank,user_attrs_tail.realistic.adjusted_arithmetic_mean_rank,user_attrs_tail.realistic.adjusted_arithmetic_mean_rank_index,user_attrs_tail.realistic.adjusted_geometric_mean_rank_index,user_attrs_tail.realistic.adjusted_hits_at_k,user_attrs_tail.realistic.adjusted_inverse_harmonic_mean_rank,user_attrs_tail.realistic.arithmetic_mean_rank,user_attrs_tail.realistic.count,user_attrs_tail.realistic.geometric_mean_rank,user_attrs_tail.realistic.harmonic_mean_rank,user_attrs_tail.realistic.hits_at_1,user_attrs_tail.realistic.hits_at_10,user_attrs_tail.realistic.hits_at_3,user_attrs_tail.realistic.hits_at_5,user_attrs_tail.realistic.inverse_arithmetic_mean_rank,user_attrs_tail.realistic.inverse_geometric_mean_rank,user_attrs_tail.realistic.inverse_harmonic_mean_rank,user_attrs_tail.realistic.inverse_median_rank,user_attrs_tail.realistic.median_absolute_deviation,user_attrs_tail.realistic.median_rank,user_attrs_tail.realistic.standard_deviation,user_attrs_tail.realistic.variance,user_attrs_tail.realistic.z_arithmetic_mean_rank,user_attrs_tail.realistic.z_geometric_mean_rank,user_attrs_tail.realistic.z_hits_at_k,user_attrs_tail.realistic.z_inverse_harmonic_mean_rank,state
4,0.012108521535992622,2025-07-14 14:17:59.562618,2025-07-14 14:27:48.529767,0 days 00:09:48.967149,5.0,400,xavier_uniform_norm,4,0.0001,2,0.0001,0.3520385067055777,0.6479908565482985,0.8901048818123066,0.02349999166757502,0.011856285616770117,7768.816578042296,163988.0,1785.435969984671,82.58549283167869,0.0033234139083347563,0.023721247896187524,0.009153108764055907,0.014055906529746079,0.00012871973355972773,0.0005600872934180808,0.01210866419406307,0.0003151591553734636,4483.38910876094,3173.0,10388.417287928272,107919213.74812701,454.4872233798219,360.5907399973897,632.1394726436321,786.9393605854793,0.3520425576585672,0.6479868054117346,0.8900959795670791,0.02349999166757502,0.011856000439091421,7768.905974827427,163988.0,1785.5805213247097,82.58743739616118,0.0033234139083347563,0.023721247896187524,0.009153108764055907,0.014055906529746079,0.00012871825238201744,0.000560041951655088,0.01210837908922068,0.0003151591553734636,4483.38910876094,3173.0,10388.372844219095,107918290.35050873,454.48438199743225,360.5871336053118,632.1394726436321,786.9204324365313,0.35204055665049944,0.6479888065104806,0.8901003972237314,0.02349999166757502,0.011856142922254526,7768.86181640625,163988.0,1785.5087890625,82.58646582305664,0.0033234139083347563,0.023721247896187524,0.009153108764055907,0.014055906529746079,0.00012871898070443422,0.0005600644508376718,0.012108521535992622,0.00031515915179625154,4483.38910876094,3173.0,10388.3955078125,107918760.0,454.4857855262069,360.58892324394185,632.1394726436321,786.9298894969372,0.641971760675422,0.358044508492842,0.5226057651880427,0.0024320787220301343,0.001465459284511564,14128.224613996146,81994.0,7731.495146392249,581.0130351566341,0.0004390565163304632,0.002658731126667805,0.0011708173768812352,0.0015366978071566211,7.078030165300094e-05,0.0001293410887629711,0.0017211317810286511,8.573755733699147e-05,12755.568186912946,11663.5,11499.871061963779,132247034.4417919,177.57180726137335,149.7604552212699,46.19664066085398,68.68385559656195,0.6419718742811218,0.3580443948819798,0.5226056545651777,0.0024320787220301343,0.001465458728334294,14128.227114179086,81994.0,7731.496937719959,581.0132228608011,0.0004390565163304632,0.002658731126667805,0.0011708173768812352,0.0015366978071566211,7.07802891274589e-05,0.00012934105879564676,0.001721131224993789,8.573755733699147e-05,12755.568186912946,11663.5,11499.873918915206,132247100.15094617,177.57175091618262,149.76042352064252,46.19664066085398,68.68382952937625,0.6419718048394214,0.3580444643268358,0.5226058876061772,0.0024320787220301343,0.0014654590023360503,14128.2255859375,81994.0,7731.4931640625,581.0131303879824,0.0004390565163304632,0.002658731126667805,0.0011708173768812352,0.0015366978071566211,7.078029739204794e-05,0.00012934111873619258,0.0017211314989253879,8.573755621910095e-05,12755.568186912946,11663.5,11499.8720703125,132247056.0,177.5717853572878,149.76049030200716,46.19664066085398,68.6838423714233,1507333250.0,0.06369164098403526,0.93635067301444,0.9747388664810679,0.044567878309882916,0.022247098625190656,1409.4085420884455,81994.0,412.31114325960897,44.451958589502325,0.00620777130033905,0.04478376466570725,0.01713540015123058,0.026575115252335538,0.0007095174820767096,0.0024253528344984764,0.022496196607097483,0.0021321961620469083,659.7579872349928,469.0,1645.3728814324438,2707251.918953303,464.3873463616786,279.3254073898357,848.8896653089141,1045.5609335923764,0.06369960774086822,0.9363427058975704,0.9747347718865127,0.044567878309882916,0.022246528826375504,1409.5848354757666,81994.0,412.3778129665084,44.453084240301415,0.00620777130033905,0.04478376466570725,0.01713540015123058,0.026575115252335538,0.0007094287444306093,0.002424960724259954,0.022495626953447572,0.0021321961620469083,659.7579872349928,469.0,1645.4634129209658,2707549.8432615125,464.38339503407474,279.32423402501814,848.8896653089141,1045.534154397877,0.06369562505474308,0.9363466887636825,0.9747368057992614,0.044567878309882916,0.022246812470512713,1409.4967041015625,81994.0,412.3446960449219,44.4525238875917,0.00620777130033905,0.04478376466570725,0.01713540015123058,0.026575115252335538,0.0007094730972312391,0.002425155369564891,0.02249591052532196,0.0021321962121874094,659.7579872349928,469.0,1645.418212890625,2707401.0,464.38537035451617,279.3248168718981,848.8896653089141,1045.5474850003932,COMPLETE
5,0.2650677561759949,2025-07-14 14:27:48.560713,2025-07-14 14:37:48.919722,0 days 00:10:00.359009,5.0,400,xavier_uniform,6,0.01,1,0.001,0.04822824363016097,0.9518148871978337,0.9974582802215282,0.39134805349545676,0.2648800132851387,1064.3051015927995,163988.0,42.27149843526161,3.7726201414299627,0.19831329121643046,0.3914859623874918,0.2881064468131814,0.3288289387028319,0.0009395801997974427,0.023656601658715512,0.26506776789379144,0.03571428571428571,40.030259899651256,28.0,2684.6649918829585,7207426.118641925,667.5830389928946,404.0807175995781,10527.091058422402,17580.928380440335,0.04822825882814285,0.951814871999163,0.9974582799356642,0.39134805349545676,0.2648800132124215,1064.3054369831939,163988.0,42.27150307701515,3.7726201424646577,0.19831329121643046,0.3914859623874918,0.2881064468131814,0.3288289387028319,0.0009395799037112226,0.023656599061028977,0.2650677678210928,0.03571428571428571,40.030259899651256,28.0,2684.665600857288,7207429.388426423,667.5830283328651,404.0807174837716,10527.091058422402,17580.928375613865,0.04822825252348998,0.9518148783041016,0.9974582799127869,0.39134805349545676,0.26488000156434854,1064.3052978515625,163988.0,42.27150344848633,3.7726203082054166,0.19831329121643046,0.3914859623874918,0.2881064468131814,0.3288289387028319,0.0009395800298079848,0.02365659922361374,0.2650677561759949,0.0357142873108387,40.030259899651256,28.0,2684.665283203125,7207428.0,667.583032755017,404.08071747450384,10527.091058422402,17580.92760249424,0.09610918344774974,0.9039318902726209,0.9734137877322376,0.07468548800751017,0.033498870793677506,2115.127509329951,81994.0,431.5133365882522,29.632842086016346,0.01114715710905676,0.07489572407737151,0.02880698587701539,0.04396663170475888,0.0004727847354776209,0.0023174254772899286,0.0337463412080847,0.001589825119236884,905.8699555069228,629.0,3493.1939510854,12202403.979899626,448.3040951320936,278.9461993726508,1418.62951261029,1570.0413027904062,0.09610921392732773,0.9039318597916579,0.9734137818799113,0.07468548800751017,0.033498870648243015,2115.12818011074,81994.0,431.51343135558943,29.632842213690445,0.01114715710905676,0.07489572407737151,0.02880698587701539,0.04396663170475888,0.0004727845855411202,0.0023174249683457666,0.03374634106268745,0.001589825119236884,905.8699555069228,629.0,3493.194685345412,12202409.10972543,448.30408001509124,278.94619769557966,1418.62951261029,1570.0412959741122,0.09610919145486259,0.9039318822651442,0.9734137877573478,0.07468548800751017,0.03349887269211031,2115.127685546875,81994.0,431.5133361816406,29.63284041941931,0.01114715710905676,0.07489572407737151,0.02880698587701539,0.04396663170475888,0.0004727846826426685,0.00231742556206882,0.03374634310603142,0.0015898251440376043,905.8699555069228,629.0,3493.1943359375,12202406.0,448.30409116079375,278.9461993798465,1418.62951261029,1570.0413917670746,1185669671.0,0.000609287421572687,0.9994358774182805,0.999807094415279,0.7080102236309767,0.4962608590836553,13.482693855647975,81994.0,4.140960263453814,2.0145482837254773,0.3854794253238042,0.708076200697612,0.5474059077493475,0.6136912457009049,0.07416915422885571,0.2414898806988162,0.49638919457949815,0.3333333333333333,2.965204437011204,3.0,63.18854468347347,3992.792179215323,495.67473848098973,286.50906777422523,13485.55472159671,23323.08477031416,0.000609287421572687,0.9994358774182805,0.999807094415279,0.7080102236309767,0.4962608590836553,13.482693855647975,81994.0,4.140960263453814,2.0145482837254773,0.3854794253238042,0.708076200697612,0.5474059077493475,0.6136912457009049,0.07416915422885571,0.2414898806988162,0.49638919457949815,0.3333333333333333,2.965204437011204,3.0,63.18854468347347,3992.792179215323,495.67473848098973,286.50906777422523,13485.55472159671,23323.08477031416,0.0006092874132817162,0.9994358774265719,0.9998070943888759,0.7080102236309767,0.49626087473229546,13.482693672180176,81994.0,4.140960693359375,2.014548220233143,0.3854794253238042,0.708076200697612,0.5474059077493475,0.6136912457009049,0.07416915893554688,0.24148985743522644,0.4963892102241516,0.3333333432674408,2.965204437011204,3.0,63.18854522705078,3992.79248046875,495.67473848510184,286.50906776665903,13485.55472159671,23323.085505763178,COMPLETE
