number,value,datetime_start,datetime_complete,duration,params_loss.margin,params_model.embedding_dim,params_model.entity_initializer,params_negative_sampler.num_negs_per_pos,params_optimizer.lr,params_regularizer.p,params_regularizer.weight,user_attrs_both.optimistic.adjusted_arithmetic_mean_rank,user_attrs_both.optimistic.adjusted_arithmetic_mean_rank_index,user_attrs_both.optimistic.adjusted_geometric_mean_rank_index,user_attrs_both.optimistic.adjusted_hits_at_k,user_attrs_both.optimistic.adjusted_inverse_harmonic_mean_rank,user_attrs_both.optimistic.arithmetic_mean_rank,user_attrs_both.optimistic.count,user_attrs_both.optimistic.geometric_mean_rank,user_attrs_both.optimistic.harmonic_mean_rank,user_attrs_both.optimistic.hits_at_1,user_attrs_both.optimistic.hits_at_10,user_attrs_both.optimistic.hits_at_3,user_attrs_both.optimistic.hits_at_5,user_attrs_both.optimistic.inverse_arithmetic_mean_rank,user_attrs_both.optimistic.inverse_geometric_mean_rank,user_attrs_both.optimistic.inverse_harmonic_mean_rank,user_attrs_both.optimistic.inverse_median_rank,user_attrs_both.optimistic.median_absolute_deviation,user_attrs_both.optimistic.median_rank,user_attrs_both.optimistic.standard_deviation,user_attrs_both.optimistic.variance,user_attrs_both.optimistic.z_arithmetic_mean_rank,user_attrs_both.optimistic.z_geometric_mean_rank,user_attrs_both.optimistic.z_hits_at_k,user_attrs_both.optimistic.z_inverse_harmonic_mean_rank,user_attrs_both.pessimistic.adjusted_arithmetic_mean_rank,user_attrs_both.pessimistic.adjusted_arithmetic_mean_rank_index,user_attrs_both.pessimistic.adjusted_geometric_mean_rank_index,user_attrs_both.pessimistic.adjusted_hits_at_k,user_attrs_both.pessimistic.adjusted_inverse_harmonic_mean_rank,user_attrs_both.pessimistic.arithmetic_mean_rank,user_attrs_both.pessimistic.count,user_attrs_both.pessimistic.geometric_mean_rank,user_attrs_both.pessimistic.harmonic_mean_rank,user_attrs_both.pessimistic.hits_at_1,user_attrs_both.pessimistic.hits_at_10,user_attrs_both.pessimistic.hits_at_3,user_attrs_both.pessimistic.hits_at_5,user_attrs_both.pessimistic.inverse_arithmetic_mean_rank,user_attrs_both.pessimistic.inverse_geometric_mean_rank,user_attrs_both.pessimistic.inverse_harmonic_mean_rank,user_attrs_both.pessimistic.inverse_median_rank,user_attrs_both.pessimistic.median_absolute_deviation,user_attrs_both.pessimistic.median_rank,user_attrs_both.pessimistic.standard_deviation,user_attrs_both.pessimistic.variance,user_attrs_both.pessimistic.z_arithmetic_mean_rank,user_attrs_both.pessimistic.z_geometric_mean_rank,user_attrs_both.pessimistic.z_hits_at_k,user_attrs_both.pessimistic.z_inverse_harmonic_mean_rank,user_attrs_both.realistic.adjusted_arithmetic_mean_rank,user_attrs_both.realistic.adjusted_arithmetic_mean_rank_index,user_attrs_both.realistic.adjusted_geometric_mean_rank_index,user_attrs_both.realistic.adjusted_hits_at_k,user_attrs_both.realistic.adjusted_inverse_harmonic_mean_rank,user_attrs_both.realistic.arithmetic_mean_rank,user_attrs_both.realistic.count,user_attrs_both.realistic.geometric_mean_rank,user_attrs_both.realistic.harmonic_mean_rank,user_attrs_both.realistic.hits_at_1,user_attrs_both.realistic.hits_at_10,user_attrs_both.realistic.hits_at_3,user_attrs_both.realistic.hits_at_5,user_attrs_both.realistic.inverse_arithmetic_mean_rank,user_attrs_both.realistic.inverse_geometric_mean_rank,user_attrs_both.realistic.inverse_harmonic_mean_rank,user_attrs_both.realistic.inverse_median_rank,user_attrs_both.realistic.median_absolute_deviation,user_attrs_both.realistic.median_rank,user_attrs_both.realistic.standard_deviation,user_attrs_both.realistic.variance,user_attrs_both.realistic.z_arithmetic_mean_rank,user_attrs_both.realistic.z_geometric_mean_rank,user_attrs_both.realistic.z_hits_at_k,user_attrs_both.realistic.z_inverse_harmonic_mean_rank,user_attrs_head.optimistic.adjusted_arithmetic_mean_rank,user_attrs_head.optimistic.adjusted_arithmetic_mean_rank_index,user_attrs_head.optimistic.adjusted_geometric_mean_rank_index,user_attrs_head.optimistic.adjusted_hits_at_k,user_attrs_head.optimistic.adjusted_inverse_harmonic_mean_rank,user_attrs_head.optimistic.arithmetic_mean_rank,user_attrs_head.optimistic.count,user_attrs_head.optimistic.geometric_mean_rank,user_attrs_head.optimistic.harmonic_mean_rank,user_attrs_head.optimistic.hits_at_1,user_attrs_head.optimistic.hits_at_10,user_attrs_head.optimistic.hits_at_3,user_attrs_head.optimistic.hits_at_5,user_attrs_head.optimistic.inverse_arithmetic_mean_rank,user_attrs_head.optimistic.inverse_geometric_mean_rank,user_attrs_head.optimistic.inverse_harmonic_mean_rank,user_attrs_head.optimistic.inverse_median_rank,user_attrs_head.optimistic.median_absolute_deviation,user_attrs_head.optimistic.median_rank,user_attrs_head.optimistic.standard_deviation,user_attrs_head.optimistic.variance,user_attrs_head.optimistic.z_arithmetic_mean_rank,user_attrs_head.optimistic.z_geometric_mean_rank,user_attrs_head.optimistic.z_hits_at_k,user_attrs_head.optimistic.z_inverse_harmonic_mean_rank,user_attrs_head.pessimistic.adjusted_arithmetic_mean_rank,user_attrs_head.pessimistic.adjusted_arithmetic_mean_rank_index,user_attrs_head.pessimistic.adjusted_geometric_mean_rank_index,user_attrs_head.pessimistic.adjusted_hits_at_k,user_attrs_head.pessimistic.adjusted_inverse_harmonic_mean_rank,user_attrs_head.pessimistic.arithmetic_mean_rank,user_attrs_head.pessimistic.count,user_attrs_head.pessimistic.geometric_mean_rank,user_attrs_head.pessimistic.harmonic_mean_rank,user_attrs_head.pessimistic.hits_at_1,user_attrs_head.pessimistic.hits_at_10,user_attrs_head.pessimistic.hits_at_3,user_attrs_head.pessimistic.hits_at_5,user_attrs_head.pessimistic.inverse_arithmetic_mean_rank,user_attrs_head.pessimistic.inverse_geometric_mean_rank,user_attrs_head.pessimistic.inverse_harmonic_mean_rank,user_attrs_head.pessimistic.inverse_median_rank,user_attrs_head.pessimistic.median_absolute_deviation,user_attrs_head.pessimistic.median_rank,user_attrs_head.pessimistic.standard_deviation,user_attrs_head.pessimistic.variance,user_attrs_head.pessimistic.z_arithmetic_mean_rank,user_attrs_head.pessimistic.z_geometric_mean_rank,user_attrs_head.pessimistic.z_hits_at_k,user_attrs_head.pessimistic.z_inverse_harmonic_mean_rank,user_attrs_head.realistic.adjusted_arithmetic_mean_rank,user_attrs_head.realistic.adjusted_arithmetic_mean_rank_index,user_attrs_head.realistic.adjusted_geometric_mean_rank_index,user_attrs_head.realistic.adjusted_hits_at_k,user_attrs_head.realistic.adjusted_inverse_harmonic_mean_rank,user_attrs_head.realistic.arithmetic_mean_rank,user_attrs_head.realistic.count,user_attrs_head.realistic.geometric_mean_rank,user_attrs_head.realistic.harmonic_mean_rank,user_attrs_head.realistic.hits_at_1,user_attrs_head.realistic.hits_at_10,user_attrs_head.realistic.hits_at_3,user_attrs_head.realistic.hits_at_5,user_attrs_head.realistic.inverse_arithmetic_mean_rank,user_attrs_head.realistic.inverse_geometric_mean_rank,user_attrs_head.realistic.inverse_harmonic_mean_rank,user_attrs_head.realistic.inverse_median_rank,user_attrs_head.realistic.median_absolute_deviation,user_attrs_head.realistic.median_rank,user_attrs_head.realistic.standard_deviation,user_attrs_head.realistic.variance,user_attrs_head.realistic.z_arithmetic_mean_rank,user_attrs_head.realistic.z_geometric_mean_rank,user_attrs_head.realistic.z_hits_at_k,user_attrs_head.realistic.z_inverse_harmonic_mean_rank,user_attrs_random_seed,user_attrs_tail.optimistic.adjusted_arithmetic_mean_rank,user_attrs_tail.optimistic.adjusted_arithmetic_mean_rank_index,user_attrs_tail.optimistic.adjusted_geometric_mean_rank_index,user_attrs_tail.optimistic.adjusted_hits_at_k,user_attrs_tail.optimistic.adjusted_inverse_harmonic_mean_rank,user_attrs_tail.optimistic.arithmetic_mean_rank,user_attrs_tail.optimistic.count,user_attrs_tail.optimistic.geometric_mean_rank,user_attrs_tail.optimistic.harmonic_mean_rank,user_attrs_tail.optimistic.hits_at_1,user_attrs_tail.optimistic.hits_at_10,user_attrs_tail.optimistic.hits_at_3,user_attrs_tail.optimistic.hits_at_5,user_attrs_tail.optimistic.inverse_arithmetic_mean_rank,user_attrs_tail.optimistic.inverse_geometric_mean_rank,user_attrs_tail.optimistic.inverse_harmonic_mean_rank,user_attrs_tail.optimistic.inverse_median_rank,user_attrs_tail.optimistic.median_absolute_deviation,user_attrs_tail.optimistic.median_rank,user_attrs_tail.optimistic.standard_deviation,user_attrs_tail.optimistic.variance,user_attrs_tail.optimistic.z_arithmetic_mean_rank,user_attrs_tail.optimistic.z_geometric_mean_rank,user_attrs_tail.optimistic.z_hits_at_k,user_attrs_tail.optimistic.z_inverse_harmonic_mean_rank,user_attrs_tail.pessimistic.adjusted_arithmetic_mean_rank,user_attrs_tail.pessimistic.adjusted_arithmetic_mean_rank_index,user_attrs_tail.pessimistic.adjusted_geometric_mean_rank_index,user_attrs_tail.pessimistic.adjusted_hits_at_k,user_attrs_tail.pessimistic.adjusted_inverse_harmonic_mean_rank,user_attrs_tail.pessimistic.arithmetic_mean_rank,user_attrs_tail.pessimistic.count,user_attrs_tail.pessimistic.geometric_mean_rank,user_attrs_tail.pessimistic.harmonic_mean_rank,user_attrs_tail.pessimistic.hits_at_1,user_attrs_tail.pessimistic.hits_at_10,user_attrs_tail.pessimistic.hits_at_3,user_attrs_tail.pessimistic.hits_at_5,user_attrs_tail.pessimistic.inverse_arithmetic_mean_rank,user_attrs_tail.pessimistic.inverse_geometric_mean_rank,user_attrs_tail.pessimistic.inverse_harmonic_mean_rank,user_attrs_tail.pessimistic.inverse_median_rank,user_attrs_tail.pessimistic.median_absolute_deviation,user_attrs_tail.pessimistic.median_rank,user_attrs_tail.pessimistic.standard_deviation,user_attrs_tail.pessimistic.variance,user_attrs_tail.pessimistic.z_arithmetic_mean_rank,user_attrs_tail.pessimistic.z_geometric_mean_rank,user_attrs_tail.pessimistic.z_hits_at_k,user_attrs_tail.pessimistic.z_inverse_harmonic_mean_rank,user_attrs_tail.realistic.adjusted_arithmetic_mean_rank,user_attrs_tail.realistic.adjusted_arithmetic_mean_rank_index,user_attrs_tail.realistic.adjusted_geometric_mean_rank_index,user_attrs_tail.realistic.adjusted_hits_at_k,user_attrs_tail.realistic.adjusted_inverse_harmonic_mean_rank,user_attrs_tail.realistic.arithmetic_mean_rank,user_attrs_tail.realistic.count,user_attrs_tail.realistic.geometric_mean_rank,user_attrs_tail.realistic.harmonic_mean_rank,user_attrs_tail.realistic.hits_at_1,user_attrs_tail.realistic.hits_at_10,user_attrs_tail.realistic.hits_at_3,user_attrs_tail.realistic.hits_at_5,user_attrs_tail.realistic.inverse_arithmetic_mean_rank,user_attrs_tail.realistic.inverse_geometric_mean_rank,user_attrs_tail.realistic.inverse_harmonic_mean_rank,user_attrs_tail.realistic.inverse_median_rank,user_attrs_tail.realistic.median_absolute_deviation,user_attrs_tail.realistic.median_rank,user_attrs_tail.realistic.standard_deviation,user_attrs_tail.realistic.variance,user_attrs_tail.realistic.z_arithmetic_mean_rank,user_attrs_tail.realistic.z_geometric_mean_rank,user_attrs_tail.realistic.z_hits_at_k,user_attrs_tail.realistic.z_inverse_harmonic_mean_rank,state
17,0.011015946045517921,2025-07-14 16:06:16.026079,2025-07-14 16:16:08.702114,0 days 00:09:52.676035,5.0,300,xavier_uniform_norm,10,1e-05,2,1e-05,0.3226796686952801,0.6773510249941589,0.9473714795000461,0.014320410957383144,0.010763684598860726,7120.923171207649,163988.0,855.5623006364812,90.77423148029634,0.0013171695489913897,0.014543747103446594,0.004042978754543016,0.00706149230431495,0.00014043123004659638,0.0011688219540015577,0.01101634223383166,0.003745318352059925,373.6157590634117,267.0,10715.507426715725,114822099.41199985,475.0798309761737,383.7900339899252,385.2127761870991,714.4199582869635,0.32267991462625967,0.6773507790520346,0.9473698411879662,0.014320410957383144,0.010762913241237442,7120.928598434032,163988.0,855.5889029374174,90.78058625859683,0.0013171695489913897,0.014543747103446594,0.004042978754543016,0.00706149230431495,0.00014043112301672433,0.0011687856125375035,0.011015571073218324,0.003745318352059925,373.6157590634117,267.0,10715.509879068666,114822151.96841818,475.07965847751564,383.78937029267183,385.2127761870991,714.3687608298112,0.32267980909365385,0.6773508845894227,0.9473706665825203,0.014320410957383144,0.010763288309331964,7120.92626953125,163988.0,855.5755004882812,90.77749617400059,0.0013171695489913897,0.014543747103446594,0.004042978754543016,0.00706149230431495,0.00014043116243556142,0.0011688038939610124,0.011015946045517921,0.00374531839042902,373.6157590634117,267.0,10715.5087890625,114822128.0,475.07973249923066,383.78970466858544,385.2127761870991,714.3936552913668,0.641833663249273,0.3581826121942787,0.4994682285536477,0.0033713852415273426,0.002039215813841401,14125.185428202063,81994.0,8106.163715069283,435.77895070499284,0.001109837305168671,0.003597824231041296,0.0025367709832426763,0.003378295972876064,7.079553079731046e-05,0.0001233629168062581,0.002294741401305005,8.617718028266115e-05,12702.935808155997,11604.0,11468.22355368893,131520151.47738552,177.64029965064879,143.13004995235937,64.03849970865183,95.57495453365026,0.6418339203860766,0.35818235504579077,0.49946803579550225,0.0033713852415273426,0.002039215707934388,14125.191087152718,81994.0,8106.166836422242,435.77897081193476,0.001109837305168671,0.003597824231041296,0.0025367709832426763,0.003378295972876064,7.07955024346205e-05,0.00012336286930424967,0.002294741295425109,8.617718028266115e-05,12702.935808155997,11604.0,11468.227851416468,131520250.05200438,177.64017211811955,143.12999471464573,64.03849970865183,95.57494956994906,0.641833757389606,0.35818251804966794,0.4994679658689667,0.0033713852415273426,0.002039215750639124,14125.1875,81994.0,8106.16796875,435.7789627042406,0.001109837305168671,0.003597824231041296,0.0025367709832426763,0.003378295972876064,7.079551869537681e-05,0.00012336285726632923,0.002294741338118911,8.617717685410753e-05,12702.935808155997,11604.0,11468.2255859375,131520208.0,177.6402529597255,143.1299746761569,64.03849970865183,95.57495157145532,590581836.0,0.005271945531086775,0.9947730085921727,0.994515538682498,0.025269423003407527,0.019488142196761236,116.66091421323512,81994.0,90.30003291318077,50.66384053485374,0.0015245017928141084,0.025489669975851892,0.005549186525843354,0.010744688635753835,0.008571851221499775,0.011074193084308761,0.01973794306635832,0.009009009009009009,78.5779175807969,111.0,68.32142490628647,4667.817101225341,493.3621676215939,284.99269655767455,481.3096976877009,915.8965172274027,0.005272180317555875,0.994772773795093,0.9945151959329058,0.025269423003407527,0.019486599588410636,116.66610971534503,81994.0,90.30561368913848,50.66779944068411,0.0015245017928141084,0.025489669975851892,0.005549186525843354,0.010744688635753835,0.008571469490496524,0.01107350871278421,0.019736400851011544,0.009009009009009009,78.5779175807969,111.0,68.32176145700511,4667.863088587908,493.36205117292155,284.99259833786124,481.3096976877009,915.8240182892539,0.005272062979422064,0.9947728911385296,0.9945153680835235,0.025269423003407527,0.019487345722284465,116.66351318359375,81994.0,90.30281066894531,50.665884506856166,0.0015245017928141084,0.025489669975851892,0.005549186525843354,0.010744688635753835,0.00857166014611721,0.011073852889239788,0.01973714679479599,0.009009009227156639,78.5779175807969,111.0,68.32158660888672,4667.8388671875,493.36210936992904,284.9926476700907,481.3096976877009,915.8590848137857,COMPLETE
18,0.4708136916160584,2025-07-14 16:16:08.737044,2025-07-14 16:25:47.552009,0 days 00:09:38.814965,3.0,300,xavier_uniform_norm,10,0.01,1,1e-05,0.008948953617247861,0.9910959572050468,0.9995182385822157,0.5459248733880766,0.47067851632252916,197.486291679879,163988.0,8.822662344078259,2.1239823346807003,0.4148657218820889,0.5460277581286436,0.4978108154255189,0.515220625899456,0.005063642602702664,0.11334447143057635,0.47081370860381033,0.25,4.447806655516806,4.0,1681.00758770705,2825786.509928676,695.1339592852954,404.9152281441464,14685.139741676832,31240.429140157314,0.008948961078075333,0.9910959497438813,0.9995182384231823,0.5459248733880766,0.47067851220390333,197.48645632607264,163988.0,8.822664926401037,2.1239823532563156,0.4148657218820889,0.5460277581286436,0.4978108154255189,0.515220625899456,0.00506363838109934,0.11334443825556485,0.47081370448623644,0.25,4.447806655516806,4.0,1681.0083918579462,2825789.213496838,695.13395405219,404.9152280797204,14685.139741676832,31240.42886679103,0.008948957343057272,0.9910959534790686,0.9995182386403668,0.5459248733880766,0.47067849933043737,197.4863739013672,163988.0,8.822661399841309,2.1239824113175647,0.4148657218820889,0.5460277581286436,0.4978108154255189,0.515220625899456,0.005063640419393778,0.11334448307752609,0.4708136916160584,0.25,4.447806655516806,4.0,1681.0079345703125,2825787.75,695.1339566719722,404.9152281677041,14685.139741676832,31240.428012338172,0.016887766578365337,0.9831569070439672,0.9962505255194459,0.11085488840113644,0.05229352171373541,371.65834085420886,81994.0,61.71563533829004,19.034501629094862,0.012866795131351074,0.11105690660292217,0.03538063760762983,0.057528599653633196,0.0026906432335182594,0.016203349354155853,0.05253617980055055,0.015873015873015872,69.68230426976329,63.0,2318.3075194045978,5374549.7545279,487.5956610539372,285.49040625783607,2105.65694217809,2450.91810600456,0.016887777661848243,0.9831568959599807,0.9962505233619283,0.11085488840113644,0.052293513482506,371.6585847744957,81994.0,61.71567027520086,19.034504610606987,0.012866795131351074,0.11105690660292217,0.03538063760762983,0.057528599653633196,0.0026906414676436206,0.016203340181526457,0.05253617157142874,0.015873015873015872,69.68230426976329,63.0,2318.3084418059875,5374554.0313489055,487.59565555684543,285.4904056395673,2105.65694217809,2450.9177202193127,0.016887772800275726,0.9831569008217741,0.9962505244617409,0.11085488840113644,0.05229352029307203,371.6584777832031,81994.0,61.71565246582031,19.03450214368683,0.012866795131351074,0.11105690660292217,0.03538063760762983,0.057528599653633196,0.0026906421408057213,0.016203345730900764,0.05253617838025093,0.01587301678955555,69.68230426976329,63.0,2318.307861328125,5374551.5,487.5956579680469,285.4904059547349,2105.65694217809,2450.9180394202203,394825057.0,0.0010535783764144301,0.9989915663848754,0.9999839545160778,0.9809943151912208,0.8890629744490728,23.314242505549185,81994.0,1.2612585191895909,1.1247439609419412,0.8168646486328268,0.9809986096543649,0.9602409932434081,0.9729126521452789,0.04289223635560894,0.7928588665886991,0.8890912374070703,1.0,0.0,1.0,465.1359585135089,216351.4599022807,495.4543804167423,286.55974957363367,18685.115097973136,41783.8536722638,0.001053582234408054,0.9989915625267074,0.9999839545145837,0.9809943151912208,0.8890629744430454,23.314327877649585,81994.0,1.2612585435181627,1.1247439609495642,0.8168646486328268,0.9809986096543649,0.9602409932434081,0.9729126521452789,0.04289207929337975,0.7928588512951464,0.8890912374010445,1.0,0.0,1.0,465.13711418060666,216352.53498826272,495.45437850326647,286.5597495732055,18685.115097973136,41783.85367198053,0.0010535803093301896,0.9989915644518723,0.9999839545109832,0.9809943151912208,0.8890629903266872,23.314285278320312,81994.0,1.261258602142334,1.1247439408610989,0.8168646486328268,0.9809986096543649,0.9602409932434081,0.9729126521452789,0.04289215803146362,0.7928588390350342,0.8890912532806396,1.0,0.0,1.0,465.13653564453125,216351.984375,495.45437945806066,286.55974957217376,18685.115097973136,41783.85441847406,COMPLETE
