number,value,datetime_start,datetime_complete,duration,params_loss.margin,params_model.embedding_dim,params_model.entity_initializer,params_negative_sampler.num_negs_per_pos,params_optimizer.lr,params_regularizer.p,params_regularizer.weight,user_attrs_both.optimistic.adjusted_arithmetic_mean_rank,user_attrs_both.optimistic.adjusted_arithmetic_mean_rank_index,user_attrs_both.optimistic.adjusted_geometric_mean_rank_index,user_attrs_both.optimistic.adjusted_hits_at_k,user_attrs_both.optimistic.adjusted_inverse_harmonic_mean_rank,user_attrs_both.optimistic.arithmetic_mean_rank,user_attrs_both.optimistic.count,user_attrs_both.optimistic.geometric_mean_rank,user_attrs_both.optimistic.harmonic_mean_rank,user_attrs_both.optimistic.hits_at_1,user_attrs_both.optimistic.hits_at_10,user_attrs_both.optimistic.hits_at_3,user_attrs_both.optimistic.hits_at_5,user_attrs_both.optimistic.inverse_arithmetic_mean_rank,user_attrs_both.optimistic.inverse_geometric_mean_rank,user_attrs_both.optimistic.inverse_harmonic_mean_rank,user_attrs_both.optimistic.inverse_median_rank,user_attrs_both.optimistic.median_absolute_deviation,user_attrs_both.optimistic.median_rank,user_attrs_both.optimistic.standard_deviation,user_attrs_both.optimistic.variance,user_attrs_both.optimistic.z_arithmetic_mean_rank,user_attrs_both.optimistic.z_geometric_mean_rank,user_attrs_both.optimistic.z_hits_at_k,user_attrs_both.optimistic.z_inverse_harmonic_mean_rank,user_attrs_both.pessimistic.adjusted_arithmetic_mean_rank,user_attrs_both.pessimistic.adjusted_arithmetic_mean_rank_index,user_attrs_both.pessimistic.adjusted_geometric_mean_rank_index,user_attrs_both.pessimistic.adjusted_hits_at_k,user_attrs_both.pessimistic.adjusted_inverse_harmonic_mean_rank,user_attrs_both.pessimistic.arithmetic_mean_rank,user_attrs_both.pessimistic.count,user_attrs_both.pessimistic.geometric_mean_rank,user_attrs_both.pessimistic.harmonic_mean_rank,user_attrs_both.pessimistic.hits_at_1,user_attrs_both.pessimistic.hits_at_10,user_attrs_both.pessimistic.hits_at_3,user_attrs_both.pessimistic.hits_at_5,user_attrs_both.pessimistic.inverse_arithmetic_mean_rank,user_attrs_both.pessimistic.inverse_geometric_mean_rank,user_attrs_both.pessimistic.inverse_harmonic_mean_rank,user_attrs_both.pessimistic.inverse_median_rank,user_attrs_both.pessimistic.median_absolute_deviation,user_attrs_both.pessimistic.median_rank,user_attrs_both.pessimistic.standard_deviation,user_attrs_both.pessimistic.variance,user_attrs_both.pessimistic.z_arithmetic_mean_rank,user_attrs_both.pessimistic.z_geometric_mean_rank,user_attrs_both.pessimistic.z_hits_at_k,user_attrs_both.pessimistic.z_inverse_harmonic_mean_rank,user_attrs_both.realistic.adjusted_arithmetic_mean_rank,user_attrs_both.realistic.adjusted_arithmetic_mean_rank_index,user_attrs_both.realistic.adjusted_geometric_mean_rank_index,user_attrs_both.realistic.adjusted_hits_at_k,user_attrs_both.realistic.adjusted_inverse_harmonic_mean_rank,user_attrs_both.realistic.arithmetic_mean_rank,user_attrs_both.realistic.count,user_attrs_both.realistic.geometric_mean_rank,user_attrs_both.realistic.harmonic_mean_rank,user_attrs_both.realistic.hits_at_1,user_attrs_both.realistic.hits_at_10,user_attrs_both.realistic.hits_at_3,user_attrs_both.realistic.hits_at_5,user_attrs_both.realistic.inverse_arithmetic_mean_rank,user_attrs_both.realistic.inverse_geometric_mean_rank,user_attrs_both.realistic.inverse_harmonic_mean_rank,user_attrs_both.realistic.inverse_median_rank,user_attrs_both.realistic.median_absolute_deviation,user_attrs_both.realistic.median_rank,user_attrs_both.realistic.standard_deviation,user_attrs_both.realistic.variance,user_attrs_both.realistic.z_arithmetic_mean_rank,user_attrs_both.realistic.z_geometric_mean_rank,user_attrs_both.realistic.z_hits_at_k,user_attrs_both.realistic.z_inverse_harmonic_mean_rank,user_attrs_head.optimistic.adjusted_arithmetic_mean_rank,user_attrs_head.optimistic.adjusted_arithmetic_mean_rank_index,user_attrs_head.optimistic.adjusted_geometric_mean_rank_index,user_attrs_head.optimistic.adjusted_hits_at_k,user_attrs_head.optimistic.adjusted_inverse_harmonic_mean_rank,user_attrs_head.optimistic.arithmetic_mean_rank,user_attrs_head.optimistic.count,user_attrs_head.optimistic.geometric_mean_rank,user_attrs_head.optimistic.harmonic_mean_rank,user_attrs_head.optimistic.hits_at_1,user_attrs_head.optimistic.hits_at_10,user_attrs_head.optimistic.hits_at_3,user_attrs_head.optimistic.hits_at_5,user_attrs_head.optimistic.inverse_arithmetic_mean_rank,user_attrs_head.optimistic.inverse_geometric_mean_rank,user_attrs_head.optimistic.inverse_harmonic_mean_rank,user_attrs_head.optimistic.inverse_median_rank,user_attrs_head.optimistic.median_absolute_deviation,user_attrs_head.optimistic.median_rank,user_attrs_head.optimistic.standard_deviation,user_attrs_head.optimistic.variance,user_attrs_head.optimistic.z_arithmetic_mean_rank,user_attrs_head.optimistic.z_geometric_mean_rank,user_attrs_head.optimistic.z_hits_at_k,user_attrs_head.optimistic.z_inverse_harmonic_mean_rank,user_attrs_head.pessimistic.adjusted_arithmetic_mean_rank,user_attrs_head.pessimistic.adjusted_arithmetic_mean_rank_index,user_attrs_head.pessimistic.adjusted_geometric_mean_rank_index,user_attrs_head.pessimistic.adjusted_hits_at_k,user_attrs_head.pessimistic.adjusted_inverse_harmonic_mean_rank,user_attrs_head.pessimistic.arithmetic_mean_rank,user_attrs_head.pessimistic.count,user_attrs_head.pessimistic.geometric_mean_rank,user_attrs_head.pessimistic.harmonic_mean_rank,user_attrs_head.pessimistic.hits_at_1,user_attrs_head.pessimistic.hits_at_10,user_attrs_head.pessimistic.hits_at_3,user_attrs_head.pessimistic.hits_at_5,user_attrs_head.pessimistic.inverse_arithmetic_mean_rank,user_attrs_head.pessimistic.inverse_geometric_mean_rank,user_attrs_head.pessimistic.inverse_harmonic_mean_rank,user_attrs_head.pessimistic.inverse_median_rank,user_attrs_head.pessimistic.median_absolute_deviation,user_attrs_head.pessimistic.median_rank,user_attrs_head.pessimistic.standard_deviation,user_attrs_head.pessimistic.variance,user_attrs_head.pessimistic.z_arithmetic_mean_rank,user_attrs_head.pessimistic.z_geometric_mean_rank,user_attrs_head.pessimistic.z_hits_at_k,user_attrs_head.pessimistic.z_inverse_harmonic_mean_rank,user_attrs_head.realistic.adjusted_arithmetic_mean_rank,user_attrs_head.realistic.adjusted_arithmetic_mean_rank_index,user_attrs_head.realistic.adjusted_geometric_mean_rank_index,user_attrs_head.realistic.adjusted_hits_at_k,user_attrs_head.realistic.adjusted_inverse_harmonic_mean_rank,user_attrs_head.realistic.arithmetic_mean_rank,user_attrs_head.realistic.count,user_attrs_head.realistic.geometric_mean_rank,user_attrs_head.realistic.harmonic_mean_rank,user_attrs_head.realistic.hits_at_1,user_attrs_head.realistic.hits_at_10,user_attrs_head.realistic.hits_at_3,user_attrs_head.realistic.hits_at_5,user_attrs_head.realistic.inverse_arithmetic_mean_rank,user_attrs_head.realistic.inverse_geometric_mean_rank,user_attrs_head.realistic.inverse_harmonic_mean_rank,user_attrs_head.realistic.inverse_median_rank,user_attrs_head.realistic.median_absolute_deviation,user_attrs_head.realistic.median_rank,user_attrs_head.realistic.standard_deviation,user_attrs_head.realistic.variance,user_attrs_head.realistic.z_arithmetic_mean_rank,user_attrs_head.realistic.z_geometric_mean_rank,user_attrs_head.realistic.z_hits_at_k,user_attrs_head.realistic.z_inverse_harmonic_mean_rank,user_attrs_random_seed,user_attrs_tail.optimistic.adjusted_arithmetic_mean_rank,user_attrs_tail.optimistic.adjusted_arithmetic_mean_rank_index,user_attrs_tail.optimistic.adjusted_geometric_mean_rank_index,user_attrs_tail.optimistic.adjusted_hits_at_k,user_attrs_tail.optimistic.adjusted_inverse_harmonic_mean_rank,user_attrs_tail.optimistic.arithmetic_mean_rank,user_attrs_tail.optimistic.count,user_attrs_tail.optimistic.geometric_mean_rank,user_attrs_tail.optimistic.harmonic_mean_rank,user_attrs_tail.optimistic.hits_at_1,user_attrs_tail.optimistic.hits_at_10,user_attrs_tail.optimistic.hits_at_3,user_attrs_tail.optimistic.hits_at_5,user_attrs_tail.optimistic.inverse_arithmetic_mean_rank,user_attrs_tail.optimistic.inverse_geometric_mean_rank,user_attrs_tail.optimistic.inverse_harmonic_mean_rank,user_attrs_tail.optimistic.inverse_median_rank,user_attrs_tail.optimistic.median_absolute_deviation,user_attrs_tail.optimistic.median_rank,user_attrs_tail.optimistic.standard_deviation,user_attrs_tail.optimistic.variance,user_attrs_tail.optimistic.z_arithmetic_mean_rank,user_attrs_tail.optimistic.z_geometric_mean_rank,user_attrs_tail.optimistic.z_hits_at_k,user_attrs_tail.optimistic.z_inverse_harmonic_mean_rank,user_attrs_tail.pessimistic.adjusted_arithmetic_mean_rank,user_attrs_tail.pessimistic.adjusted_arithmetic_mean_rank_index,user_attrs_tail.pessimistic.adjusted_geometric_mean_rank_index,user_attrs_tail.pessimistic.adjusted_hits_at_k,user_attrs_tail.pessimistic.adjusted_inverse_harmonic_mean_rank,user_attrs_tail.pessimistic.arithmetic_mean_rank,user_attrs_tail.pessimistic.count,user_attrs_tail.pessimistic.geometric_mean_rank,user_attrs_tail.pessimistic.harmonic_mean_rank,user_attrs_tail.pessimistic.hits_at_1,user_attrs_tail.pessimistic.hits_at_10,user_attrs_tail.pessimistic.hits_at_3,user_attrs_tail.pessimistic.hits_at_5,user_attrs_tail.pessimistic.inverse_arithmetic_mean_rank,user_attrs_tail.pessimistic.inverse_geometric_mean_rank,user_attrs_tail.pessimistic.inverse_harmonic_mean_rank,user_attrs_tail.pessimistic.inverse_median_rank,user_attrs_tail.pessimistic.median_absolute_deviation,user_attrs_tail.pessimistic.median_rank,user_attrs_tail.pessimistic.standard_deviation,user_attrs_tail.pessimistic.variance,user_attrs_tail.pessimistic.z_arithmetic_mean_rank,user_attrs_tail.pessimistic.z_geometric_mean_rank,user_attrs_tail.pessimistic.z_hits_at_k,user_attrs_tail.pessimistic.z_inverse_harmonic_mean_rank,user_attrs_tail.realistic.adjusted_arithmetic_mean_rank,user_attrs_tail.realistic.adjusted_arithmetic_mean_rank_index,user_attrs_tail.realistic.adjusted_geometric_mean_rank_index,user_attrs_tail.realistic.adjusted_hits_at_k,user_attrs_tail.realistic.adjusted_inverse_harmonic_mean_rank,user_attrs_tail.realistic.arithmetic_mean_rank,user_attrs_tail.realistic.count,user_attrs_tail.realistic.geometric_mean_rank,user_attrs_tail.realistic.harmonic_mean_rank,user_attrs_tail.realistic.hits_at_1,user_attrs_tail.realistic.hits_at_10,user_attrs_tail.realistic.hits_at_3,user_attrs_tail.realistic.hits_at_5,user_attrs_tail.realistic.inverse_arithmetic_mean_rank,user_attrs_tail.realistic.inverse_geometric_mean_rank,user_attrs_tail.realistic.inverse_harmonic_mean_rank,user_attrs_tail.realistic.inverse_median_rank,user_attrs_tail.realistic.median_absolute_deviation,user_attrs_tail.realistic.median_rank,user_attrs_tail.realistic.standard_deviation,user_attrs_tail.realistic.variance,user_attrs_tail.realistic.z_arithmetic_mean_rank,user_attrs_tail.realistic.z_geometric_mean_rank,user_attrs_tail.realistic.z_hits_at_k,user_attrs_tail.realistic.z_inverse_harmonic_mean_rank,state
8,0.4589701294898987,2025-07-14 14:52:05.273700,2025-07-14 14:59:42.276314,0 days 00:07:37.002614,1.0,200,xavier_uniform_norm,10,0.01,2,0.0001,0.03530901454310554,0.964734701737277,0.9992476522405846,0.53902036484061,0.4588319238130159,779.2024233480498,163988.0,13.216342508907816,2.1787909690403917,0.40340146840012686,0.5391248140107813,0.4884747664463253,0.5082506037027099,0.0012833635651481098,0.07566389864109528,0.4589701417940205,0.2,5.930408874022408,5.0,3467.128782269017,12020981.992838236,676.6447264801102,404.80561080448723,14499.4114889268,30454.133141909195,0.03530905267622372,0.9647346636024309,0.999247651812169,0.53902036484061,0.4588319220919323,779.2032648730395,163988.0,13.216349465361471,2.178790977208513,0.40340146840012686,0.5391248140107813,0.4884747664463253,0.5082506037027099,0.0012833621791394011,0.07566385881524129,0.45897014007337644,0.2,5.930408874022408,5.0,3467.13075970645,12020995.704902627,676.6446997331273,404.8056106309316,14499.4114889268,30454.1330276754,0.035309035274912255,0.9647346810045309,0.9992476520974316,0.53902036484061,0.45883191150575076,779.202880859375,163988.0,13.216344833374023,2.1787910274496602,0.40340146840012686,0.5391248140107813,0.4884747664463253,0.5082506037027099,0.0012833628570660949,0.07566388696432114,0.4589701294898987,0.20000000298023224,5.930408874022408,5.0,3467.129638671875,12020988.0,676.644711938596,404.80561074649444,14499.4114889268,30454.132325036888,0.06920862445749856,0.9308336716517022,0.9920188548723031,0.10502386870867325,0.04763670357061867,1523.1121545478939,81994.0,130.2395240102041,20.885305535005898,0.012988755274776203,0.10522721174720101,0.035246481449862185,0.05666268263531478,0.0006565504693886646,0.007678160739605063,0.04788055402512059,0.009900990099009901,130.46899522849296,101.0,4761.032513224184,22667430.59197779,461.64600605300734,284.27775809228325,1994.8983886086437,2232.660097568737,0.06920869927100819,0.9308335968347929,0.9920188464881927,0.10502386870867325,0.047636700132007354,1523.11380100983,81994.0,130.23965977498796,20.885307034530417,0.012988755274776203,0.10522721174720101,0.035246481449862185,0.05666268263531478,0.0006565497596679882,0.007678152735715656,0.04788055058738972,0.009900990099009901,130.46899522849296,101.0,4761.035101469144,22667455.237421308,461.6459689476378,284.27775568969173,1994.8983886086437,2232.659936406236,0.06920865901342246,0.930833637094208,0.992018851522923,0.10502386870867325,0.04763670225426366,1523.1129150390625,81994.0,130.2395782470703,20.88530610904767,0.012988755274776203,0.10522721174720101,0.035246481449862185,0.05666268263531478,0.0006565501680597663,0.007678157649934292,0.04788055270910263,0.009900989942252636,130.46899522849296,101.0,4761.03369140625,22667442.0,461.6459889142535,284.27775713246854,1994.8983886086437,2232.6600358731725,1201551166.0,0.0015948885014793347,0.9984502317967203,0.9999790474332909,0.9730163191289991,0.87002661679239,35.292692148205965,81994.0,1.3411574607649703,1.1493463793599044,0.7938141815254774,0.9730224162743616,0.9417030514427885,0.9598385247701051,0.028334477738356182,0.7456246035641626,0.8700597295629203,1.0,0.0,1.0,517.4263400243938,267730.0173510395,495.1859030822007,286.55834337865605,18533.15726053681,40889.18995817469,0.0015948901549051736,0.9984502301432198,0.999979047432444,0.9730163191289991,0.8700266167888319,35.292728736248996,81994.0,1.3411574745537351,1.1493463793646033,0.7938141815254774,0.9730224162743616,0.9417030514427885,0.9598385247701051,0.02833444836394599,0.7456245958982155,0.8700597295593632,1.0,0.0,1.0,517.4267105912596,267730.4008332911,495.1859022621396,286.5583433784134,18533.15726053681,40889.189958007475,0.0015948892788606095,0.9984502310193039,0.9999790474347892,0.9730163191289991,0.8700265562318326,35.29270935058594,81994.0,1.3411574363708496,1.1493464593398492,0.7938141815254774,0.9730224162743616,0.9417030514427885,0.9598385247701051,0.028334463015198708,0.7456246018409729,0.8700596690177916,1.0,0.0,1.0,517.426513671875,267730.21875,495.1859026966375,286.5583433790854,18533.15726053681,40889.18711197196,COMPLETE
9,0.44205906987190247,2025-07-14 14:59:42.306672,2025-07-14 15:07:29.355078,0 days 00:07:47.048406,1.0,300,xavier_uniform,2,0.01,2,1e-05,0.07239247498763876,0.9276495608054388,0.998886749387177,0.5276572028053359,0.44191653795987373,1597.5634741566455,163988.0,19.07654852998618,2.262141088686906,0.38712588726004343,0.5277642266507305,0.4708027416640242,0.4933836622191868,0.000625953219497523,0.052420384034780346,0.44205907624464974,0.16666666666666666,7.41301109252801,6.0,5281.140452469293,27890444.47870757,650.6339848771471,404.6594053070941,14193.747412183597,29331.405218713746,0.07239255291183679,0.9276494828777095,0.9988867475227037,0.5276572028053359,0.44191649272883976,1597.565193794668,163988.0,19.07657880461051,2.262141320087783,0.38712588726004343,0.5277642266507305,0.4708027416640242,0.4933836622191868,0.0006259525457140926,0.05242030084337322,0.4420590310251681,0.16666666666666666,7.41301109252801,6.0,5281.143366286779,27890475.25527486,650.6339302202689,404.65940455177656,14193.747412183597,29331.402216586255,0.07239251381737609,0.9276495219739419,0.9988867483858711,0.5276572028053359,0.4419165315854984,1597.5643310546875,163988.0,19.07656478881836,2.2621411212980536,0.38712588726004343,0.5277642266507305,0.4708027416640242,0.4933836622191868,0.0006259529036469758,0.05242034047842026,0.44205906987190247,0.1666666716337204,7.41301109252801,6.0,5281.14208984375,27890460.0,650.6339576415479,404.6594049014547,14193.747412183597,29331.404795626193,0.1435591365431705,0.8564797810029484,0.9853865234730882,0.11062311146775401,0.04752310662503732,3159.3846500963487,81994.0,237.63756519327725,20.934961157679723,0.013244871575968974,0.11082518233041443,0.03912481401078128,0.061614264458375,0.0003165173319334523,0.004208088898683473,0.04776698616577862,0.005813953488372093,244.62936605342432,172.0,7121.27227883656,50712518.869326055,424.77027014243214,282.37716488094094,2101.2544055299322,2227.3359808982964,0.14355928672436388,0.8564796308149306,0.9853864817224051,0.11062311146775401,0.04752301799074554,3159.3879552162352,81994.0,237.63824126648893,20.934999993786732,0.013244871575968974,0.11082518233041443,0.03912481401078128,0.061614264458375,0.00031651700081624127,0.004208076926804866,0.047766897554181446,0.005813953488372093,244.62936605342432,172.0,7121.275853538686,50712569.78219314,424.77019565683855,282.37715291666166,2101.2544055299322,2227.331826743376,0.14355920835364075,0.856479709189215,0.9853864975338872,0.11062311146775401,0.047523062978953666,3159.38623046875,81994.0,237.6379852294922,20.934980281681792,0.013244871575968974,0.11082518233041443,0.03912481401078128,0.061614264458375,0.0003165171656291932,0.004208081401884556,0.04776694253087044,0.0058139534667134285,244.62936605342432,172.0,7121.27392578125,50712544.0,424.7702345264846,282.37715744767706,2101.2544055299322,2227.333935272506,433508114.0,0.0016152063493276177,0.9984299130306602,0.9999673643702683,0.9446907734768903,0.8363094635761057,35.7422982169427,81994.0,1.5313854251996561,1.1956700011501817,0.7610069029441179,0.9447032709710467,0.9024806693172671,0.9251530599799985,0.027978055410157597,0.653003472244503,0.8363511663235208,1.0,0.0,1.0,435.659634189051,189799.31686173775,495.17582589838065,286.55499542932256,17993.63723220782,39304.56363054302,0.0016152124118890266,0.9984299069678249,0.9999673643393214,0.9446907734768903,0.8363094617482737,35.74243237310047,81994.0,1.5313859290871363,1.1956700037626335,0.7610069029441179,0.9447032709710467,0.9024806693172671,0.9251530599799985,0.027977950396923565,0.6530032573801321,0.8363511644961545,1.0,0.0,1.0,435.6604780876835,189800.05216758896,495.17582289149004,286.5549954204543,17993.63723220782,39304.563544639255,0.0016152094482017579,0.998429909931646,0.9999673643558372,0.9446907734768903,0.8363095131045889,35.742366790771484,81994.0,1.5313856601715088,1.1956699303609806,0.7610069029441179,0.9447032709710467,0.9024806693172671,0.9251530599799985,0.027978001162409782,0.6530033946037292,0.8363512158393859,1.0,0.0,1.0,435.6600646972656,189799.703125,495.1758243614106,286.55499542518714,17993.63723220782,39304.56595826441,COMPLETE
