number,value,datetime_start,datetime_complete,duration,params_loss.margin,params_model.embedding_dim,params_model.entity_initializer,params_model.scoring_fct_norm,params_negative_sampler.num_negs_per_pos,params_optimizer.lr,params_regularizer.p,params_regularizer.weight,user_attrs_both.optimistic.adjusted_arithmetic_mean_rank,user_attrs_both.optimistic.adjusted_arithmetic_mean_rank_index,user_attrs_both.optimistic.adjusted_geometric_mean_rank_index,user_attrs_both.optimistic.adjusted_hits_at_k,user_attrs_both.optimistic.adjusted_inverse_harmonic_mean_rank,user_attrs_both.optimistic.arithmetic_mean_rank,user_attrs_both.optimistic.count,user_attrs_both.optimistic.geometric_mean_rank,user_attrs_both.optimistic.harmonic_mean_rank,user_attrs_both.optimistic.hits_at_1,user_attrs_both.optimistic.hits_at_10,user_attrs_both.optimistic.hits_at_3,user_attrs_both.optimistic.hits_at_5,user_attrs_both.optimistic.inverse_arithmetic_mean_rank,user_attrs_both.optimistic.inverse_geometric_mean_rank,user_attrs_both.optimistic.inverse_harmonic_mean_rank,user_attrs_both.optimistic.inverse_median_rank,user_attrs_both.optimistic.median_absolute_deviation,user_attrs_both.optimistic.median_rank,user_attrs_both.optimistic.standard_deviation,user_attrs_both.optimistic.variance,user_attrs_both.optimistic.z_arithmetic_mean_rank,user_attrs_both.optimistic.z_geometric_mean_rank,user_attrs_both.optimistic.z_hits_at_k,user_attrs_both.optimistic.z_inverse_harmonic_mean_rank,user_attrs_both.pessimistic.adjusted_arithmetic_mean_rank,user_attrs_both.pessimistic.adjusted_arithmetic_mean_rank_index,user_attrs_both.pessimistic.adjusted_geometric_mean_rank_index,user_attrs_both.pessimistic.adjusted_hits_at_k,user_attrs_both.pessimistic.adjusted_inverse_harmonic_mean_rank,user_attrs_both.pessimistic.arithmetic_mean_rank,user_attrs_both.pessimistic.count,user_attrs_both.pessimistic.geometric_mean_rank,user_attrs_both.pessimistic.harmonic_mean_rank,user_attrs_both.pessimistic.hits_at_1,user_attrs_both.pessimistic.hits_at_10,user_attrs_both.pessimistic.hits_at_3,user_attrs_both.pessimistic.hits_at_5,user_attrs_both.pessimistic.inverse_arithmetic_mean_rank,user_attrs_both.pessimistic.inverse_geometric_mean_rank,user_attrs_both.pessimistic.inverse_harmonic_mean_rank,user_attrs_both.pessimistic.inverse_median_rank,user_attrs_both.pessimistic.median_absolute_deviation,user_attrs_both.pessimistic.median_rank,user_attrs_both.pessimistic.standard_deviation,user_attrs_both.pessimistic.variance,user_attrs_both.pessimistic.z_arithmetic_mean_rank,user_attrs_both.pessimistic.z_geometric_mean_rank,user_attrs_both.pessimistic.z_hits_at_k,user_attrs_both.pessimistic.z_inverse_harmonic_mean_rank,user_attrs_both.realistic.adjusted_arithmetic_mean_rank,user_attrs_both.realistic.adjusted_arithmetic_mean_rank_index,user_attrs_both.realistic.adjusted_geometric_mean_rank_index,user_attrs_both.realistic.adjusted_hits_at_k,user_attrs_both.realistic.adjusted_inverse_harmonic_mean_rank,user_attrs_both.realistic.arithmetic_mean_rank,user_attrs_both.realistic.count,user_attrs_both.realistic.geometric_mean_rank,user_attrs_both.realistic.harmonic_mean_rank,user_attrs_both.realistic.hits_at_1,user_attrs_both.realistic.hits_at_10,user_attrs_both.realistic.hits_at_3,user_attrs_both.realistic.hits_at_5,user_attrs_both.realistic.inverse_arithmetic_mean_rank,user_attrs_both.realistic.inverse_geometric_mean_rank,user_attrs_both.realistic.inverse_harmonic_mean_rank,user_attrs_both.realistic.inverse_median_rank,user_attrs_both.realistic.median_absolute_deviation,user_attrs_both.realistic.median_rank,user_attrs_both.realistic.standard_deviation,user_attrs_both.realistic.variance,user_attrs_both.realistic.z_arithmetic_mean_rank,user_attrs_both.realistic.z_geometric_mean_rank,user_attrs_both.realistic.z_hits_at_k,user_attrs_both.realistic.z_inverse_harmonic_mean_rank,user_attrs_head.optimistic.adjusted_arithmetic_mean_rank,user_attrs_head.optimistic.adjusted_arithmetic_mean_rank_index,user_attrs_head.optimistic.adjusted_geometric_mean_rank_index,user_attrs_head.optimistic.adjusted_hits_at_k,user_attrs_head.optimistic.adjusted_inverse_harmonic_mean_rank,user_attrs_head.optimistic.arithmetic_mean_rank,user_attrs_head.optimistic.count,user_attrs_head.optimistic.geometric_mean_rank,user_attrs_head.optimistic.harmonic_mean_rank,user_attrs_head.optimistic.hits_at_1,user_attrs_head.optimistic.hits_at_10,user_attrs_head.optimistic.hits_at_3,user_attrs_head.optimistic.hits_at_5,user_attrs_head.optimistic.inverse_arithmetic_mean_rank,user_attrs_head.optimistic.inverse_geometric_mean_rank,user_attrs_head.optimistic.inverse_harmonic_mean_rank,user_attrs_head.optimistic.inverse_median_rank,user_attrs_head.optimistic.median_absolute_deviation,user_attrs_head.optimistic.median_rank,user_attrs_head.optimistic.standard_deviation,user_attrs_head.optimistic.variance,user_attrs_head.optimistic.z_arithmetic_mean_rank,user_attrs_head.optimistic.z_geometric_mean_rank,user_attrs_head.optimistic.z_hits_at_k,user_attrs_head.optimistic.z_inverse_harmonic_mean_rank,user_attrs_head.pessimistic.adjusted_arithmetic_mean_rank,user_attrs_head.pessimistic.adjusted_arithmetic_mean_rank_index,user_attrs_head.pessimistic.adjusted_geometric_mean_rank_index,user_attrs_head.pessimistic.adjusted_hits_at_k,user_attrs_head.pessimistic.adjusted_inverse_harmonic_mean_rank,user_attrs_head.pessimistic.arithmetic_mean_rank,user_attrs_head.pessimistic.count,user_attrs_head.pessimistic.geometric_mean_rank,user_attrs_head.pessimistic.harmonic_mean_rank,user_attrs_head.pessimistic.hits_at_1,user_attrs_head.pessimistic.hits_at_10,user_attrs_head.pessimistic.hits_at_3,user_attrs_head.pessimistic.hits_at_5,user_attrs_head.pessimistic.inverse_arithmetic_mean_rank,user_attrs_head.pessimistic.inverse_geometric_mean_rank,user_attrs_head.pessimistic.inverse_harmonic_mean_rank,user_attrs_head.pessimistic.inverse_median_rank,user_attrs_head.pessimistic.median_absolute_deviation,user_attrs_head.pessimistic.median_rank,user_attrs_head.pessimistic.standard_deviation,user_attrs_head.pessimistic.variance,user_attrs_head.pessimistic.z_arithmetic_mean_rank,user_attrs_head.pessimistic.z_geometric_mean_rank,user_attrs_head.pessimistic.z_hits_at_k,user_attrs_head.pessimistic.z_inverse_harmonic_mean_rank,user_attrs_head.realistic.adjusted_arithmetic_mean_rank,user_attrs_head.realistic.adjusted_arithmetic_mean_rank_index,user_attrs_head.realistic.adjusted_geometric_mean_rank_index,user_attrs_head.realistic.adjusted_hits_at_k,user_attrs_head.realistic.adjusted_inverse_harmonic_mean_rank,user_attrs_head.realistic.arithmetic_mean_rank,user_attrs_head.realistic.count,user_attrs_head.realistic.geometric_mean_rank,user_attrs_head.realistic.harmonic_mean_rank,user_attrs_head.realistic.hits_at_1,user_attrs_head.realistic.hits_at_10,user_attrs_head.realistic.hits_at_3,user_attrs_head.realistic.hits_at_5,user_attrs_head.realistic.inverse_arithmetic_mean_rank,user_attrs_head.realistic.inverse_geometric_mean_rank,user_attrs_head.realistic.inverse_harmonic_mean_rank,user_attrs_head.realistic.inverse_median_rank,user_attrs_head.realistic.median_absolute_deviation,user_attrs_head.realistic.median_rank,user_attrs_head.realistic.standard_deviation,user_attrs_head.realistic.variance,user_attrs_head.realistic.z_arithmetic_mean_rank,user_attrs_head.realistic.z_geometric_mean_rank,user_attrs_head.realistic.z_hits_at_k,user_attrs_head.realistic.z_inverse_harmonic_mean_rank,user_attrs_random_seed,user_attrs_tail.optimistic.adjusted_arithmetic_mean_rank,user_attrs_tail.optimistic.adjusted_arithmetic_mean_rank_index,user_attrs_tail.optimistic.adjusted_geometric_mean_rank_index,user_attrs_tail.optimistic.adjusted_hits_at_k,user_attrs_tail.optimistic.adjusted_inverse_harmonic_mean_rank,user_attrs_tail.optimistic.arithmetic_mean_rank,user_attrs_tail.optimistic.count,user_attrs_tail.optimistic.geometric_mean_rank,user_attrs_tail.optimistic.harmonic_mean_rank,user_attrs_tail.optimistic.hits_at_1,user_attrs_tail.optimistic.hits_at_10,user_attrs_tail.optimistic.hits_at_3,user_attrs_tail.optimistic.hits_at_5,user_attrs_tail.optimistic.inverse_arithmetic_mean_rank,user_attrs_tail.optimistic.inverse_geometric_mean_rank,user_attrs_tail.optimistic.inverse_harmonic_mean_rank,user_attrs_tail.optimistic.inverse_median_rank,user_attrs_tail.optimistic.median_absolute_deviation,user_attrs_tail.optimistic.median_rank,user_attrs_tail.optimistic.standard_deviation,user_attrs_tail.optimistic.variance,user_attrs_tail.optimistic.z_arithmetic_mean_rank,user_attrs_tail.optimistic.z_geometric_mean_rank,user_attrs_tail.optimistic.z_hits_at_k,user_attrs_tail.optimistic.z_inverse_harmonic_mean_rank,user_attrs_tail.pessimistic.adjusted_arithmetic_mean_rank,user_attrs_tail.pessimistic.adjusted_arithmetic_mean_rank_index,user_attrs_tail.pessimistic.adjusted_geometric_mean_rank_index,user_attrs_tail.pessimistic.adjusted_hits_at_k,user_attrs_tail.pessimistic.adjusted_inverse_harmonic_mean_rank,user_attrs_tail.pessimistic.arithmetic_mean_rank,user_attrs_tail.pessimistic.count,user_attrs_tail.pessimistic.geometric_mean_rank,user_attrs_tail.pessimistic.harmonic_mean_rank,user_attrs_tail.pessimistic.hits_at_1,user_attrs_tail.pessimistic.hits_at_10,user_attrs_tail.pessimistic.hits_at_3,user_attrs_tail.pessimistic.hits_at_5,user_attrs_tail.pessimistic.inverse_arithmetic_mean_rank,user_attrs_tail.pessimistic.inverse_geometric_mean_rank,user_attrs_tail.pessimistic.inverse_harmonic_mean_rank,user_attrs_tail.pessimistic.inverse_median_rank,user_attrs_tail.pessimistic.median_absolute_deviation,user_attrs_tail.pessimistic.median_rank,user_attrs_tail.pessimistic.standard_deviation,user_attrs_tail.pessimistic.variance,user_attrs_tail.pessimistic.z_arithmetic_mean_rank,user_attrs_tail.pessimistic.z_geometric_mean_rank,user_attrs_tail.pessimistic.z_hits_at_k,user_attrs_tail.pessimistic.z_inverse_harmonic_mean_rank,user_attrs_tail.realistic.adjusted_arithmetic_mean_rank,user_attrs_tail.realistic.adjusted_arithmetic_mean_rank_index,user_attrs_tail.realistic.adjusted_geometric_mean_rank_index,user_attrs_tail.realistic.adjusted_hits_at_k,user_attrs_tail.realistic.adjusted_inverse_harmonic_mean_rank,user_attrs_tail.realistic.arithmetic_mean_rank,user_attrs_tail.realistic.count,user_attrs_tail.realistic.geometric_mean_rank,user_attrs_tail.realistic.harmonic_mean_rank,user_attrs_tail.realistic.hits_at_1,user_attrs_tail.realistic.hits_at_10,user_attrs_tail.realistic.hits_at_3,user_attrs_tail.realistic.hits_at_5,user_attrs_tail.realistic.inverse_arithmetic_mean_rank,user_attrs_tail.realistic.inverse_geometric_mean_rank,user_attrs_tail.realistic.inverse_harmonic_mean_rank,user_attrs_tail.realistic.inverse_median_rank,user_attrs_tail.realistic.median_absolute_deviation,user_attrs_tail.realistic.median_rank,user_attrs_tail.realistic.standard_deviation,user_attrs_tail.realistic.variance,user_attrs_tail.realistic.z_arithmetic_mean_rank,user_attrs_tail.realistic.z_geometric_mean_rank,user_attrs_tail.realistic.z_hits_at_k,user_attrs_tail.realistic.z_inverse_harmonic_mean_rank,state
22,0.47410780191421503,2025-07-14 13:11:44.169650,2025-07-14 13:17:25.271546,0 days 00:05:41.101896,7.0,200,xavier_uniform_norm,1.0,6,0.001,1,1e-05,0.00703015700755718,0.9930148407676083,0.9995424441945905,0.5541834463326611,0.4739735044113589,155.1421201551333,163988.0,8.429620632040342,2.1092247031530187,0.41827450789082127,0.5542844598385248,0.4976339732175525,0.5188733321950386,0.006445702811074496,0.11862930061159296,0.4741078551304321,0.25,4.447806655516806,4.0,1333.0569345361268,1777040.7907148553,696.4798240510164,404.9250340893296,14907.291733040385,31459.12797245373,0.007030162534096046,0.993014835240819,0.999542444010108,0.5541834463326611,0.4739735004172575,155.14224211527673,163988.0,8.429623627596332,2.109224720917554,0.41827450789082127,0.5542844598385248,0.4976339732175525,0.5188733321950386,0.006445697743990067,0.11862925845541522,0.4741078511373508,0.25,4.447806655516806,4.0,1333.0577886556832,1777043.0678955803,696.4798201746421,404.92503401459385,14907.291733040385,31459.127707352527,0.007030159782666305,0.9930148379923734,0.9995424440703047,0.5541834463326611,0.4739734511815466,155.14218139648438,163988.0,8.429622650146484,2.109224939902887,0.41827450789082127,0.5542844598385248,0.4976339732175525,0.5188733321950386,0.00644570030272007,0.11862926930189133,0.47410780191421503,0.25,4.447806655516806,4.0,1333.057373046875,1777042.0,696.4798221045247,404.92503403898013,14907.291733040385,31459.124439421903,0.014002032176541244,0.986042772576505,0.9965098102495398,0.1260911720745392,0.058227215988746146,308.15040124887184,81994.0,57.51701038356447,17.10326900750154,0.01506207771300339,0.12628972851672074,0.042015269409956826,0.06828548430372954,0.0032451685798467254,0.017386160951886866,0.05846835476664708,0.017241379310344827,65.23449761424648,58.0,1872.7437141126238,3507169.018748345,489.0269031089631,285.5647081538299,2395.065798680681,2729.0213634927536,0.014002043260024152,0.9860427614925185,0.9965098077250963,0.1260911720745392,0.05822720800053847,308.15064516915874,81994.0,57.517051262143205,17.103271343628524,0.01506207771300339,0.12628972851672074,0.042015269409956826,0.06828548430372954,0.0032451660110951637,0.0173861485951764,0.05846834678048476,0.017241379310344827,65.23449761424648,58.0,1872.7449101428942,3507173.4984661173,489.02689761187133,285.5647074304131,2395.065798680681,2729.0209890975666,0.014002037240551032,0.9860427675122652,0.9965098088761326,0.1260911720745392,0.058227210498666526,308.1505126953125,81994.0,57.517032623291016,17.10327061305852,0.01506207771300339,0.12628972851672074,0.042015269409956826,0.06828548430372954,0.0032451674342155457,0.01738615334033966,0.05846834927797318,0.017241379246115685,65.23449761424648,58.0,1872.7442626953125,3507171.0,489.0269005973585,285.56470776025964,2395.065798680681,2729.021106181043,527654021.0,9.642889719873403e-05,0.9999487591199493,0.999985540521699,0.9822751861186417,0.8897192597352533,2.133839061394736,81994.0,1.2354345875463868,1.12391455150158,0.8214869380686391,0.9822791911603288,0.9532526770251482,0.9694611800863477,0.468638904447823,0.8094317660201116,0.8897473554942171,1.0,0.0,1.0,9.460154060281472,89.49451484426,495.92910447793895,286.56020406629983,18709.51199847897,41814.6975260212,9.642889719873403e-05,0.9999487591199493,0.999985540521699,0.9822751861186417,0.8897192597352533,2.133839061394736,81994.0,1.2354345875463868,1.12391455150158,0.8214869380686391,0.9822791911603288,0.9532526770251482,0.9694611800863477,0.468638904447823,0.8094317660201116,0.8897473554942171,1.0,0.0,1.0,9.460154060281472,89.49451484426,495.92910447793895,286.56020406629983,18709.51199847897,41814.6975260212,9.642890031717768e-05,0.9999487591168307,0.9999855405177789,0.9822751861186417,0.8897192854579167,2.1338391304016113,81994.0,1.235434651374817,1.1239145190174045,0.8214869380686391,0.9822791911603288,0.9532526770251482,0.9694611800863477,0.46863889694213867,0.8094317317008972,0.8897473812103271,1.0,0.0,1.0,9.460153579711914,89.49451446533203,495.92910447639224,286.5602040651765,18709.51199847897,41814.69873492544,COMPLETE
23,,2025-07-14 13:17:25.305742,2025-07-14 13:18:04.936768,0 days 00:00:39.631026,7.0,200,xavier_uniform_norm,1.0,4,0.001,1,1e-05,,,,,,,,,,,,,,,,,,,,,,,,,,,,,,,,,,,,,,,,,,,,,,,,,,,,,,,,,,,,,,,,,,,,,,,,,,,,,,,,,,,,,,,,,,,,,,,,,,,,,,,,,,,,,,,,,,,,,,,,,,,,,,,,,,,,,,,,,,,,,,,,,,,,,,,,,,,,,,,,,,,,,,,,,,,,,,,,,,,,,,,,,,,,,,,,,,,,,,,,,,,,,,,,,,,,,,,,,,,,,,,,,,,FAIL
24,0.44996741414070135,2025-07-14 13:24:02.824701,2025-07-14 13:29:36.674447,0 days 00:05:33.849746,3.0,200,xavier_uniform_norm,1.0,4,0.001,1,1e-05,0.008768162293330724,0.9912767567217681,0.9995154644010573,0.5469251732129746,0.4498269136606673,193.49657291996976,163988.0,8.867708463757891,2.222383065556607,0.3795155743103154,0.5470278313047297,0.4901334243969071,0.5130253433178037,0.005168050187708494,0.11276870502531468,0.4499674315820729,0.25,4.447806655516806,4.0,1727.2206663219763,2983291.230169732,695.2607682819234,404.9141042945224,14712.047368400335,29856.44199643513,0.008768173070081514,0.9912767459445289,0.9995154638780993,0.5469190738237983,0.4498268522101825,193.49681074224944,163988.0,8.867716955355007,2.222383368982246,0.3795155743103154,0.5470217332975583,0.4901334243969071,0.5130253433178037,0.005168043835782215,0.11276859703963864,0.449967370147283,0.25,4.447806655516806,4.0,1727.2224088436765,2983297.249611752,695.2607607229935,404.9141040826667,14711.883297505678,29856.43791777114,0.008768167546291748,0.991276751468569,0.9995154640057939,0.5469190738237983,0.4498268962148399,193.49668884277344,163988.0,8.867714881896973,2.222383151699309,0.3795155743103154,0.5470217332975583,0.4901334243969071,0.5130253433178037,0.005168047267943621,0.11276862025260925,0.44996741414070135,0.25,4.447806655516806,4.0,1727.2215576171875,2983294.25,695.2607645974396,404.9141041343971,14711.883297505678,29856.44083850012,0.01745498044134901,0.9825896674062072,0.9964281330065952,0.11529524649330505,0.05435094313071952,384.14132741420104,81994.0,58.839618584735284,18.317341725738768,0.013366831719394102,0.11549625582359685,0.038173524892065276,0.061126423884674486,0.0026032085814129244,0.01699535150045023,0.05459307441946347,0.016666666666666666,66.71709983275208,60.0,2427.599582400661,5893239.732471863,487.31433913658304,285.5413023250017,2190.000275858589,2547.346329564868,0.01745500205414068,0.9825896457924335,0.9964281260475784,0.11528304770733756,0.054350820229671165,384.1418030587604,81994.0,58.839731272827535,18.31738295164829,0.013366831719394102,0.11548405980925433,0.038173524892065276,0.061126423884674486,0.002603205358118847,0.01699531895146171,0.05459295154988365,0.016666666666666666,66.71709983275208,60.0,2427.602024632026,5893251.58999751,487.3143284172541,285.54130033079196,2189.7685634034224,2547.3405693790023,0.01745499151167434,0.9825896563353789,0.9964281299380552,0.11528304770733756,0.05435088043207201,384.1415710449219,81994.0,58.83966827392578,18.31736275734065,0.013366831719394102,0.11548405980925433,0.038173524892065276,0.061126423884674486,0.00260320701636374,0.01699533686041832,0.054593011736869805,0.01666666753590107,66.71709983275208,60.0,2427.600830078125,5893246.0,487.3143336460171,285.54130144566597,2189.7685634034224,2547.3433909742857,1643375267.0,0.0001288746235741154,0.9999163119272745,0.9999793365001373,0.9785545610437524,0.8453023770839041,2.8518184257384687,81994.0,1.3364507671809405,1.1829534672419095,0.7456643169012367,0.9785594067858624,0.9420933239017489,0.964924262750933,0.35065346060419444,0.7482505338444774,0.8453417887446826,1.0,0.0,1.0,25.532000220690136,651.8830352693212,495.91301214614765,286.5584262149083,18638.644811295362,39727.20926183818,0.0001288746235741154,0.9999163119272745,0.9999793365001373,0.9785545610437524,0.8453023770839041,2.8518184257384687,81994.0,1.3364507671809405,1.1829534672419095,0.7456643169012367,0.9785594067858624,0.9420933239017489,0.964924262750933,0.35065346060419444,0.7482505338444774,0.8453417887446826,1.0,0.0,1.0,25.532000220690136,651.8830352693212,495.91301214614765,286.5584262149083,18638.644811295362,39727.20926183818,0.00012887461893744748,0.9999163119319113,0.9999793364971881,0.9785545610437524,0.8453023303660462,2.851818323135376,81994.0,1.3364508152008057,1.1829535326012424,0.7456643169012367,0.9785594067858624,0.9420933239017489,0.964924262750933,0.3506534695625305,0.7482504844665527,0.8453417420387268,1.0,0.0,1.0,25.531999588012695,651.8829956054688,495.9130121484473,286.55842621406316,18638.644811295362,39727.20706620953,COMPLETE
25,,2025-07-14 13:29:36.708911,,,7.0,300,xavier_uniform_norm,1.0,8,0.001,1,1e-05,,,,,,,,,,,,,,,,,,,,,,,,,,,,,,,,,,,,,,,,,,,,,,,,,,,,,,,,,,,,,,,,,,,,,,,,,,,,,,,,,,,,,,,,,,,,,,,,,,,,,,,,,,,,,,,,,,,,,,,,,,,,,,,,,,,,,,,,,,,,,,,,,,,,,,,,,,,,,,,,,,,,,,,,,,,,,,,,,,,,,,,,,,,,,,,,,,,,,,,,,,,,,,,,,,,,,,,,,,,,,,,,,,,RUNNING
