number,value,datetime_start,datetime_complete,duration,params_loss.margin,params_model.embedding_dim,params_model.entity_initializer,params_negative_sampler.num_negs_per_pos,params_optimizer.lr,params_regularizer.p,params_regularizer.weight,user_attrs_both.optimistic.adjusted_arithmetic_mean_rank,user_attrs_both.optimistic.adjusted_arithmetic_mean_rank_index,user_attrs_both.optimistic.adjusted_geometric_mean_rank_index,user_attrs_both.optimistic.adjusted_hits_at_k,user_attrs_both.optimistic.adjusted_inverse_harmonic_mean_rank,user_attrs_both.optimistic.arithmetic_mean_rank,user_attrs_both.optimistic.count,user_attrs_both.optimistic.geometric_mean_rank,user_attrs_both.optimistic.harmonic_mean_rank,user_attrs_both.optimistic.hits_at_1,user_attrs_both.optimistic.hits_at_10,user_attrs_both.optimistic.hits_at_3,user_attrs_both.optimistic.hits_at_5,user_attrs_both.optimistic.inverse_arithmetic_mean_rank,user_attrs_both.optimistic.inverse_geometric_mean_rank,user_attrs_both.optimistic.inverse_harmonic_mean_rank,user_attrs_both.optimistic.inverse_median_rank,user_attrs_both.optimistic.median_absolute_deviation,user_attrs_both.optimistic.median_rank,user_attrs_both.optimistic.standard_deviation,user_attrs_both.optimistic.variance,user_attrs_both.optimistic.z_arithmetic_mean_rank,user_attrs_both.optimistic.z_geometric_mean_rank,user_attrs_both.optimistic.z_hits_at_k,user_attrs_both.optimistic.z_inverse_harmonic_mean_rank,user_attrs_both.pessimistic.adjusted_arithmetic_mean_rank,user_attrs_both.pessimistic.adjusted_arithmetic_mean_rank_index,user_attrs_both.pessimistic.adjusted_geometric_mean_rank_index,user_attrs_both.pessimistic.adjusted_hits_at_k,user_attrs_both.pessimistic.adjusted_inverse_harmonic_mean_rank,user_attrs_both.pessimistic.arithmetic_mean_rank,user_attrs_both.pessimistic.count,user_attrs_both.pessimistic.geometric_mean_rank,user_attrs_both.pessimistic.harmonic_mean_rank,user_attrs_both.pessimistic.hits_at_1,user_attrs_both.pessimistic.hits_at_10,user_attrs_both.pessimistic.hits_at_3,user_attrs_both.pessimistic.hits_at_5,user_attrs_both.pessimistic.inverse_arithmetic_mean_rank,user_attrs_both.pessimistic.inverse_geometric_mean_rank,user_attrs_both.pessimistic.inverse_harmonic_mean_rank,user_attrs_both.pessimistic.inverse_median_rank,user_attrs_both.pessimistic.median_absolute_deviation,user_attrs_both.pessimistic.median_rank,user_attrs_both.pessimistic.standard_deviation,user_attrs_both.pessimistic.variance,user_attrs_both.pessimistic.z_arithmetic_mean_rank,user_attrs_both.pessimistic.z_geometric_mean_rank,user_attrs_both.pessimistic.z_hits_at_k,user_attrs_both.pessimistic.z_inverse_harmonic_mean_rank,user_attrs_both.realistic.adjusted_arithmetic_mean_rank,user_attrs_both.realistic.adjusted_arithmetic_mean_rank_index,user_attrs_both.realistic.adjusted_geometric_mean_rank_index,user_attrs_both.realistic.adjusted_hits_at_k,user_attrs_both.realistic.adjusted_inverse_harmonic_mean_rank,user_attrs_both.realistic.arithmetic_mean_rank,user_attrs_both.realistic.count,user_attrs_both.realistic.geometric_mean_rank,user_attrs_both.realistic.harmonic_mean_rank,user_attrs_both.realistic.hits_at_1,user_attrs_both.realistic.hits_at_10,user_attrs_both.realistic.hits_at_3,user_attrs_both.realistic.hits_at_5,user_attrs_both.realistic.inverse_arithmetic_mean_rank,user_attrs_both.realistic.inverse_geometric_mean_rank,user_attrs_both.realistic.inverse_harmonic_mean_rank,user_attrs_both.realistic.inverse_median_rank,user_attrs_both.realistic.median_absolute_deviation,user_attrs_both.realistic.median_rank,user_attrs_both.realistic.standard_deviation,user_attrs_both.realistic.variance,user_attrs_both.realistic.z_arithmetic_mean_rank,user_attrs_both.realistic.z_geometric_mean_rank,user_attrs_both.realistic.z_hits_at_k,user_attrs_both.realistic.z_inverse_harmonic_mean_rank,user_attrs_head.optimistic.adjusted_arithmetic_mean_rank,user_attrs_head.optimistic.adjusted_arithmetic_mean_rank_index,user_attrs_head.optimistic.adjusted_geometric_mean_rank_index,user_attrs_head.optimistic.adjusted_hits_at_k,user_attrs_head.optimistic.adjusted_inverse_harmonic_mean_rank,user_attrs_head.optimistic.arithmetic_mean_rank,user_attrs_head.optimistic.count,user_attrs_head.optimistic.geometric_mean_rank,user_attrs_head.optimistic.harmonic_mean_rank,user_attrs_head.optimistic.hits_at_1,user_attrs_head.optimistic.hits_at_10,user_attrs_head.optimistic.hits_at_3,user_attrs_head.optimistic.hits_at_5,user_attrs_head.optimistic.inverse_arithmetic_mean_rank,user_attrs_head.optimistic.inverse_geometric_mean_rank,user_attrs_head.optimistic.inverse_harmonic_mean_rank,user_attrs_head.optimistic.inverse_median_rank,user_attrs_head.optimistic.median_absolute_deviation,user_attrs_head.optimistic.median_rank,user_attrs_head.optimistic.standard_deviation,user_attrs_head.optimistic.variance,user_attrs_head.optimistic.z_arithmetic_mean_rank,user_attrs_head.optimistic.z_geometric_mean_rank,user_attrs_head.optimistic.z_hits_at_k,user_attrs_head.optimistic.z_inverse_harmonic_mean_rank,user_attrs_head.pessimistic.adjusted_arithmetic_mean_rank,user_attrs_head.pessimistic.adjusted_arithmetic_mean_rank_index,user_attrs_head.pessimistic.adjusted_geometric_mean_rank_index,user_attrs_head.pessimistic.adjusted_hits_at_k,user_attrs_head.pessimistic.adjusted_inverse_harmonic_mean_rank,user_attrs_head.pessimistic.arithmetic_mean_rank,user_attrs_head.pessimistic.count,user_attrs_head.pessimistic.geometric_mean_rank,user_attrs_head.pessimistic.harmonic_mean_rank,user_attrs_head.pessimistic.hits_at_1,user_attrs_head.pessimistic.hits_at_10,user_attrs_head.pessimistic.hits_at_3,user_attrs_head.pessimistic.hits_at_5,user_attrs_head.pessimistic.inverse_arithmetic_mean_rank,user_attrs_head.pessimistic.inverse_geometric_mean_rank,user_attrs_head.pessimistic.inverse_harmonic_mean_rank,user_attrs_head.pessimistic.inverse_median_rank,user_attrs_head.pessimistic.median_absolute_deviation,user_attrs_head.pessimistic.median_rank,user_attrs_head.pessimistic.standard_deviation,user_attrs_head.pessimistic.variance,user_attrs_head.pessimistic.z_arithmetic_mean_rank,user_attrs_head.pessimistic.z_geometric_mean_rank,user_attrs_head.pessimistic.z_hits_at_k,user_attrs_head.pessimistic.z_inverse_harmonic_mean_rank,user_attrs_head.realistic.adjusted_arithmetic_mean_rank,user_attrs_head.realistic.adjusted_arithmetic_mean_rank_index,user_attrs_head.realistic.adjusted_geometric_mean_rank_index,user_attrs_head.realistic.adjusted_hits_at_k,user_attrs_head.realistic.adjusted_inverse_harmonic_mean_rank,user_attrs_head.realistic.arithmetic_mean_rank,user_attrs_head.realistic.count,user_attrs_head.realistic.geometric_mean_rank,user_attrs_head.realistic.harmonic_mean_rank,user_attrs_head.realistic.hits_at_1,user_attrs_head.realistic.hits_at_10,user_attrs_head.realistic.hits_at_3,user_attrs_head.realistic.hits_at_5,user_attrs_head.realistic.inverse_arithmetic_mean_rank,user_attrs_head.realistic.inverse_geometric_mean_rank,user_attrs_head.realistic.inverse_harmonic_mean_rank,user_attrs_head.realistic.inverse_median_rank,user_attrs_head.realistic.median_absolute_deviation,user_attrs_head.realistic.median_rank,user_attrs_head.realistic.standard_deviation,user_attrs_head.realistic.variance,user_attrs_head.realistic.z_arithmetic_mean_rank,user_attrs_head.realistic.z_geometric_mean_rank,user_attrs_head.realistic.z_hits_at_k,user_attrs_head.realistic.z_inverse_harmonic_mean_rank,user_attrs_random_seed,user_attrs_tail.optimistic.adjusted_arithmetic_mean_rank,user_attrs_tail.optimistic.adjusted_arithmetic_mean_rank_index,user_attrs_tail.optimistic.adjusted_geometric_mean_rank_index,user_attrs_tail.optimistic.adjusted_hits_at_k,user_attrs_tail.optimistic.adjusted_inverse_harmonic_mean_rank,user_attrs_tail.optimistic.arithmetic_mean_rank,user_attrs_tail.optimistic.count,user_attrs_tail.optimistic.geometric_mean_rank,user_attrs_tail.optimistic.harmonic_mean_rank,user_attrs_tail.optimistic.hits_at_1,user_attrs_tail.optimistic.hits_at_10,user_attrs_tail.optimistic.hits_at_3,user_attrs_tail.optimistic.hits_at_5,user_attrs_tail.optimistic.inverse_arithmetic_mean_rank,user_attrs_tail.optimistic.inverse_geometric_mean_rank,user_attrs_tail.optimistic.inverse_harmonic_mean_rank,user_attrs_tail.optimistic.inverse_median_rank,user_attrs_tail.optimistic.median_absolute_deviation,user_attrs_tail.optimistic.median_rank,user_attrs_tail.optimistic.standard_deviation,user_attrs_tail.optimistic.variance,user_attrs_tail.optimistic.z_arithmetic_mean_rank,user_attrs_tail.optimistic.z_geometric_mean_rank,user_attrs_tail.optimistic.z_hits_at_k,user_attrs_tail.optimistic.z_inverse_harmonic_mean_rank,user_attrs_tail.pessimistic.adjusted_arithmetic_mean_rank,user_attrs_tail.pessimistic.adjusted_arithmetic_mean_rank_index,user_attrs_tail.pessimistic.adjusted_geometric_mean_rank_index,user_attrs_tail.pessimistic.adjusted_hits_at_k,user_attrs_tail.pessimistic.adjusted_inverse_harmonic_mean_rank,user_attrs_tail.pessimistic.arithmetic_mean_rank,user_attrs_tail.pessimistic.count,user_attrs_tail.pessimistic.geometric_mean_rank,user_attrs_tail.pessimistic.harmonic_mean_rank,user_attrs_tail.pessimistic.hits_at_1,user_attrs_tail.pessimistic.hits_at_10,user_attrs_tail.pessimistic.hits_at_3,user_attrs_tail.pessimistic.hits_at_5,user_attrs_tail.pessimistic.inverse_arithmetic_mean_rank,user_attrs_tail.pessimistic.inverse_geometric_mean_rank,user_attrs_tail.pessimistic.inverse_harmonic_mean_rank,user_attrs_tail.pessimistic.inverse_median_rank,user_attrs_tail.pessimistic.median_absolute_deviation,user_attrs_tail.pessimistic.median_rank,user_attrs_tail.pessimistic.standard_deviation,user_attrs_tail.pessimistic.variance,user_attrs_tail.pessimistic.z_arithmetic_mean_rank,user_attrs_tail.pessimistic.z_geometric_mean_rank,user_attrs_tail.pessimistic.z_hits_at_k,user_attrs_tail.pessimistic.z_inverse_harmonic_mean_rank,user_attrs_tail.realistic.adjusted_arithmetic_mean_rank,user_attrs_tail.realistic.adjusted_arithmetic_mean_rank_index,user_attrs_tail.realistic.adjusted_geometric_mean_rank_index,user_attrs_tail.realistic.adjusted_hits_at_k,user_attrs_tail.realistic.adjusted_inverse_harmonic_mean_rank,user_attrs_tail.realistic.arithmetic_mean_rank,user_attrs_tail.realistic.count,user_attrs_tail.realistic.geometric_mean_rank,user_attrs_tail.realistic.harmonic_mean_rank,user_attrs_tail.realistic.hits_at_1,user_attrs_tail.realistic.hits_at_10,user_attrs_tail.realistic.hits_at_3,user_attrs_tail.realistic.hits_at_5,user_attrs_tail.realistic.inverse_arithmetic_mean_rank,user_attrs_tail.realistic.inverse_geometric_mean_rank,user_attrs_tail.realistic.inverse_harmonic_mean_rank,user_attrs_tail.realistic.inverse_median_rank,user_attrs_tail.realistic.median_absolute_deviation,user_attrs_tail.realistic.median_rank,user_attrs_tail.realistic.standard_deviation,user_attrs_tail.realistic.variance,user_attrs_tail.realistic.z_arithmetic_mean_rank,user_attrs_tail.realistic.z_geometric_mean_rank,user_attrs_tail.realistic.z_hits_at_k,user_attrs_tail.realistic.z_inverse_harmonic_mean_rank,state
23,0.481164962053299,2025-07-14 17:00:53.109414,2025-07-14 17:09:02.893003,0 days 00:08:09.783589,4.0,200,xavier_uniform,12,0.01,2,1e-05,0.007151378598007983,0.9928936136838368,0.9995792939308669,0.5605390098542691,0.4810324462228966,157.8172488230846,163988.0,7.831268348694553,2.078289178110276,0.42399443861745983,0.5606385833109739,0.5071834524477401,0.5271666219479474,0.006336442989961219,0.12769323632827584,0.4811649940405642,0.3333333333333333,2.965204437011204,3.0,1576.6584350972478,2485851.820963302,696.3947979119205,404.9399623005372,15078.253605271417,31927.652376734644,0.0071513885457779435,0.992893603735616,0.9995792936328715,0.5605390098542691,0.48103243619960956,157.81746835134277,163988.0,7.8312731874336405,2.078289221392662,0.42399443861745983,0.5606385833109739,0.5071834524477401,0.5271666219479474,0.006336434175802008,0.12769315742996146,0.4811649840198372,0.3333333333333333,2.965204437011204,3.0,1576.6595086427585,2485855.206193625,696.3947909344466,404.9399621798162,15078.253605271417,31927.651711457227,0.007151383286762147,0.9928936089948701,0.9995792937863853,0.5605390098542691,0.48103241422745957,157.81735229492188,163988.0,7.831270694732666,2.078289316272429,0.42399443861745983,0.5606385833109739,0.5071834524477401,0.5271666219479474,0.006336438935250044,0.12769319117069244,0.481164962053299,0.3333333432674408,2.965204437011204,3.0,1576.6590576171875,2485853.75,696.3947946231774,404.93996224200623,15078.253605271417,31927.650253095795,0.012959171198783183,0.9870856809429293,0.9969776531465414,0.13331285336729695,0.060874186725399675,285.1995877747152,81994.0,49.941181056739325,16.362689416951085,0.015671878430129033,0.13350976900748834,0.043759299460936166,0.07176134839134571,0.0035063164284442087,0.02002355528724635,0.06111464775246791,0.018867924528301886,59.30408874022408,53.0,2156.025360752024,4648445.356205895,489.5441324450965,285.69877549463274,2532.2395721390744,2853.080870137615,0.01295918560731096,0.9870856665337467,0.9969776494255046,0.13331285336729695,0.060874166689059754,285.1999048710881,81994.0,49.94124131188079,16.36269478006094,0.015671878430129033,0.13350976900748834,0.043759299460936166,0.07176134839134571,0.003506312529984908,0.020023531128412396,0.061114627721258245,0.018867924528301886,59.30408874022408,53.0,2156.02652400251,4648450.372202347,489.5441252988772,285.6987744283143,2532.2395721390744,2853.0799310647303,0.01295917800436234,0.9870856741370408,0.9969776514897251,0.13331285336729695,0.060874178014509346,285.1997375488281,81994.0,49.94120788574219,16.362691748587167,0.015671878430129033,0.13350976900748834,0.043759299460936166,0.07176134839134571,0.0035063144750893116,0.020023545250296593,0.06111463904380798,0.01886792480945587,59.30408874022408,53.0,2156.02587890625,4648448.0,489.5441290697231,285.69877501984735,2532.2395721390744,2853.080461871388,844069977.0,0.0013753637040128531,0.9986697665150338,0.9999859959032887,0.9877646329504458,0.9011901669643398,30.43490987145401,81994.0,1.2280198956365909,1.1096127143545007,0.8323169988047906,0.9877673976144596,0.9706076054345439,0.9825718955045492,0.032857005465882314,0.8143190542378077,0.9012153403286604,1.0,0.0,1.0,539.264095937356,290805.765167134,495.2947823175235,286.56033456242807,18814.07014350397,42353.802992026314,0.0013753692154323156,0.9986697610033652,0.9999859959010845,0.9877646329504458,0.901190166954093,30.435031831597435,81994.0,1.2280199315275564,1.109612714367114,0.8323169988047906,0.9877673976144596,0.9706076054345439,0.9825718955045492,0.032856873800335806,0.8143190304379521,0.9012153403184161,1.0,0.0,1.0,539.265676561645,290807.4699174887,495.29477958398667,286.56033456179637,18814.07014350397,42353.80299154474,0.001375366459911804,0.9986697637590103,0.9999859958997797,0.9877646329504458,0.9011901414943029,30.43497085571289,81994.0,1.2280199527740479,1.1096127457062501,0.8323169988047906,0.9877673976144596,0.9706076054345439,0.9825718955045492,0.03285694122314453,0.8143190145492554,0.9012153148651123,1.0,0.0,1.0,539.264892578125,290806.59375,495.2947809506613,286.56033456142245,18814.07014350397,42353.80179499492,COMPLETE
24,0.4811975657939911,2025-07-14 17:09:02.924314,2025-07-14 17:18:42.522558,0 days 00:09:39.598244,4.0,300,xavier_uniform,12,0.01,2,1e-05,0.007370910959382644,0.9926740713740554,0.9995727275958664,0.5589043735550456,0.48106500328443413,162.66190818840403,163988.0,7.937890049086191,2.078148600278792,0.4245554552772154,0.5590043173890773,0.5076469009927556,0.5262336268507452,0.0061477208225157705,0.1259780614012309,0.4811975427868084,0.3333333333333333,2.965204437011204,3.0,1553.3076180361343,2412764.5562490895,696.2408155311838,404.9373022099734,15034.282605503744,31929.813292388757,0.007370924223075925,0.9926740581097611,0.9995727274050442,0.5589043735550456,0.48106499767947297,162.66220089274825,163988.0,7.937893147584948,2.078148624478765,0.4245554552772154,0.5590043173890773,0.5076469009927556,0.5262336268507452,0.0061477097599297375,0.12597801222661248,0.48119753718327873,0.3333333333333333,2.965204437011204,3.0,1553.3099682434795,2412771.857444559,696.2408062278853,404.93730213266934,15034.282605503744,31929.812920369666,0.00737091731024742,0.9926740650229028,0.9995727275369055,0.5589043735550456,0.48106502629749454,162.66204833984375,163988.0,7.937891006469727,2.07814850091764,0.4245554552772154,0.5590043173890773,0.5076469009927556,0.5262336268507452,0.006147715728729963,0.12597805261611938,0.4811975657939911,0.3333333432674408,2.965204437011204,3.0,1553.308837890625,2412768.25,696.2408110766182,404.9373021860878,15034.282605503744,31929.81481983872,0.013242288794504684,0.9868025504820556,0.996899073136019,0.129921590868333,0.06089638433560394,291.4303119740469,81994.0,51.213635446948395,16.356749960418536,0.01667195160621509,0.13011927702026976,0.04495450886650243,0.0700417103690514,0.0034313520554068314,0.019526049874664497,0.0611368396790246,0.01818181818181818,60.78669095872968,55.0,2113.62755753893,4467421.451987983,489.4037141830214,285.6762572238232,2467.8235096028693,2854.1212384849123,0.013242307082251478,0.9868025321934777,0.9968990710715743,0.129921590868333,0.06089637339995115,291.4307144425202,81994.0,51.21366887672024,16.35675288543022,0.01667195160621509,0.13011927702026976,0.04495450886650243,0.0700417103690514,0.0034313473166783636,0.019526037129016575,0.061136828746171865,0.01818181818181818,60.78669095872968,55.0,2113.630594881126,4467434.2916175425,489.40370511282,285.67625663222583,2467.8235096028693,2854.1207259474404,0.013242296472914883,0.9868025428032964,0.9968990722527538,0.129921590868333,0.06089637897861391,291.43048095703125,81994.0,51.21364974975586,16.356751393278312,0.01667195160621509,0.13011927702026976,0.04495450886650243,0.0700417103690514,0.003431349992752075,0.0195260439068079,0.06113683432340622,0.0181818176060915,60.78669095872968,55.0,2113.629150390625,4467428.0,489.4037103747487,285.6762569707104,2467.8235096028693,2854.120987410909,267986087.0,0.0015316587416964976,0.9985134644140061,0.9999858535143844,0.9878866206578192,0.9012330834639273,33.89350440276118,81994.0,1.2303383245786748,1.1095598898042773,0.8324389589482157,0.9878893577578848,0.9703392931190087,0.9824255433324389,0.029504178385240495,0.8127845650442911,0.9012582458945922,1.0,0.0,1.0,570.0395222115674,324945.056883192,495.2172635844048,286.5602937588445,18816.393657837856,42355.8199658408,0.001531667008825691,0.9985134561465033,0.9999858535047174,0.9878866206578192,0.9012330831896509,33.893687342976314,81994.0,1.2303384819812837,1.1095598901418593,0.8324389589482157,0.9878893577578848,0.9703392931190087,0.9824255433324389,0.029504019137275336,0.8127844610611897,0.9012582456203857,1.0,0.0,1.0,570.0410187942107,324946.76310794166,495.21725948409943,286.5602937560743,18816.393657837856,42355.819952950456,0.0015316629103424028,0.9985134602451718,0.9999858535064207,0.9878866206578192,0.9012330677746886,33.89359664916992,81994.0,1.230338454246521,1.1095599091147417,0.8324389589482157,0.9878893577578848,0.9703392931190087,0.9824255433324389,0.029504097998142242,0.8127844929695129,0.9012582302093506,1.0,0.0,1.0,570.040283203125,324945.90625,495.2172615168526,286.56029375656243,18816.393657837856,42355.81922848374,COMPLETE
