number,value,datetime_start,datetime_complete,duration,params_loss.margin,params_model.embedding_dim,params_model.entity_initializer,params_model.scoring_fct_norm,params_negative_sampler.num_negs_per_pos,params_optimizer.lr,params_regularizer.p,params_regularizer.weight,user_attrs_both.optimistic.adjusted_arithmetic_mean_rank,user_attrs_both.optimistic.adjusted_arithmetic_mean_rank_index,user_attrs_both.optimistic.adjusted_geometric_mean_rank_index,user_attrs_both.optimistic.adjusted_hits_at_k,user_attrs_both.optimistic.adjusted_inverse_harmonic_mean_rank,user_attrs_both.optimistic.arithmetic_mean_rank,user_attrs_both.optimistic.count,user_attrs_both.optimistic.geometric_mean_rank,user_attrs_both.optimistic.harmonic_mean_rank,user_attrs_both.optimistic.hits_at_1,user_attrs_both.optimistic.hits_at_10,user_attrs_both.optimistic.hits_at_3,user_attrs_both.optimistic.hits_at_5,user_attrs_both.optimistic.inverse_arithmetic_mean_rank,user_attrs_both.optimistic.inverse_geometric_mean_rank,user_attrs_both.optimistic.inverse_harmonic_mean_rank,user_attrs_both.optimistic.inverse_median_rank,user_attrs_both.optimistic.median_absolute_deviation,user_attrs_both.optimistic.median_rank,user_attrs_both.optimistic.standard_deviation,user_attrs_both.optimistic.variance,user_attrs_both.optimistic.z_arithmetic_mean_rank,user_attrs_both.optimistic.z_geometric_mean_rank,user_attrs_both.optimistic.z_hits_at_k,user_attrs_both.optimistic.z_inverse_harmonic_mean_rank,user_attrs_both.pessimistic.adjusted_arithmetic_mean_rank,user_attrs_both.pessimistic.adjusted_arithmetic_mean_rank_index,user_attrs_both.pessimistic.adjusted_geometric_mean_rank_index,user_attrs_both.pessimistic.adjusted_hits_at_k,user_attrs_both.pessimistic.adjusted_inverse_harmonic_mean_rank,user_attrs_both.pessimistic.arithmetic_mean_rank,user_attrs_both.pessimistic.count,user_attrs_both.pessimistic.geometric_mean_rank,user_attrs_both.pessimistic.harmonic_mean_rank,user_attrs_both.pessimistic.hits_at_1,user_attrs_both.pessimistic.hits_at_10,user_attrs_both.pessimistic.hits_at_3,user_attrs_both.pessimistic.hits_at_5,user_attrs_both.pessimistic.inverse_arithmetic_mean_rank,user_attrs_both.pessimistic.inverse_geometric_mean_rank,user_attrs_both.pessimistic.inverse_harmonic_mean_rank,user_attrs_both.pessimistic.inverse_median_rank,user_attrs_both.pessimistic.median_absolute_deviation,user_attrs_both.pessimistic.median_rank,user_attrs_both.pessimistic.standard_deviation,user_attrs_both.pessimistic.variance,user_attrs_both.pessimistic.z_arithmetic_mean_rank,user_attrs_both.pessimistic.z_geometric_mean_rank,user_attrs_both.pessimistic.z_hits_at_k,user_attrs_both.pessimistic.z_inverse_harmonic_mean_rank,user_attrs_both.realistic.adjusted_arithmetic_mean_rank,user_attrs_both.realistic.adjusted_arithmetic_mean_rank_index,user_attrs_both.realistic.adjusted_geometric_mean_rank_index,user_attrs_both.realistic.adjusted_hits_at_k,user_attrs_both.realistic.adjusted_inverse_harmonic_mean_rank,user_attrs_both.realistic.arithmetic_mean_rank,user_attrs_both.realistic.count,user_attrs_both.realistic.geometric_mean_rank,user_attrs_both.realistic.harmonic_mean_rank,user_attrs_both.realistic.hits_at_1,user_attrs_both.realistic.hits_at_10,user_attrs_both.realistic.hits_at_3,user_attrs_both.realistic.hits_at_5,user_attrs_both.realistic.inverse_arithmetic_mean_rank,user_attrs_both.realistic.inverse_geometric_mean_rank,user_attrs_both.realistic.inverse_harmonic_mean_rank,user_attrs_both.realistic.inverse_median_rank,user_attrs_both.realistic.median_absolute_deviation,user_attrs_both.realistic.median_rank,user_attrs_both.realistic.standard_deviation,user_attrs_both.realistic.variance,user_attrs_both.realistic.z_arithmetic_mean_rank,user_attrs_both.realistic.z_geometric_mean_rank,user_attrs_both.realistic.z_hits_at_k,user_attrs_both.realistic.z_inverse_harmonic_mean_rank,user_attrs_head.optimistic.adjusted_arithmetic_mean_rank,user_attrs_head.optimistic.adjusted_arithmetic_mean_rank_index,user_attrs_head.optimistic.adjusted_geometric_mean_rank_index,user_attrs_head.optimistic.adjusted_hits_at_k,user_attrs_head.optimistic.adjusted_inverse_harmonic_mean_rank,user_attrs_head.optimistic.arithmetic_mean_rank,user_attrs_head.optimistic.count,user_attrs_head.optimistic.geometric_mean_rank,user_attrs_head.optimistic.harmonic_mean_rank,user_attrs_head.optimistic.hits_at_1,user_attrs_head.optimistic.hits_at_10,user_attrs_head.optimistic.hits_at_3,user_attrs_head.optimistic.hits_at_5,user_attrs_head.optimistic.inverse_arithmetic_mean_rank,user_attrs_head.optimistic.inverse_geometric_mean_rank,user_attrs_head.optimistic.inverse_harmonic_mean_rank,user_attrs_head.optimistic.inverse_median_rank,user_attrs_head.optimistic.median_absolute_deviation,user_attrs_head.optimistic.median_rank,user_attrs_head.optimistic.standard_deviation,user_attrs_head.optimistic.variance,user_attrs_head.optimistic.z_arithmetic_mean_rank,user_attrs_head.optimistic.z_geometric_mean_rank,user_attrs_head.optimistic.z_hits_at_k,user_attrs_head.optimistic.z_inverse_harmonic_mean_rank,user_attrs_head.pessimistic.adjusted_arithmetic_mean_rank,user_attrs_head.pessimistic.adjusted_arithmetic_mean_rank_index,user_attrs_head.pessimistic.adjusted_geometric_mean_rank_index,user_attrs_head.pessimistic.adjusted_hits_at_k,user_attrs_head.pessimistic.adjusted_inverse_harmonic_mean_rank,user_attrs_head.pessimistic.arithmetic_mean_rank,user_attrs_head.pessimistic.count,user_attrs_head.pessimistic.geometric_mean_rank,user_attrs_head.pessimistic.harmonic_mean_rank,user_attrs_head.pessimistic.hits_at_1,user_attrs_head.pessimistic.hits_at_10,user_attrs_head.pessimistic.hits_at_3,user_attrs_head.pessimistic.hits_at_5,user_attrs_head.pessimistic.inverse_arithmetic_mean_rank,user_attrs_head.pessimistic.inverse_geometric_mean_rank,user_attrs_head.pessimistic.inverse_harmonic_mean_rank,user_attrs_head.pessimistic.inverse_median_rank,user_attrs_head.pessimistic.median_absolute_deviation,user_attrs_head.pessimistic.median_rank,user_attrs_head.pessimistic.standard_deviation,user_attrs_head.pessimistic.variance,user_attrs_head.pessimistic.z_arithmetic_mean_rank,user_attrs_head.pessimistic.z_geometric_mean_rank,user_attrs_head.pessimistic.z_hits_at_k,user_attrs_head.pessimistic.z_inverse_harmonic_mean_rank,user_attrs_head.realistic.adjusted_arithmetic_mean_rank,user_attrs_head.realistic.adjusted_arithmetic_mean_rank_index,user_attrs_head.realistic.adjusted_geometric_mean_rank_index,user_attrs_head.realistic.adjusted_hits_at_k,user_attrs_head.realistic.adjusted_inverse_harmonic_mean_rank,user_attrs_head.realistic.arithmetic_mean_rank,user_attrs_head.realistic.count,user_attrs_head.realistic.geometric_mean_rank,user_attrs_head.realistic.harmonic_mean_rank,user_attrs_head.realistic.hits_at_1,user_attrs_head.realistic.hits_at_10,user_attrs_head.realistic.hits_at_3,user_attrs_head.realistic.hits_at_5,user_attrs_head.realistic.inverse_arithmetic_mean_rank,user_attrs_head.realistic.inverse_geometric_mean_rank,user_attrs_head.realistic.inverse_harmonic_mean_rank,user_attrs_head.realistic.inverse_median_rank,user_attrs_head.realistic.median_absolute_deviation,user_attrs_head.realistic.median_rank,user_attrs_head.realistic.standard_deviation,user_attrs_head.realistic.variance,user_attrs_head.realistic.z_arithmetic_mean_rank,user_attrs_head.realistic.z_geometric_mean_rank,user_attrs_head.realistic.z_hits_at_k,user_attrs_head.realistic.z_inverse_harmonic_mean_rank,user_attrs_random_seed,user_attrs_tail.optimistic.adjusted_arithmetic_mean_rank,user_attrs_tail.optimistic.adjusted_arithmetic_mean_rank_index,user_attrs_tail.optimistic.adjusted_geometric_mean_rank_index,user_attrs_tail.optimistic.adjusted_hits_at_k,user_attrs_tail.optimistic.adjusted_inverse_harmonic_mean_rank,user_attrs_tail.optimistic.arithmetic_mean_rank,user_attrs_tail.optimistic.count,user_attrs_tail.optimistic.geometric_mean_rank,user_attrs_tail.optimistic.harmonic_mean_rank,user_attrs_tail.optimistic.hits_at_1,user_attrs_tail.optimistic.hits_at_10,user_attrs_tail.optimistic.hits_at_3,user_attrs_tail.optimistic.hits_at_5,user_attrs_tail.optimistic.inverse_arithmetic_mean_rank,user_attrs_tail.optimistic.inverse_geometric_mean_rank,user_attrs_tail.optimistic.inverse_harmonic_mean_rank,user_attrs_tail.optimistic.inverse_median_rank,user_attrs_tail.optimistic.median_absolute_deviation,user_attrs_tail.optimistic.median_rank,user_attrs_tail.optimistic.standard_deviation,user_attrs_tail.optimistic.variance,user_attrs_tail.optimistic.z_arithmetic_mean_rank,user_attrs_tail.optimistic.z_geometric_mean_rank,user_attrs_tail.optimistic.z_hits_at_k,user_attrs_tail.optimistic.z_inverse_harmonic_mean_rank,user_attrs_tail.pessimistic.adjusted_arithmetic_mean_rank,user_attrs_tail.pessimistic.adjusted_arithmetic_mean_rank_index,user_attrs_tail.pessimistic.adjusted_geometric_mean_rank_index,user_attrs_tail.pessimistic.adjusted_hits_at_k,user_attrs_tail.pessimistic.adjusted_inverse_harmonic_mean_rank,user_attrs_tail.pessimistic.arithmetic_mean_rank,user_attrs_tail.pessimistic.count,user_attrs_tail.pessimistic.geometric_mean_rank,user_attrs_tail.pessimistic.harmonic_mean_rank,user_attrs_tail.pessimistic.hits_at_1,user_attrs_tail.pessimistic.hits_at_10,user_attrs_tail.pessimistic.hits_at_3,user_attrs_tail.pessimistic.hits_at_5,user_attrs_tail.pessimistic.inverse_arithmetic_mean_rank,user_attrs_tail.pessimistic.inverse_geometric_mean_rank,user_attrs_tail.pessimistic.inverse_harmonic_mean_rank,user_attrs_tail.pessimistic.inverse_median_rank,user_attrs_tail.pessimistic.median_absolute_deviation,user_attrs_tail.pessimistic.median_rank,user_attrs_tail.pessimistic.standard_deviation,user_attrs_tail.pessimistic.variance,user_attrs_tail.pessimistic.z_arithmetic_mean_rank,user_attrs_tail.pessimistic.z_geometric_mean_rank,user_attrs_tail.pessimistic.z_hits_at_k,user_attrs_tail.pessimistic.z_inverse_harmonic_mean_rank,user_attrs_tail.realistic.adjusted_arithmetic_mean_rank,user_attrs_tail.realistic.adjusted_arithmetic_mean_rank_index,user_attrs_tail.realistic.adjusted_geometric_mean_rank_index,user_attrs_tail.realistic.adjusted_hits_at_k,user_attrs_tail.realistic.adjusted_inverse_harmonic_mean_rank,user_attrs_tail.realistic.arithmetic_mean_rank,user_attrs_tail.realistic.count,user_attrs_tail.realistic.geometric_mean_rank,user_attrs_tail.realistic.harmonic_mean_rank,user_attrs_tail.realistic.hits_at_1,user_attrs_tail.realistic.hits_at_10,user_attrs_tail.realistic.hits_at_3,user_attrs_tail.realistic.hits_at_5,user_attrs_tail.realistic.inverse_arithmetic_mean_rank,user_attrs_tail.realistic.inverse_geometric_mean_rank,user_attrs_tail.realistic.inverse_harmonic_mean_rank,user_attrs_tail.realistic.inverse_median_rank,user_attrs_tail.realistic.median_absolute_deviation,user_attrs_tail.realistic.median_rank,user_attrs_tail.realistic.standard_deviation,user_attrs_tail.realistic.variance,user_attrs_tail.realistic.z_arithmetic_mean_rank,user_attrs_tail.realistic.z_geometric_mean_rank,user_attrs_tail.realistic.z_hits_at_k,user_attrs_tail.realistic.z_inverse_harmonic_mean_rank,state
18,0.15641631186008453,2025-07-14 12:44:50.396133,2025-07-14 12:51:51.417918,0 days 00:07:01.021785,5.0,300,xavier_uniform_norm,1.0,12,0.0001,1,0.01,0.09324082060539353,0.9068002704166265,0.995973658839284,0.38241244835231314,0.15620081630952157,2057.6465899943896,163988.0,66.37822710504801,6.393194436586097,0.0,0.38255238188160107,0.26073249262141135,0.32715808473790764,0.00048599210615790276,0.015065180912672354,0.15641632831896007,0.011363636363636364,127.50379079148176,88.0,5852.112529784029,34247221.061255224,636.0107290047941,403.47928204543376,10286.727197752089,10367.544649538459,0.09324091455655427,0.9068001764612083,0.9959736556514731,0.38241244835231314,0.15620080992159718,2057.648663316828,163988.0,66.37827886753276,6.393194697612642,0.0,0.38255238188160107,0.26073249262141135,0.32715808473790764,0.0004859916164638376,0.015065169164684752,0.15641632193266722,0.011363636363636364,127.50379079148176,88.0,5852.115684798083,34247257.98825973,636.0106631064303,403.4792807540184,10286.727197752089,10367.544225551614,0.09324087113463556,0.9068002198850946,0.9959736583614904,0.38241244835231314,0.15620079984644122,2057.647705078125,163988.0,66.37823486328125,6.39319510930872,0.0,0.38255238188160107,0.26073249262141135,0.32715808473790764,0.00048599185538478196,0.015065179206430912,0.15641631186008453,0.011363636702299118,127.50379079148176,88.0,5852.1142578125,34247240.0,636.0106935630354,403.47928185187465,10286.727197752089,10367.54355683149,0.18653643212929544,0.8135005324846896,0.9428819900402917,-0.00015406390307906156,0.002307688577980573,4105.209564114447,81994.0,925.917953688807,390.1456354333312,0.0,7.31760860550772e-05,3.65880430275386e-05,3.65880430275386e-05,0.00024359292366983327,0.0010800092988974392,0.002563145423603955,0.002304147465437788,382.51137237444533,434.0,7753.001139612344,60109026.6708303,403.45475586112457,270.196858615906,-2.926399834381618,108.1578660881604,0.18653661999433074,0.8135003446111174,0.9428819210763437,-0.00015406390307906156,0.0023076860535000427,4105.21369856331,81994.0,925.9190704292832,390.1460195956327,0.0,7.31760860550772e-05,3.65880430275386e-05,3.65880430275386e-05,0.00024359267834216943,0.0010800079963104881,0.002563142899769812,0.002304147465437788,382.51137237444533,434.0,7753.004813818358,60109083.64309064,403.4546626854189,270.19683885326094,-2.926399834381618,108.15774776958408,0.186536538908479,0.8135004257006538,0.9428819551873351,-0.00015406390307906156,0.0023076872343734526,4105.2119140625,81994.0,925.9185180664062,390.14583989637214,0.0,7.31760860550772e-05,3.65880430275386e-05,3.65880430275386e-05,0.00024359278904739767,0.001080008689314127,0.0025631440803408623,0.0023041474632918835,382.51137237444533,434.0,7753.0029296875,60109056.0,403.4547029016914,270.1968486282729,-2.926399834381618,108.15780311533106,673164115.0,0.00045568195658671315,0.9995894898250623,0.9997691616552836,0.7649784829743648,0.3100937467086234,10.083615874332269,81994.0,4.758595527882131,3.2230044005492315,0.0,0.7650315876771471,0.5214283971997951,0.6542795814327877,0.09917077489489547,0.21014603870841317,0.3102695112143161,0.3333333333333333,1.482602218505602,3.0,19.677034975121924,387.1857054121714,495.7509232480962,286.498197597603,14570.635915522795,14573.671505312868,0.0004556825077286594,0.9995894892738955,0.9997691615519622,0.7649784829743648,0.3100937364572602,10.083628070346611,81994.0,4.758597210200199,3.223004507010779,0.0,0.7650315876771471,0.5214283971997951,0.6542795814327877,0.09917065494915922,0.21014596441498962,0.3102695009655646,0.3333333333333333,1.482602218505602,3.0,19.677050108620566,387.1863009771646,495.75092297474254,286.4981975679948,14570.635915522795,14573.671023523082,0.00045568223244782293,0.9995894895491887,0.9997691616004755,0.7649784829743648,0.31009374027820674,10.083621978759766,81994.0,4.758596420288086,3.2230044673298233,0.0,0.7650315876771471,0.5214283971997951,0.6542795814327877,0.09917071461677551,0.2101459950208664,0.3102695047855377,0.3333333432674408,1.482602218505602,3.0,19.67704200744629,387.1860046386719,495.7509231112755,286.498197581897,14570.635915522795,14573.671203098518,COMPLETE
19,0.10833677649497984,2025-07-14 12:51:51.448513,2025-07-14 12:57:52.124814,0 days 00:06:00.676301,2.0,200,xavier_uniform_norm,1.5,4,1e-05,1,1e-05,0.4209950600819565,0.57903117831218,0.9746012036460756,0.1956064560526144,0.1081089995084639,9290.55583335366,163988.0,413.41618877783185,9.230474324840056,0.06297412005756518,0.1957887162475303,0.11327658121325951,0.14376051906237042,0.00010763618646044182,0.0024188699599700385,0.10833679449266306,0.0051813471502590676,284.6596259530756,193.0,12934.03772227152,167289331.80114266,406.12034849265547,394.8210782863568,5261.727907137978,7175.537912682524,0.420995755320546,0.5790304830420849,0.9746011350766448,0.1956064560526144,0.10810895416919863,9290.571175939704,163988.0,413.4173021826927,9.230478186835533,0.06297412005756518,0.1957887162475303,0.11327658121325951,0.14376051906237042,0.00010763600870845855,0.0024188634455315837,0.10833674916497776,0.0051813471502590676,284.6596259530756,193.0,12934.050930069543,167289673.4616328,406.1198608447637,394.8210505081676,5261.727907137978,7175.534903371382,0.42099540642863614,0.5790308319498052,0.9746011729621661,0.1956064560526144,0.10810898150618277,9290.5634765625,163988.0,413.41668701171875,9.23047585827273,0.06297412005756518,0.1957887162475303,0.11327658121325951,0.14376051906237042,0.0001076361004379578,0.002418867079541087,0.10833677649497984,0.005181347019970417,284.6596259530756,193.0,12934.0439453125,167289504.0,406.1201055613356,394.8210658559861,5261.727907137978,7175.536717813907,0.8426588550412141,0.1573482947008482,0.26460275943293377,0.000638857184808192,0.00040507151229697596,18544.85556260214,81994.0,11909.365003848947,1512.823786621845,0.0001463521721101544,0.0008659170183184135,0.00031709637290533454,0.00042686050198795033,5.392331024764714e-05,8.39675330865091e-05,0.0006610155186897298,5.853601428278749e-05,15990.60622769217,17083.5,12778.59573783853,163292509.03110504,78.036725593526,75.82585640099441,12.13490975142175,18.98508784988828,0.8426602438016223,0.15734690587733335,0.26460071670775864,0.000638857184808192,0.0004050687150487521,18544.886125814082,81994.0,11909.398081912947,1512.8301868921878,0.0001463521721101544,0.0008659170183184135,0.00031709637290533454,0.00042686050198795033,5.392322137842742e-05,8.396729986872477e-05,0.000661012722157735,5.853601428278749e-05,15990.60622769217,17083.5,12778.60042874904,163292628.91762513,78.03603680792628,75.82527102771209,12.13490975142175,18.984956747103574,0.8426595607603408,0.15734758894965295,0.2646020818165469,0.000638857184808192,0.0004050701068225978,18544.87109375,81994.0,11909.3759765625,1512.827002424064,0.0001463521721101544,0.0008659170183184135,0.00031709637290533454,0.00042686050198795033,5.3923264204058796e-05,8.39674539747648e-05,0.0006610141135752201,5.8536013966659084e-05,15990.60622769217,17083.5,12778.59765625,163292560.0,78.03637557694356,75.82566221993989,12.13490975142175,18.985021977434332,1527186779.0,0.0016384254083809293,0.9984066929222825,0.9991800249162239,0.39057381150385756,0.21581278939918627,36.25610410517843,81994.0,14.35113837625693,4.62936015228971,0.12580188794302022,0.3907115154767422,0.22623606605361368,0.2870941776227529,0.02758156246184131,0.06968088341022745,0.21601257346663638,0.05555555555555555,23.721635496089633,18.0,45.02903111675942,2027.6136433140882,495.164309780731,286.3293720123052,7439.305721951195,10142.689856639872,0.0016384309198003918,0.998406687410614,0.9991800226167803,0.39057381150385756,0.21581270151795853,36.256226065321854,81994.0,14.351175816650727,4.629362035191086,0.12580188794302022,0.3907115154767422,0.22623606605361368,0.2870941776227529,0.027581469681878287,0.06968070162165846,0.2160124856077978,0.05555555555555555,23.721635496089633,18.0,45.02913171990945,2027.6227034489552,495.1643070471941,286.3293713533667,7439.305721951195,10142.685726430353,0.0016384281399378336,0.9984066901906021,0.9991800238194252,0.39057381150385756,0.2158127384978214,36.25616455078125,81994.0,14.351156234741211,4.629361242877951,0.12580188794302022,0.3907115154767422,0.22623606605361368,0.2870941776227529,0.02758151665329933,0.06968079507350922,0.21601252257823944,0.0555555559694767,23.721635496089633,18.0,45.02907943725586,2027.6181640625,495.1643084259418,286.3293716980018,7439.305721951195,10142.687464396304,COMPLETE
