number,value,datetime_start,datetime_complete,duration,params_model.dropout_0,params_model.dropout_1,params_model.dropout_2,params_model.embedding_dim,params_model.entity_initializer,params_model.relation_dim,params_negative_sampler.num_negs_per_pos,params_optimizer.lr,user_attrs_both.optimistic.adjusted_arithmetic_mean_rank,user_attrs_both.optimistic.adjusted_arithmetic_mean_rank_index,user_attrs_both.optimistic.adjusted_geometric_mean_rank_index,user_attrs_both.optimistic.adjusted_hits_at_k,user_attrs_both.optimistic.adjusted_inverse_harmonic_mean_rank,user_attrs_both.optimistic.arithmetic_mean_rank,user_attrs_both.optimistic.count,user_attrs_both.optimistic.geometric_mean_rank,user_attrs_both.optimistic.harmonic_mean_rank,user_attrs_both.optimistic.hits_at_1,user_attrs_both.optimistic.hits_at_10,user_attrs_both.optimistic.hits_at_3,user_attrs_both.optimistic.hits_at_5,user_attrs_both.optimistic.inverse_arithmetic_mean_rank,user_attrs_both.optimistic.inverse_geometric_mean_rank,user_attrs_both.optimistic.inverse_harmonic_mean_rank,user_attrs_both.optimistic.inverse_median_rank,user_attrs_both.optimistic.median_absolute_deviation,user_attrs_both.optimistic.median_rank,user_attrs_both.optimistic.standard_deviation,user_attrs_both.optimistic.variance,user_attrs_both.optimistic.z_arithmetic_mean_rank,user_attrs_both.optimistic.z_geometric_mean_rank,user_attrs_both.optimistic.z_hits_at_k,user_attrs_both.optimistic.z_inverse_harmonic_mean_rank,user_attrs_both.pessimistic.adjusted_arithmetic_mean_rank,user_attrs_both.pessimistic.adjusted_arithmetic_mean_rank_index,user_attrs_both.pessimistic.adjusted_geometric_mean_rank_index,user_attrs_both.pessimistic.adjusted_hits_at_k,user_attrs_both.pessimistic.adjusted_inverse_harmonic_mean_rank,user_attrs_both.pessimistic.arithmetic_mean_rank,user_attrs_both.pessimistic.count,user_attrs_both.pessimistic.geometric_mean_rank,user_attrs_both.pessimistic.harmonic_mean_rank,user_attrs_both.pessimistic.hits_at_1,user_attrs_both.pessimistic.hits_at_10,user_attrs_both.pessimistic.hits_at_3,user_attrs_both.pessimistic.hits_at_5,user_attrs_both.pessimistic.inverse_arithmetic_mean_rank,user_attrs_both.pessimistic.inverse_geometric_mean_rank,user_attrs_both.pessimistic.inverse_harmonic_mean_rank,user_attrs_both.pessimistic.inverse_median_rank,user_attrs_both.pessimistic.median_absolute_deviation,user_attrs_both.pessimistic.median_rank,user_attrs_both.pessimistic.standard_deviation,user_attrs_both.pessimistic.variance,user_attrs_both.pessimistic.z_arithmetic_mean_rank,user_attrs_both.pessimistic.z_geometric_mean_rank,user_attrs_both.pessimistic.z_hits_at_k,user_attrs_both.pessimistic.z_inverse_harmonic_mean_rank,user_attrs_both.realistic.adjusted_arithmetic_mean_rank,user_attrs_both.realistic.adjusted_arithmetic_mean_rank_index,user_attrs_both.realistic.adjusted_geometric_mean_rank_index,user_attrs_both.realistic.adjusted_hits_at_k,user_attrs_both.realistic.adjusted_inverse_harmonic_mean_rank,user_attrs_both.realistic.arithmetic_mean_rank,user_attrs_both.realistic.count,user_attrs_both.realistic.geometric_mean_rank,user_attrs_both.realistic.harmonic_mean_rank,user_attrs_both.realistic.hits_at_1,user_attrs_both.realistic.hits_at_10,user_attrs_both.realistic.hits_at_3,user_attrs_both.realistic.hits_at_5,user_attrs_both.realistic.inverse_arithmetic_mean_rank,user_attrs_both.realistic.inverse_geometric_mean_rank,user_attrs_both.realistic.inverse_harmonic_mean_rank,user_attrs_both.realistic.inverse_median_rank,user_attrs_both.realistic.median_absolute_deviation,user_attrs_both.realistic.median_rank,user_attrs_both.realistic.standard_deviation,user_attrs_both.realistic.variance,user_attrs_both.realistic.z_arithmetic_mean_rank,user_attrs_both.realistic.z_geometric_mean_rank,user_attrs_both.realistic.z_hits_at_k,user_attrs_both.realistic.z_inverse_harmonic_mean_rank,user_attrs_head.optimistic.adjusted_arithmetic_mean_rank,user_attrs_head.optimistic.adjusted_arithmetic_mean_rank_index,user_attrs_head.optimistic.adjusted_geometric_mean_rank_index,user_attrs_head.optimistic.adjusted_hits_at_k,user_attrs_head.optimistic.adjusted_inverse_harmonic_mean_rank,user_attrs_head.optimistic.arithmetic_mean_rank,user_attrs_head.optimistic.count,user_attrs_head.optimistic.geometric_mean_rank,user_attrs_head.optimistic.harmonic_mean_rank,user_attrs_head.optimistic.hits_at_1,user_attrs_head.optimistic.hits_at_10,user_attrs_head.optimistic.hits_at_3,user_attrs_head.optimistic.hits_at_5,user_attrs_head.optimistic.inverse_arithmetic_mean_rank,user_attrs_head.optimistic.inverse_geometric_mean_rank,user_attrs_head.optimistic.inverse_harmonic_mean_rank,user_attrs_head.optimistic.inverse_median_rank,user_attrs_head.optimistic.median_absolute_deviation,user_attrs_head.optimistic.median_rank,user_attrs_head.optimistic.standard_deviation,user_attrs_head.optimistic.variance,user_attrs_head.optimistic.z_arithmetic_mean_rank,user_attrs_head.optimistic.z_geometric_mean_rank,user_attrs_head.optimistic.z_hits_at_k,user_attrs_head.optimistic.z_inverse_harmonic_mean_rank,user_attrs_head.pessimistic.adjusted_arithmetic_mean_rank,user_attrs_head.pessimistic.adjusted_arithmetic_mean_rank_index,user_attrs_head.pessimistic.adjusted_geometric_mean_rank_index,user_attrs_head.pessimistic.adjusted_hits_at_k,user_attrs_head.pessimistic.adjusted_inverse_harmonic_mean_rank,user_attrs_head.pessimistic.arithmetic_mean_rank,user_attrs_head.pessimistic.count,user_attrs_head.pessimistic.geometric_mean_rank,user_attrs_head.pessimistic.harmonic_mean_rank,user_attrs_head.pessimistic.hits_at_1,user_attrs_head.pessimistic.hits_at_10,user_attrs_head.pessimistic.hits_at_3,user_attrs_head.pessimistic.hits_at_5,user_attrs_head.pessimistic.inverse_arithmetic_mean_rank,user_attrs_head.pessimistic.inverse_geometric_mean_rank,user_attrs_head.pessimistic.inverse_harmonic_mean_rank,user_attrs_head.pessimistic.inverse_median_rank,user_attrs_head.pessimistic.median_absolute_deviation,user_attrs_head.pessimistic.median_rank,user_attrs_head.pessimistic.standard_deviation,user_attrs_head.pessimistic.variance,user_attrs_head.pessimistic.z_arithmetic_mean_rank,user_attrs_head.pessimistic.z_geometric_mean_rank,user_attrs_head.pessimistic.z_hits_at_k,user_attrs_head.pessimistic.z_inverse_harmonic_mean_rank,user_attrs_head.realistic.adjusted_arithmetic_mean_rank,user_attrs_head.realistic.adjusted_arithmetic_mean_rank_index,user_attrs_head.realistic.adjusted_geometric_mean_rank_index,user_attrs_head.realistic.adjusted_hits_at_k,user_attrs_head.realistic.adjusted_inverse_harmonic_mean_rank,user_attrs_head.realistic.arithmetic_mean_rank,user_attrs_head.realistic.count,user_attrs_head.realistic.geometric_mean_rank,user_attrs_head.realistic.harmonic_mean_rank,user_attrs_head.realistic.hits_at_1,user_attrs_head.realistic.hits_at_10,user_attrs_head.realistic.hits_at_3,user_attrs_head.realistic.hits_at_5,user_attrs_head.realistic.inverse_arithmetic_mean_rank,user_attrs_head.realistic.inverse_geometric_mean_rank,user_attrs_head.realistic.inverse_harmonic_mean_rank,user_attrs_head.realistic.inverse_median_rank,user_attrs_head.realistic.median_absolute_deviation,user_attrs_head.realistic.median_rank,user_attrs_head.realistic.standard_deviation,user_attrs_head.realistic.variance,user_attrs_head.realistic.z_arithmetic_mean_rank,user_attrs_head.realistic.z_geometric_mean_rank,user_attrs_head.realistic.z_hits_at_k,user_attrs_head.realistic.z_inverse_harmonic_mean_rank,user_attrs_random_seed,user_attrs_tail.optimistic.adjusted_arithmetic_mean_rank,user_attrs_tail.optimistic.adjusted_arithmetic_mean_rank_index,user_attrs_tail.optimistic.adjusted_geometric_mean_rank_index,user_attrs_tail.optimistic.adjusted_hits_at_k,user_attrs_tail.optimistic.adjusted_inverse_harmonic_mean_rank,user_attrs_tail.optimistic.arithmetic_mean_rank,user_attrs_tail.optimistic.count,user_attrs_tail.optimistic.geometric_mean_rank,user_attrs_tail.optimistic.harmonic_mean_rank,user_attrs_tail.optimistic.hits_at_1,user_attrs_tail.optimistic.hits_at_10,user_attrs_tail.optimistic.hits_at_3,user_attrs_tail.optimistic.hits_at_5,user_attrs_tail.optimistic.inverse_arithmetic_mean_rank,user_attrs_tail.optimistic.inverse_geometric_mean_rank,user_attrs_tail.optimistic.inverse_harmonic_mean_rank,user_attrs_tail.optimistic.inverse_median_rank,user_attrs_tail.optimistic.median_absolute_deviation,user_attrs_tail.optimistic.median_rank,user_attrs_tail.optimistic.standard_deviation,user_attrs_tail.optimistic.variance,user_attrs_tail.optimistic.z_arithmetic_mean_rank,user_attrs_tail.optimistic.z_geometric_mean_rank,user_attrs_tail.optimistic.z_hits_at_k,user_attrs_tail.optimistic.z_inverse_harmonic_mean_rank,user_attrs_tail.pessimistic.adjusted_arithmetic_mean_rank,user_attrs_tail.pessimistic.adjusted_arithmetic_mean_rank_index,user_attrs_tail.pessimistic.adjusted_geometric_mean_rank_index,user_attrs_tail.pessimistic.adjusted_hits_at_k,user_attrs_tail.pessimistic.adjusted_inverse_harmonic_mean_rank,user_attrs_tail.pessimistic.arithmetic_mean_rank,user_attrs_tail.pessimistic.count,user_attrs_tail.pessimistic.geometric_mean_rank,user_attrs_tail.pessimistic.harmonic_mean_rank,user_attrs_tail.pessimistic.hits_at_1,user_attrs_tail.pessimistic.hits_at_10,user_attrs_tail.pessimistic.hits_at_3,user_attrs_tail.pessimistic.hits_at_5,user_attrs_tail.pessimistic.inverse_arithmetic_mean_rank,user_attrs_tail.pessimistic.inverse_geometric_mean_rank,user_attrs_tail.pessimistic.inverse_harmonic_mean_rank,user_attrs_tail.pessimistic.inverse_median_rank,user_attrs_tail.pessimistic.median_absolute_deviation,user_attrs_tail.pessimistic.median_rank,user_attrs_tail.pessimistic.standard_deviation,user_attrs_tail.pessimistic.variance,user_attrs_tail.pessimistic.z_arithmetic_mean_rank,user_attrs_tail.pessimistic.z_geometric_mean_rank,user_attrs_tail.pessimistic.z_hits_at_k,user_attrs_tail.pessimistic.z_inverse_harmonic_mean_rank,user_attrs_tail.realistic.adjusted_arithmetic_mean_rank,user_attrs_tail.realistic.adjusted_arithmetic_mean_rank_index,user_attrs_tail.realistic.adjusted_geometric_mean_rank_index,user_attrs_tail.realistic.adjusted_hits_at_k,user_attrs_tail.realistic.adjusted_inverse_harmonic_mean_rank,user_attrs_tail.realistic.arithmetic_mean_rank,user_attrs_tail.realistic.count,user_attrs_tail.realistic.geometric_mean_rank,user_attrs_tail.realistic.harmonic_mean_rank,user_attrs_tail.realistic.hits_at_1,user_attrs_tail.realistic.hits_at_10,user_attrs_tail.realistic.hits_at_3,user_attrs_tail.realistic.hits_at_5,user_attrs_tail.realistic.inverse_arithmetic_mean_rank,user_attrs_tail.realistic.inverse_geometric_mean_rank,user_attrs_tail.realistic.inverse_harmonic_mean_rank,user_attrs_tail.realistic.inverse_median_rank,user_attrs_tail.realistic.median_absolute_deviation,user_attrs_tail.realistic.median_rank,user_attrs_tail.realistic.standard_deviation,user_attrs_tail.realistic.variance,user_attrs_tail.realistic.z_arithmetic_mean_rank,user_attrs_tail.realistic.z_geometric_mean_rank,user_attrs_tail.realistic.z_hits_at_k,user_attrs_tail.realistic.z_inverse_harmonic_mean_rank,state
10,0.49565649032592773,2025-07-07 19:51:57.586446,2025-07-07 21:56:34.383723,0 days 02:04:36.797277,0.1,0.2,0.2,400,xavier_uniform_norm,128,14,0.001,0.005653876954320683,0.994391183188842,0.9996666470372702,0.5838569746749094,0.49552767014787463,124.77025148181575,163988.0,6.412861164403537,2.01752618627692,0.43619045295997266,0.5839512647266873,0.5170378320364905,0.5398138888211332,0.00801473098053138,0.15593663645032466,0.4956565157874699,0.3333333333333333,2.965204437011204,3.0,1492.1065888307369,2226382.072432098,697.4451618163954,404.9753499519507,15705.49663553941,32889.74646047797,0.005653878888609286,0.9943911812544658,0.9996666469727824,0.5838569746749094,0.4955276660302217,124.77029416786594,163988.0,6.4128622115328255,2.017526203033183,0.43619045295997266,0.5839512647266873,0.5170378320364905,0.5398138888211332,0.008014728238554925,0.1559366109880874,0.4956565116708686,0.3333333333333333,2.965204437011204,3.0,1492.1070829509958,2226383.54699253,697.4451604596644,404.97534992582604,15705.49663553941,32889.74618717625,0.0056538781981461065,0.9943911819449602,0.9996666470260127,0.5838569746749094,0.4955276446798278,124.77027893066406,163988.0,6.412861347198486,2.0175262899158897,0.43619045295997266,0.5839512647266873,0.5170378320364905,0.5398138888211332,0.008014729246497154,0.15593662858009338,0.49565649032592773,0.3333333432674408,2.965204437011204,3.0,1492.10693359375,2226383.0,697.4451609439627,404.9753499473902,15705.49663553941,32889.74477008275,0.009902372105077805,0.9901426189407023,0.9979272107339517,0.17931447525072516,0.0784508767539335,217.926933678074,81994.0,34.56489499080718,12.70860583792919,0.02118447691294485,0.17950093909310438,0.06017513476595848,0.09627533721979657,0.004588693940314968,0.02893108745928371,0.07868683730952392,0.02702702702702703,40.030259899651256,37.0,1912.6884526886017,3658377.117048317,491.0602177140356,285.9708853449675,3406.0272405708365,3676.8736923228576,0.009902374321774389,0.990142616723905,0.9979272100537195,0.17931447525072516,0.07845086852229063,217.92698246213138,81994.0,34.56490600587921,12.708607167070546,0.02118447691294485,0.17950093909310438,0.06017513476595848,0.09627533721979657,0.004588692913112618,0.02893107823958521,0.07868682907998874,0.02702702702702703,40.030259899651256,37.0,1912.688854854622,3658378.6554850847,491.0602166146173,285.9708851500368,3406.0272405708365,3676.8733065182323,0.009902373820737912,0.9901426172249643,0.9979272102233351,0.17931447525072516,0.07845088027754524,217.92697143554688,81994.0,34.564903259277344,12.708605268981113,0.02118447691294485,0.17950093909310438,0.06017513476595848,0.09627533721979657,0.004588692914694548,0.028931081295013428,0.07868684083223343,0.027027027681469917,40.030259899651256,37.0,1912.6885986328125,3658377.75,491.0602168631171,285.97088519864263,3406.0272405708365,3676.873857469199,1141262382.0,0.001428627715123707,0.9986165000967957,0.999988344151502,0.9883989690287875,0.9126039287370317,31.613569285557478,81994.0,1.189784847454406,1.095738875657533,0.8511964290070005,0.9884015903602703,0.9739005293070224,0.9833524404224699,0.03163198659940134,0.8404880950867222,0.9126261942654158,1.0,0.0,1.0,881.4934446382738,777030.6929402495,495.26836459676076,286.56100748664534,18826.15241804019,42890.222756954405,0.001428629368549546,0.9986164984432951,0.9999883441509252,0.9883989690287875,0.9126039287333634,31.61360587360051,81994.0,1.189784856846152,1.0957388756619362,0.8511964290070005,0.9884015903602703,0.9739005293070224,0.9833524404224699,0.03163194999008535,0.8404880884522028,0.9126261942617484,1.0,0.0,1.0,881.4942435161253,777032.1013520659,495.2683637766997,286.56100748648004,18826.15241804019,42890.222756782,0.001428628575889842,0.9986164992359907,0.9999883441492297,0.9883989690287875,0.9126039413496765,31.613588333129883,81994.0,1.1897848844528198,1.0957388605180989,0.8511964290070005,0.9884015903602703,0.9739005293070224,0.9833524404224699,0.031631968915462494,0.840488076210022,0.9126262068748473,1.0,0.0,1.0,881.4938354492188,777031.375,495.2683641698406,286.5610074859942,18826.15241804019,42890.22334971883,COMPLETE
11,,2025-07-07 21:56:34.705155,2025-07-07 22:01:53.898952,0 days 00:05:19.193797,0.1,0.2,0.2,400,xavier_uniform_norm,128,14,0.001,,,,,,,,,,,,,,,,,,,,,,,,,,,,,,,,,,,,,,,,,,,,,,,,,,,,,,,,,,,,,,,,,,,,,,,,,,,,,,,,,,,,,,,,,,,,,,,,,,,,,,,,,,,,,,,,,,,,,,,,,,,,,,,,,,,,,,,,,,,,,,,,,,,,,,,,,,,,,,,,,,,,,,,,,,,,,,,,,,,,,,,,,,,,,,,,,,,,,,,,,,,,,,,,,,,,,,,,,,,,,,,,,,,FAIL
12,,2025-07-07 22:11:09.899097,2025-07-07 22:51:32.826556,0 days 00:40:22.927459,0.1,0.2,0.2,400,xavier_uniform_norm,128,14,0.001,,,,,,,,,,,,,,,,,,,,,,,,,,,,,,,,,,,,,,,,,,,,,,,,,,,,,,,,,,,,,,,,,,,,,,,,,,,,,,,,,,,,,,,,,,,,,,,,,,,,,,,,,,,,,,,,,,,,,,,,,,,,,,,,,,,,,,,,,,,,,,,,,,,,,,,,,,,,,,,,,,,,,,,,,,,,,,,,,,,,,,,,,,,,,,,,,,,,,,,,,,,,,,,,,,,,,,,,,,,,,,,,,,,FAIL
13,,2025-07-08 08:32:50.042194,2025-07-08 10:07:58.021837,0 days 01:35:07.979643,0.1,0.2,0.2,400,xavier_uniform_norm,128,14,0.001,,,,,,,,,,,,,,,,,,,,,,,,,,,,,,,,,,,,,,,,,,,,,,,,,,,,,,,,,,,,,,,,,,,,,,,,,,,,,,,,,,,,,,,,,,,,,,,,,,,,,,,,,,,,,,,,,,,,,,,,,,,,,,,,,,,,,,,,,,,,,,,,,,,,,,,,,,,,,,,,,,,,,,,,,,,,,,,,,,,,,,,,,,,,,,,,,,,,,,,,,,,,,,,,,,,,,,,,,,,,,,,,,,,FAIL
14,0.4971331655979157,2025-07-08 10:12:00.172238,2025-07-08 12:15:30.106110,0 days 02:03:29.933872,0.1,0.2,0.2,400,xavier_uniform_norm,128,14,0.001,0.005702176693402531,0.994342881260992,0.9996703570824155,0.5846742928245211,0.4970047442077305,125.83613435129399,163988.0,6.352618834110074,2.0115332765333163,0.4382454813766861,0.5847683976876357,0.5173305363807108,0.5399358489645584,0.007946842972848497,0.15741539451895795,0.4971332125926366,0.3333333333333333,2.965204437011204,3.0,1484.7686281016374,2204537.8789948183,697.4112838552319,404.9768529298039,15727.482135423246,32987.7845605855,0.005702177798710305,0.9943428801556341,0.9996703570807369,0.5846742928245211,0.4970047442061726,125.83615874332268,163988.0,6.352618861364892,2.0115332765396183,0.4382454813766861,0.5847683976876357,0.5173305363807108,0.5399358489645584,0.007946841432435759,0.1574153938435943,0.4971332125910791,0.3333333333333333,2.965204437011204,3.0,1484.7688284581475,2204538.47396098,697.411283079957,404.97685292912394,15727.482135423246,32987.78456048209,0.005702176761961431,0.99434288119243,0.9996703570616592,0.5846742928245211,0.49700469720100376,125.83613586425781,163988.0,6.352619171142578,2.0115334666864815,0.4382454813766861,0.5847683976876357,0.5173305363807108,0.5399358489645584,0.007946843281388283,0.15741539001464844,0.4971331655979157,0.3333333432674408,2.965204437011204,3.0,1484.768798828125,2204538.25,697.411283807144,404.97685292139533,15727.482135423246,32987.78144059963,0.010115804518718912,0.9899291768284748,0.9979634800159254,0.18118088950375208,0.07943912770441235,222.62405785789204,81994.0,33.97758268618664,12.55101434764559,0.02178208161572798,0.18136692928750883,0.06049223113886382,0.0962997292484816,0.004491877515943634,0.02943116964016817,0.07967483522059611,0.02702702702702703,40.030259899651256,37.0,1946.446767833269,3788655.02000858,490.95436131709357,285.9812788471841,3441.4792462112655,3723.1915165662494,0.010115806181241348,0.9899291751658768,0.9979634800104131,0.18118088950375208,0.07943912770420353,222.62409444593507,81994.0,33.977582775446535,12.551014347678477,0.02178208161572798,0.18136692928750883,0.06049223113886382,0.0962997292484816,0.004491876777708142,0.02943116956285181,0.07967483522038735,0.02702702702702703,40.030259899651256,37.0,1946.4470596347253,3788656.155960668,490.9543604925298,285.9812788456045,3441.4792462112655,3723.191516556463,0.010115805034722555,0.9899291763124477,0.9979634803541381,0.18118088950375208,0.0794391324584832,222.6240692138672,81994.0,33.977577209472656,12.5510135989383,0.02178208161572798,0.18136692928750883,0.06049223113886382,0.0962997292484816,0.004491877276450396,0.0294311735779047,0.07967483997344971,0.027027027681469917,40.030259899651256,37.0,1946.44677734375,3788655.25,490.95436106117046,285.981278944104,3441.4792462112655,3723.191739382346,1027001782.0,0.0013126983135829699,0.9987324347374614,0.9999884711263054,0.988167192384778,0.914569825279462,29.048210844695955,81994.0,1.1877173966203436,1.0933842066474952,0.8547088811376442,0.9881698660877625,0.9741688416225578,0.9835719686806351,0.03442552814513857,0.8419511264594638,0.9145915899646774,1.0,0.0,1.0,775.6835267733995,601684.9337076192,495.32586290554804,286.56104387309705,18821.737740805802,42982.61523737978,0.001312698864724916,0.9987324341862946,0.9999884711258711,0.988167192384778,0.9145698252765548,29.048223040710297,81994.0,1.1877174036915754,1.0933842066509698,0.8547088811376442,0.9881698660877625,0.9741688416225578,0.9835719686806351,0.034425513691440854,0.841951121446797,0.9145915899617709,1.0,0.0,1.0,775.683558525089,601684.9829661452,495.32586263219434,286.5610438729726,18821.737740805802,42982.61523724315,0.0013126986266951057,0.9987324344243352,0.9999884711237798,0.988167192384778,0.9145697265120036,29.0482177734375,81994.0,1.1877174377441406,1.0933843246928387,0.8547088811376442,0.9881698660877625,0.9741688416225578,0.9835719686806351,0.0344255194067955,0.8419510722160339,0.9145914912223816,1.0,0.0,1.0,775.6835327148438,601684.9375,495.32586275025164,286.5610438723733,18821.737740805802,42982.610595543214,COMPLETE
15,,2025-07-08 12:15:30.140026,,,0.1,0.2,0.2,400,xavier_uniform_norm,128,14,0.001,,,,,,,,,,,,,,,,,,,,,,,,,,,,,,,,,,,,,,,,,,,,,,,,,,,,,,,,,,,,,,,,,,,,,,,,,,,,,,,,,,,,,,,,,,,,,,,,,,,,,,,,,,,,,,,,,,,,,,,,,,,,,,,,,,,,,,,,,,,,,,,,,,,,,,,,,,,,,,,,,,,,,,,,,,,,,,,,,,,,,,,,,,,,,,,,,,,,,,,,,,,,,,,,,,,,,,,,,,,,,,,,,,,RUNNING
