number,value,datetime_start,datetime_complete,duration,params_loss.margin,params_model.embedding_dim,params_model.entity_initializer,params_model.scoring_fct_norm,params_negative_sampler.num_negs_per_pos,params_optimizer.lr,params_regularizer.p,params_regularizer.weight,user_attrs_both.optimistic.adjusted_arithmetic_mean_rank,user_attrs_both.optimistic.adjusted_arithmetic_mean_rank_index,user_attrs_both.optimistic.adjusted_geometric_mean_rank_index,user_attrs_both.optimistic.adjusted_hits_at_k,user_attrs_both.optimistic.adjusted_inverse_harmonic_mean_rank,user_attrs_both.optimistic.arithmetic_mean_rank,user_attrs_both.optimistic.count,user_attrs_both.optimistic.geometric_mean_rank,user_attrs_both.optimistic.harmonic_mean_rank,user_attrs_both.optimistic.hits_at_1,user_attrs_both.optimistic.hits_at_10,user_attrs_both.optimistic.hits_at_3,user_attrs_both.optimistic.hits_at_5,user_attrs_both.optimistic.inverse_arithmetic_mean_rank,user_attrs_both.optimistic.inverse_geometric_mean_rank,user_attrs_both.optimistic.inverse_harmonic_mean_rank,user_attrs_both.optimistic.inverse_median_rank,user_attrs_both.optimistic.median_absolute_deviation,user_attrs_both.optimistic.median_rank,user_attrs_both.optimistic.standard_deviation,user_attrs_both.optimistic.variance,user_attrs_both.optimistic.z_arithmetic_mean_rank,user_attrs_both.optimistic.z_geometric_mean_rank,user_attrs_both.optimistic.z_hits_at_k,user_attrs_both.optimistic.z_inverse_harmonic_mean_rank,user_attrs_both.pessimistic.adjusted_arithmetic_mean_rank,user_attrs_both.pessimistic.adjusted_arithmetic_mean_rank_index,user_attrs_both.pessimistic.adjusted_geometric_mean_rank_index,user_attrs_both.pessimistic.adjusted_hits_at_k,user_attrs_both.pessimistic.adjusted_inverse_harmonic_mean_rank,user_attrs_both.pessimistic.arithmetic_mean_rank,user_attrs_both.pessimistic.count,user_attrs_both.pessimistic.geometric_mean_rank,user_attrs_both.pessimistic.harmonic_mean_rank,user_attrs_both.pessimistic.hits_at_1,user_attrs_both.pessimistic.hits_at_10,user_attrs_both.pessimistic.hits_at_3,user_attrs_both.pessimistic.hits_at_5,user_attrs_both.pessimistic.inverse_arithmetic_mean_rank,user_attrs_both.pessimistic.inverse_geometric_mean_rank,user_attrs_both.pessimistic.inverse_harmonic_mean_rank,user_attrs_both.pessimistic.inverse_median_rank,user_attrs_both.pessimistic.median_absolute_deviation,user_attrs_both.pessimistic.median_rank,user_attrs_both.pessimistic.standard_deviation,user_attrs_both.pessimistic.variance,user_attrs_both.pessimistic.z_arithmetic_mean_rank,user_attrs_both.pessimistic.z_geometric_mean_rank,user_attrs_both.pessimistic.z_hits_at_k,user_attrs_both.pessimistic.z_inverse_harmonic_mean_rank,user_attrs_both.realistic.adjusted_arithmetic_mean_rank,user_attrs_both.realistic.adjusted_arithmetic_mean_rank_index,user_attrs_both.realistic.adjusted_geometric_mean_rank_index,user_attrs_both.realistic.adjusted_hits_at_k,user_attrs_both.realistic.adjusted_inverse_harmonic_mean_rank,user_attrs_both.realistic.arithmetic_mean_rank,user_attrs_both.realistic.count,user_attrs_both.realistic.geometric_mean_rank,user_attrs_both.realistic.harmonic_mean_rank,user_attrs_both.realistic.hits_at_1,user_attrs_both.realistic.hits_at_10,user_attrs_both.realistic.hits_at_3,user_attrs_both.realistic.hits_at_5,user_attrs_both.realistic.inverse_arithmetic_mean_rank,user_attrs_both.realistic.inverse_geometric_mean_rank,user_attrs_both.realistic.inverse_harmonic_mean_rank,user_attrs_both.realistic.inverse_median_rank,user_attrs_both.realistic.median_absolute_deviation,user_attrs_both.realistic.median_rank,user_attrs_both.realistic.standard_deviation,user_attrs_both.realistic.variance,user_attrs_both.realistic.z_arithmetic_mean_rank,user_attrs_both.realistic.z_geometric_mean_rank,user_attrs_both.realistic.z_hits_at_k,user_attrs_both.realistic.z_inverse_harmonic_mean_rank,user_attrs_head.optimistic.adjusted_arithmetic_mean_rank,user_attrs_head.optimistic.adjusted_arithmetic_mean_rank_index,user_attrs_head.optimistic.adjusted_geometric_mean_rank_index,user_attrs_head.optimistic.adjusted_hits_at_k,user_attrs_head.optimistic.adjusted_inverse_harmonic_mean_rank,user_attrs_head.optimistic.arithmetic_mean_rank,user_attrs_head.optimistic.count,user_attrs_head.optimistic.geometric_mean_rank,user_attrs_head.optimistic.harmonic_mean_rank,user_attrs_head.optimistic.hits_at_1,user_attrs_head.optimistic.hits_at_10,user_attrs_head.optimistic.hits_at_3,user_attrs_head.optimistic.hits_at_5,user_attrs_head.optimistic.inverse_arithmetic_mean_rank,user_attrs_head.optimistic.inverse_geometric_mean_rank,user_attrs_head.optimistic.inverse_harmonic_mean_rank,user_attrs_head.optimistic.inverse_median_rank,user_attrs_head.optimistic.median_absolute_deviation,user_attrs_head.optimistic.median_rank,user_attrs_head.optimistic.standard_deviation,user_attrs_head.optimistic.variance,user_attrs_head.optimistic.z_arithmetic_mean_rank,user_attrs_head.optimistic.z_geometric_mean_rank,user_attrs_head.optimistic.z_hits_at_k,user_attrs_head.optimistic.z_inverse_harmonic_mean_rank,user_attrs_head.pessimistic.adjusted_arithmetic_mean_rank,user_attrs_head.pessimistic.adjusted_arithmetic_mean_rank_index,user_attrs_head.pessimistic.adjusted_geometric_mean_rank_index,user_attrs_head.pessimistic.adjusted_hits_at_k,user_attrs_head.pessimistic.adjusted_inverse_harmonic_mean_rank,user_attrs_head.pessimistic.arithmetic_mean_rank,user_attrs_head.pessimistic.count,user_attrs_head.pessimistic.geometric_mean_rank,user_attrs_head.pessimistic.harmonic_mean_rank,user_attrs_head.pessimistic.hits_at_1,user_attrs_head.pessimistic.hits_at_10,user_attrs_head.pessimistic.hits_at_3,user_attrs_head.pessimistic.hits_at_5,user_attrs_head.pessimistic.inverse_arithmetic_mean_rank,user_attrs_head.pessimistic.inverse_geometric_mean_rank,user_attrs_head.pessimistic.inverse_harmonic_mean_rank,user_attrs_head.pessimistic.inverse_median_rank,user_attrs_head.pessimistic.median_absolute_deviation,user_attrs_head.pessimistic.median_rank,user_attrs_head.pessimistic.standard_deviation,user_attrs_head.pessimistic.variance,user_attrs_head.pessimistic.z_arithmetic_mean_rank,user_attrs_head.pessimistic.z_geometric_mean_rank,user_attrs_head.pessimistic.z_hits_at_k,user_attrs_head.pessimistic.z_inverse_harmonic_mean_rank,user_attrs_head.realistic.adjusted_arithmetic_mean_rank,user_attrs_head.realistic.adjusted_arithmetic_mean_rank_index,user_attrs_head.realistic.adjusted_geometric_mean_rank_index,user_attrs_head.realistic.adjusted_hits_at_k,user_attrs_head.realistic.adjusted_inverse_harmonic_mean_rank,user_attrs_head.realistic.arithmetic_mean_rank,user_attrs_head.realistic.count,user_attrs_head.realistic.geometric_mean_rank,user_attrs_head.realistic.harmonic_mean_rank,user_attrs_head.realistic.hits_at_1,user_attrs_head.realistic.hits_at_10,user_attrs_head.realistic.hits_at_3,user_attrs_head.realistic.hits_at_5,user_attrs_head.realistic.inverse_arithmetic_mean_rank,user_attrs_head.realistic.inverse_geometric_mean_rank,user_attrs_head.realistic.inverse_harmonic_mean_rank,user_attrs_head.realistic.inverse_median_rank,user_attrs_head.realistic.median_absolute_deviation,user_attrs_head.realistic.median_rank,user_attrs_head.realistic.standard_deviation,user_attrs_head.realistic.variance,user_attrs_head.realistic.z_arithmetic_mean_rank,user_attrs_head.realistic.z_geometric_mean_rank,user_attrs_head.realistic.z_hits_at_k,user_attrs_head.realistic.z_inverse_harmonic_mean_rank,user_attrs_random_seed,user_attrs_tail.optimistic.adjusted_arithmetic_mean_rank,user_attrs_tail.optimistic.adjusted_arithmetic_mean_rank_index,user_attrs_tail.optimistic.adjusted_geometric_mean_rank_index,user_attrs_tail.optimistic.adjusted_hits_at_k,user_attrs_tail.optimistic.adjusted_inverse_harmonic_mean_rank,user_attrs_tail.optimistic.arithmetic_mean_rank,user_attrs_tail.optimistic.count,user_attrs_tail.optimistic.geometric_mean_rank,user_attrs_tail.optimistic.harmonic_mean_rank,user_attrs_tail.optimistic.hits_at_1,user_attrs_tail.optimistic.hits_at_10,user_attrs_tail.optimistic.hits_at_3,user_attrs_tail.optimistic.hits_at_5,user_attrs_tail.optimistic.inverse_arithmetic_mean_rank,user_attrs_tail.optimistic.inverse_geometric_mean_rank,user_attrs_tail.optimistic.inverse_harmonic_mean_rank,user_attrs_tail.optimistic.inverse_median_rank,user_attrs_tail.optimistic.median_absolute_deviation,user_attrs_tail.optimistic.median_rank,user_attrs_tail.optimistic.standard_deviation,user_attrs_tail.optimistic.variance,user_attrs_tail.optimistic.z_arithmetic_mean_rank,user_attrs_tail.optimistic.z_geometric_mean_rank,user_attrs_tail.optimistic.z_hits_at_k,user_attrs_tail.optimistic.z_inverse_harmonic_mean_rank,user_attrs_tail.pessimistic.adjusted_arithmetic_mean_rank,user_attrs_tail.pessimistic.adjusted_arithmetic_mean_rank_index,user_attrs_tail.pessimistic.adjusted_geometric_mean_rank_index,user_attrs_tail.pessimistic.adjusted_hits_at_k,user_attrs_tail.pessimistic.adjusted_inverse_harmonic_mean_rank,user_attrs_tail.pessimistic.arithmetic_mean_rank,user_attrs_tail.pessimistic.count,user_attrs_tail.pessimistic.geometric_mean_rank,user_attrs_tail.pessimistic.harmonic_mean_rank,user_attrs_tail.pessimistic.hits_at_1,user_attrs_tail.pessimistic.hits_at_10,user_attrs_tail.pessimistic.hits_at_3,user_attrs_tail.pessimistic.hits_at_5,user_attrs_tail.pessimistic.inverse_arithmetic_mean_rank,user_attrs_tail.pessimistic.inverse_geometric_mean_rank,user_attrs_tail.pessimistic.inverse_harmonic_mean_rank,user_attrs_tail.pessimistic.inverse_median_rank,user_attrs_tail.pessimistic.median_absolute_deviation,user_attrs_tail.pessimistic.median_rank,user_attrs_tail.pessimistic.standard_deviation,user_attrs_tail.pessimistic.variance,user_attrs_tail.pessimistic.z_arithmetic_mean_rank,user_attrs_tail.pessimistic.z_geometric_mean_rank,user_attrs_tail.pessimistic.z_hits_at_k,user_attrs_tail.pessimistic.z_inverse_harmonic_mean_rank,user_attrs_tail.realistic.adjusted_arithmetic_mean_rank,user_attrs_tail.realistic.adjusted_arithmetic_mean_rank_index,user_attrs_tail.realistic.adjusted_geometric_mean_rank_index,user_attrs_tail.realistic.adjusted_hits_at_k,user_attrs_tail.realistic.adjusted_inverse_harmonic_mean_rank,user_attrs_tail.realistic.arithmetic_mean_rank,user_attrs_tail.realistic.count,user_attrs_tail.realistic.geometric_mean_rank,user_attrs_tail.realistic.harmonic_mean_rank,user_attrs_tail.realistic.hits_at_1,user_attrs_tail.realistic.hits_at_10,user_attrs_tail.realistic.hits_at_3,user_attrs_tail.realistic.hits_at_5,user_attrs_tail.realistic.inverse_arithmetic_mean_rank,user_attrs_tail.realistic.inverse_geometric_mean_rank,user_attrs_tail.realistic.inverse_harmonic_mean_rank,user_attrs_tail.realistic.inverse_median_rank,user_attrs_tail.realistic.median_absolute_deviation,user_attrs_tail.realistic.median_rank,user_attrs_tail.realistic.standard_deviation,user_attrs_tail.realistic.variance,user_attrs_tail.realistic.z_arithmetic_mean_rank,user_attrs_tail.realistic.z_geometric_mean_rank,user_attrs_tail.realistic.z_hits_at_k,user_attrs_tail.realistic.z_inverse_harmonic_mean_rank,state
20,0.3344777822494507,2025-07-14 12:57:52.155695,2025-07-14 13:06:06.451484,0 days 00:08:14.295789,5.0,400,xavier_uniform_norm,1.5,8,0.001,2,1e-05,0.13675893304637318,0.8632801858933595,0.9967818677877799,0.4510793716980542,0.3343077937013707,3018.0081042515308,163988.0,53.25483142794183,2.9897349008091374,0.27101983071932095,0.451203746615606,0.3673378539893163,0.40404175915310875,0.00033134437200194364,0.018777639008266928,0.33447781598608006,0.047619047619047616,29.65204437011204,21.0,6641.341561575236,44107417.73750659,605.4866526596512,403.8066958915608,12133.83732978375,22189.0708369901,0.13675907259147957,0.8632800463419295,0.9967818619655334,0.4510793716980542,0.3343077692279187,3018.0111837451523,163988.0,53.254925967409065,2.9897351195095934,0.27101983071932095,0.451203746615606,0.3673378539893163,0.40404175915310875,0.0003313440339074775,0.018777605673735792,0.3344777915188788,0.047619047619047616,29.65204437011204,21.0,6641.34472110402,44107459.70453624,605.4865547811992,403.80669353290824,12133.83732978375,22189.069212609305,0.1367589972672914,0.863280121669531,0.9967818643883143,0.4510793716980542,0.33430775995612255,3018.009521484375,163988.0,53.254886627197266,2.9897352023645283,0.27101983071932095,0.451203746615606,0.3673378539893163,0.40404175915310875,0.000331344228470698,0.018777620047330856,0.3344777822494507,0.0476190485060215,29.65204437011204,21.0,6641.34326171875,44107440.0,605.4866076144023,403.80669451440195,12133.83732978375,22189.068597210724,0.2738552493120141,0.726177747445882,0.9327519714710055,0.07192856237885605,0.03212528021955826,6026.88266214601,81994.0,1089.9544117611917,30.889841496728806,0.012293582457252969,0.07213942483596361,0.031380344903285604,0.045564309583628074,0.00016592325685728997,0.00091746956497397,0.03237310233870571,0.00047281323877068556,3103.086443332225,2115.0,8373.032789964067,70107678.10181345,360.14711006114027,267.29395112159176,1366.2624977427279,1505.663194412561,0.2738555286157834,0.7261774681294209,0.9327517532741112,0.07192856237885605,0.03212523909258312,6026.888808937239,81994.0,1089.957945046494,30.88988072936269,0.012293582457252969,0.07213942483596361,0.031380344903285604,0.045564309583628074,0.00016592308763305964,0.0009174665908392854,0.032373061222261044,0.00047281323877068556,3103.086443332225,2115.0,8373.035597598897,70107725.11865832,360.1469715344275,267.2938885940262,1366.2624977427279,1505.6612668535693,0.2738553892658804,0.7261776074856561,0.9327518700126212,0.07192856237885605,0.03212525976834487,6026.8857421875,81994.0,1089.9560546875,30.889861005930552,0.012293582457252969,0.07213942483596361,0.031380344903285604,0.045564309583628074,0.000165923178428784,0.0009174681617878377,0.032373081892728806,0.00047281323350034654,3103.086443332225,2115.0,8373.0341796875,70107696.0,360.1470406480096,267.29392204718266,1366.2624977427279,1505.6622358951856,903293107.0,0.0004127479989743094,0.9996324257229622,0.9999016104955567,0.8302297076484084,0.6364899197038114,9.133546357050516,81994.0,2.602014396029513,1.5708882249341687,0.5297460789813889,0.8302680683952485,0.703295363075347,0.7625192087225895,0.1094864974575909,0.3843176277294731,0.6365825296334544,1.0,0.0,1.0,22.47582946863307,505.1629103030746,495.7722175006279,286.5361527131112,15813.483732719933,29913.51842680791,0.00041274855011625566,0.9996324251717954,0.9999016104462125,0.8302297076484084,0.6364899118838613,9.133558553064859,81994.0,2.602015199470143,1.5708882442264638,0.5297460789813889,0.8302680683952485,0.703295363075347,0.7625192087225895,0.10948635126058723,0.38431750906129736,0.6365825218154966,1.0,0.0,1.0,22.475845946311658,505.1636510023341,495.7722172272742,286.5361526989709,15813.483732719933,29913.51805928878,0.0004127482788931278,0.9996324254430308,0.999901610471972,0.8302297076484084,0.6364898838432644,9.133552551269531,81994.0,2.6020147800445557,1.5708883134043352,0.5297460789813889,0.8302680683952485,0.703295363075347,0.7625192087225895,0.109486423432827,0.3843175768852234,0.6365824937820435,1.0,0.0,1.0,22.47583770751953,505.1632995605469,495.7722173617946,286.53615270635265,15813.483732719933,29913.516741447154,COMPLETE
21,0.47001972794532776,2025-07-14 13:06:06.480632,2025-07-14 13:11:44.139938,0 days 00:05:37.659306,8.0,200,xavier_uniform_norm,1.0,6,0.001,1,1e-05,0.008515220346543515,0.9915297101309626,0.9995138388084639,0.5541956451110135,0.46988428483506944,187.9146278996024,163988.0,8.894104230414008,2.127570488255205,0.4146035075737249,0.5542966558528672,0.4920055125984828,0.5147083932970705,0.005321565495871201,0.11243403203893546,0.4700196799684357,0.25,4.447806655516806,4.0,1407.6328321565522,1981430.1901650762,695.438184508445,404.91344575006525,14907.619874829694,31187.713471937044,0.00851522836002487,0.9915297021171181,0.9995138386095019,0.5541956451110135,0.469884281703003,187.91480474181037,163988.0,8.894107461083518,2.1275705024290588,0.4146035075737249,0.5542966558528672,0.4920055125984828,0.5147083932970705,0.005321560487870936,0.1124339911987274,0.4700196768371692,0.25,4.447806655516806,4.0,1407.6338515773386,1981433.0601064533,695.4381788877022,404.9134456694637,14907.619874829694,31187.71326405184,0.008515224457834408,0.9915297060194854,0.999513838587484,0.5541956451110135,0.46988433282421826,187.9147186279297,163988.0,8.894107818603516,2.12757027108513,0.4146035075737249,0.5542966558528672,0.4920055125984828,0.5147083932970705,0.005321562755852938,0.11243398487567902,0.47001972794532776,0.25,4.447806655516806,4.0,1407.6334228515625,1981431.75,695.438181624741,404.91344566054397,14907.619874829694,31187.71665712938,0.016973668004286777,0.9830710017145974,0.9962019249695983,0.13048273502283783,0.0583772272570561,373.54882064541306,81994.0,62.50262916291695,17.059510916087497,0.015110861770373442,0.13068029368002537,0.04178354513744908,0.06806595604556431,0.0026770262539504534,0.01599932696260566,0.0586183276249132,0.01694915254237288,69.68230426976329,59.0,1973.2831653134424,3893846.4505094388,487.5530563938244,285.47647904739557,2478.482282540515,2736.0521642794793,0.01697368407533699,0.9830709856428169,0.9962019221655303,0.13048273502283783,0.05837722099291906,373.549174329829,81994.0,62.50267456948512,17.05951273865337,0.015110861770373442,0.13068029368002537,0.04178354513744908,0.06806595604556431,0.0026770237192842512,0.015999315339510562,0.05861832136238008,0.01694915254237288,69.68230426976329,59.0,1973.2845864396465,3893852.0590802873,487.55304842304133,285.4764782438482,2478.482282540515,2736.05187068887,0.016973675277585667,0.983070994440968,0.9962019231366529,0.13048273502283783,0.058377225371759135,373.5489807128906,81994.0,62.50265884399414,17.059511464619185,0.015110861770373442,0.13068029368002537,0.04178354513744908,0.06806595604556431,0.0026770250406116247,0.015999319031834602,0.05861832574009896,0.016949152573943138,69.68230426976329,59.0,1973.2838134765625,3893849.0,487.55305278647535,285.4764785221378,2478.482282540515,2736.052075918468,484804791.0,0.00010305362339258632,0.9999421340943683,0.9999836861472292,0.9779080261946732,0.8813908147502003,2.280435153791741,81994.0,1.2656282002998,1.1345315840456067,0.8140961533770764,0.9779130180257092,0.9422274800595165,0.9613508305485767,0.43851279802333915,0.7901214588637655,0.8814210323119583,1.0,0.0,1.0,9.686216389106823,93.82278793660161,495.9258187665727,286.55967266868964,18626.33018532575,41423.280341216494,0.00010305362339258632,0.9999421340943683,0.9999836861472292,0.9779080261946732,0.8813908147502003,2.280435153791741,81994.0,1.2656282002998,1.1345315840456067,0.8140961533770764,0.9779130180257092,0.9422274800595165,0.9613508305485767,0.43851279802333915,0.7901214588637655,0.8814210323119583,1.0,0.0,1.0,9.686216389106823,93.82278793660161,495.9258187665727,286.55967266868964,18626.33018532575,41423.280341216494,0.0001030536202972695,0.9999421340974638,0.9999836861461021,0.9779080261946732,0.8813908120052614,2.280435085296631,81994.0,1.2656282186508179,1.1345315875778876,0.8140961533770764,0.9779130180257092,0.9422274800595165,0.9613508305485767,0.43851280212402344,0.7901214361190796,0.8814210295677186,1.0,0.0,1.0,9.686216354370117,93.82278442382812,495.9258187681079,286.55967266836666,18626.33018532575,41423.28021221086,COMPLETE
