number,value,datetime_start,datetime_complete,duration,params_loss.margin,params_model.embedding_dim,params_model.entity_initializer,params_negative_sampler.num_negs_per_pos,params_optimizer.lr,params_regularizer.p,params_regularizer.weight,user_attrs_both.optimistic.adjusted_arithmetic_mean_rank,user_attrs_both.optimistic.adjusted_arithmetic_mean_rank_index,user_attrs_both.optimistic.adjusted_geometric_mean_rank_index,user_attrs_both.optimistic.adjusted_hits_at_k,user_attrs_both.optimistic.adjusted_inverse_harmonic_mean_rank,user_attrs_both.optimistic.arithmetic_mean_rank,user_attrs_both.optimistic.count,user_attrs_both.optimistic.geometric_mean_rank,user_attrs_both.optimistic.harmonic_mean_rank,user_attrs_both.optimistic.hits_at_1,user_attrs_both.optimistic.hits_at_10,user_attrs_both.optimistic.hits_at_3,user_attrs_both.optimistic.hits_at_5,user_attrs_both.optimistic.inverse_arithmetic_mean_rank,user_attrs_both.optimistic.inverse_geometric_mean_rank,user_attrs_both.optimistic.inverse_harmonic_mean_rank,user_attrs_both.optimistic.inverse_median_rank,user_attrs_both.optimistic.median_absolute_deviation,user_attrs_both.optimistic.median_rank,user_attrs_both.optimistic.standard_deviation,user_attrs_both.optimistic.variance,user_attrs_both.optimistic.z_arithmetic_mean_rank,user_attrs_both.optimistic.z_geometric_mean_rank,user_attrs_both.optimistic.z_hits_at_k,user_attrs_both.optimistic.z_inverse_harmonic_mean_rank,user_attrs_both.pessimistic.adjusted_arithmetic_mean_rank,user_attrs_both.pessimistic.adjusted_arithmetic_mean_rank_index,user_attrs_both.pessimistic.adjusted_geometric_mean_rank_index,user_attrs_both.pessimistic.adjusted_hits_at_k,user_attrs_both.pessimistic.adjusted_inverse_harmonic_mean_rank,user_attrs_both.pessimistic.arithmetic_mean_rank,user_attrs_both.pessimistic.count,user_attrs_both.pessimistic.geometric_mean_rank,user_attrs_both.pessimistic.harmonic_mean_rank,user_attrs_both.pessimistic.hits_at_1,user_attrs_both.pessimistic.hits_at_10,user_attrs_both.pessimistic.hits_at_3,user_attrs_both.pessimistic.hits_at_5,user_attrs_both.pessimistic.inverse_arithmetic_mean_rank,user_attrs_both.pessimistic.inverse_geometric_mean_rank,user_attrs_both.pessimistic.inverse_harmonic_mean_rank,user_attrs_both.pessimistic.inverse_median_rank,user_attrs_both.pessimistic.median_absolute_deviation,user_attrs_both.pessimistic.median_rank,user_attrs_both.pessimistic.standard_deviation,user_attrs_both.pessimistic.variance,user_attrs_both.pessimistic.z_arithmetic_mean_rank,user_attrs_both.pessimistic.z_geometric_mean_rank,user_attrs_both.pessimistic.z_hits_at_k,user_attrs_both.pessimistic.z_inverse_harmonic_mean_rank,user_attrs_both.realistic.adjusted_arithmetic_mean_rank,user_attrs_both.realistic.adjusted_arithmetic_mean_rank_index,user_attrs_both.realistic.adjusted_geometric_mean_rank_index,user_attrs_both.realistic.adjusted_hits_at_k,user_attrs_both.realistic.adjusted_inverse_harmonic_mean_rank,user_attrs_both.realistic.arithmetic_mean_rank,user_attrs_both.realistic.count,user_attrs_both.realistic.geometric_mean_rank,user_attrs_both.realistic.harmonic_mean_rank,user_attrs_both.realistic.hits_at_1,user_attrs_both.realistic.hits_at_10,user_attrs_both.realistic.hits_at_3,user_attrs_both.realistic.hits_at_5,user_attrs_both.realistic.inverse_arithmetic_mean_rank,user_attrs_both.realistic.inverse_geometric_mean_rank,user_attrs_both.realistic.inverse_harmonic_mean_rank,user_attrs_both.realistic.inverse_median_rank,user_attrs_both.realistic.median_absolute_deviation,user_attrs_both.realistic.median_rank,user_attrs_both.realistic.standard_deviation,user_attrs_both.realistic.variance,user_attrs_both.realistic.z_arithmetic_mean_rank,user_attrs_both.realistic.z_geometric_mean_rank,user_attrs_both.realistic.z_hits_at_k,user_attrs_both.realistic.z_inverse_harmonic_mean_rank,user_attrs_head.optimistic.adjusted_arithmetic_mean_rank,user_attrs_head.optimistic.adjusted_arithmetic_mean_rank_index,user_attrs_head.optimistic.adjusted_geometric_mean_rank_index,user_attrs_head.optimistic.adjusted_hits_at_k,user_attrs_head.optimistic.adjusted_inverse_harmonic_mean_rank,user_attrs_head.optimistic.arithmetic_mean_rank,user_attrs_head.optimistic.count,user_attrs_head.optimistic.geometric_mean_rank,user_attrs_head.optimistic.harmonic_mean_rank,user_attrs_head.optimistic.hits_at_1,user_attrs_head.optimistic.hits_at_10,user_attrs_head.optimistic.hits_at_3,user_attrs_head.optimistic.hits_at_5,user_attrs_head.optimistic.inverse_arithmetic_mean_rank,user_attrs_head.optimistic.inverse_geometric_mean_rank,user_attrs_head.optimistic.inverse_harmonic_mean_rank,user_attrs_head.optimistic.inverse_median_rank,user_attrs_head.optimistic.median_absolute_deviation,user_attrs_head.optimistic.median_rank,user_attrs_head.optimistic.standard_deviation,user_attrs_head.optimistic.variance,user_attrs_head.optimistic.z_arithmetic_mean_rank,user_attrs_head.optimistic.z_geometric_mean_rank,user_attrs_head.optimistic.z_hits_at_k,user_attrs_head.optimistic.z_inverse_harmonic_mean_rank,user_attrs_head.pessimistic.adjusted_arithmetic_mean_rank,user_attrs_head.pessimistic.adjusted_arithmetic_mean_rank_index,user_attrs_head.pessimistic.adjusted_geometric_mean_rank_index,user_attrs_head.pessimistic.adjusted_hits_at_k,user_attrs_head.pessimistic.adjusted_inverse_harmonic_mean_rank,user_attrs_head.pessimistic.arithmetic_mean_rank,user_attrs_head.pessimistic.count,user_attrs_head.pessimistic.geometric_mean_rank,user_attrs_head.pessimistic.harmonic_mean_rank,user_attrs_head.pessimistic.hits_at_1,user_attrs_head.pessimistic.hits_at_10,user_attrs_head.pessimistic.hits_at_3,user_attrs_head.pessimistic.hits_at_5,user_attrs_head.pessimistic.inverse_arithmetic_mean_rank,user_attrs_head.pessimistic.inverse_geometric_mean_rank,user_attrs_head.pessimistic.inverse_harmonic_mean_rank,user_attrs_head.pessimistic.inverse_median_rank,user_attrs_head.pessimistic.median_absolute_deviation,user_attrs_head.pessimistic.median_rank,user_attrs_head.pessimistic.standard_deviation,user_attrs_head.pessimistic.variance,user_attrs_head.pessimistic.z_arithmetic_mean_rank,user_attrs_head.pessimistic.z_geometric_mean_rank,user_attrs_head.pessimistic.z_hits_at_k,user_attrs_head.pessimistic.z_inverse_harmonic_mean_rank,user_attrs_head.realistic.adjusted_arithmetic_mean_rank,user_attrs_head.realistic.adjusted_arithmetic_mean_rank_index,user_attrs_head.realistic.adjusted_geometric_mean_rank_index,user_attrs_head.realistic.adjusted_hits_at_k,user_attrs_head.realistic.adjusted_inverse_harmonic_mean_rank,user_attrs_head.realistic.arithmetic_mean_rank,user_attrs_head.realistic.count,user_attrs_head.realistic.geometric_mean_rank,user_attrs_head.realistic.harmonic_mean_rank,user_attrs_head.realistic.hits_at_1,user_attrs_head.realistic.hits_at_10,user_attrs_head.realistic.hits_at_3,user_attrs_head.realistic.hits_at_5,user_attrs_head.realistic.inverse_arithmetic_mean_rank,user_attrs_head.realistic.inverse_geometric_mean_rank,user_attrs_head.realistic.inverse_harmonic_mean_rank,user_attrs_head.realistic.inverse_median_rank,user_attrs_head.realistic.median_absolute_deviation,user_attrs_head.realistic.median_rank,user_attrs_head.realistic.standard_deviation,user_attrs_head.realistic.variance,user_attrs_head.realistic.z_arithmetic_mean_rank,user_attrs_head.realistic.z_geometric_mean_rank,user_attrs_head.realistic.z_hits_at_k,user_attrs_head.realistic.z_inverse_harmonic_mean_rank,user_attrs_random_seed,user_attrs_tail.optimistic.adjusted_arithmetic_mean_rank,user_attrs_tail.optimistic.adjusted_arithmetic_mean_rank_index,user_attrs_tail.optimistic.adjusted_geometric_mean_rank_index,user_attrs_tail.optimistic.adjusted_hits_at_k,user_attrs_tail.optimistic.adjusted_inverse_harmonic_mean_rank,user_attrs_tail.optimistic.arithmetic_mean_rank,user_attrs_tail.optimistic.count,user_attrs_tail.optimistic.geometric_mean_rank,user_attrs_tail.optimistic.harmonic_mean_rank,user_attrs_tail.optimistic.hits_at_1,user_attrs_tail.optimistic.hits_at_10,user_attrs_tail.optimistic.hits_at_3,user_attrs_tail.optimistic.hits_at_5,user_attrs_tail.optimistic.inverse_arithmetic_mean_rank,user_attrs_tail.optimistic.inverse_geometric_mean_rank,user_attrs_tail.optimistic.inverse_harmonic_mean_rank,user_attrs_tail.optimistic.inverse_median_rank,user_attrs_tail.optimistic.median_absolute_deviation,user_attrs_tail.optimistic.median_rank,user_attrs_tail.optimistic.standard_deviation,user_attrs_tail.optimistic.variance,user_attrs_tail.optimistic.z_arithmetic_mean_rank,user_attrs_tail.optimistic.z_geometric_mean_rank,user_attrs_tail.optimistic.z_hits_at_k,user_attrs_tail.optimistic.z_inverse_harmonic_mean_rank,user_attrs_tail.pessimistic.adjusted_arithmetic_mean_rank,user_attrs_tail.pessimistic.adjusted_arithmetic_mean_rank_index,user_attrs_tail.pessimistic.adjusted_geometric_mean_rank_index,user_attrs_tail.pessimistic.adjusted_hits_at_k,user_attrs_tail.pessimistic.adjusted_inverse_harmonic_mean_rank,user_attrs_tail.pessimistic.arithmetic_mean_rank,user_attrs_tail.pessimistic.count,user_attrs_tail.pessimistic.geometric_mean_rank,user_attrs_tail.pessimistic.harmonic_mean_rank,user_attrs_tail.pessimistic.hits_at_1,user_attrs_tail.pessimistic.hits_at_10,user_attrs_tail.pessimistic.hits_at_3,user_attrs_tail.pessimistic.hits_at_5,user_attrs_tail.pessimistic.inverse_arithmetic_mean_rank,user_attrs_tail.pessimistic.inverse_geometric_mean_rank,user_attrs_tail.pessimistic.inverse_harmonic_mean_rank,user_attrs_tail.pessimistic.inverse_median_rank,user_attrs_tail.pessimistic.median_absolute_deviation,user_attrs_tail.pessimistic.median_rank,user_attrs_tail.pessimistic.standard_deviation,user_attrs_tail.pessimistic.variance,user_attrs_tail.pessimistic.z_arithmetic_mean_rank,user_attrs_tail.pessimistic.z_geometric_mean_rank,user_attrs_tail.pessimistic.z_hits_at_k,user_attrs_tail.pessimistic.z_inverse_harmonic_mean_rank,user_attrs_tail.realistic.adjusted_arithmetic_mean_rank,user_attrs_tail.realistic.adjusted_arithmetic_mean_rank_index,user_attrs_tail.realistic.adjusted_geometric_mean_rank_index,user_attrs_tail.realistic.adjusted_hits_at_k,user_attrs_tail.realistic.adjusted_inverse_harmonic_mean_rank,user_attrs_tail.realistic.arithmetic_mean_rank,user_attrs_tail.realistic.count,user_attrs_tail.realistic.geometric_mean_rank,user_attrs_tail.realistic.harmonic_mean_rank,user_attrs_tail.realistic.hits_at_1,user_attrs_tail.realistic.hits_at_10,user_attrs_tail.realistic.hits_at_3,user_attrs_tail.realistic.hits_at_5,user_attrs_tail.realistic.inverse_arithmetic_mean_rank,user_attrs_tail.realistic.inverse_geometric_mean_rank,user_attrs_tail.realistic.inverse_harmonic_mean_rank,user_attrs_tail.realistic.inverse_median_rank,user_attrs_tail.realistic.median_absolute_deviation,user_attrs_tail.realistic.median_rank,user_attrs_tail.realistic.standard_deviation,user_attrs_tail.realistic.variance,user_attrs_tail.realistic.z_arithmetic_mean_rank,user_attrs_tail.realistic.z_geometric_mean_rank,user_attrs_tail.realistic.z_hits_at_k,user_attrs_tail.realistic.z_inverse_harmonic_mean_rank,state
19,0.48059365153312683,2025-07-14 16:25:47.588402,2025-07-14 16:35:06.721753,0 days 00:09:19.133351,4.0,200,xavier_uniform,14,0.01,2,1e-05,0.007550720217343122,0.9924942539677944,0.9995819294186153,0.5607829854213173,0.480460981387888,166.62995463082666,163988.0,7.7884742809112595,2.0807598012268635,0.42253091689635824,0.5608825035978242,0.5071712564333976,0.5268190355391857,0.006001321924473472,0.12839485166573586,0.4805936751615334,0.3333333333333333,2.965204437011204,3.0,1659.9576705577822,2755459.4680436184,696.1146953662756,404.9410299640192,15084.816441057637,31889.72243928251,0.007550729888786138,0.9924942442959132,0.9995819293662058,0.5607829854213173,0.4804609810414003,166.63016806107763,163988.0,7.788475131916929,2.0807598027266203,0.42253091689635824,0.5608825035978242,0.5071712564333976,0.5268190355391857,0.006001314237608246,0.12839483763670645,0.48059367481513415,0.3333333333333333,2.965204437011204,3.0,1659.9596374140979,2755465.997843943,696.1146885826205,404.94102994278757,15084.816441057637,31889.722416285018,0.007550725260242375,0.9924942489246668,0.999581929430807,0.5607829854213173,0.48046095775344505,166.63006591796875,163988.0,7.788474082946777,2.0807599035275044,0.42253091689635824,0.5608825035978242,0.5071712564333976,0.5268190355391857,0.006001317873597145,0.12839485704898834,0.48059365153312683,0.3333333432674408,2.965204437011204,3.0,1659.9586181640625,2755462.75,696.1146918291313,404.9410299689582,15084.816441057637,31889.720870589408,0.0135706962722544,0.9864741280811352,0.9970223405550689,0.13403258173937924,0.061353702892684554,298.6577554455204,81994.0,49.21755314183197,16.235336754657954,0.015366978071566213,0.13422933385369662,0.044734980608337194,0.07179793643437325,0.00334831418828638,0.020317954391561574,0.061594041140729514,0.018867924528301886,57.82148652171848,53.0,2254.0282058822636,5080643.152912815,489.2408334296703,285.71158133622407,2545.910606993881,2875.5550661375323,0.013570708464085599,0.98647411588875,0.9970223400221989,0.13403258173937924,0.06135370223476191,298.65802375783596,81994.0,49.21756177065083,16.235336928032854,0.015366978071566213,0.13422933385369662,0.044734980608337194,0.07179793643437325,0.0033483111801839304,0.02031795082941949,0.06159404048297533,0.018867924528301886,57.82148652171848,53.0,2254.030245774626,5080652.348866822,489.2408273828693,285.7115811835223,2545.910606993881,2875.555035301695,0.013570702747473518,0.9864741216056218,0.9970223401430033,0.13403258173937924,0.06135370095319488,298.65789794921875,81994.0,49.217559814453125,16.235337265749706,0.015366978071566213,0.13422933385369662,0.044734980608337194,0.07179793643437325,0.003348312573507428,0.02031795121729374,0.06159403920173644,0.01886792480945587,57.82148652171848,53.0,2254.029052734375,5080647.5,489.2408302181461,285.71158121814057,2545.910606993881,2875.554975236591,1709666312.0,0.0015636828444830025,0.9984814388639744,0.9999857211303006,0.9875328563064362,0.8995677224746785,34.60215381613289,81994.0,1.232493851321887,1.1116134255255021,0.8296948557211503,0.9875356733419518,0.969607532258458,0.9818401346439983,0.028899935111373343,0.8113630740854972,0.8995933091823372,1.0,0.0,1.0,628.8188155569877,395413.102798493,495.2013803681872,286.5602558222859,18809.655466269578,42277.55194446763,0.0015636900093283033,0.9984814316988053,0.9999857211270298,0.9875328563064362,0.8995677224396254,34.60231236431934,81994.0,1.2324939045773906,1.1116134255688057,0.8296948557211503,0.9875356733419518,0.969607532258458,0.9818401346439983,0.028899802691543935,0.8113630390268661,0.899593309147293,1.0,0.0,1.0,628.8218646495181,395416.93746129685,495.2013768145892,286.5602558213486,18809.655466269578,42277.551942820224,0.00156368646289942,0.9984814352453945,0.9999857211286982,0.9875328563064362,0.8995676473353934,34.60223388671875,81994.0,1.2324938774108887,1.1116135183502984,0.8296948557211503,0.9875356733419518,0.969607532258458,0.9818401346439983,0.028899868950247765,0.8113630414009094,0.8995932340621949,1.0,0.0,1.0,628.8203735351562,395415.03125,495.2013785735361,286.5602558218268,18809.655466269578,42277.54841309923,COMPLETE
20,0.010167349129915237,2025-07-14 16:35:06.756733,2025-07-14 16:42:23.461954,0 days 00:07:16.705221,3.0,100,xavier_uniform,10,1e-05,2,0.01,0.3267722785241393,0.6732582297031346,0.9490117566537715,0.010764467067654328,0.009914580842486139,7211.23924311535,163988.0,828.9280915640404,98.35302601664007,0.0008537210039759007,0.010988608922604092,0.0027928872844354465,0.005073541966485353,0.00013867242041022438,0.0012063772601953653,0.010167455344290198,0.004016064257028112,343.96371469329966,249.0,10823.000047342457,117137330.02477482,472.2092300272836,384.454527315092,289.55944460294046,658.0622431719514,0.3267724434913245,0.6732580647284737,0.9490112680058244,0.010764467067654328,0.00991437300614929,7211.242883625631,163988.0,828.9360260472797,98.3550360111512,0.0008537210039759007,0.010988608922604092,0.0027928872844354465,0.005073541966485353,0.00013867235040310072,0.0012063657128867063,0.010167247561036152,0.004016064257028112,343.96371469329966,249.0,10823.003036345119,117137394.72473565,472.2091143175096,384.4543293587293,289.55944460294046,658.0484484136846,0.32677236769462803,0.673258140528605,0.9490115192892432,0.010764467067654328,0.009914474600976381,7211.2412109375,163988.0,828.9319458007812,98.35405347276952,0.0008537210039759007,0.010988608922604092,0.0027928872844354465,0.005073541966485353,0.00013867238885723054,0.0012063717003911734,0.010167349129915237,0.00401606410741806,343.96371469329966,249.0,10823.0009765625,117137352.0,472.20916748213506,384.45443115625426,289.55944460294046,658.0551915852691,0.6507367391145066,0.3492791317641998,0.4795742511782922,-0.0002272566188840388,6.751938546289542e-05,14321.120301485475,81994.0,8428.308986897293,3090.7141161531517,0.0,0.0,0.0,0.0,6.982693943966617e-05,0.00011864776214951385,0.0003235498213094672,8.47637211273575e-05,12811.165770106907,11797.5,11539.948668311114,133170415.26725546,173.2246276507052,137.42913483363148,-4.316674565378852,3.164531263417384,0.6507370106598379,0.3492788602065292,0.47957395429270633,-0.0002272566188840388,6.751917610989434e-05,14321.126277532503,81994.0,8428.313794396867,3090.71611548981,0.0,0.0,0.0,0.0,6.982691030165944e-05,0.00011864769447297974,0.0003235496120100704,8.47637211273575e-05,12811.165770106907,11797.5,11539.951398419335,133170478.27788037,173.22449297195664,137.42904975665098,-4.316674565378852,3.1645214513595192,0.6507368638621374,0.3492790070109003,0.47957373269125614,-0.0002272566188840388,6.751929203877417e-05,14321.123046875,81994.0,8428.3173828125,3090.715008360106,0.0,0.0,0.0,0.0,6.982692866586149e-05,0.0001186476438306272,0.00032354972790926695,8.47637202241458e-05,12811.165770106907,11797.5,11539.9501953125,133170440.0,173.22456577943416,137.42898625345933,-4.316674565378852,3.1645268847704155,1096259602.0,0.004580410094592211,0.995464575280796,0.9950544387832796,0.021756177031052967,0.019761629672924406,101.35818474522526,81994.0,81.5254616379403,49.9716139563264,0.0017074420079518013,0.021977217845208185,0.005585774568870893,0.010147083932970705,0.009866001473029613,0.012266106562402098,0.02001136086727093,0.011235955056179775,54.856282084707274,89.0,58.54446134015594,3427.4539536090133,493.7051532450549,285.1471261134967,414.39248487170255,928.7497807347261,0.004580469066780459,0.9954645163059427,0.9950543457854738,0.021756177031052967,0.01976121420986994,101.3594897187599,81994.0,81.52697586270006,49.972651192176976,0.0017074420079518013,0.021977217845208185,0.005585774568870893,0.010147083932970705,0.009865874451170577,0.012265878740358338,0.020010945510062234,0.011235955056179775,54.856282084707274,89.0,58.54418575317267,3427.421685501986,493.7051239962099,285.14709946364115,414.39248487170255,928.7302549553685,0.004580439748360104,0.995464545625688,0.9950543920707294,0.021756177031052967,0.019761418098580032,101.35884094238281,81994.0,81.5262222290039,49.97214216276331,0.0017074420079518013,0.021977217845208185,0.005585774568870893,0.010147083932970705,0.009865937754511833,0.012265992350876331,0.02001114934682846,0.01123595517128706,54.856282084707274,89.0,58.54431915283203,3427.4375,493.7051385374701,285.14711272734525,414.39248487170255,928.7398372417451,COMPLETE
