number,value,datetime_start,datetime_complete,duration,params_loss.margin,params_model.embedding_dim,params_model.entity_initializer,params_model.scoring_fct_norm,params_negative_sampler.num_negs_per_pos,params_optimizer.lr,params_regularizer.p,params_regularizer.weight,user_attrs_both.optimistic.adjusted_arithmetic_mean_rank,user_attrs_both.optimistic.adjusted_arithmetic_mean_rank_index,user_attrs_both.optimistic.adjusted_geometric_mean_rank_index,user_attrs_both.optimistic.adjusted_hits_at_k,user_attrs_both.optimistic.adjusted_inverse_harmonic_mean_rank,user_attrs_both.optimistic.arithmetic_mean_rank,user_attrs_both.optimistic.count,user_attrs_both.optimistic.geometric_mean_rank,user_attrs_both.optimistic.harmonic_mean_rank,user_attrs_both.optimistic.hits_at_1,user_attrs_both.optimistic.hits_at_10,user_attrs_both.optimistic.hits_at_3,user_attrs_both.optimistic.hits_at_5,user_attrs_both.optimistic.inverse_arithmetic_mean_rank,user_attrs_both.optimistic.inverse_geometric_mean_rank,user_attrs_both.optimistic.inverse_harmonic_mean_rank,user_attrs_both.optimistic.inverse_median_rank,user_attrs_both.optimistic.median_absolute_deviation,user_attrs_both.optimistic.median_rank,user_attrs_both.optimistic.standard_deviation,user_attrs_both.optimistic.variance,user_attrs_both.optimistic.z_arithmetic_mean_rank,user_attrs_both.optimistic.z_geometric_mean_rank,user_attrs_both.optimistic.z_hits_at_k,user_attrs_both.optimistic.z_inverse_harmonic_mean_rank,user_attrs_both.pessimistic.adjusted_arithmetic_mean_rank,user_attrs_both.pessimistic.adjusted_arithmetic_mean_rank_index,user_attrs_both.pessimistic.adjusted_geometric_mean_rank_index,user_attrs_both.pessimistic.adjusted_hits_at_k,user_attrs_both.pessimistic.adjusted_inverse_harmonic_mean_rank,user_attrs_both.pessimistic.arithmetic_mean_rank,user_attrs_both.pessimistic.count,user_attrs_both.pessimistic.geometric_mean_rank,user_attrs_both.pessimistic.harmonic_mean_rank,user_attrs_both.pessimistic.hits_at_1,user_attrs_both.pessimistic.hits_at_10,user_attrs_both.pessimistic.hits_at_3,user_attrs_both.pessimistic.hits_at_5,user_attrs_both.pessimistic.inverse_arithmetic_mean_rank,user_attrs_both.pessimistic.inverse_geometric_mean_rank,user_attrs_both.pessimistic.inverse_harmonic_mean_rank,user_attrs_both.pessimistic.inverse_median_rank,user_attrs_both.pessimistic.median_absolute_deviation,user_attrs_both.pessimistic.median_rank,user_attrs_both.pessimistic.standard_deviation,user_attrs_both.pessimistic.variance,user_attrs_both.pessimistic.z_arithmetic_mean_rank,user_attrs_both.pessimistic.z_geometric_mean_rank,user_attrs_both.pessimistic.z_hits_at_k,user_attrs_both.pessimistic.z_inverse_harmonic_mean_rank,user_attrs_both.realistic.adjusted_arithmetic_mean_rank,user_attrs_both.realistic.adjusted_arithmetic_mean_rank_index,user_attrs_both.realistic.adjusted_geometric_mean_rank_index,user_attrs_both.realistic.adjusted_hits_at_k,user_attrs_both.realistic.adjusted_inverse_harmonic_mean_rank,user_attrs_both.realistic.arithmetic_mean_rank,user_attrs_both.realistic.count,user_attrs_both.realistic.geometric_mean_rank,user_attrs_both.realistic.harmonic_mean_rank,user_attrs_both.realistic.hits_at_1,user_attrs_both.realistic.hits_at_10,user_attrs_both.realistic.hits_at_3,user_attrs_both.realistic.hits_at_5,user_attrs_both.realistic.inverse_arithmetic_mean_rank,user_attrs_both.realistic.inverse_geometric_mean_rank,user_attrs_both.realistic.inverse_harmonic_mean_rank,user_attrs_both.realistic.inverse_median_rank,user_attrs_both.realistic.median_absolute_deviation,user_attrs_both.realistic.median_rank,user_attrs_both.realistic.standard_deviation,user_attrs_both.realistic.variance,user_attrs_both.realistic.z_arithmetic_mean_rank,user_attrs_both.realistic.z_geometric_mean_rank,user_attrs_both.realistic.z_hits_at_k,user_attrs_both.realistic.z_inverse_harmonic_mean_rank,user_attrs_head.optimistic.adjusted_arithmetic_mean_rank,user_attrs_head.optimistic.adjusted_arithmetic_mean_rank_index,user_attrs_head.optimistic.adjusted_geometric_mean_rank_index,user_attrs_head.optimistic.adjusted_hits_at_k,user_attrs_head.optimistic.adjusted_inverse_harmonic_mean_rank,user_attrs_head.optimistic.arithmetic_mean_rank,user_attrs_head.optimistic.count,user_attrs_head.optimistic.geometric_mean_rank,user_attrs_head.optimistic.harmonic_mean_rank,user_attrs_head.optimistic.hits_at_1,user_attrs_head.optimistic.hits_at_10,user_attrs_head.optimistic.hits_at_3,user_attrs_head.optimistic.hits_at_5,user_attrs_head.optimistic.inverse_arithmetic_mean_rank,user_attrs_head.optimistic.inverse_geometric_mean_rank,user_attrs_head.optimistic.inverse_harmonic_mean_rank,user_attrs_head.optimistic.inverse_median_rank,user_attrs_head.optimistic.median_absolute_deviation,user_attrs_head.optimistic.median_rank,user_attrs_head.optimistic.standard_deviation,user_attrs_head.optimistic.variance,user_attrs_head.optimistic.z_arithmetic_mean_rank,user_attrs_head.optimistic.z_geometric_mean_rank,user_attrs_head.optimistic.z_hits_at_k,user_attrs_head.optimistic.z_inverse_harmonic_mean_rank,user_attrs_head.pessimistic.adjusted_arithmetic_mean_rank,user_attrs_head.pessimistic.adjusted_arithmetic_mean_rank_index,user_attrs_head.pessimistic.adjusted_geometric_mean_rank_index,user_attrs_head.pessimistic.adjusted_hits_at_k,user_attrs_head.pessimistic.adjusted_inverse_harmonic_mean_rank,user_attrs_head.pessimistic.arithmetic_mean_rank,user_attrs_head.pessimistic.count,user_attrs_head.pessimistic.geometric_mean_rank,user_attrs_head.pessimistic.harmonic_mean_rank,user_attrs_head.pessimistic.hits_at_1,user_attrs_head.pessimistic.hits_at_10,user_attrs_head.pessimistic.hits_at_3,user_attrs_head.pessimistic.hits_at_5,user_attrs_head.pessimistic.inverse_arithmetic_mean_rank,user_attrs_head.pessimistic.inverse_geometric_mean_rank,user_attrs_head.pessimistic.inverse_harmonic_mean_rank,user_attrs_head.pessimistic.inverse_median_rank,user_attrs_head.pessimistic.median_absolute_deviation,user_attrs_head.pessimistic.median_rank,user_attrs_head.pessimistic.standard_deviation,user_attrs_head.pessimistic.variance,user_attrs_head.pessimistic.z_arithmetic_mean_rank,user_attrs_head.pessimistic.z_geometric_mean_rank,user_attrs_head.pessimistic.z_hits_at_k,user_attrs_head.pessimistic.z_inverse_harmonic_mean_rank,user_attrs_head.realistic.adjusted_arithmetic_mean_rank,user_attrs_head.realistic.adjusted_arithmetic_mean_rank_index,user_attrs_head.realistic.adjusted_geometric_mean_rank_index,user_attrs_head.realistic.adjusted_hits_at_k,user_attrs_head.realistic.adjusted_inverse_harmonic_mean_rank,user_attrs_head.realistic.arithmetic_mean_rank,user_attrs_head.realistic.count,user_attrs_head.realistic.geometric_mean_rank,user_attrs_head.realistic.harmonic_mean_rank,user_attrs_head.realistic.hits_at_1,user_attrs_head.realistic.hits_at_10,user_attrs_head.realistic.hits_at_3,user_attrs_head.realistic.hits_at_5,user_attrs_head.realistic.inverse_arithmetic_mean_rank,user_attrs_head.realistic.inverse_geometric_mean_rank,user_attrs_head.realistic.inverse_harmonic_mean_rank,user_attrs_head.realistic.inverse_median_rank,user_attrs_head.realistic.median_absolute_deviation,user_attrs_head.realistic.median_rank,user_attrs_head.realistic.standard_deviation,user_attrs_head.realistic.variance,user_attrs_head.realistic.z_arithmetic_mean_rank,user_attrs_head.realistic.z_geometric_mean_rank,user_attrs_head.realistic.z_hits_at_k,user_attrs_head.realistic.z_inverse_harmonic_mean_rank,user_attrs_random_seed,user_attrs_tail.optimistic.adjusted_arithmetic_mean_rank,user_attrs_tail.optimistic.adjusted_arithmetic_mean_rank_index,user_attrs_tail.optimistic.adjusted_geometric_mean_rank_index,user_attrs_tail.optimistic.adjusted_hits_at_k,user_attrs_tail.optimistic.adjusted_inverse_harmonic_mean_rank,user_attrs_tail.optimistic.arithmetic_mean_rank,user_attrs_tail.optimistic.count,user_attrs_tail.optimistic.geometric_mean_rank,user_attrs_tail.optimistic.harmonic_mean_rank,user_attrs_tail.optimistic.hits_at_1,user_attrs_tail.optimistic.hits_at_10,user_attrs_tail.optimistic.hits_at_3,user_attrs_tail.optimistic.hits_at_5,user_attrs_tail.optimistic.inverse_arithmetic_mean_rank,user_attrs_tail.optimistic.inverse_geometric_mean_rank,user_attrs_tail.optimistic.inverse_harmonic_mean_rank,user_attrs_tail.optimistic.inverse_median_rank,user_attrs_tail.optimistic.median_absolute_deviation,user_attrs_tail.optimistic.median_rank,user_attrs_tail.optimistic.standard_deviation,user_attrs_tail.optimistic.variance,user_attrs_tail.optimistic.z_arithmetic_mean_rank,user_attrs_tail.optimistic.z_geometric_mean_rank,user_attrs_tail.optimistic.z_hits_at_k,user_attrs_tail.optimistic.z_inverse_harmonic_mean_rank,user_attrs_tail.pessimistic.adjusted_arithmetic_mean_rank,user_attrs_tail.pessimistic.adjusted_arithmetic_mean_rank_index,user_attrs_tail.pessimistic.adjusted_geometric_mean_rank_index,user_attrs_tail.pessimistic.adjusted_hits_at_k,user_attrs_tail.pessimistic.adjusted_inverse_harmonic_mean_rank,user_attrs_tail.pessimistic.arithmetic_mean_rank,user_attrs_tail.pessimistic.count,user_attrs_tail.pessimistic.geometric_mean_rank,user_attrs_tail.pessimistic.harmonic_mean_rank,user_attrs_tail.pessimistic.hits_at_1,user_attrs_tail.pessimistic.hits_at_10,user_attrs_tail.pessimistic.hits_at_3,user_attrs_tail.pessimistic.hits_at_5,user_attrs_tail.pessimistic.inverse_arithmetic_mean_rank,user_attrs_tail.pessimistic.inverse_geometric_mean_rank,user_attrs_tail.pessimistic.inverse_harmonic_mean_rank,user_attrs_tail.pessimistic.inverse_median_rank,user_attrs_tail.pessimistic.median_absolute_deviation,user_attrs_tail.pessimistic.median_rank,user_attrs_tail.pessimistic.standard_deviation,user_attrs_tail.pessimistic.variance,user_attrs_tail.pessimistic.z_arithmetic_mean_rank,user_attrs_tail.pessimistic.z_geometric_mean_rank,user_attrs_tail.pessimistic.z_hits_at_k,user_attrs_tail.pessimistic.z_inverse_harmonic_mean_rank,user_attrs_tail.realistic.adjusted_arithmetic_mean_rank,user_attrs_tail.realistic.adjusted_arithmetic_mean_rank_index,user_attrs_tail.realistic.adjusted_geometric_mean_rank_index,user_attrs_tail.realistic.adjusted_hits_at_k,user_attrs_tail.realistic.adjusted_inverse_harmonic_mean_rank,user_attrs_tail.realistic.arithmetic_mean_rank,user_attrs_tail.realistic.count,user_attrs_tail.realistic.geometric_mean_rank,user_attrs_tail.realistic.harmonic_mean_rank,user_attrs_tail.realistic.hits_at_1,user_attrs_tail.realistic.hits_at_10,user_attrs_tail.realistic.hits_at_3,user_attrs_tail.realistic.hits_at_5,user_attrs_tail.realistic.inverse_arithmetic_mean_rank,user_attrs_tail.realistic.inverse_geometric_mean_rank,user_attrs_tail.realistic.inverse_harmonic_mean_rank,user_attrs_tail.realistic.inverse_median_rank,user_attrs_tail.realistic.median_absolute_deviation,user_attrs_tail.realistic.median_rank,user_attrs_tail.realistic.standard_deviation,user_attrs_tail.realistic.variance,user_attrs_tail.realistic.z_arithmetic_mean_rank,user_attrs_tail.realistic.z_geometric_mean_rank,user_attrs_tail.realistic.z_hits_at_k,user_attrs_tail.realistic.z_inverse_harmonic_mean_rank,state
16,0.2604810893535614,2025-07-14 12:33:00.337155,2025-07-14 12:38:04.993575,0 days 00:05:04.656420,1.0,200,xavier_uniform_norm,1.0,2,0.001,1,1e-05,0.05364680774402621,0.9463960775343866,0.9983417316529097,0.4634855292824596,0.26029245532682743,1183.8824487157597,163988.0,27.926343364777303,3.8390459761350733,0.1247957167597629,0.4636070932019416,0.35945313071688173,0.4061455716271922,0.0008446784569572512,0.0358084832997245,0.26048138162876117,0.0625,22.239033277584028,16.0,4229.00395394439,17884474.44247728,663.7823993186212,404.4386129576454,12467.557529513044,17276.43757758249,0.0536469019715139,0.9463959833026289,0.9983417270378013,0.4634855292824596,0.26029194187965815,1183.884528136205,163988.0,27.926418303187713,3.839053541542306,0.1247957167597629,0.4636070932019416,0.35944703270971046,0.4061455716271922,0.0008446769733314318,0.03580838721039472,0.2604808683127297,0.0625,22.239033277584028,16.0,4229.009178299352,17884518.630140163,663.7823332264388,404.43861108801696,12467.557529513044,17276.403498461914,0.053646857417842045,0.9463960278583198,0.9983417295044834,0.4634855292824596,0.26029216297695956,1183.883544921875,163988.0,27.92637825012207,3.8390502837718863,0.1247957167597629,0.4636070932019416,0.35944703270971046,0.4061455716271922,0.0008446776773780584,0.035808440297842026,0.2604810893535614,0.0625,22.239033277584028,16.0,4229.0068359375,17884498.0,663.7823644768678,404.43861208729555,12467.557529513044,17276.418173392547,0.10701113940905327,0.8930294389153222,0.9859103061613185,0.10082748633585456,0.04417828999696811,2355.0528331341316,81994.0,229.155896932823,22.510848330468278,0.013391223748079127,0.10103178281337659,0.03544161767934239,0.05665048662097227,0.00042461892401334726,0.004363841443247475,0.044423025970394325,0.0051813471502590676,271.3162059865252,193.0,5746.511411498477,33022393.40248222,442.89703554823336,282.52726260096546,1915.189304031469,2070.569494986779,0.10701132671991441,0.8930292515959494,0.9859102854947825,0.10082748633585456,0.04417828655861935,2355.0569553869796,81994.0,229.1562315882169,22.51085007236527,0.013391223748079127,0.10103178281337659,0.03544161767934239,0.05665048662097227,0.00042461818076738677,0.004363835070376587,0.044423022532925946,0.0051813471502590676,271.3162059865252,193.0,5746.51826808671,33022472.205454282,442.89694264738233,282.5272566786622,1915.189304031469,2070.5693338365836,0.10701123476299512,0.8930293435570473,0.9859102937807848,0.10082748633585456,0.044178289127774495,2355.054931640625,81994.0,229.15609741210938,22.510848770809197,0.013391223748079127,0.10103178281337659,0.03544161767934239,0.05665048662097227,0.00042461854172870517,0.004363837651908398,0.044423025101423264,0.005181347019970417,271.3162059865252,193.0,5746.5146484375,33022432.0,442.89698825539466,282.52725905313935,1915.189304031469,2070.5694542489914,352526078.0,0.0005744624154153706,0.9994707039982627,0.9998524001483409,0.8261431194513987,0.47640634354011896,12.712064297387613,81994.0,3.4032755175227463,2.098460887423273,0.23620020977144668,0.8261824035905067,0.6834646437544211,0.7556406566334122,0.07866542967419576,0.2938345705045658,0.476539737287128,0.5,1.482602218505602,2.0,57.230619383202225,3275.343794984962,495.69201088066524,286.5220507820643,15735.646002534657,22389.96957370068,0.0005744640688412093,0.9994707023447621,0.9998523993318241,0.8261431194513987,0.47640532008478303,12.712100885430642,81994.0,3.403288812350668,2.098465393109324,0.23620020977144668,0.8261824035905067,0.6834524477400785,0.7556406566334122,0.07866520325889653,0.2938334226501615,0.4765387140925335,0.5,1.482602218505602,2.0,57.23063970549641,3275.346121100342,495.69201006060416,286.5220505480797,15735.646002534657,22389.92147372439,0.0005744632543949743,0.9994707031592451,0.9998523996961179,0.8261431194513987,0.47640577088866937,12.712082862854004,81994.0,3.403282880783081,2.0984634084763347,0.23620020977144668,0.8261824035905067,0.6834524477400785,0.7556406566334122,0.07866531610488892,0.2938339412212372,0.47653916478157043,0.5,1.482602218505602,2.0,57.230628967285156,3275.3447265625,495.69201046455066,286.5220506524733,15735.646002534657,22389.942660439123,COMPLETE
17,0.042075663805007935,2025-07-14 12:38:05.023969,2025-07-14 12:44:50.366259,0 days 00:06:45.342290,3.0,400,xavier_uniform_norm,2.0,4,0.001,1,0.0001,0.49746418950441856,0.5025585835874058,0.9473909362078728,0.07127040769563003,0.041869474521290445,10978.08327438593,163988.0,855.2463698665231,23.74496716451659,0.022099177988633315,0.07148084006146792,0.03615508451837939,0.04740590774934751,9.109058248202585e-05,0.0011692537206045882,0.04211418752746708,0.004132231404958678,357.3071346598501,242.0,14163.18305796905,200595754.33354154,352.4840712367548,383.7979161045125,1917.142719585537,2779.010102559439,0.4974790525780475,0.5025437198402365,0.9473561203752962,0.07106912785281519,0.04180429583867918,10978.411273995658,163988.0,855.8116963796509,23.78176398384984,0.022050393931263262,0.07127960582481645,0.036112398468180595,0.0473510256848062,9.108786098847289e-05,0.0011684813426017784,0.042049025491931485,0.004132231404958678,357.3071346598501,242.0,14163.265667819951,200598094.37724733,352.47364611561045,383.7838118488355,1911.728380061905,2774.6839862296024,0.4974716118026303,0.5025511609528426,0.947373106090196,0.07106912785281519,0.0418309409570988,10978.2470703125,163988.0,855.535888671875,23.76670763019496,0.022050393931263262,0.07127960582481645,0.036118496475351855,0.0473510256848062,9.108922677114606e-05,0.0011688580270856619,0.042075663805007935,0.00413223123177886,357.3071346598501,242.0,14163.224609375,200596928.0,352.47886515623884,383.79069293850284,1911.728380061905,2776.4525074283665,0.9937015969269483,0.0062986892789095306,0.05543017221244484,0.0005778632549707109,0.0003818155575624109,21868.93601970876,81994.0,15296.518748810338,1567.9743900418364,0.000182940215137693,0.0008049369466058492,0.0003414884015903603,0.00045125253067297607,4.5726961709466724e-05,6.537435193074721e-05,0.0006377655185894447,4.501260352898812e-05,16261.181132569442,22216.0,12804.885863228898,163965101.97031927,3.123828496467979,15.884340312514894,10.976347475590723,17.895116498496265,0.993729246337582,0.006271038611858404,0.05531884141606136,0.0005778632549707109,0.00038113811447914014,21869.54451545235,81994.0,15298.32154012688,1569.6412571197989,0.000182940215137693,0.0008049369466058492,0.0003414884015903603,0.00045125253067297607,4.572568940763401e-05,6.536664805854945e-05,0.0006370882489639335,4.500855162480871e-05,16259.698530350937,22218.0,12804.591476927979,163957562.89101666,3.110115176465058,15.852436816883653,10.976347475590723,17.863365767924606,0.9937154201234395,0.00628486545427831,0.05537415871663609,0.0005778632549707109,0.0003814684823835453,21869.240234375,81994.0,15297.42578125,1568.827935431372,0.000182940215137693,0.0008049369466058492,0.0003414884015903603,0.00045125253067297607,4.5726326789008453e-05,6.537047738675028e-05,0.0006374185322783887,4.5011085603618994e-05,16260.069180905562,22216.75,12804.73828125,163961328.0,3.11697258480109,15.868288812149558,10.976347475590723,17.878849610894335,1608968303.0,0.003941976633476305,0.9961030375942364,0.9971246305693763,0.14196286387682316,0.08335708028666544,87.23052906310218,81994.0,47.8178313105884,11.963066252857098,0.04401541576212894,0.14215674317632998,0.07196868063516842,0.09436056296802205,0.011463876360036799,0.020912700818754362,0.0835906095363447,0.014084507042253521,78.5779175807969,71.0,71.13126002084596,5059.656152153198,494.0218015137382,285.7403692721635,2703.983509485757,3917.5853064890916,0.003944123331356926,0.9961008907993414,0.997121093331812,0.14156030444249088,0.08322740044723417,87.27803253896627,81994.0,47.87542592428354,11.981649470978986,0.04391784764738883,0.14175427470302704,0.07188330853477083,0.09425079883893943,0.011457636829216316,0.020887542631610856,0.08346096273489904,0.014084507042253521,78.5779175807969,71.0,71.12873647222783,5059.297152135634,494.0207368011116,285.7393556259885,2696.3159121839235,3911.490661238122,0.0039430499502997466,0.9961019642289072,0.9971228147686967,0.14156030444249088,0.083280359292644,87.25428009033203,81994.0,47.84739685058594,11.974053458782,0.04391784764738883,0.14175427470302704,0.07189550454911335,0.09425079883893943,0.011460755951702595,0.020899778231978416,0.08351390808820724,0.014084506779909134,78.5779175807969,71.0,71.12991333007812,5059.46484375,494.0212691733541,285.73984892842634,2696.3159121839235,3913.979601516652,COMPLETE
