number,value,datetime_start,datetime_complete,duration,params_loss.margin,params_model.embedding_dim,params_model.entity_initializer,params_negative_sampler.num_negs_per_pos,params_optimizer.lr,params_regularizer.p,params_regularizer.weight,user_attrs_both.optimistic.adjusted_arithmetic_mean_rank,user_attrs_both.optimistic.adjusted_arithmetic_mean_rank_index,user_attrs_both.optimistic.adjusted_geometric_mean_rank_index,user_attrs_both.optimistic.adjusted_hits_at_k,user_attrs_both.optimistic.adjusted_inverse_harmonic_mean_rank,user_attrs_both.optimistic.arithmetic_mean_rank,user_attrs_both.optimistic.count,user_attrs_both.optimistic.geometric_mean_rank,user_attrs_both.optimistic.harmonic_mean_rank,user_attrs_both.optimistic.hits_at_1,user_attrs_both.optimistic.hits_at_10,user_attrs_both.optimistic.hits_at_3,user_attrs_both.optimistic.hits_at_5,user_attrs_both.optimistic.inverse_arithmetic_mean_rank,user_attrs_both.optimistic.inverse_geometric_mean_rank,user_attrs_both.optimistic.inverse_harmonic_mean_rank,user_attrs_both.optimistic.inverse_median_rank,user_attrs_both.optimistic.median_absolute_deviation,user_attrs_both.optimistic.median_rank,user_attrs_both.optimistic.standard_deviation,user_attrs_both.optimistic.variance,user_attrs_both.optimistic.z_arithmetic_mean_rank,user_attrs_both.optimistic.z_geometric_mean_rank,user_attrs_both.optimistic.z_hits_at_k,user_attrs_both.optimistic.z_inverse_harmonic_mean_rank,user_attrs_both.pessimistic.adjusted_arithmetic_mean_rank,user_attrs_both.pessimistic.adjusted_arithmetic_mean_rank_index,user_attrs_both.pessimistic.adjusted_geometric_mean_rank_index,user_attrs_both.pessimistic.adjusted_hits_at_k,user_attrs_both.pessimistic.adjusted_inverse_harmonic_mean_rank,user_attrs_both.pessimistic.arithmetic_mean_rank,user_attrs_both.pessimistic.count,user_attrs_both.pessimistic.geometric_mean_rank,user_attrs_both.pessimistic.harmonic_mean_rank,user_attrs_both.pessimistic.hits_at_1,user_attrs_both.pessimistic.hits_at_10,user_attrs_both.pessimistic.hits_at_3,user_attrs_both.pessimistic.hits_at_5,user_attrs_both.pessimistic.inverse_arithmetic_mean_rank,user_attrs_both.pessimistic.inverse_geometric_mean_rank,user_attrs_both.pessimistic.inverse_harmonic_mean_rank,user_attrs_both.pessimistic.inverse_median_rank,user_attrs_both.pessimistic.median_absolute_deviation,user_attrs_both.pessimistic.median_rank,user_attrs_both.pessimistic.standard_deviation,user_attrs_both.pessimistic.variance,user_attrs_both.pessimistic.z_arithmetic_mean_rank,user_attrs_both.pessimistic.z_geometric_mean_rank,user_attrs_both.pessimistic.z_hits_at_k,user_attrs_both.pessimistic.z_inverse_harmonic_mean_rank,user_attrs_both.realistic.adjusted_arithmetic_mean_rank,user_attrs_both.realistic.adjusted_arithmetic_mean_rank_index,user_attrs_both.realistic.adjusted_geometric_mean_rank_index,user_attrs_both.realistic.adjusted_hits_at_k,user_attrs_both.realistic.adjusted_inverse_harmonic_mean_rank,user_attrs_both.realistic.arithmetic_mean_rank,user_attrs_both.realistic.count,user_attrs_both.realistic.geometric_mean_rank,user_attrs_both.realistic.harmonic_mean_rank,user_attrs_both.realistic.hits_at_1,user_attrs_both.realistic.hits_at_10,user_attrs_both.realistic.hits_at_3,user_attrs_both.realistic.hits_at_5,user_attrs_both.realistic.inverse_arithmetic_mean_rank,user_attrs_both.realistic.inverse_geometric_mean_rank,user_attrs_both.realistic.inverse_harmonic_mean_rank,user_attrs_both.realistic.inverse_median_rank,user_attrs_both.realistic.median_absolute_deviation,user_attrs_both.realistic.median_rank,user_attrs_both.realistic.standard_deviation,user_attrs_both.realistic.variance,user_attrs_both.realistic.z_arithmetic_mean_rank,user_attrs_both.realistic.z_geometric_mean_rank,user_attrs_both.realistic.z_hits_at_k,user_attrs_both.realistic.z_inverse_harmonic_mean_rank,user_attrs_head.optimistic.adjusted_arithmetic_mean_rank,user_attrs_head.optimistic.adjusted_arithmetic_mean_rank_index,user_attrs_head.optimistic.adjusted_geometric_mean_rank_index,user_attrs_head.optimistic.adjusted_hits_at_k,user_attrs_head.optimistic.adjusted_inverse_harmonic_mean_rank,user_attrs_head.optimistic.arithmetic_mean_rank,user_attrs_head.optimistic.count,user_attrs_head.optimistic.geometric_mean_rank,user_attrs_head.optimistic.harmonic_mean_rank,user_attrs_head.optimistic.hits_at_1,user_attrs_head.optimistic.hits_at_10,user_attrs_head.optimistic.hits_at_3,user_attrs_head.optimistic.hits_at_5,user_attrs_head.optimistic.inverse_arithmetic_mean_rank,user_attrs_head.optimistic.inverse_geometric_mean_rank,user_attrs_head.optimistic.inverse_harmonic_mean_rank,user_attrs_head.optimistic.inverse_median_rank,user_attrs_head.optimistic.median_absolute_deviation,user_attrs_head.optimistic.median_rank,user_attrs_head.optimistic.standard_deviation,user_attrs_head.optimistic.variance,user_attrs_head.optimistic.z_arithmetic_mean_rank,user_attrs_head.optimistic.z_geometric_mean_rank,user_attrs_head.optimistic.z_hits_at_k,user_attrs_head.optimistic.z_inverse_harmonic_mean_rank,user_attrs_head.pessimistic.adjusted_arithmetic_mean_rank,user_attrs_head.pessimistic.adjusted_arithmetic_mean_rank_index,user_attrs_head.pessimistic.adjusted_geometric_mean_rank_index,user_attrs_head.pessimistic.adjusted_hits_at_k,user_attrs_head.pessimistic.adjusted_inverse_harmonic_mean_rank,user_attrs_head.pessimistic.arithmetic_mean_rank,user_attrs_head.pessimistic.count,user_attrs_head.pessimistic.geometric_mean_rank,user_attrs_head.pessimistic.harmonic_mean_rank,user_attrs_head.pessimistic.hits_at_1,user_attrs_head.pessimistic.hits_at_10,user_attrs_head.pessimistic.hits_at_3,user_attrs_head.pessimistic.hits_at_5,user_attrs_head.pessimistic.inverse_arithmetic_mean_rank,user_attrs_head.pessimistic.inverse_geometric_mean_rank,user_attrs_head.pessimistic.inverse_harmonic_mean_rank,user_attrs_head.pessimistic.inverse_median_rank,user_attrs_head.pessimistic.median_absolute_deviation,user_attrs_head.pessimistic.median_rank,user_attrs_head.pessimistic.standard_deviation,user_attrs_head.pessimistic.variance,user_attrs_head.pessimistic.z_arithmetic_mean_rank,user_attrs_head.pessimistic.z_geometric_mean_rank,user_attrs_head.pessimistic.z_hits_at_k,user_attrs_head.pessimistic.z_inverse_harmonic_mean_rank,user_attrs_head.realistic.adjusted_arithmetic_mean_rank,user_attrs_head.realistic.adjusted_arithmetic_mean_rank_index,user_attrs_head.realistic.adjusted_geometric_mean_rank_index,user_attrs_head.realistic.adjusted_hits_at_k,user_attrs_head.realistic.adjusted_inverse_harmonic_mean_rank,user_attrs_head.realistic.arithmetic_mean_rank,user_attrs_head.realistic.count,user_attrs_head.realistic.geometric_mean_rank,user_attrs_head.realistic.harmonic_mean_rank,user_attrs_head.realistic.hits_at_1,user_attrs_head.realistic.hits_at_10,user_attrs_head.realistic.hits_at_3,user_attrs_head.realistic.hits_at_5,user_attrs_head.realistic.inverse_arithmetic_mean_rank,user_attrs_head.realistic.inverse_geometric_mean_rank,user_attrs_head.realistic.inverse_harmonic_mean_rank,user_attrs_head.realistic.inverse_median_rank,user_attrs_head.realistic.median_absolute_deviation,user_attrs_head.realistic.median_rank,user_attrs_head.realistic.standard_deviation,user_attrs_head.realistic.variance,user_attrs_head.realistic.z_arithmetic_mean_rank,user_attrs_head.realistic.z_geometric_mean_rank,user_attrs_head.realistic.z_hits_at_k,user_attrs_head.realistic.z_inverse_harmonic_mean_rank,user_attrs_random_seed,user_attrs_tail.optimistic.adjusted_arithmetic_mean_rank,user_attrs_tail.optimistic.adjusted_arithmetic_mean_rank_index,user_attrs_tail.optimistic.adjusted_geometric_mean_rank_index,user_attrs_tail.optimistic.adjusted_hits_at_k,user_attrs_tail.optimistic.adjusted_inverse_harmonic_mean_rank,user_attrs_tail.optimistic.arithmetic_mean_rank,user_attrs_tail.optimistic.count,user_attrs_tail.optimistic.geometric_mean_rank,user_attrs_tail.optimistic.harmonic_mean_rank,user_attrs_tail.optimistic.hits_at_1,user_attrs_tail.optimistic.hits_at_10,user_attrs_tail.optimistic.hits_at_3,user_attrs_tail.optimistic.hits_at_5,user_attrs_tail.optimistic.inverse_arithmetic_mean_rank,user_attrs_tail.optimistic.inverse_geometric_mean_rank,user_attrs_tail.optimistic.inverse_harmonic_mean_rank,user_attrs_tail.optimistic.inverse_median_rank,user_attrs_tail.optimistic.median_absolute_deviation,user_attrs_tail.optimistic.median_rank,user_attrs_tail.optimistic.standard_deviation,user_attrs_tail.optimistic.variance,user_attrs_tail.optimistic.z_arithmetic_mean_rank,user_attrs_tail.optimistic.z_geometric_mean_rank,user_attrs_tail.optimistic.z_hits_at_k,user_attrs_tail.optimistic.z_inverse_harmonic_mean_rank,user_attrs_tail.pessimistic.adjusted_arithmetic_mean_rank,user_attrs_tail.pessimistic.adjusted_arithmetic_mean_rank_index,user_attrs_tail.pessimistic.adjusted_geometric_mean_rank_index,user_attrs_tail.pessimistic.adjusted_hits_at_k,user_attrs_tail.pessimistic.adjusted_inverse_harmonic_mean_rank,user_attrs_tail.pessimistic.arithmetic_mean_rank,user_attrs_tail.pessimistic.count,user_attrs_tail.pessimistic.geometric_mean_rank,user_attrs_tail.pessimistic.harmonic_mean_rank,user_attrs_tail.pessimistic.hits_at_1,user_attrs_tail.pessimistic.hits_at_10,user_attrs_tail.pessimistic.hits_at_3,user_attrs_tail.pessimistic.hits_at_5,user_attrs_tail.pessimistic.inverse_arithmetic_mean_rank,user_attrs_tail.pessimistic.inverse_geometric_mean_rank,user_attrs_tail.pessimistic.inverse_harmonic_mean_rank,user_attrs_tail.pessimistic.inverse_median_rank,user_attrs_tail.pessimistic.median_absolute_deviation,user_attrs_tail.pessimistic.median_rank,user_attrs_tail.pessimistic.standard_deviation,user_attrs_tail.pessimistic.variance,user_attrs_tail.pessimistic.z_arithmetic_mean_rank,user_attrs_tail.pessimistic.z_geometric_mean_rank,user_attrs_tail.pessimistic.z_hits_at_k,user_attrs_tail.pessimistic.z_inverse_harmonic_mean_rank,user_attrs_tail.realistic.adjusted_arithmetic_mean_rank,user_attrs_tail.realistic.adjusted_arithmetic_mean_rank_index,user_attrs_tail.realistic.adjusted_geometric_mean_rank_index,user_attrs_tail.realistic.adjusted_hits_at_k,user_attrs_tail.realistic.adjusted_inverse_harmonic_mean_rank,user_attrs_tail.realistic.arithmetic_mean_rank,user_attrs_tail.realistic.count,user_attrs_tail.realistic.geometric_mean_rank,user_attrs_tail.realistic.harmonic_mean_rank,user_attrs_tail.realistic.hits_at_1,user_attrs_tail.realistic.hits_at_10,user_attrs_tail.realistic.hits_at_3,user_attrs_tail.realistic.hits_at_5,user_attrs_tail.realistic.inverse_arithmetic_mean_rank,user_attrs_tail.realistic.inverse_geometric_mean_rank,user_attrs_tail.realistic.inverse_harmonic_mean_rank,user_attrs_tail.realistic.inverse_median_rank,user_attrs_tail.realistic.median_absolute_deviation,user_attrs_tail.realistic.median_rank,user_attrs_tail.realistic.standard_deviation,user_attrs_tail.realistic.variance,user_attrs_tail.realistic.z_arithmetic_mean_rank,user_attrs_tail.realistic.z_geometric_mean_rank,user_attrs_tail.realistic.z_hits_at_k,user_attrs_tail.realistic.z_inverse_harmonic_mean_rank,state
15,0.4802736639976502,2025-07-14 15:45:03.490369,2025-07-14 15:55:36.291187,0 days 00:10:32.800818,4.0,300,xavier_uniform_norm,14,0.01,2,1e-05,0.00763371694906658,0.9924112534749616,0.999575976262027,0.5591178521762128,0.480140897155989,168.4615337707637,163988.0,7.885139418783535,2.082146194725027,0.42275654316169475,0.5592177476400713,0.507085884333,0.526300704929629,0.005936073224649394,0.126820839415706,0.48027367268130866,0.3333333333333333,2.965204437011204,3.0,1643.8064927170303,2702099.7854986642,696.0564805579252,404.938618278404,15040.025086816686,31868.47743145073,0.00763372938377903,0.9924112410396856,0.9995759758620392,0.5591178521762128,0.48014087334243916,168.4618081810864,163988.0,7.885145913637825,2.082146297938327,0.42275654316169475,0.5592177476400713,0.507085884333,0.526300704929629,0.005936063555278117,0.1268207349556387,0.48027364887384094,0.3333333333333333,2.965204437011204,3.0,1643.8084688204392,2702106.2821657965,696.0564718360829,404.93861811636475,15040.025086816686,31868.475850869738,0.0076337231186592615,0.9924112473050893,0.9995759760829632,0.5591178521762128,0.4801408884701121,168.461669921875,163988.0,7.8851423263549805,2.082146232371577,0.42275654316169475,0.5592177476400713,0.507085884333,0.526300704929629,0.00593606848269701,0.12682078778743744,0.4802736639976502,0.3333333432674408,2.965204437011204,3.0,1643.8074951171875,2702103.25,696.0564762305058,404.9386182058634,15040.025086816686,31868.476854941473,0.013671882375278568,0.9863729373801113,0.9969474957553931,0.13053153016670782,0.060348908819291155,300.8846135083055,81994.0,50.42952286922914,16.50450867440707,0.015330390028538674,0.13072907773739542,0.04395443569041637,0.07015147449813401,0.003323533192143095,0.019829654200638404,0.06058950434257173,0.018518518518518517,59.30408874022408,54.0,2236.623686334682,5002485.514273343,489.19064800514167,285.69013344563996,2479.4091323611797,2828.4618907961,0.013671903433896092,0.9863729163205368,0.99694749070223,0.13053153016670782,0.06034886120849056,300.8850769568505,81994.0,50.42960469563079,16.504521640221803,0.015330390028538674,0.13072907773739542,0.04395443569041637,0.07015147449813401,0.0033235280729572657,0.019829622025306887,0.060589456743961774,0.018518518518518517,59.30408874022408,54.0,2236.6263070600294,5002497.237432985,489.1906375606673,285.6901319975809,2479.4091323611797,2828.4596593500355,0.01367189344736275,0.9863729263075239,0.996947492655935,0.13053153016670782,0.06034888188967737,300.8848571777344,81994.0,50.42957305908203,16.504516008126725,0.015330390028538674,0.13072907773739542,0.04395443569041637,0.07015147449813401,0.0033235305454581976,0.019829634577035904,0.06058947741985321,0.018518518656492233,59.30408874022408,54.0,2236.625,5002491.0,489.1906425137033,285.69013255744414,2479.4091323611797,2828.4606286459166,1383290329.0,0.00162858972920826,0.9984165290459529,0.9999856951328882,0.9877036390967591,0.8999323472062916,36.038454033221946,81994.0,1.2329171508301513,1.1111631616727324,0.8301826962948509,0.987706417542747,0.9702173329755835,0.982449935361124,0.02774813811597337,0.8110845074437298,0.8999578410200455,1.0,0.0,1.0,605.509960801337,366642.3126296367,495.1691880507012,286.5602483723544,18812.908386337025,42294.68844308343,0.0016285935872018835,0.9984165251877849,0.9999856951310121,0.9877036390967591,0.8999323471899621,36.03853940532234,81994.0,1.2329171813783057,1.111163161692889,0.8301826962948509,0.987706417542747,0.9702173329755835,0.982449935361124,0.027748072383097615,0.8110844873473801,0.8999578410037202,1.0,0.0,1.0,605.5109269634129,366643.4826720916,495.1691861372254,286.5602483718168,18812.908386337025,42294.68844231599,0.0016285917126834886,0.998416527062388,0.9999856951305072,0.9877036390967591,0.8999323418591695,36.03849792480469,81994.0,1.2329171895980835,1.111163168273054,0.8301826962948509,0.987706417542747,0.9702173329755835,0.982449935361124,0.02774810418486595,0.811084508895874,0.8999578356742858,1.0,0.0,1.0,605.5104370117188,366642.875,495.16918706694327,286.5602483716721,18812.908386337025,42294.688191781366,COMPLETE
16,0.48049706220626837,2025-07-14 15:55:36.328416,2025-07-14 16:06:15.990249,0 days 00:10:39.661833,4.0,300,xavier_uniform_norm,14,0.01,2,1e-05,0.007454979010665467,0.9925899995131148,0.9995766035502553,0.5598680770448863,0.4803643259271719,164.51712930214407,163988.0,7.874953746329987,2.0811782542287864,0.42312242359197016,0.5599678025221357,0.506659023831012,0.5264775471375954,0.006078394415474204,0.12698487282747992,0.48049704438727464,0.3333333333333333,2.965204437011204,3.0,1614.2186179724229,2605701.746608799,696.1818492876679,404.9388723993858,15060.205806859312,31883.307109143578,0.007454991721704861,0.9925899868014993,0.9995766034079004,0.5598680770448863,0.48036432131064083,164.51740981047394,163988.0,7.874956057836293,2.0811782742192744,0.42312242359197016,0.5599678025221357,0.506659023831012,0.5264775471375954,0.0060783840515846455,0.12698483555408663,0.48049703977192265,0.3333333333333333,2.965204437011204,3.0,1614.2203287869677,2605707.2698691064,696.181840372007,404.9388723417163,15060.205806859312,31883.306802729738,0.007454986211373892,0.99258999231208,0.9995766034327619,0.5598680770448863,0.48036434375071785,164.5172882080078,163988.0,7.874955654144287,2.08117817704933,0.42312242359197016,0.5599678025221357,0.506659023831012,0.5264775471375954,0.006078388541936874,0.1269848346710205,0.48049706220626837,0.3333333432674408,2.965204437011204,3.0,1614.219482421875,2605704.5,696.1818442370129,404.93887235178795,15060.205806859312,31883.308292148977,0.013315523461986004,0.9867293124867162,0.9969578459601225,0.13239794441973476,0.0602971898853429,293.0420274654243,81994.0,50.26192091346456,16.518605272760254,0.01501329365563334,0.1325950679317999,0.04344220308803083,0.07106617557382247,0.003412479802467886,0.01989577759516374,0.0605377986511388,0.018518518518518517,59.30408874022408,54.0,2195.852312027601,4821767.37623696,489.3673918742466,285.6930994507535,2514.8611380016096,2826.0379027478107,0.013315538424687927,0.9867292975233344,0.9969578442875704,0.13239794441973476,0.06029718067775042,293.04235675781155,81994.0,50.26194799727752,16.518607784540798,0.01501329365563334,0.1325950679317999,0.04344220308803083,0.07106617557382247,0.003412475967856286,0.019895766874259747,0.060537789445903906,0.018518518518518517,59.30408874022408,54.0,2195.853920083908,4821774.438347867,489.36738445317275,285.6930989714588,2514.8611380016096,2826.0374712019066,0.01331553156580198,0.986729304382532,0.9969578459591659,0.13239794441973476,0.06029719142743189,293.0422058105469,81994.0,50.26192092895508,16.51860485208694,0.01501329365563334,0.1325950679317999,0.04344220308803083,0.07106617557382247,0.003412477672100067,0.019895777106285095,0.06053780019283294,0.018518518656492233,59.30408874022408,54.0,2195.85302734375,4821771.0,489.36738785498477,285.6930994504794,2514.8611380016096,2826.0379750231846,1684871806.0,0.0016265009012319954,0.9984186179683282,0.9999856387874292,0.9873376759746387,0.9004309233297922,35.99223113886382,81994.0,1.23383458848712,1.1105480754240127,0.8312315535283069,0.9873405371124716,0.9698758445739932,0.9818889187013684,0.027783773563295897,0.8104814124445653,0.9004562901234106,1.0,0.0,1.0,597.1589554589924,356598.8180848749,495.17022406119025,286.5602322257547,18805.937843335356,42318.12033979665,0.0016265113729289737,0.998418607496158,0.9999856387837768,0.9873376759746387,0.9004309233043166,35.992462863136325,81994.0,1.2338346479569722,1.1105480754554242,0.8312315535283069,0.9873405371124716,0.9698758445739932,0.9818889187013684,0.02778359468765905,0.8104813733800036,0.9004562900979414,1.0,0.0,1.0,597.162270588752,356602.77741471387,495.1702188674701,286.56023222470805,18805.937843335356,42318.12033859936,0.0016265061694496457,0.9984186126998725,0.9999856387852303,0.9873376759746387,0.9004308829099817,35.992347717285156,81994.0,1.2338346242904663,1.1105481252617553,0.8312315535283069,0.9873405371124716,0.9698758445739932,0.9818889187013684,0.02778368443250656,0.8104813694953918,0.9004562497138976,1.0,0.0,1.0,597.16064453125,356600.8125,495.17022144827587,286.5602322251246,18805.937843335356,42318.11844016131,COMPLETE
