number,value,datetime_start,datetime_complete,duration,params_loss.margin,params_model.embedding_dim,params_model.entity_initializer,params_negative_sampler.num_negs_per_pos,params_optimizer.lr,params_regularizer.p,params_regularizer.weight,user_attrs_both.optimistic.adjusted_arithmetic_mean_rank,user_attrs_both.optimistic.adjusted_arithmetic_mean_rank_index,user_attrs_both.optimistic.adjusted_geometric_mean_rank_index,user_attrs_both.optimistic.adjusted_hits_at_k,user_attrs_both.optimistic.adjusted_inverse_harmonic_mean_rank,user_attrs_both.optimistic.arithmetic_mean_rank,user_attrs_both.optimistic.count,user_attrs_both.optimistic.geometric_mean_rank,user_attrs_both.optimistic.harmonic_mean_rank,user_attrs_both.optimistic.hits_at_1,user_attrs_both.optimistic.hits_at_10,user_attrs_both.optimistic.hits_at_3,user_attrs_both.optimistic.hits_at_5,user_attrs_both.optimistic.inverse_arithmetic_mean_rank,user_attrs_both.optimistic.inverse_geometric_mean_rank,user_attrs_both.optimistic.inverse_harmonic_mean_rank,user_attrs_both.optimistic.inverse_median_rank,user_attrs_both.optimistic.median_absolute_deviation,user_attrs_both.optimistic.median_rank,user_attrs_both.optimistic.standard_deviation,user_attrs_both.optimistic.variance,user_attrs_both.optimistic.z_arithmetic_mean_rank,user_attrs_both.optimistic.z_geometric_mean_rank,user_attrs_both.optimistic.z_hits_at_k,user_attrs_both.optimistic.z_inverse_harmonic_mean_rank,user_attrs_both.pessimistic.adjusted_arithmetic_mean_rank,user_attrs_both.pessimistic.adjusted_arithmetic_mean_rank_index,user_attrs_both.pessimistic.adjusted_geometric_mean_rank_index,user_attrs_both.pessimistic.adjusted_hits_at_k,user_attrs_both.pessimistic.adjusted_inverse_harmonic_mean_rank,user_attrs_both.pessimistic.arithmetic_mean_rank,user_attrs_both.pessimistic.count,user_attrs_both.pessimistic.geometric_mean_rank,user_attrs_both.pessimistic.harmonic_mean_rank,user_attrs_both.pessimistic.hits_at_1,user_attrs_both.pessimistic.hits_at_10,user_attrs_both.pessimistic.hits_at_3,user_attrs_both.pessimistic.hits_at_5,user_attrs_both.pessimistic.inverse_arithmetic_mean_rank,user_attrs_both.pessimistic.inverse_geometric_mean_rank,user_attrs_both.pessimistic.inverse_harmonic_mean_rank,user_attrs_both.pessimistic.inverse_median_rank,user_attrs_both.pessimistic.median_absolute_deviation,user_attrs_both.pessimistic.median_rank,user_attrs_both.pessimistic.standard_deviation,user_attrs_both.pessimistic.variance,user_attrs_both.pessimistic.z_arithmetic_mean_rank,user_attrs_both.pessimistic.z_geometric_mean_rank,user_attrs_both.pessimistic.z_hits_at_k,user_attrs_both.pessimistic.z_inverse_harmonic_mean_rank,user_attrs_both.realistic.adjusted_arithmetic_mean_rank,user_attrs_both.realistic.adjusted_arithmetic_mean_rank_index,user_attrs_both.realistic.adjusted_geometric_mean_rank_index,user_attrs_both.realistic.adjusted_hits_at_k,user_attrs_both.realistic.adjusted_inverse_harmonic_mean_rank,user_attrs_both.realistic.arithmetic_mean_rank,user_attrs_both.realistic.count,user_attrs_both.realistic.geometric_mean_rank,user_attrs_both.realistic.harmonic_mean_rank,user_attrs_both.realistic.hits_at_1,user_attrs_both.realistic.hits_at_10,user_attrs_both.realistic.hits_at_3,user_attrs_both.realistic.hits_at_5,user_attrs_both.realistic.inverse_arithmetic_mean_rank,user_attrs_both.realistic.inverse_geometric_mean_rank,user_attrs_both.realistic.inverse_harmonic_mean_rank,user_attrs_both.realistic.inverse_median_rank,user_attrs_both.realistic.median_absolute_deviation,user_attrs_both.realistic.median_rank,user_attrs_both.realistic.standard_deviation,user_attrs_both.realistic.variance,user_attrs_both.realistic.z_arithmetic_mean_rank,user_attrs_both.realistic.z_geometric_mean_rank,user_attrs_both.realistic.z_hits_at_k,user_attrs_both.realistic.z_inverse_harmonic_mean_rank,user_attrs_head.optimistic.adjusted_arithmetic_mean_rank,user_attrs_head.optimistic.adjusted_arithmetic_mean_rank_index,user_attrs_head.optimistic.adjusted_geometric_mean_rank_index,user_attrs_head.optimistic.adjusted_hits_at_k,user_attrs_head.optimistic.adjusted_inverse_harmonic_mean_rank,user_attrs_head.optimistic.arithmetic_mean_rank,user_attrs_head.optimistic.count,user_attrs_head.optimistic.geometric_mean_rank,user_attrs_head.optimistic.harmonic_mean_rank,user_attrs_head.optimistic.hits_at_1,user_attrs_head.optimistic.hits_at_10,user_attrs_head.optimistic.hits_at_3,user_attrs_head.optimistic.hits_at_5,user_attrs_head.optimistic.inverse_arithmetic_mean_rank,user_attrs_head.optimistic.inverse_geometric_mean_rank,user_attrs_head.optimistic.inverse_harmonic_mean_rank,user_attrs_head.optimistic.inverse_median_rank,user_attrs_head.optimistic.median_absolute_deviation,user_attrs_head.optimistic.median_rank,user_attrs_head.optimistic.standard_deviation,user_attrs_head.optimistic.variance,user_attrs_head.optimistic.z_arithmetic_mean_rank,user_attrs_head.optimistic.z_geometric_mean_rank,user_attrs_head.optimistic.z_hits_at_k,user_attrs_head.optimistic.z_inverse_harmonic_mean_rank,user_attrs_head.pessimistic.adjusted_arithmetic_mean_rank,user_attrs_head.pessimistic.adjusted_arithmetic_mean_rank_index,user_attrs_head.pessimistic.adjusted_geometric_mean_rank_index,user_attrs_head.pessimistic.adjusted_hits_at_k,user_attrs_head.pessimistic.adjusted_inverse_harmonic_mean_rank,user_attrs_head.pessimistic.arithmetic_mean_rank,user_attrs_head.pessimistic.count,user_attrs_head.pessimistic.geometric_mean_rank,user_attrs_head.pessimistic.harmonic_mean_rank,user_attrs_head.pessimistic.hits_at_1,user_attrs_head.pessimistic.hits_at_10,user_attrs_head.pessimistic.hits_at_3,user_attrs_head.pessimistic.hits_at_5,user_attrs_head.pessimistic.inverse_arithmetic_mean_rank,user_attrs_head.pessimistic.inverse_geometric_mean_rank,user_attrs_head.pessimistic.inverse_harmonic_mean_rank,user_attrs_head.pessimistic.inverse_median_rank,user_attrs_head.pessimistic.median_absolute_deviation,user_attrs_head.pessimistic.median_rank,user_attrs_head.pessimistic.standard_deviation,user_attrs_head.pessimistic.variance,user_attrs_head.pessimistic.z_arithmetic_mean_rank,user_attrs_head.pessimistic.z_geometric_mean_rank,user_attrs_head.pessimistic.z_hits_at_k,user_attrs_head.pessimistic.z_inverse_harmonic_mean_rank,user_attrs_head.realistic.adjusted_arithmetic_mean_rank,user_attrs_head.realistic.adjusted_arithmetic_mean_rank_index,user_attrs_head.realistic.adjusted_geometric_mean_rank_index,user_attrs_head.realistic.adjusted_hits_at_k,user_attrs_head.realistic.adjusted_inverse_harmonic_mean_rank,user_attrs_head.realistic.arithmetic_mean_rank,user_attrs_head.realistic.count,user_attrs_head.realistic.geometric_mean_rank,user_attrs_head.realistic.harmonic_mean_rank,user_attrs_head.realistic.hits_at_1,user_attrs_head.realistic.hits_at_10,user_attrs_head.realistic.hits_at_3,user_attrs_head.realistic.hits_at_5,user_attrs_head.realistic.inverse_arithmetic_mean_rank,user_attrs_head.realistic.inverse_geometric_mean_rank,user_attrs_head.realistic.inverse_harmonic_mean_rank,user_attrs_head.realistic.inverse_median_rank,user_attrs_head.realistic.median_absolute_deviation,user_attrs_head.realistic.median_rank,user_attrs_head.realistic.standard_deviation,user_attrs_head.realistic.variance,user_attrs_head.realistic.z_arithmetic_mean_rank,user_attrs_head.realistic.z_geometric_mean_rank,user_attrs_head.realistic.z_hits_at_k,user_attrs_head.realistic.z_inverse_harmonic_mean_rank,user_attrs_random_seed,user_attrs_tail.optimistic.adjusted_arithmetic_mean_rank,user_attrs_tail.optimistic.adjusted_arithmetic_mean_rank_index,user_attrs_tail.optimistic.adjusted_geometric_mean_rank_index,user_attrs_tail.optimistic.adjusted_hits_at_k,user_attrs_tail.optimistic.adjusted_inverse_harmonic_mean_rank,user_attrs_tail.optimistic.arithmetic_mean_rank,user_attrs_tail.optimistic.count,user_attrs_tail.optimistic.geometric_mean_rank,user_attrs_tail.optimistic.harmonic_mean_rank,user_attrs_tail.optimistic.hits_at_1,user_attrs_tail.optimistic.hits_at_10,user_attrs_tail.optimistic.hits_at_3,user_attrs_tail.optimistic.hits_at_5,user_attrs_tail.optimistic.inverse_arithmetic_mean_rank,user_attrs_tail.optimistic.inverse_geometric_mean_rank,user_attrs_tail.optimistic.inverse_harmonic_mean_rank,user_attrs_tail.optimistic.inverse_median_rank,user_attrs_tail.optimistic.median_absolute_deviation,user_attrs_tail.optimistic.median_rank,user_attrs_tail.optimistic.standard_deviation,user_attrs_tail.optimistic.variance,user_attrs_tail.optimistic.z_arithmetic_mean_rank,user_attrs_tail.optimistic.z_geometric_mean_rank,user_attrs_tail.optimistic.z_hits_at_k,user_attrs_tail.optimistic.z_inverse_harmonic_mean_rank,user_attrs_tail.pessimistic.adjusted_arithmetic_mean_rank,user_attrs_tail.pessimistic.adjusted_arithmetic_mean_rank_index,user_attrs_tail.pessimistic.adjusted_geometric_mean_rank_index,user_attrs_tail.pessimistic.adjusted_hits_at_k,user_attrs_tail.pessimistic.adjusted_inverse_harmonic_mean_rank,user_attrs_tail.pessimistic.arithmetic_mean_rank,user_attrs_tail.pessimistic.count,user_attrs_tail.pessimistic.geometric_mean_rank,user_attrs_tail.pessimistic.harmonic_mean_rank,user_attrs_tail.pessimistic.hits_at_1,user_attrs_tail.pessimistic.hits_at_10,user_attrs_tail.pessimistic.hits_at_3,user_attrs_tail.pessimistic.hits_at_5,user_attrs_tail.pessimistic.inverse_arithmetic_mean_rank,user_attrs_tail.pessimistic.inverse_geometric_mean_rank,user_attrs_tail.pessimistic.inverse_harmonic_mean_rank,user_attrs_tail.pessimistic.inverse_median_rank,user_attrs_tail.pessimistic.median_absolute_deviation,user_attrs_tail.pessimistic.median_rank,user_attrs_tail.pessimistic.standard_deviation,user_attrs_tail.pessimistic.variance,user_attrs_tail.pessimistic.z_arithmetic_mean_rank,user_attrs_tail.pessimistic.z_geometric_mean_rank,user_attrs_tail.pessimistic.z_hits_at_k,user_attrs_tail.pessimistic.z_inverse_harmonic_mean_rank,user_attrs_tail.realistic.adjusted_arithmetic_mean_rank,user_attrs_tail.realistic.adjusted_arithmetic_mean_rank_index,user_attrs_tail.realistic.adjusted_geometric_mean_rank_index,user_attrs_tail.realistic.adjusted_hits_at_k,user_attrs_tail.realistic.adjusted_inverse_harmonic_mean_rank,user_attrs_tail.realistic.arithmetic_mean_rank,user_attrs_tail.realistic.count,user_attrs_tail.realistic.geometric_mean_rank,user_attrs_tail.realistic.harmonic_mean_rank,user_attrs_tail.realistic.hits_at_1,user_attrs_tail.realistic.hits_at_10,user_attrs_tail.realistic.hits_at_3,user_attrs_tail.realistic.hits_at_5,user_attrs_tail.realistic.inverse_arithmetic_mean_rank,user_attrs_tail.realistic.inverse_geometric_mean_rank,user_attrs_tail.realistic.inverse_harmonic_mean_rank,user_attrs_tail.realistic.inverse_median_rank,user_attrs_tail.realistic.median_absolute_deviation,user_attrs_tail.realistic.median_rank,user_attrs_tail.realistic.standard_deviation,user_attrs_tail.realistic.variance,user_attrs_tail.realistic.z_arithmetic_mean_rank,user_attrs_tail.realistic.z_geometric_mean_rank,user_attrs_tail.realistic.z_hits_at_k,user_attrs_tail.realistic.z_inverse_harmonic_mean_rank,state
10,0.010573368519544601,2025-07-14 15:07:29.385769,2025-07-14 15:14:33.928405,0 days 00:07:04.542636,4.0,100,xavier_uniform_norm,14,1e-05,2,1e-05,0.3224428882824285,0.677587816137036,0.9500187342529708,0.011691574222437827,0.010320702960610882,7115.697880332707,163988.0,812.5771646201223,94.57629772014768,0.0008110349537771057,0.011915506012635071,0.0029575334780593703,0.0053113642461643535,0.0001405343533153551,0.001230652353450638,0.01057347373608355,0.004016064257028112,346.9289191303109,249.0,10727.501494381082,115079288.31194834,475.2459113274002,384.86246440775994,314.49822059057703,685.0178589766733,0.3224430648553453,0.6775876395561176,0.9500183001649108,0.01168547483326162,0.010320496859932539,7115.701776959289,163988.0,812.5842131802506,94.57814078903053,0.0008110349537771057,0.011909408005463815,0.0029575334780593703,0.0053113642461643535,0.0001405342763573945,0.0012306416784621634,0.01057326768804471,0.004016064257028112,346.9289191303109,249.0,10727.50574581265,115079379.5264434,475.2457874772401,384.86228855417465,314.33414969592155,685.004179419578,0.3224429710579994,0.677587733357714,0.9500185097172866,0.01168547483326162,0.010320597717192055,7115.69970703125,163988.0,812.580810546875,94.57723885737317,0.0008110349537771057,0.011909408005463815,0.0029575334780593703,0.0053113642461643535,0.0001405343209626153,0.0012306468561291695,0.010573368519544601,0.00401606410741806,346.9289191303109,249.0,10727.50390625,115079344.0,475.2458532677165,384.86237344602034,314.33414969592155,685.0108736364584,0.6420626263933376,0.3579536386458956,0.48926128021555415,-0.0002272566188840388,7.224415292305568e-05,14130.224345683831,81994.0,8271.445904993903,3046.2415290422077,0.0,0.0,0.0,0.0,7.077028471281536e-05,0.00012089784681977402,0.00032827337900367265,8.623663332183511e-05,12682.17937709692,11596.0,11478.143873600977,131747786.78308365,177.5267404538534,140.20509708854462,-4.316674565378852,3.3859739533581976,0.6420629239848535,0.35795334104085674,0.4892610478414796,-0.0002272566188840388,7.224408426825487e-05,14130.230894943532,81994.0,8271.449667851777,3046.242165967444,0.0,0.0,0.0,0.0,7.077025191130086e-05,0.00012089779182077951,0.00032827331036645077,8.623663332183511e-05,12682.17937709692,11596.0,11478.148578375401,131747894.78726123,177.5265928569392,140.20503049829722,-4.316674565378852,3.385970735611739,0.6420627271231474,0.3579535379115085,0.48926107557561505,-0.0002272566188840388,7.224411170888596e-05,14130.2265625,81994.0,8271.44921875,3046.241911394822,0.0,0.0,0.0,0.0,7.07702711224556e-05,0.00012089779920643196,0.00032827333780005574,8.623663597973064e-05,12682.17937709692,11596.0,11478.146484375,131747840.0,177.5266904947373,140.20503844592625,-4.316674565378852,3.3859720217125293,239061105.0,0.004571969906827431,0.9954730158499929,0.9951587744517867,0.023610390183128986,0.02056914862701421,101.17141498158402,81994.0,79.8266295936761,48.03379867156798,0.0016220699075542113,0.023831012025270142,0.005915066956118741,0.010622728492328707,0.009884214826707994,0.01252714795914696,0.020818674093163424,0.011111111111111112,60.78669095872968,90.0,60.22270826163136,3626.774590365562,493.7093393834794,285.17702499627774,449.7099027468128,966.7012586220786,0.004572026123305949,0.9954729596309739,0.9951586916275371,0.023598191412391643,0.020568736494576512,101.17265897504696,81994.0,79.82797816882008,48.03474933897045,0.0016220699075542113,0.02381881601092763,0.005915066956118741,0.010622728492328707,0.009884093292898808,0.01252693633158542,0.02081826206572297,0.011111111111111112,60.78669095872968,90.0,60.22268283629276,3626.7715280007105,493.7093115014029,285.1770012618007,449.47755131342393,966.6818893738192,0.004571997935485143,0.9954729878200685,0.9951587327464898,0.023598191412391643,0.02056893707529824,101.17203521728516,81994.0,79.82730865478516,48.03428665398507,0.0016220699075542113,0.02381881601092763,0.005915066956118741,0.010622728492328707,0.009884154424071312,0.012527041137218475,0.02081846259534359,0.011111111380159855,60.78669095872968,90.0,60.22269821166992,3626.773193359375,493.7093254819118,285.1770130450265,449.47755131342393,966.6913161925789,COMPLETE
11,0.473326563835144,2025-07-14 15:14:33.960094,2025-07-14 15:22:51.981244,0 days 00:08:18.021150,3.0,200,xavier_uniform_norm,12,0.01,2,0.0001,0.009536626970130245,0.9905082572209495,0.9995228502107553,0.5489318722519467,0.47319215412638155,210.45511866721955,163988.0,8.747780438656854,2.112705644300336,0.41653047783984193,0.549034075664073,0.5011525233553674,0.519403858818938,0.004751606928512116,0.1143147118303236,0.4733267044075938,0.3333333333333333,2.965204437011204,3.0,1750.714428250728,3065001.0092852735,694.7217588178759,404.91709636280433,14766.026692741996,31407.26727058403,0.009536638299534923,0.9905082458910314,0.9995228492241083,0.5489318722519467,0.4731918435430868,210.45536868551358,163988.0,8.7477964594637,2.1127070302435196,0.41653047783984193,0.549034075664073,0.5011525233553674,0.519403858818938,0.004751601283663683,0.11431450247315275,0.4733263939036241,0.3333333333333333,2.965204437011204,3.0,1750.7157466232748,3065005.62547469,694.7217508713085,404.91709596310335,14766.026692741996,31407.246656183594,0.009536632047401709,0.9905082521434478,0.9995228496599188,0.5489318722519467,0.4731920135180195,210.45523071289062,163988.0,8.74778938293457,2.1127062717491856,0.41653047783984193,0.549034075664073,0.5011525233553674,0.519403858818938,0.00475160451605916,0.11431459337472916,0.473326563835144,0.3333333432674408,2.965204437011204,3.0,1750.7149658203125,3065003.0,694.7217552566225,404.91709613965475,14766.026692741996,31407.257937960127,0.01827591684086272,0.9817686937025064,0.9962526931996666,0.11174539977676366,0.05300501830685484,402.208124984755,81994.0,61.680533864072835,18.780226463473632,0.012793619045295997,0.1119472156499256,0.03671000317096373,0.05962631412054541,0.0024862749852154363,0.0162125704392204,0.053247494216586665,0.015873015873015872,71.1649064882689,63.0,2436.9652288133275,5938799.526445193,486.9071780691117,285.49102743884526,2122.571951405223,2484.2648729708962,0.018275935682783663,0.9817686748597293,0.9962526794765738,0.11174539977676366,0.053004397224611054,402.20853964924265,81994.0,61.68075608356086,18.780445463724956,0.012793619045295997,0.1119472156499256,0.03671000317096373,0.05962631412054541,0.002486272421943299,0.016212512029607235,0.05324687329336957,0.015873015873015872,71.1649064882689,63.0,2436.966985523823,5938808.08853307,486.9071687240557,285.49102350628885,2122.571951405223,2484.2357637874497,0.018275926770233323,0.9817686837726847,0.9962526863371818,0.11174539977676366,0.05300467403583075,402.2083435058594,81994.0,61.68064498901367,18.780347856493158,0.012793619045295997,0.1119472156499256,0.03671000317096373,0.05962631412054541,0.0024862736463546753,0.016212541610002518,0.05324715003371239,0.01587301678955555,71.1649064882689,63.0,2436.966064453125,5938804.0,486.90717314442674,285.49102547229813,2122.571951405223,2484.2487375097785,480803211.0,0.0008451546800291944,0.9991999995004225,0.9999852205017996,0.9861177989009046,0.8933787511528274,18.702112349684125,81994.0,1.2406452702174218,1.1193120435622939,0.8202673366343879,0.9861209356782203,0.9655950435397712,0.9791814035173305,0.05346989587606075,0.8060321705210314,0.8934059145986007,1.0,0.0,1.0,343.0219544894003,117664.06126172822,495.5577537620203,286.56011236000614,18782.70269999647,41986.684953572745,0.0008451585380228181,0.9991999956422545,0.9999852204972216,0.9861177989009046,0.8933787510680842,18.702197721784522,81994.0,1.2406453447577115,1.1193120436684383,0.8202673366343879,0.9861209356782203,0.9655950435397712,0.9791814035173305,0.0534696517957988,0.806032122093113,0.8934059145138791,1.0,0.0,1.0,343.0227474483568,117664.60526701917,495.55775184854446,286.56011235869425,18782.70269999647,41986.68494959001,0.0008451565694307597,0.9991999976109355,0.9999852205006201,0.9861177989009046,0.893378691240959,18.7021541595459,81994.0,1.2406452894210815,1.1193121186043264,0.8202673366343879,0.9861209356782203,0.9655950435397712,0.9791814035173305,0.05346977710723877,0.8060321807861328,0.8934058547019958,1.0,0.0,1.0,343.0223693847656,117664.3359375,495.55775282492067,286.56011235966815,18782.70269999647,41986.68213785686,COMPLETE
