number,value,datetime_start,datetime_complete,duration,params_loss.margin,params_model.embedding_dim,params_model.entity_initializer,params_model.scoring_fct_norm,params_negative_sampler.num_negs_per_pos,params_optimizer.lr,params_regularizer.p,params_regularizer.weight,user_attrs_both.optimistic.adjusted_arithmetic_mean_rank,user_attrs_both.optimistic.adjusted_arithmetic_mean_rank_index,user_attrs_both.optimistic.adjusted_geometric_mean_rank_index,user_attrs_both.optimistic.adjusted_hits_at_k,user_attrs_both.optimistic.adjusted_inverse_harmonic_mean_rank,user_attrs_both.optimistic.arithmetic_mean_rank,user_attrs_both.optimistic.count,user_attrs_both.optimistic.geometric_mean_rank,user_attrs_both.optimistic.harmonic_mean_rank,user_attrs_both.optimistic.hits_at_1,user_attrs_both.optimistic.hits_at_10,user_attrs_both.optimistic.hits_at_3,user_attrs_both.optimistic.hits_at_5,user_attrs_both.optimistic.inverse_arithmetic_mean_rank,user_attrs_both.optimistic.inverse_geometric_mean_rank,user_attrs_both.optimistic.inverse_harmonic_mean_rank,user_attrs_both.optimistic.inverse_median_rank,user_attrs_both.optimistic.median_absolute_deviation,user_attrs_both.optimistic.median_rank,user_attrs_both.optimistic.standard_deviation,user_attrs_both.optimistic.variance,user_attrs_both.optimistic.z_arithmetic_mean_rank,user_attrs_both.optimistic.z_geometric_mean_rank,user_attrs_both.optimistic.z_hits_at_k,user_attrs_both.optimistic.z_inverse_harmonic_mean_rank,user_attrs_both.pessimistic.adjusted_arithmetic_mean_rank,user_attrs_both.pessimistic.adjusted_arithmetic_mean_rank_index,user_attrs_both.pessimistic.adjusted_geometric_mean_rank_index,user_attrs_both.pessimistic.adjusted_hits_at_k,user_attrs_both.pessimistic.adjusted_inverse_harmonic_mean_rank,user_attrs_both.pessimistic.arithmetic_mean_rank,user_attrs_both.pessimistic.count,user_attrs_both.pessimistic.geometric_mean_rank,user_attrs_both.pessimistic.harmonic_mean_rank,user_attrs_both.pessimistic.hits_at_1,user_attrs_both.pessimistic.hits_at_10,user_attrs_both.pessimistic.hits_at_3,user_attrs_both.pessimistic.hits_at_5,user_attrs_both.pessimistic.inverse_arithmetic_mean_rank,user_attrs_both.pessimistic.inverse_geometric_mean_rank,user_attrs_both.pessimistic.inverse_harmonic_mean_rank,user_attrs_both.pessimistic.inverse_median_rank,user_attrs_both.pessimistic.median_absolute_deviation,user_attrs_both.pessimistic.median_rank,user_attrs_both.pessimistic.standard_deviation,user_attrs_both.pessimistic.variance,user_attrs_both.pessimistic.z_arithmetic_mean_rank,user_attrs_both.pessimistic.z_geometric_mean_rank,user_attrs_both.pessimistic.z_hits_at_k,user_attrs_both.pessimistic.z_inverse_harmonic_mean_rank,user_attrs_both.realistic.adjusted_arithmetic_mean_rank,user_attrs_both.realistic.adjusted_arithmetic_mean_rank_index,user_attrs_both.realistic.adjusted_geometric_mean_rank_index,user_attrs_both.realistic.adjusted_hits_at_k,user_attrs_both.realistic.adjusted_inverse_harmonic_mean_rank,user_attrs_both.realistic.arithmetic_mean_rank,user_attrs_both.realistic.count,user_attrs_both.realistic.geometric_mean_rank,user_attrs_both.realistic.harmonic_mean_rank,user_attrs_both.realistic.hits_at_1,user_attrs_both.realistic.hits_at_10,user_attrs_both.realistic.hits_at_3,user_attrs_both.realistic.hits_at_5,user_attrs_both.realistic.inverse_arithmetic_mean_rank,user_attrs_both.realistic.inverse_geometric_mean_rank,user_attrs_both.realistic.inverse_harmonic_mean_rank,user_attrs_both.realistic.inverse_median_rank,user_attrs_both.realistic.median_absolute_deviation,user_attrs_both.realistic.median_rank,user_attrs_both.realistic.standard_deviation,user_attrs_both.realistic.variance,user_attrs_both.realistic.z_arithmetic_mean_rank,user_attrs_both.realistic.z_geometric_mean_rank,user_attrs_both.realistic.z_hits_at_k,user_attrs_both.realistic.z_inverse_harmonic_mean_rank,user_attrs_head.optimistic.adjusted_arithmetic_mean_rank,user_attrs_head.optimistic.adjusted_arithmetic_mean_rank_index,user_attrs_head.optimistic.adjusted_geometric_mean_rank_index,user_attrs_head.optimistic.adjusted_hits_at_k,user_attrs_head.optimistic.adjusted_inverse_harmonic_mean_rank,user_attrs_head.optimistic.arithmetic_mean_rank,user_attrs_head.optimistic.count,user_attrs_head.optimistic.geometric_mean_rank,user_attrs_head.optimistic.harmonic_mean_rank,user_attrs_head.optimistic.hits_at_1,user_attrs_head.optimistic.hits_at_10,user_attrs_head.optimistic.hits_at_3,user_attrs_head.optimistic.hits_at_5,user_attrs_head.optimistic.inverse_arithmetic_mean_rank,user_attrs_head.optimistic.inverse_geometric_mean_rank,user_attrs_head.optimistic.inverse_harmonic_mean_rank,user_attrs_head.optimistic.inverse_median_rank,user_attrs_head.optimistic.median_absolute_deviation,user_attrs_head.optimistic.median_rank,user_attrs_head.optimistic.standard_deviation,user_attrs_head.optimistic.variance,user_attrs_head.optimistic.z_arithmetic_mean_rank,user_attrs_head.optimistic.z_geometric_mean_rank,user_attrs_head.optimistic.z_hits_at_k,user_attrs_head.optimistic.z_inverse_harmonic_mean_rank,user_attrs_head.pessimistic.adjusted_arithmetic_mean_rank,user_attrs_head.pessimistic.adjusted_arithmetic_mean_rank_index,user_attrs_head.pessimistic.adjusted_geometric_mean_rank_index,user_attrs_head.pessimistic.adjusted_hits_at_k,user_attrs_head.pessimistic.adjusted_inverse_harmonic_mean_rank,user_attrs_head.pessimistic.arithmetic_mean_rank,user_attrs_head.pessimistic.count,user_attrs_head.pessimistic.geometric_mean_rank,user_attrs_head.pessimistic.harmonic_mean_rank,user_attrs_head.pessimistic.hits_at_1,user_attrs_head.pessimistic.hits_at_10,user_attrs_head.pessimistic.hits_at_3,user_attrs_head.pessimistic.hits_at_5,user_attrs_head.pessimistic.inverse_arithmetic_mean_rank,user_attrs_head.pessimistic.inverse_geometric_mean_rank,user_attrs_head.pessimistic.inverse_harmonic_mean_rank,user_attrs_head.pessimistic.inverse_median_rank,user_attrs_head.pessimistic.median_absolute_deviation,user_attrs_head.pessimistic.median_rank,user_attrs_head.pessimistic.standard_deviation,user_attrs_head.pessimistic.variance,user_attrs_head.pessimistic.z_arithmetic_mean_rank,user_attrs_head.pessimistic.z_geometric_mean_rank,user_attrs_head.pessimistic.z_hits_at_k,user_attrs_head.pessimistic.z_inverse_harmonic_mean_rank,user_attrs_head.realistic.adjusted_arithmetic_mean_rank,user_attrs_head.realistic.adjusted_arithmetic_mean_rank_index,user_attrs_head.realistic.adjusted_geometric_mean_rank_index,user_attrs_head.realistic.adjusted_hits_at_k,user_attrs_head.realistic.adjusted_inverse_harmonic_mean_rank,user_attrs_head.realistic.arithmetic_mean_rank,user_attrs_head.realistic.count,user_attrs_head.realistic.geometric_mean_rank,user_attrs_head.realistic.harmonic_mean_rank,user_attrs_head.realistic.hits_at_1,user_attrs_head.realistic.hits_at_10,user_attrs_head.realistic.hits_at_3,user_attrs_head.realistic.hits_at_5,user_attrs_head.realistic.inverse_arithmetic_mean_rank,user_attrs_head.realistic.inverse_geometric_mean_rank,user_attrs_head.realistic.inverse_harmonic_mean_rank,user_attrs_head.realistic.inverse_median_rank,user_attrs_head.realistic.median_absolute_deviation,user_attrs_head.realistic.median_rank,user_attrs_head.realistic.standard_deviation,user_attrs_head.realistic.variance,user_attrs_head.realistic.z_arithmetic_mean_rank,user_attrs_head.realistic.z_geometric_mean_rank,user_attrs_head.realistic.z_hits_at_k,user_attrs_head.realistic.z_inverse_harmonic_mean_rank,user_attrs_random_seed,user_attrs_tail.optimistic.adjusted_arithmetic_mean_rank,user_attrs_tail.optimistic.adjusted_arithmetic_mean_rank_index,user_attrs_tail.optimistic.adjusted_geometric_mean_rank_index,user_attrs_tail.optimistic.adjusted_hits_at_k,user_attrs_tail.optimistic.adjusted_inverse_harmonic_mean_rank,user_attrs_tail.optimistic.arithmetic_mean_rank,user_attrs_tail.optimistic.count,user_attrs_tail.optimistic.geometric_mean_rank,user_attrs_tail.optimistic.harmonic_mean_rank,user_attrs_tail.optimistic.hits_at_1,user_attrs_tail.optimistic.hits_at_10,user_attrs_tail.optimistic.hits_at_3,user_attrs_tail.optimistic.hits_at_5,user_attrs_tail.optimistic.inverse_arithmetic_mean_rank,user_attrs_tail.optimistic.inverse_geometric_mean_rank,user_attrs_tail.optimistic.inverse_harmonic_mean_rank,user_attrs_tail.optimistic.inverse_median_rank,user_attrs_tail.optimistic.median_absolute_deviation,user_attrs_tail.optimistic.median_rank,user_attrs_tail.optimistic.standard_deviation,user_attrs_tail.optimistic.variance,user_attrs_tail.optimistic.z_arithmetic_mean_rank,user_attrs_tail.optimistic.z_geometric_mean_rank,user_attrs_tail.optimistic.z_hits_at_k,user_attrs_tail.optimistic.z_inverse_harmonic_mean_rank,user_attrs_tail.pessimistic.adjusted_arithmetic_mean_rank,user_attrs_tail.pessimistic.adjusted_arithmetic_mean_rank_index,user_attrs_tail.pessimistic.adjusted_geometric_mean_rank_index,user_attrs_tail.pessimistic.adjusted_hits_at_k,user_attrs_tail.pessimistic.adjusted_inverse_harmonic_mean_rank,user_attrs_tail.pessimistic.arithmetic_mean_rank,user_attrs_tail.pessimistic.count,user_attrs_tail.pessimistic.geometric_mean_rank,user_attrs_tail.pessimistic.harmonic_mean_rank,user_attrs_tail.pessimistic.hits_at_1,user_attrs_tail.pessimistic.hits_at_10,user_attrs_tail.pessimistic.hits_at_3,user_attrs_tail.pessimistic.hits_at_5,user_attrs_tail.pessimistic.inverse_arithmetic_mean_rank,user_attrs_tail.pessimistic.inverse_geometric_mean_rank,user_attrs_tail.pessimistic.inverse_harmonic_mean_rank,user_attrs_tail.pessimistic.inverse_median_rank,user_attrs_tail.pessimistic.median_absolute_deviation,user_attrs_tail.pessimistic.median_rank,user_attrs_tail.pessimistic.standard_deviation,user_attrs_tail.pessimistic.variance,user_attrs_tail.pessimistic.z_arithmetic_mean_rank,user_attrs_tail.pessimistic.z_geometric_mean_rank,user_attrs_tail.pessimistic.z_hits_at_k,user_attrs_tail.pessimistic.z_inverse_harmonic_mean_rank,user_attrs_tail.realistic.adjusted_arithmetic_mean_rank,user_attrs_tail.realistic.adjusted_arithmetic_mean_rank_index,user_attrs_tail.realistic.adjusted_geometric_mean_rank_index,user_attrs_tail.realistic.adjusted_hits_at_k,user_attrs_tail.realistic.adjusted_inverse_harmonic_mean_rank,user_attrs_tail.realistic.arithmetic_mean_rank,user_attrs_tail.realistic.count,user_attrs_tail.realistic.geometric_mean_rank,user_attrs_tail.realistic.harmonic_mean_rank,user_attrs_tail.realistic.hits_at_1,user_attrs_tail.realistic.hits_at_10,user_attrs_tail.realistic.hits_at_3,user_attrs_tail.realistic.hits_at_5,user_attrs_tail.realistic.inverse_arithmetic_mean_rank,user_attrs_tail.realistic.inverse_geometric_mean_rank,user_attrs_tail.realistic.inverse_harmonic_mean_rank,user_attrs_tail.realistic.inverse_median_rank,user_attrs_tail.realistic.median_absolute_deviation,user_attrs_tail.realistic.median_rank,user_attrs_tail.realistic.standard_deviation,user_attrs_tail.realistic.variance,user_attrs_tail.realistic.z_arithmetic_mean_rank,user_attrs_tail.realistic.z_geometric_mean_rank,user_attrs_tail.realistic.z_hits_at_k,user_attrs_tail.realistic.z_inverse_harmonic_mean_rank,state
4,0.35727688670158386,2025-07-14 11:13:35.050937,2025-07-14 11:19:25.561067,0 days 00:05:50.510130,2.0,100,xavier_uniform_norm,2.0,12,0.0001,1,0.01,0.1833050195529539,0.8167319900877399,0.9958548996131739,0.4111832670964827,0.35711270887467456,4045.191215210869,163988.0,68.30659515572489,2.798949446333682,0.3269446544869137,0.4113166817084177,0.3659231163255848,0.3842720199038954,0.00024720710265555934,0.014639874783982529,0.3572769066300539,0.019230769230769232,75.6127131437857,52.0,8992.724662581193,80869096.85699603,572.838722443896,403.43117144846974,11060.6496078421,23702.7055405352,0.18330510549063328,0.8167319041461661,0.9958548953408065,0.4111832670964827,0.3571126943417686,4045.193111691099,163988.0,68.30666452883305,2.798949560157108,0.3269446544869137,0.4113166817084177,0.3659231163255848,0.3842720199038954,0.0002472069867591435,0.01463985991554145,0.3572768921008598,0.019230769230769232,75.6127131437857,52.0,8992.726224465783,80869124.94819461,572.8386621662751,403.43116971768933,11060.6496078421,23702.70457594004,0.18330507246200775,0.8167319371762884,0.9958548982225094,0.4111832670964827,0.35711268894111337,4045.1923828125,163988.0,68.3066177368164,2.798949602455677,0.3269446544869137,0.4113166817084177,0.3659231163255848,0.3842720199038954,0.0002472070336807519,0.014639870263636112,0.35727688670158386,0.01923076994717121,75.6127131437857,52.0,8992.7255859375,80869112.0,572.8386853329114,403.4311708850971,11060.6496078421,23702.704217481383,0.36664273842458417,0.6333860419751944,0.9094180630624391,0.07100145464532633,0.03302309454192071,8068.907822523599,81994.0,1467.802849268687,30.056488063499398,0.014086396565602361,0.07121252774593263,0.033843939800473205,0.04883284142742152,0.00012393251007386573,0.0006812904066089234,0.03327068677775432,0.00030057108506161706,4867.383083353891,3327.0,11373.45346193689,129355443.65084422,314.1271587744849,260.6072725999705,1348.6523511500961,1547.7423909630274,0.36664290911022096,0.6333858712818016,0.9094179551144834,0.07100145464532633,0.0330230881745249,8068.911578896017,81994.0,1467.8045972813086,30.05649381428511,0.014086396565602361,0.07121252774593263,0.033843939800473205,0.04883284142742152,0.0001239324523787655,0.0006812895952582627,0.033270680411988864,0.00030057108506161706,4867.383083353891,3327.0,11373.45461574318,129355469.89636983,314.12707411927147,260.6072416658782,1348.6523511500961,1547.7420925328363,0.3666428222796831,0.6333859581162851,0.9094179646198828,0.07100145464532633,0.033023094629041606,8068.90966796875,81994.0,1467.804443359375,30.056487984815192,0.014086396565602361,0.07121252774593263,0.033843939800473205,0.04883284142742152,0.00012393247743602842,0.0006812896463088691,0.033270686864852905,0.0003005710896104574,4867.383083353891,3327.0,11373.4541015625,129355456.0,314.12711718474463,260.60724438979173,1348.6523511500961,1547.7423950462517,522030267.0,0.000970444676384939,0.9990747038419142,0.9998661891052533,0.751364654831491,0.681201907637253,21.47460789813889,81994.0,3.178758607869423,1.467818534070067,0.639802912408225,0.7514208356709028,0.6980022928506964,0.7197111983803693,0.046566624393950665,0.31458821614336246,0.6812831264823535,1.0,0.0,1.0,46.46925025519559,2159.3912192799953,495.49561281414447,286.5260022055065,14311.331715860802,32014.875940165883,0.0009704463298107778,0.9990747021884137,0.9998661889411995,0.751364654831491,0.6812018849388475,21.474644486181916,81994.0,3.1787612790534983,1.4678185829611254,0.639802912408225,0.7514208356709028,0.6980022928506964,0.7197111983803693,0.04656654505472537,0.3145879517878606,0.6812831037897308,1.0,0.0,1.0,46.46927337107043,2159.3933676352754,495.4956119940834,286.5260021584945,14311.331715860802,32014.874873394598,0.0009704455188682584,0.9990747029993928,0.9998661890458626,0.751364654831491,0.6812018378731184,21.474626541137695,81994.0,3.1787595748901367,1.4678186843380068,0.639802912408225,0.7514208356709028,0.6980022928506964,0.7197111983803693,0.04656658321619034,0.31458812952041626,0.6812830567359924,1.0,0.0,1.0,46.469261169433594,2159.392333984375,495.4956123962922,286.5260021884872,14311.331715860802,32014.872661416826,COMPLETE
5,0.10533463954925537,2025-07-14 11:19:25.591752,2025-07-14 11:25:19.317182,0 days 00:05:53.725430,3.0,100,xavier_uniform_norm,2.0,12,1e-05,1,0.001,0.5082417678942227,0.49178051679701973,0.9673430547293509,0.18391392700182516,0.10510608930794489,11215.92381759641,163988.0,531.2713056938387,9.493552103501267,0.06430348562089909,0.18409883650023173,0.11132521891845745,0.13960777617874479,8.915895081519032e-05,0.001882277452748936,0.10533465125568703,0.004291845493562232,343.96371469329966,233.0,14581.361259201325,212616096.17133728,344.9245607907926,391.88072671389466,4947.204002083378,6976.225218178139,0.5082421262902682,0.4917801583847329,0.9673430026979638,0.18391392700182516,0.10510606004598884,11215.931726711711,163988.0,531.2721505601094,9.49355474013628,0.06430348562089909,0.18409883650023173,0.11132521891845745,0.13960777617874479,8.9158887943158e-05,0.0018822744594191893,0.10533462200120468,0.004291845493562232,343.96371469329966,233.0,14581.367355926224,212616273.96847093,344.9243094079168,391.8807056354389,4947.204002083378,6976.223275969109,0.5082419453803138,0.49178033930288567,0.9673430211719789,0.18391392700182516,0.10510607759852257,11215.927734375,163988.0,531.2718505859375,9.493553158573173,0.06430348562089909,0.18409883650023173,0.11132521891845745,0.13960777617874479,8.915892249206081e-05,0.001882275566458702,0.10533463954925537,0.004291845485568047,343.96371469329966,233.0,14581.3642578125,212616176.0,344.92443630012224,391.88071311945447,4947.204002083378,6976.224440986562,1.0170391436795592,-0.017039917955622208,0.015637575330110454,0.00023629724788081711,0.0001460791818418755,22382.538210112936,81994.0,15940.884462992868,2487.008473127813,0.00012196014342512867,0.00046344854501548894,0.0001463521721101544,0.00026831231553528306,4.467768537297425e-05,6.273177641563886e-05,0.000402089502631384,4.433999911320002e-05,17508.049598332655,22553.0,13260.551271880007,175842220.03415847,-8.450929857023254,4.481179803195573,4.488398730936964,6.846509853486221,1.0170398580100326,-0.01704063231855546,0.01563642884165173,0.00023629724788081711,0.0001460782618056669,22382.553930775422,81994.0,15940.903028201285,2487.014162301969,0.00012196014342512867,0.00046344854501548894,0.0001463521721101544,0.00026831231553528306,4.467765399305154e-05,6.273170335650907e-05,0.00040208858283074855,4.433999911320002e-05,17508.049598332655,22553.0,13260.551523631342,175842226.7108815,-8.451284144588271,4.480851259874953,4.488398730936964,6.846466732783544,1.0170395374029715,-0.01704031169692577,0.015636652031626785,0.00023629724788081711,0.00014607871283190652,22382.546875,81994.0,15940.8994140625,2487.011373314107,0.00012196014342512867,0.00046344854501548894,0.0001463521721101544,0.00026831231553528306,4.4677668483927846e-05,6.27317203907296e-05,0.00040208903374150395,4.433999856701121e-05,17508.049598332655,22553.0,13260.5517578125,175842224.0,-8.451125132619438,4.480915218282007,4.488398730936964,6.846487871699814,1724192063.0,0.002228309326594152,0.9978167823458141,0.9989739827258776,0.3675913274347048,0.21006596484704512,49.309425079883894,81994.0,17.705993723804003,4.755853210259753,0.12848501109837304,0.36773422445544796,0.22250408566480473,0.2789472400419543,0.020280098548704367,0.05647805006592747,0.21026721300874265,0.041666666666666664,32.61724880712324,24.0,58.4664536433342,3418.3262016281465,494.8717409653374,286.2703276664429,7001.555621446539,9872.602716507152,0.002228313735729722,0.9978167779364792,0.9989739805337019,0.3675913274347048,0.21006590724320562,49.309522647998634,81994.0,17.706029417620226,4.7558545128198695,0.12848501109837304,0.36773422445544796,0.22250408566480473,0.2789472400419543,0.02028005842073565,0.05647793621108785,0.21026715541957866,0.041666666666666664,32.61724880712324,24.0,58.466481704875264,3418.329482946514,494.87173877850785,286.2703270382435,7001.555621446539,9872.600009263157,0.00222831158001843,0.9978167800922879,0.9989739816759888,0.3675913274347048,0.21006595290127625,49.30947494506836,81994.0,17.706010818481445,4.755853480382003,0.12848501109837304,0.36773422445544796,0.22250408566480473,0.2789472400419543,0.020280078053474426,0.05647799372673035,0.21026720106601715,0.0416666679084301,32.61724880712324,24.0,58.466468811035156,3418.327880859375,494.8717398476909,286.2703273655822,7001.555621446539,9872.602155084314,COMPLETE
